ID,Speaker,Japanese,English,Chinese,EnglishCensored,Korean,German
2,5004,,"Archivio del Felice Hacker
Qui scrivo della terminologia hacker.","某位幸福駭客的紀錄。
在此記下幾個駭客用語。",,"어느 행복한 해커의 기록
이곳에 해커어를 몇 가지 적어둔다","Aufzeichnungen eines glücklichen Hackers
Hier erläutere ich Hackerbegriffe."
3,5004,,Firewall,【防火牆】,,【방화벽】,Firewalls
4,5004,,"I firewall erano originariamente sistemi che impedivano
agli utenti di causare danni.","又稱為防火牆代碼。
原本是為了防止用戶引發故障而設置的系統。",,"방화벽 코드라고도 한다.
원래는 유저가 장애를 일으키지 않게
하기 위한 시스템이었다","Firewalls waren ursprünglich Systeme, die Nutzer
davon abhalten sollten, Schaden anzurichten."
5,5004,,"Tuttavia, gli hacker di EDEN ora li hanno modificati, e
vengono spesso usati come barriere nelle guerre territoriali.","但是被EDEN的駭客改造後，
大多被用來當作爭地盤時的屏障。",,"하지만 EDEN의 해커가 개조하여
에어리어의 구역 싸움을 위한 방벽으로 이용되는 경우가 많다","Allerdings haben EDEN-Hacker sie mittlerweile
modifiziert. Oft werden sie als Barrieren bei
Revierkämpfen eingesetzt."
6,5004,,"Variano in forza, ma è necessario un certo livello di
abilità per poterli superare.","強度有分難易度，如果要通過防火牆，
需要展現出一定的技術。",,"강도에는 난이도가 있어서 
통과하기 위해서는 일정 이상의 기술이 필요하다","Sie sind unterschiedlich stark, aber man braucht
gute Fertigkeiten, um sie zu überwinden."
