ID,Speaker,Japanese,English,Chinese,EnglishCensored,Korean,German
708,3006,,"In parole povere, tutte le linee energetiche
che fluiscono per Tokyo potrebbero benissimo partire
dalla nostra zona, che ci crediate o no.","環繞著東京的龍脈——
其入口說不定就是我們最熟悉的中野。",,"도쿄를 순환하는 용맥― 그 입구는 우리의 홈그라운드인
나카노일지도 모른다","Einfach gesagt: Alle Ley-Linien, die Tokio
durchziehen, kommen möglicherweise aus unserem
eigenen Revier. Unglaublich, oder?"
709,3006,,"Non sarebbe incredibile pensarlo se si
rivelasse vero?",……怎麼樣？　挺有趣的吧？,,…어떤가? 꽤 유쾌한 이야기지?,"Wäre das nicht fantastisch, wenn es wirklich
so wäre?"
801,3006,,Fermo lì! Non andare oltre.,在那裡停下。,,거기서 멈추도록,Stopp! Keinen Schritt weiter.
802,2001,,?,？？,,??,?
803,3006,,"Ti trovi al confine del comune. Se vai oltre,
sarai nel territorio del governo
centrale. È un alveare che è meglio non stuzzicare.","再往前就不是自治團體，而是“政府＂的設施。
不要再前進比較好。",,"그 앞은 지자체가 아닌 ""정부""의 시설이다
이 이상은 가지 않는 편이 좋겠지","Du befindest dich an der Grenze des Stadtbezirks.
Noch einen Schritt weiter und du bist auf dem
Gebiet der Regierung. Lassen wir das lieber."
804,2001,,!?,！？,,!?,?!
805,3006,,"Mi hai incuriosito, devo ammetterlo. È una
bella cosa in cui imbattersi semplicemente
camminando in quel tunnel.",……看來是找到不得了的虎穴呢。,,…엄청난 뱀굴을 발견해버린 것 같군,"Aber mein Interesse ist geweckt. Was für eine
Entdeckung! Und das nur, weil du in dem Tunnel
herumgelaufen bist."
806,3006,,"Sei arrivato giusto per riparare una porta e
sei uscito dall'altra parte nell'occhio di un
vero e proprio uragano.","追查著都市傳說，
看來是找到不得了的虎穴呢。",,"…도시전설을 쫓았더니
엄청난 뱀굴을 발견해버린 것 같다","Du gehst hin, um ein Tor zu reparieren, und
auf der anderen Seite landest du mitten in
einem Wirbelsturm."
807,3006,,"Non siamo ancora pronti per affrontare questo tipo di
combattimento. Ci sono ancora troppe cose che non sappiamo.","要闖入那個虎穴的話，
事前準備跟情報都還不足……",,"그 뱀굴에 목을 들이밀기엔
준비도 정보도 부족해","Für einen solchen Kampf sind wir noch nicht
gerüstet. Wir wissen noch nicht genug."
808,3006,,"Penso che questa piccola digressione sia durata
abbastanza. Torna indietro da dove sei venuto e
ritroviamoci in ufficio.","似乎已超出原本的委託內容太多了。
這次就到此為止，你先回事務所吧。",,"원래 의뢰에서 너무 이탈해버린 것 같군
여기서 일단락 짓고 사무소로 돌아오도록","So, aber genug abgeschweift. Geh den Weg, den
du gekommen bist, zurück. Wir sehen uns
dann im Büro."
901,3006,,"Anche se non è forte come siamo abituati, quel tunnel
sta causando uno Spostamento Digitale. Dovremmo
probabilmente tenerlo chiuso come prima, dopo tutto.","雖說是輕度，但那個地下道發生了Digital Shift……
還是跟之前一樣上鎖比較好吧。",,"가볍다고는 해도 그 지하도는 디지털 시프트를 일으킨다…
지금까지처럼 잠가두는 편이 좋겠지","Auch wenn sie nicht so stark ist, wie die übrigen,
verursacht der Tunnel eine digitale Verschiebung.
Vielleicht gehört er doch zugesperrt."
902,3006,,"Non ho idea di come spiegherò tutto
questo al nostro cliente...",唉，該怎麼跟區公所解釋才好……,,"이런이런, 관공서에는 뭐라고 설명해야 좋을지…","Ich habe keine Ahnung, wie ich das Ganze unserem
Klienten erklären soll ..."
903,3006,,"Comunque la si metta, probabilmente sarà tutto un bel
boccone da digerire. Non mi sorprenderei se ne uscissimo con un'aria
ancora più losca di quanto non lo siamo già.","說是發生Digital Shift，還有龍脈等等，他們也很難理解吧。
我們公司給人的印象本來就有點奇怪，這樣會變得更可疑啊……",,"디지털 시프트나 용맥이라고 설명해도 이해받기 어려울 테고
안 그래도 수상한 우리 회사의 인상이 더더욱 수상해질 테니 말이다","Egal, wie man es dreht, da gibt es einiges zu
verdauen. Wahrscheinlich wirken wir im Endeffekt
noch zwielichtiger als bisher."
904,3006,,"...Eh, lasciamo che se ne occupi il Detective Matayoshi.
Alcuni lavori è meglio lasciarli fare agli altri.","算了，交給又吉刑警處理吧。
正所謂人盡其才嘛……",,"…뭐, 그건 마타요시 형사님께 맡기도록 하지
사람에게는 적재적소라는 것이 있는 법이다","... Ach, soll Kommissar Matayoshi das regeln.
Manche Jobs muss man delegieren."
905,2001,,"Hmm? Sei curioso di sapere cosa c'era
esattamente oltre dove ti sei fermato?",嗯？　那個地下道前方的設施是什麼？,,응? 그 지하도 앞의 시설은 뭐였냐고?,"Hm? Du bist neugierig, was sich hinter dem Ort
befindet, an dem du kehrtgemacht hast?"
906,3006,,"Credimi, siamo in due. In
realtà, mentre eri sulla via del ritorno,
ho deciso di indagare un po'.","當然，這我也很在意，
所以在等你回來時調查了一下。",,"…물론 나도 신경 쓰여서 말이지
네가 돌아오는 사이에 조사해 봤다","Das geht uns beiden so, glaub mir.
Tatsächlich habe ich schnell etwas nachgeforscht,
während du auf dem Rückweg warst."
907,3006,,"A quanto pare quello che hai trovato era un
laboratorio di ricerca Kamishiro, tra tutte le cose.",那個似乎是神代的研究設施。,,…그건 아무래도 카미시로의 연구시설인 듯하다,"Anscheinend bist du ausgerechnet über ein
Forschungslabor von Kamishiro gestolpert."
909,2001,,!!!,！！,,!!,!!!
910,2001,,"Perché ci siamo fermati, allora!? C'era così tanto da
vedere! C'è qualcosa che non quadra. Dobbiamo investigare!","為什麼阻止我！？　好不容易可以調查……
太可疑了！　去調查看看吧！",,"왜 말린 건가요!? 조사할 수 있었는데…
너무 수상해요! 조사하자구요!","Warum haben wir dann nicht weitergemacht?!
Höchst seltsam. Da müssen wir nachforschen!"
911,3006,,"Oh, non fare il tonto. Te l'ho detto, quella zona è sotto
la giurisdizione del governo centrale. Non è
il tipo di posto in cui ti avventuri per divertimento.","嗯？為什麼不讓你去調查？
我說過了吧？那裡是政府的管轄區，
無法隨便入侵。",,"흐음? 왜 조사를 하게 해주지 않았냐고?
…말했잖나? 거긴 정부의 관할이다
간단히 침입하는 건 불가능해","Ach, denk mit. Ich habe doch gesagt, dass wir da
mit der Regierung ins Gehege kommen.
Das macht man nicht aus Spaß an der Freude."
912,3006,,"Se non altro, indica che Kamishiro e il
governo hanno una relazione più stretta di
quanto sospettassimo in precedenza.",……神代和政府的關係似乎比我們想的還要密切。,,"…카미시로와 정부는
우리가 생각했던 것 이상으로 유착되어 있는 것 같다","Es zeigt zumindest, dass Kamishiro und die
Regierung mehr miteinander zu tun haben,
als wir bisher gedacht hatten."
913,3006,,"Dare la caccia a Kamishiro potrebbe significare che
andremmo a irritare anche il governo.","要對神代出手，
可能就是與政府為敵……",,"…카미시로에 손을 댄다는 건
정부를 적으로 돌리는 것과 같을지도 모른다","Wenn wir uns Kamishiro vorknöpfen, könnte das auch
Ärger mit der Regierung bedeuten."
914,2001,,...!,……！！,,…!!,...!
915,3006,,"Ecco perché non possiamo essere frettolosi ora.
Faremo quello che possiamo per prepararci e affronteremo
quella sfida quando arriverà il momento.",不過，我們就別焦急，一步一步開始準備吧。,,"뭐, 우리는 서두르지 말고 착실하게 준비를 진행해가면 된다","Deshalb dürfen wir jetzt nicht voreilig sein.
Wir müssen uns gut vorbereiten und wenn es dann
soweit ist, sehen wir weiter."
916,3006,,"È solo una supposizione da parte mia, ma
immagino sia stato Kamishiro a cambiare la password
su quella porta e a renderla impossibile da aprire.","雖然只是我的猜測……更改那個地下道門的密碼，
讓人無法進入也是神代做的吧。",,"아마… 그 지하도 문의 패스워드를 변경해
들어오지 못하게 한 것도 카미시로겠지","Ich könnte mir vorstellen, dass Kamishiro das
Passwort für das Tor geändert hat. Vielleicht
war es Absicht, dass das Tor nicht zu öffnen war."
917,3006,,"Probabilmente non si aspettavano che saremmo stati
capaci di entrare e ficcanasare in giro.",他們應該沒想到我們能從那裏入侵——,,"우리가 그곳으로 침입할 수 있다고는
생각지도 못할 터―","Sie hatten sicher nicht damit gerechnet, dass
wir es öffnen und herumschnüffeln."
918,3006,,"Sapendo questo, potrebbe benissimo servirci come asso
nella manica più avanti, quando arriverà il momento di
affrontare loro, sperando che siano ignari.",那個地下道（捷徑）說不定之後會成為我們偷襲神代的有利手段。,,"그 지하도(지름길)는, 언젠가 카미시로의 허를 찌르기 위해
쓸 수 있는 유효한 카드가 될지도 모른다","Das könnte sich als unser Ass im Ärmel erweisen,
wenn wir sie schließlich konfrontieren und sie
hoffentlich nichts davon wissen."
919,3006,,"Ma ancora, non preoccupiamoci di sviscerare i dettagli
finché non sarà necessario e siamo solo grati di avere
questo nella manica se necessario.",在那之前，我們就先保密吧。,,그 때까지 소중히 아껴두도록 하지,"Aber wie gesagt, noch müssen wir uns darüber keine
Gedanken machen. Wir sollten einfach dankbar sein,
dieses Ass im Ärmel zu haben."
920,3006,,"A proposito, mi rendo conto che tecnicamente
questo caso è chiuso, ma che ne dici di andare
a Roppongi per me un'altra volta?","好了……雖然委託已經結束，
你能再幫我跑一趟六本木嗎？",,"그럼… 의뢰는 완료했지만…
다시 한 번 롯폰기로 가주지 않겠나?","Dieser Fall ist zwar eigentlich abgeschlossen ...
Aber was hältst du davon, noch ein letztes Mal
für mich nach Roppongi zu gehen?"
921,2001,,?,？？,,??,?
922,3006,,"Non intendo per affari ufficiali. Piuttosto, sono
interessato a fare un po' di raccolta di informazioni
indipendente per il nostro uso interno.",接下來是我們事務所要私下收集情報。,,여기서부터는 우리 사무소의 사적인 정보수집이다,"Ich meine nicht offiziell. Ich meine, um heimlich
ein paar Informationen für unsere eigenen
internen Zwecke zu sammeln."
923,3006,,"Sicuramente sei interessato a sapere perché
Kamishiro ha costruito un laboratorio di
ricerca anche sotto il Metropolitan Office, giusto?","為什麼神代會在新都廳的地下成立研究設施……
你也很在意吧？",,"왜 카미시로가 신 도청 지하 같은 곳에
연구시설을 만들고 있는지… 너도 신경 쓰이잖아?","Sicher interessiert es dich auch, warum Kamishiro
ein Forschungslabor unterhalb des Tokioer
Metropolitan-Gebäudes gebaut hat, nicht wahr?"
924,3006,,"Allora, perché non entri
semplicemente dalla porta principale e vedi cosa
riesci a trovare? Ti va bene?","這次我們就從正門堂堂正正地拜訪他們。
去「東京新都廳」收集情報吧。",,"이번엔 당당하게 정면 현관으로 방문하는 거다
「도쿄 신 도청」에서 정보를 모아오도록","Wie wäre es, wenn du einfach mal durch die
Eingangstür spazierst und schaust, was du finden
kannst? Na, sie sieht’s aus?"
951,3006,,"Mi spiace farti lavorare di nuovo appena
sei tornato, ma se visitassi l'Ufficio
Metropolitano di Tokyo, sarebbe di grande aiuto. Grazie!","真是抱歉，明明你才剛回來。
但還是麻煩你去「東京新都廳」收集情報。",,"「도쿄 신 도청」으로 가서 정보를 모아오도록
돌아온 직후인데 미안하군","Tut mir leid, dass ich dich gleich wieder
losschicke, aber wenn du dir das Tokioer
Metropolitan-Gebäude anschaust, wäre das super!"
1001,4938,,"Oh, sei qui per un tour della lobby?
Prego, entra pure.","請問是來參觀新都廳大廳的來賓嗎？
請由此進入。",,"신 도청 로비를 견학하러 온 분입니까?
이쪽으로 들어가 주세요","Ach, bist du hier, um dir die Lobby anzusehen?
Komm bitte herein."
1002,2001,,...?,……？,,……?,...?
1003,4938,,"Devi essere confuso. Lascia che ti spieghi.
La costruzione di questo Ufficio
Metropolitano non è ancora del tutto completa.",其實，這個新都廳還沒完工。,,실은 이 신 도청은 아직 완성되지 않았습니다,"Du bist verwirrt? Ich erkläre es dir. Der Bau
des neuen Tokioer Metropolitan-Gebäudes 
ist noch nicht ganz abgeschlossen."
1004,4938,,"Beh, lo era a un certo punto, cioè, fino a quando una
grande azienda è arrivata ed è stato deciso che i piani
superiori meritavano una costruzione aggiuntiva.","雖然曾經建好一次，但因為某間大型公司提出的意見，
所以決定增建……",,"한 번 완성하긴 했지만 어딘가의 큰 회사 의견으로
더욱 층수를 올리도록 증축이 결정져서…","Eigentlich war er das, aber dann hat sich eine
große Firma eingemischt und beschlossen,
die oberen Etagen weiter auszubauen."
1005,4938,,"Pertanto, mentre ciò sta accadendo, la lobby
qui rimane libera e aperta al pubblico.",在這段期間，僅開放大廳樓層讓一般民眾參觀。,,"그 동안 로비 플로어만이라도 견학할 수 있도록
일반인 분들에게 공개하고 있습니다","Solange das der Fall ist, ist die Lobby hier für
die Öffentlichkeit kostenlos zugänglich."
1006,3006,,Sei riuscito ad entrare nell'Ufficio Metropolitano?,你到新都廳了嗎？,,신 도청에 도착했나?,"Hast du es geschafft, ins Gebäude zu kommen?"
1007,3006,,"...Bene, ho capito. Quindi va bene a loro che tu te ne stia in
giro per la hall. Beh, questo rende il nostro lavoro un po'
più facile, allora. Entra pure.","……原來如此，只能參觀大廳嗎？
這樣剛好，去看看吧。",,"…과연, 로비만이라면 견학할 수 있다, 라
좋은 기회잖나, 다녀오도록","... Aha, verstanden. Du darfst dich also in der
Lobby aufhalten. Das macht es uns etwas
leichter. Geh hinein."
1008,3006,,"Tutto ciò di cui hai bisogno a questo punto è un terminale da
qualche parte così puoi infiltrarti nei loro sistemi. Una
passeggiata a questo punto, direi.","以你來說，只要接觸終端便能入侵。
這麼方便真是幫了大忙。",,"네 경우, 단말기에 접촉하기만 하면 침입이 가능하지
…이건 편리해서 도움이 된다","Erst mal brauchst du nur ein Terminal, mit dem
du ihre Systeme infiltrieren kannst. Das ist
doch ein Kinderspiel."
1009,3006,,"Quindi, una volta trovato un terminale, infilati
dentro e fai la tua magia come sempre.",找到終端的話就入侵看看吧。,,어딘가에 단말기가 있다면 침입해보도록,"Wenn du ein Terminal gefunden hast, schlüpf hinein
und zieh wie gewohnt dein Ding durch."
1010,3006,,"Vorrei essere stato lì per vederlo di
persona. Sembra uno spettacolo niente male...
Mi ricorda in un certo senso la Torre di Babele.","不過，那裡的景色似乎很壯觀啊，
令人想起那個巴比倫塔——",,"…그런데 그곳은 꽤나 경치가 장관이라고 하더군
그 바벨론의 탑을 떠오르게 한다―","Ich wünschte, ich könnte es selbst sehen. Es
scheint ziemlich spektakulär zu sein ... Es
erinnert mich irgendwie an den Turm von Babel."
1011,3006,,"Heh, immagino che stia ricominciando a
divagare, però. Non preoccuparti per me.
Sentiti libero di tornare al lavoro ora.","唉呀，說下去可沒完沒了。
麻煩你繼續調查。",,"이런, 또 이야기가 길어져 버리겠군…
조사를 계속하도록","Aber ich schweife wohl schon wieder ab.
Mach dir meinetwegen keine Gedanken.
Kümmer dich einfach um deine Arbeit."
1101,4939,,"Hanno intenzione di finirlo, questo, prima o
poi? Onestamente, a questo punto sembra solo un
enorme spreco di denaro dei contribuenti...","這棟建築物，到底何時才會完成啊？
根本就是浪費納稅人的錢嘛……",,"이 건물, 대체 언제가 되어야 완성되는 걸까?
솔직히 세금도둑이잖아…","Soll dieses Ding überhaupt jemals fertiggestellt
werden? Ehrlich gesagt, ist das wohl nichts als
eine Verschwendung unserer Steuergelder ..."
1102,4940,,"Wooooow, questo posto è così
graaaaande! È fantastico! Ma a cosa serve?","哇～！　哇～！　好大哦～！
這個地方是用來做什麼的？",,"와아―! 와아―! 넓어―!
그런데 여기 뭐하는 곳이야?","Wooow, dieses Gebäude ist so riiiesig!
Es ist super! Aber was machen die hier?"
1103,4941,,"Ma un ragazzo non può avere un po' di aria condizionata qui intorno,
per l'amor del cielo?",這裡有開空調，要休息的話是再適合不過了……,,에어컨도 작동되고 있응께 휴식을 취하기엔 안성맞춤이여…,"Zum Teufel noch mal, gibt es denn hier keine
Klimaanlage?"
1104,4938,,"Questo EDEN Spot qui è pronto all'uso, quindi, per favore,
sentiti libero di usarlo.","EDEN點已經啟動了，
敬請自由使用。",,"EDEN 스폿은 이미 기동되고 있으므로
자유롭게 사용해 주세요","Diese EDEN-Station hier ist bereit. Du kannst
sie gern nutzen."
1105,4938,,"Viene usato come forum multiuso mentre aspettiamo
che il resto dell'edificio sia completato.",直到完工之前，本廳將作為多用途廣場提供各位使用。,,"준공될 때까지 여러분의 다용도 포럼으로
이용하실 수 있습니다","Es wird für verschiedene Zwecke genutzt, während
die Bauarbeiten abgeschlossen werden."
1106,2001,,"Qui sta avvenendo un piccolo
Digital Shift...",……有輕微的Digital Shift。,,…아주 약간 디지털 시프트가 일어나고 있다,"Hier findet gerade eine kleinere digitale
Verschiebung statt ..."
1201,3006,,"C'è qualcosa che non va là fuori?
...Oh? Hai trovato un terminale che
si sta Digital Shifting un po'?","發生什麼事了嗎？
……嗯？　有終端發生了輕微的Digital Shift？",,"무슨 일이 있었나?
…응? 약간 디지털 시프트가 일어나고 있는 단말기가 있다고?","Stimmt da drüben etwas nicht?... Ach? Du hast ein
Terminal gefunden, bei dem eine kleine
digitale Verschiebung stattfindet?"
1202,3006,,"Huh. Se questa Distorsione è debole pur essendo abbastanza
prominente da fartela notare, potrebbe essere un segno che
questo luogo si trasformerà in un labirinto più avanti.","嗯……微弱到只有你能察覺到的Shift嗎？
說不定是異空間化的徵兆。",,"흐음… 너니까 눈치챌 수 있을 정도의 가벼운 시프트…인가
어쩌면 마요이가화의 전조일지도 모르겠군","Hm. Wenn die Verschiebung schwach ist, aber stark
genug, um dir aufzufallen, könnte das bedeuten,
dass dieser Ort zu einem Labyrinth wird."
1203,3006,,"Bene, per ora, prova a fare un Salto di Connessione lì dentro.
Non abbiamo idea di cosa potrebbe esserci
all'interno, quindi stai in guardia, d'accordo?","你先試著登入跳躍看看。
不知道會出現什麼，一定要小心謹慎——",,"한번 커넥트 점프를 해봐
…뭐가 있을지 모른다, 부디 조심하도록―","Versuch es erst mal mit einem Verbindungssprung.
Aber da wir nicht wissen, was sich im
Inneren befindet, pass gut auf dich auf!"
1301,3006,,"Hmm... Quindi alla fine hai
trovato un Eater lì dentro.","……嗯。
這樣啊，果然有侵食者……",,"…흐음
그렇군, 역시 이터가 있었나…","Hm ... Du hast da drin also doch einen
Verschlinger gefunden."
1302,3006,,"Ma non sei riuscito a trovare altre
prove di rilievo? Heehee, non vedi la
foresta per gli alberi qui, [p]!","嗯？　找不到有用的情報？
呵呵，小助手，你腦袋還轉不過來呢。",,"응? 눈에 띄는 정보는 찾지 못했다, 고?
…후후, 조수 군, 아직 융통성이 없는 것 같군","Aber sonst hast du keine wichtigen Beweise
gefunden? Hihi, du siehst hier den Wald vor
lauter Bäumen nicht, [p]!"
1303,3006,,"Il fatto che ci fosse un Eater dentro il
terminale è già di per sé una grossa prova!","“新都廳的終端裡有侵食者＂
這可是無庸置疑的珍貴情報哦。",,"""신 도청의 단말기 내에 이터가 있었다""
…그것이야말로 틀림없는 귀중한 정보다","Dass sich ein Verschlinger im Terminal befunden
hat, ist doch schon ein großer Beweis!"
1304,3006,,"Comunque, per oggi smettiamola
qui. Torna subito in ufficio.","調查到這樣就足夠了。
回來事務所吧。",,"이제 조사는 그 정도로 충분하겠지
사무소로 돌아오도록","Aber lassen wir es für heute gut sein.
Komm jetzt zurück ins Büro."
1401,3006,,"Probabilmente è stato un duro lavoro andare in giro
per tutto il giorno. Ma grazie a te, penso che stia
iniziando a mettere insieme tutti i pezzi ora.","來回奔波真是辛苦你了，
不過，多虧於此，我也有了大概的頭緒。",,"왔다갔다 하느라 수고가 많았다
하지만 덕분에 대략적인 짐작은 가는군","Das war heute sicher anstrengend, überall
herumzulaufen. Aber dank dir kann ich mir
allmählich einen Reim darauf machen."
1402,3006,,"Mentre eri fuori, ho deciso di misurare le
Onde Digitali che provengono da quell'edificio.","在你回來之前，
我測量了那個設施的數碼波。",,"네가 돌아다니는 동안
그 시설의 디지털 웨이브를 계측해 봤다","Während du unterwegs warst, habe ich die digitalen
Wellen gemessen, die aus dem Gebäude kommen."
1403,3006,,"E ho scoperto che l'Ufficio
Metropolitano stesso è un grande campo
di forza ad Onda Digitale.",結果，那個新都廳本身就是個龐大的“數碼波力場＂。,,"…그랬더니 그 신 도청 자체가
방대한 ""디지털 웨이브의 역장""이라는 걸 알 수 있었지","Und ich habe herausgefunden, dass das Tokioer
Metropolitan-Gebäude selbst ein großes Kraftfeld
mit digitalen Wellen darstellt."
1404,2001,,...!?,……！？,,…!?,...?!
1405,3006,,"Da quel che posso capire, l'energia fluisce direttamente
nell'Ufficio Metropolitano attraverso la linea ley
all'interno del Sottopassaggio di Nakano.","中野地下道是條龍脈，
似乎不斷地往新都廳這個“箱子＂裡注入能量。",,"나카노 지하도가 용맥이 되어 신 도청이라는 ""상자"" 안에
에너지를 계속 흘려보내고 있는 듯하다","Mir scheint es, als ob die Energie direkt über die
Ley-Linie in der Nakano-Unterführung in das
Metropolitan-Gebäude fließt."
1406,3006,,"Quindi quel laboratorio sotterraneo che Kamishiro ha sotto
l'edificio probabilmente sta controllando il flusso di energia.",地下的神秘研究設施，恐怕就是控制中心吧？,,지하에 있던 수수께끼의 연구시설은 아마 그 제어장소겠지,"Das Kamishiro-Labor unter dem Gebäude steuert
also wahrscheinlich den Energiefluss."
1407,3006,,"Ti ricordi cosa ho detto delle linee ley
quando eri dentro quel tunnel, vero?",你還記得在地下道時我說過的龍脈嗎？,,지하를 지나갈 때 이야기한 용맥 이야기는 기억하고 있나?,"Erinnerst du dich, was ich über Ley-Linien gesagt
habe, als du in dem Tunnel warst?"
1408,3006,,"Qui entrano in gioco due cose: il flusso di
energia naturale dalla terra lungo le linee di energia
e le Onde Digitali che emanano da un mare di elettroni.","在大地上流動的地脈能量……
從電子海中湧上的數碼波……",,"대지를 흐르는 지맥 에너지―…
전자 바다에서 솟아나는 디지털 웨이브…","Zwei Dinge spielen eine Rolle: der natürliche
Energiefluss über die Ley-Linien und digitale
Wellen, die von einem Haufen Elektronen ausgehen."
1409,3006,,"Se riesci a fare di una struttura massiccia come
il Tokyo Metropolitan Government Office un centro per
quelle cose, allora puoi manipolarne il flusso.","只要把巨大的建築物做為起點，
便能操控這些流動。",,"이것들은 거대 건축물을 기점으로 삼아
흐름을 조작할 수 있다","Wenn man ein riesigen Bau wie das Tokioer
Metropolitan-Gebäude zu ihrem Zentrum macht,
kann man ihren Fluss manipulieren."
1410,3006,,"Perché devono farlo in quel modo? Beh, per prima cosa,
le Onde Digitali potrebbero essere invisibili a occhio
nudo, ma hanno massa e quindi richiedono un contenitore.","為什麼？　因為數碼波雖是肉眼看不見的存在，
但仍需要有質量的“器皿＂。",,"어째서인가? 디지털 웨이브는 눈에 보이지 않는 존재이지만
질량을 가진 ""그릇""을 필요로 하기 때문이다","Warum sie das so machen? Erstens sind digitale
Wellen mit bloßem Auge unsichtbar, aber da sie
Masse haben, brauchen sie ein Transportmittel."
1411,3006,,"E più grande è il contenitore che
contiene quelle onde, più energia puoi
accumulare.",“器皿＂越大，能儲存的能量越多……,,"""그릇""이 크면 모아둘 수 있는 에너지도 많아진다…","Und je größer das Transportmittel, das diese
Wellen enthält, desto mehr Energie kann man
ansammeln."
1412,3006,,"Probabilmente spiega anche la nuova costruzione in
corso, dato che più spazio significherebbe molta più energia
che Kamishiro potrebbe accumulare.","那個設施在轉至神代手上後開始增建，
一定是為了要增加能儲存的能量吧。",,"그 시설이 카미시로의 손에 넘어가자마자 증축을 하기 시작한 건
틀림없이 모아둘 에너지를 늘리기 위해서겠지","Das erklärt wahrscheinlich auch, warum weiterhin
gebaut wird. Mehr Platz bedeutet, dass Kamishiro
mehr Energie anhäufen kann."
