ID,Speaker,Japanese,English,Chinese,EnglishCensored,Korean,German
1413,3006,,"Quell'energia extra andrebbe poi a influenzare
l'ufficio oltre la struttura, da qui lo
Slittamento Digitale in cui ti sei imbattuto nella hall.","正因為如此，新都廳的內部也像地下道一樣，
出現了小規模但持續發生的異空間……",,"덕분에 신 도청 내부도, 지하도처럼
소규모지만 언제나 마요이가 현상이 일어나고 있다","Die zusätzliche Energie wirkt sich dann über das
Labor hinaus auf das Gebäude aus. Deshalb hast
du in der Lobby die digitale Verschiebung bemerkt."
1414,3006,,"E con ogni Buona Trasformazione Digitale arriva
un Eater, ovviamente... Onestamente, non mi
sorprenderebbe se quel posto diventasse labirintico alla fine.","侵食者大概也是因此而出現……
那裡什麼時候出現異空間都不奇怪。",,"이터 출현도 아마 그 때문이다…
언제 마요이가가 일어나도 이상하지 않았지","Und zu jeder guten digitalen Verschiebung gehört
natürlich ein Verschlinger ... Es würde mich nicht
überraschen, wenn dort mal ein Labyrinth entsteht."
1415,2001,,...!,……！,,…!,...!
1416,3006,,"Ma non dobbiamo più preoccuparci di
quella minaccia ora che hai ripulito il posto.","你擊退了啊，
看來暫時不用擔心異空間化了。",,"네가 퇴치해줬으니
당분간 마요이가화 할 걱정은 없다","Wir müssen uns darüber allerdings keine Sorgen
mehr machen, da du ordentlich aufgeräumt hast."
1417,3006,,"D'altra parte, è preoccupante a modo suo che
le cose si siano risolte così nettamente questa volta.",但是，“不用擔心＂反而是個問題呢。,,"하지만 ""걱정이 없다""는 게 반대로 문제라서 말이지","Allerdings ist es etwas besorgniserregend, dass
sich das Ganze dieses Mal so einfach beheben ließ."
1418,3006,,"Il fatto che le Onde Digitali possano essere
concentrate in qualità così piccole da attrarre
singoli Eater e produrre un micro-labirinto è spaventoso.","明明持續聚集了大量的數碼波，
卻只出現一隻侵食者，異空間化也十分輕微……",,"그만큼 디지털 웨이브를 계속 모으고 있는데
이터가 4마리 나오는 정도에 마요이가화도 가벼운 정도…","Beunruhigend, dass digitale Wellen in so kleinen
Mengen konzentriert sein, aber doch Verschlinger
anlocken und ein Mini-Labyrinth erzeugen können."
1419,3006,,"Se tu non fossi stato lì, probabilmente non sarebbe stato
catturato fino a molto tempo dopo. Tutta la faccenda non mi quadra
per niente.","這種平靜反而令人害怕，
說不定就是所謂暴風雨前的寧靜吧。",,"이 고요함은 반대로 무서운 것이다
어쩌면 폭풍전야 같은 것일지도 모르지","Wenn du nicht dagewesen wärst, wäre es vielleicht
erst viel später aufgefallen. Da wird mir ganz
mulmig."
1420,3006,,"Questo caso ci ha insegnato che esiste tecnologia che
può sopprimere in gran parte grandi quantità di Onde
Digitali mentre vengono accumulate e posizionate ovunque.","畢竟他們擁有的技術，
能夠幾乎毫無洩漏地控制並儲存龐大的數碼波。",,"방대한 디지털 웨이브를 거의 밖으로 새어나가지 않도록 제어해
모아두는 기술이 있다는 얘기니까 말이지","Dieser Fall zeigt, dass man mit Technologie große
Mengen an digitalen Wellen komprimieren kann,
während man sie ansammelt und irgendwo platziert."
1421,3006,,"La natura deliberata e calcolata di tutto ciò
indica che qualcuno ha grandi piani in cantiere,
tanto per dire.","依那種具有企圖性的力場製造方法來看，
他們肯定有什麼目的。",,"…그 의도적인 역장을 만든 것에는
틀림없이 무언가의 목적이 있다","Wie das geplant und vorbereitet wurde, lässt sich
zweifellos darauf schließen, dass jemand große
Pläne hat."
1422,3006,,"Questo, ovviamente, richiede ulteriori indagini.
Dobbiamo capire da quanto tempo sta succedendo
tutto questo, e esattamente a cosa serve.","到底是從什麼時候、為了什麼目的而這麼做……
我們接下來必須調查這些事。",,"대체 언제부터 무엇을 위해 그런 걸 하고 있는 건지…
그건 앞으로 조사해나가야만 하겠군","Natürlich sind weitere Nachforschungen nötig.
Wir müssen herausfinden, wie lange das schon
so geht und wozu es genau dient."
1423,3006,,"Teniamo gli occhi aperti
mentre andiamo avanti, [p]. Qui
c'è qualcosa, lo so.",今後也繼續注意吧。,,이후로도 주시하도록 하지,"Halten wir unsere Augen ab jetzt offen,
[p]. Das ist eine richtig heiße Spur,
ich weiß es einfach."
1500,2001,,"La porta ora dovrebbe essere sbloccata!
Torniamo indietro e controlliamo!","這樣應該就能打開通往地下的門……！
回去確認看看吧。",,"이걸로 지하로 가는 문이 해제됐을 거다…!
돌아가서 확인해 보자","Die Tür sollte jetzt entsperrt sein! Gehen wir
zurück und sehen wir nach!"
1550,2001,,"La porta non si apre. C'è qualcosa che
non va con la serratura elettrica...",門因為電子鎖故障而打不開……,,문의 전자 록이 오작동을 일으켜 열리지 않는다…,"Die Tür lässt sich nicht öffnen. Etwas stimmt
mit dem elektronischen Schloss nicht ..."
