ID,Speaker,Japanese,English,Chinese,EnglishCensored,Korean,German
861,9163,"","Dear customer, I say this very respectfully:
Please get out!","拜託你了，請你回去吧，
這位客人～！","","부탁이니 이만 물러가 주십시오.
고객님~!","Verehrter Kunde, ich sage dies bei allem Respekt:
Raus hier!"
862,3002,"","Got enough recovery items? You can always do some
shopping at my place!♪","回復道具夠嗎？
不嫌棄的話我去幫你買吧♪","","회복 아이템은 충분해?
괜찮다면 우리 가게에서 물건 좀 사줘♪","Hast du genug Items zur Heilung? Du kannst
jederzeit bei mir einkaufen!♪"
863,3002,"","Too bad! Better find someone else, I guess!","可惜！　我還得去找別人才行！","","아쉽다! 또 누군가 다른 사람을 찾아야겠어!","Schade! Ich sollte mir wohl jemand anders suchen!"
864,3002,"","See you next time, Mas—I mean, thanks for your
patronage, valued customer!","一路順風，主……不對，
非常感謝您的惠顧！！","","다녀오십시오, 주인……이 아니라
감사합니다, 고객님!!","Bis zum nächsten Mal, Meis... ich meine, danke für
Ihren Einkauf, werter Kunde!"
865,3002,"","How did you find our Digimon battle? I eagerly
await our next tussle in the ring!","跟我進行的數碼寶貝戰鬥怎麼樣啊？
真心期盼您再次光臨～","","저와 한 디지몬 배틀, 어떠셨습니까?
또 오시기를 기다리겠습니다~","Wie hat dir unser Digimonkampf gefallen? Ich
freue mich schon auf unser nächstes Treffen im
Ring!"
866,3002,"","I've got nothing left to teach YOU anymore!","我已經沒有東西能教你了！！","","네놈에게 가르쳐줄 것은 이제 아무것도 없다!!","DIR habe ich nichts mehr beizubringen!"
867,3002,"","Ouch ow ow ow...I got a little carried away!","好痛……有點太興奮了！","","아야야야……조금 지나치게 흥분했구먼!","Autsch, au au au ... Ich habe es ein wenig
übertrieben!"
868,3002,"","Hang on! Allow me to challenge you one more time!","還沒呢！　再來比一次吧！！","","또 보게나! 다시 한번 대결해주게나!!","Warte! Lass mir noch eine letzte Herausforderung!"
869,3002,"","Whew! Worked up a good sweat!","呼……流了很舒服的汗呢！","","후우……좋은 땀을 흘렸구먼!","Puh! Bin ordentlich ins Schwitzen gekommen!"
870,3002,"","I'm not giving up! I'll collect all the Digimon
there as long as I'm still breathing!","我不會放棄的！！
我會趁著還有命的時候，收集所有數碼寶貝！！","","나는 포기 안 할걸세!!
살아있는 동안에, 모든 디지몬을 모으겠어!!","Ich gebe nicht auf! Solange ich lebe, will ich
alle Digimon sammeln, die es gibt!"
871,3002,"","*cough, cough* The spirit's willing, but the flesh
is weak...","咳咳咳……
就算心靈是少年，但身體跟不上啊……","","쿨럭쿨럭……
마음은 소년이지만, 몸이 못 따라주는군……","*Hust, hust* Der Geist ist willig, aber das
Fleisch ist schwach ..."
872,9149,"","Eeek! My mistake, my mistake! Please forgive me!","呀啊啊啊！　是我們錯了啦～！
請原諒我們吧～！","","히이이이! 내가 잘못했어~!
용서해줘~!","Huch! Mein Fehler, mein Fehler! Bitte verzeih mir!"
873,9149,"","Even if we lose in battle, my love for my Digimon
is stronger than anyone else's!","就算戰鬥輸了，我對數碼寶貝的愛情，
可是不會輸給任何人的喔！","","배틀에 져도, 디지몬에 대한 내 애정은
누구에게도 지지 않아요!","Auch wenn wir im Kampf verlieren, ist meine Liebe
zu Digimon stärker als die von anderen!"
874,9149,"","Hmph. This calls for a strategic retreat!","嗚嗚，這時候就戰略性撤退！！","","으음, 지금은 전략적 후퇴다!!","Hmpf. Ein taktischer Rückzug scheint angemessen."
875,9149,"","I-I knew it...I can't do it!!","果然……憑我是沒辦法的！！","","여여, 역시……나 따위로는 안 돼~!!","I-Ich wusste es ... I kann mich nicht entscheiden!"
876,9149,"","Aha, I've lost! Very well then, goodbye!","好，我輸了！　那就再見了！！","","네, 졌습니다! 그럼 작별입니다!!","Aha, ich habe also verloren! Nun denn, leb wohl!"
877,9149,"","Your fashion sense isn't so bad, you know.☆","你的時尚品味也很不錯喔☆","","네 패션도 제법 끝내주네☆","Dein Modegeschmack ist gar nicht übel, weißt du.☆"
1000,3045,"","You want me to help? I mean...sure, fine.","…………要我幫忙嗎？
……是沒關係啦。","","…………도와줬으면 좋겠어?
……딱히 상관없는데","Du willst, dass ich helfe? Ich meine ...
Natürlich, kein Problem."
1020,3045,"","Look, if you still want help, say so! If you keep
acting on your own and piling more work on, that
doesn't help me any!","還要我幫忙的話就別那麼說了。
要是你單獨行動增加工作，
我可是很困擾的。","","또 도움이 필요하면 그렇게 말해.
단독행동을 하다 일이 늘어나면 내가 곤란하니까","Schau, wenn du noch Hilfe brauchst, dann sag das!
Wenn du eigenmächtig immer mehr Arbeit annimmst,
hilfst du mir damit nicht!"
1040,3045,"","You need a hand, right? I know that look on your
face. What, did you think I'd say no?","你要我幫忙對吧？
看你的表情就知道了。
你覺得我會拒絕你的請求嗎？","","도와달라고? …얼굴을 보면 알지.
네 부탁, 거절할 줄 알았어?","Den Blick kenne ich. Du brauchst Hilfe, oder?
Dachtest du etwa, ich sage nein?"
1001,3046,"","Help with a case? Sure, let's roll.","要我幫忙委託嗎？
知道了，走吧。","","의뢰 도움 요청인가.
알았다. 가도록 하지","Du brauchst Hilfe bei einem Fall? Klar, gehen wir."
1021,3046,"","Another case? Sure. Who we after?","又是委託嗎？
沒關係，是誰？","","또 의뢰냐?
상관없어, 상대는 누구냐?","Du hast wieder einen Fall? Klar. Um wen geht es?"
1041,3046,"","Ah, don't play so distant. Not like I'm gonna turn
you down.","……客氣的是你啊。
我不會拒絕你的吧。","","……서먹하게 구는 건 네 쪽이야.
내가 거절할 리 없잖냐","Ach, jetzt hab dich doch nicht so. Natürlich sage
ich nicht nein."
1002,3047,"","Ooh, you need help on a case? All righty, where we
headed?","喔，要我幫忙委託嗎？
好啊，要去哪裡？","","오, 의뢰를 도와달라고?
좋지, 어디로 갈까?","Oooh, du brauchst Hilfe bei einem Fall? Alles
klar, wo geht’s hin?"
1022,3047,"","Always happy to help you out! I'd go clear across
the globe if we had to!","我很歡迎你的邀請喔！
就算到地球另一面我也去啦！","","네 권유라면 대환영이라고!
지구 반대편까지 가주겠어!","Ich helfe immer gerne! Ich würde auch um die
ganze Welt reisen, wenn es nötig ist!"
1042,3047,"","More work to be done? You can count on me!","又是工作的邀請嗎？
交給我吧，我才不會拒絕呢！","","또 일 권유야?
맡겨줘, 거절할 리 없잖아!","Es gibt noch mehr Arbeit? Du kannst dich auf mich
verlassen!"
1003,3048,"","You're inviting me?! Thanks! Of course I'll help!","你要邀我嗎！？　謝謝你！
我當然會幫忙的啊！","","나를 불러주는 거야!? 고마워!
물론 협력할게!","Du fragst mich?! Danke! Natürlich helfe ich dir!"
1023,3048,"","I hope you'll ask for me again! Would be nice if
I could be of any help...","你又來找我了，我好開心喔。
我有幫上忙嗎…","","또 말을 걸어줘서 기뻐.
조금은 도움이 되는 걸까, 나…","Ich hoffe, du fragst wieder mich! Wäre schön, wenn
ich helfen könnte ..."
1043,3048,"","You didn't think I'd refuse, did you? C'mon, pal,
you know me!","你覺得我會拒絕你嗎？
別讓我失望啊，夥伴！","","내가 거절할 줄 알았냐?
잘못 보지 말라고, 파트너!","Du hast doch nicht wirklich gedacht, dass ich nein
sage? Du kennst mich doch!"
1004,3002,"","Wha? You're inviting...me?! I-I'm not sure I'll be
much use...","咦！？　來邀我嗎！？
我，我這種人沒問題嗎～","","으에!? 나를 불러주는 거야!?
나, 나 같은 게 괜찮을까나~","Was? Du fragst ... mich?! I-Ich weiß nicht, ob ich
eine Hilfe sein werde ..."
1024,3002,"","Help with work? Leave it to me! Let's go tell
the bad hackers what's up!","要幫忙工作對吧！
交給我吧！　去收拾壞蛋駭客囉！","","일을 돕는 거구나!
맡겨줘! 나쁜 해커는 혼쭐내주자!","Hilfe bei der Arbeit? Du kannst auf mich zählen!
Zeigen wir den bösen Hackern, wo der Hammer
hängt!"
1044,3002,"","Heh heh. Let's show the Kowloon hackers what an
unstoppable duo we make!","嗯呵呵……我跟你搭檔是所向無敵的，
就讓Kowloon的駭客們知道這件事吧！","","음훗후…너와 내 콤비가 얼마나 무적인지
쿠롱의 해커들에게 뼈저리게 느끼게 해주자!","Hihi. Zeigen wir den Hackern in Kowloon mal, was
wir für ein unschlagbares Team sind!"
1005,3004,"","Huh? You want ME to help? Well...whatever.","咦？ 要我幫忙嗎？
……嗯，是可以啦。","","뭐어? 나보고 일을 도와달라고?
……뭐, 괜찮지만","Was?! Du willst, dass ICH helfe? Hm ... wenn du
meinst."
1025,3004,"","Help with a case again? Fine, but you're paying
for food later.","又要我幫忙啊，真沒辦法──
作為交換……之後要請客喔。","","또 도와달라는 거냐. 하는 수 없네.
그 대신…나중에 뭐 먹을 거라도 사라","Ich soll wieder bei einem Fall helfen? Na schön,
aber du gibst nachher das Essen aus."
1045,3004,"","Ugh, all this nerd play... I was wondering when
you'd call me again. Who're we after today?","跟你一起玩……我很喜歡喔。
我等你邀請等很久了。
那麼，今天的對手是什麼角色？","","댁과 노는 거…마음에 들어서
불러주길 기다렸어.
자, 오늘은 어떤 녀석이 상대야?","Puh, diese Nerd-Spielchen ... Habe mich schon
gefragt, wann du mich wieder brauchst. Um wen
geht es heute?"
1006,3007,"","Are you asking me for help? Now that's a change.","你想找我幫忙嗎？
你也真是個奇怪的人啊……","","나에게 도움을 부탁하고 싶다고?
별난 녀석이군…너는","Bittest du mich etwa um Hilfe? Na, das ist
ungewöhnlich."
1026,3007,"","Again? Who's the brat this time?","又來了？
這次的對手是哪裡的壞小孩啊？","","또냐?
이번에는 어떤 못된 꼬맹이가 상대냐?","Schon wieder? Wer stiftet denn dieses Mal Ärger?"
1046,3007,"","This might be unbecoming of a detective to say,
but playing at reforming the world with you isn't
so terrible.","雖然我這刑警說這話是不太好……
但跟你去矯正世風也很不錯呢。","","형사인 내가 이런 말을 하는 건 좀 그렇다만…
너랑 세상 바로잡는 놀이를 하는 것도 나쁘지 않군","Ein Kommissar sollte das vielleicht nicht sagen,
aber mit dir zusammen die Welt zu verbessern,
ist gar nicht so übel."
1007,3015,"","Huh? You want help? *sigh* Whatever. Just this
once, get me?","啊～？　要我幫忙～？
……真沒辦法。我就幫你吧？","","아앙~? 도와달라고~?
……어쩔 수 없네. 빚 하나 낸 거라고!","Was? Du willst Hilfe? *Seufz* Wenn du meinst.
Aber nur dieses eine Mal, verstanden?"
1027,3015,"","MORE help? Do you not have any friends or what?
I'll be your pal for a while, but you better be
grateful!","又要我幫忙？　你是沒朋友喔？
真沒辦法，我來當你的朋友啦！
給我高興一點啊！","","또 도와줘어? 너, 친구 없지?
하는 수 없지, 내가 친구 해줄게! 얌마, 기뻐하라고!","Du brauchst SCHON WIEDER Hilfe? Hast du keine
Freunde? Na schön, ich spiele eine Zeitlang mit,
du solltest das wertschätzen!"
1047,3015,"","Leave it to me! Hacker or not, I'll knock their
blocks off!","交給我吧！　管他是駭客還是什麼，
敢來礙事的傢伙就徹底擊垮！","","맡겨줘! 해커든 뭐든
방해하는 녀석들은 하나하나 날려버릴게!","Überlasst das mir! Hacker oder nicht, ich mache
sie platt!"
1008,3012,"","I'm pretty busy, but oh well. Let's get it over
with.","我也是很忙的啊……
算了，也好。","","내도 한가한 건 아닌데 말입니더……
뭐 됐지예","Ich bin eigentlich beschäftigt, aber was soll’s.
Bringen wir es hinter uns."
1028,3012,"","Some other fool spring up? Well, let's mop 'em up
then.","又有愚蠢之徒出現了嗎？
這樣子……就趕快收拾他們吧。","","또 바보 같은 패거리가 나타난 겁니꺼?
그럼…빨랑 정리하지요","Jemand macht Ärger? Na, dann knöpfen wir
ihn uns mal vor."
1048,3012,"","Gettin' pretty sick of your stupid face... Pfft,
I'm pulling your leg. Don't take it so serious.","我也看膩你那張臉了啊……
呵呵，開玩笑的，別當真喔。","","당신의 얼굴도 질렸습니더…
후후, 농담입니더, 진지하게 받아들이지 마소","Deine dumme Visage nervt mich langsam ... Bah, war
doch nur Spaß. Nimm doch nicht alles so ernst."
1009,3003,"","Help with...work? I'm not sure I'd be much use...","要我幫忙工作嗎……
我能幫得上忙嗎……","","일 협력…인가요
제가 도움이 될까요…","Hilfe bei ... der Arbeit? Ich weiß nicht, ob ich
eine Hilfe sein werde ..."
1029,3003,"","Another case? Very well, I'm with you.","又是委託嗎……
我知道了，我也一起去。","","또 의뢰……로군요
알겠습니다. 함께 가겠습니다","Ein neuer Fall? Gut, ich werde dir beistehen."
1049,3003,"","Please do bring me along. I'm quite thankful for
the chance to help out.","請一定要讓我一起去。
這是平常受你照顧的微薄回禮。","","부디 같이 가게 해주세요
평소에 협력해주시는 것에 대한 사소한 답례입니다","Du kannst mich gerne mitnehmen. Ich helfe immer
gerne."
1010,1050,"","You need...OUR help? Are you sure?","要我幫你忙？
我們辦得到嗎……","","너를 도와달라고?
우리가 할 수 있을까…","Du brauchst ... UNSERE Hilfe? Bist du sicher?"
1011,1151,"","I'm a little worried, but I'll give it my best.","諾奇雅也不在……
但是，我會加油的！","","노키아도 없으니까……
그래도 열심히 할게!","Ich mache mir etwas Sorgen, aber ich werde mein
Bestes geben!"
1030,1050,"","Coming for help again? You got it!","又要我們幫忙嗎？
好～啊～！","","또 도와줬으면 좋겠어?
좋아~!","Du brauchst wieder Hilfe? Geht klar!"
1031,1151,"","Fighting with you isn't so bad anyway!","總覺得跟你一起戰鬥很有趣呢！","","너랑 싸우는 거, 왠지 즐겁거든~!","Mit dir kämpft es sich sowieso gar nicht so
schlecht!"
1050,1050,"","Ooh, who's it gonna be this time?","這次要跟什麼樣的傢伙戰鬥啊？","","있지 있지, 이번엔 어떤 녀석이랑 싸워~!?","Ui, wen nimmst du denn dieses Mal?"
1051,1151,"","We want to get stronger and stronger by your side!","我們跟你在一起，
就能不斷不斷變強喔！","","우리, 너랑 같이 더욱더
강해지고 싶어~!","Wir wollen an deiner Seite immer stärker werden!"
1012,1391,"","You've need of my power? Very well. Consider this
my thanks for the other day.","……需要我的力量嗎？
好啊，當作之前你救了我的謝禮。","","……내 힘이 필요해?
좋아. 전에 구해준 답례를 하지","Meine Kraft ist gefragt? Nun gut. Sieh es als
Dankesbeweis für neulich."
1032,1391,"","Off to wallop some upstart hackers? I may tag
along.","又要去打倒不良駭客了嗎？
那我會陪你的。","","또 질 나쁜 해커를 쓰러트리러 가?
그렇다면 함께 갈게","Eine Tracht Prügel für Möchtegern-Hacker? Da
geselle ich mich gern dazu."
1052,1391,"","Oh, no need to explain it all. I'll follow where
you wish to go.","沒有必要一一拒絕。
只要是你的請求…不管到哪我都會跟去。","","일일이 말할 필요는 없어.
네가 바란다면…어디든지 따라갈게","Ach, eine komplette Erklärung ist gar nicht nötig.
Ich folge dir, wohin du auch gehst."
1013,1035,"","You're asking me for a hand? Well, damn it, I
did promise...","……要我幫忙？
……這麼說來，好像是有這種約定。
沒辦法，還真是麻煩。","","……힘을 빌려달라고?
……그러고 보니 그런 약속을 했었군
귀찮지만 하는 수 없지","Ich soll mit anpacken? Hmpf, Mist, ich hatte es
versprochen ..."
1033,1035,"","Again? Can't you wipe this scum up on your own?
You make so much work.","又來了啊……
你一個人沒辦法收拾那些垃圾嗎？
真是讓人操心的傢伙。","","또냐……
혼자서는 쓰레기 하나 처리하지 못하는 건가?
손이 많이 가는 녀석이군","Schon wieder? Kommst du mit dem Abschaum nicht
alleine klar? Du machst so viel Arbeit."
1053,1035,"","Look, I told you you can call me anytime. Don't
make me repeat myself.","不要讓我說這麼多次。
我已經跟你說過了吧，
隨時都能來找我。","","몇 번이고 말하게 하지 마.
언제든지 부르라고 했을 텐데","Ich habe doch gesagt, du kannst mich jederzeit
bitten. Ich wiederhole mich nicht gerne."
1014,1072,"","I promised I'd repay you! What can I do?","我跟你約好要回禮了吧！
要我做什麼好呢？","","너에게 답례를 하겠다고 약속했었지!
뭘 하면 돼?","Ich habe versprochen, mich zu revanchieren! Was
kann ich also für dich tun?"
1034,1072,"","Aha, a case? You got it. You lead, I'll follow.","委託啊，沒關係喔。
你要去的地方我也會跟去！","","의뢰구나. 괜찮아.
네가 가는 곳에 나도 갈게!","Aha, du hast einen Fall? Geht klar. Geh du voran,
ich folge dir."
1054,1072,"","I hope you're not holding back on my account. You
know I'll happily help you should you need it!","居然這麼客氣，還真是意外啊。
你的請求我會高興答應的喔！","","망설이다니 섭섭한데
네 부탁이라면 기꺼이 응하겠다!","Ich hoffe, du hältst dich nicht meinetwegen
zurück. Ich helfe dir immer gerne, wenn Bedarf
besteht!"
1015,1359,"","A help request? Well, without you, I wouldn't even
be here. You bet I'll do it!","要我幫忙嗎？　嗯～畢竟是我的救命恩人
的請求呢！　我知道了，我答應喔。","","도와달라고? 음~, 생명의 은인이 
부탁하는 거니까! 알았어, 받아줄게!","Du bittest um Hilfe? Nun, ohne dich wäre ich gar
nicht hier. Natürlich bin ich dabei!"
1035,1359,"","You're inviting me out again?! All right! W-wait,
I didn't mean it like that!","你又要邀請我嗎？　太好了！
……啊，剛才的不是那個意思喔！","","또 불러주는 거야? 앗싸!
……아, 지, 지금 말한 건 그런 게 아니니까!","Du willst wieder mit mir gehen?! Fein! Moment ...
So war das nicht gemeint!"
1055,1359,"","I'm so glad we get to fight together again! We've
got so much to talk about!","又能一起戰鬥了，真是高興耶！
要跟我說很多話喔？","","또 같이 싸울 수 있다니 기뻐!
잔뜩 수다 떨자!","Ich freue mich so, dass wir wieder zusammen
kämpfen! Da können wir so viel besprechen!"
1100,3045,"","I'm beat. I'm going back.","好累……我要回去了……","","피곤해…이제 갈래…","Ich bin platt. Ich gehe zurück."
1120,3045,"","Things are really crazy when you're around. Not
that I really mind!","跟你在一起總是這麼吵鬧呢。
……我先說清楚喔，我不討厭喔。","","정말, 너랑 있으면 소란스럽네.
……말해두는데, 딱히 싫은 건 아니야","Wenn du da bist, ist immer einiges los. Nicht,
dass ich etwas dagegen hätte!"
1140,3045,"","Well, that was kinda fun. Only kinda, though, I
mean it.","……有點開心呢。
真的，只有一點點喔。","","……조금 즐거웠으려나.
정말 아주 조금이지만","Das hat ein bisschen Spaß gemacht. Aber auch nur
ein bisschen."
1101,3046,"","I have a feeling you could've handled this
yourself.","……這點程度的話，你一個人也能做得到吧？","","…이 정도라면, 너 혼자서도
할 수 있지 않았을까?","Ich habe das Gefühl, dass du das allein geschafft
hättest."
1121,3046,"","Ask me along again sometime. It's a good change of
pace.","再來邀我吧，
這很適合轉換心情。","","또 불러.
좋은 기분전환이 된다","Nimm mich irgendwann mal wieder mit. Das ist
eine nette Abwechslung."
1141,3046,"","Working with you is...definitely not bad, I'll say
that. Invite me along anytime.","跟你一起這樣工作……很不錯。
隨時都能來找我，我會馬上趕來的。","","너랑 이렇게 일하는 건…나쁘지 않군.
얼마든지 불러. 바로 달려갈게","Mit dir zusammenzuarbeiten ist ... nicht so übel.
Du kannst mich jederzeit wieder mitnehmen."
1102,3047,"","Whew, well, that's that. Good work.","啊～好累喔。
那麼，再見啦。","","아~, 지쳤다.
그럼, 수고했어","Uff. Das wäre also erledigt. Gute Arbeit."
1122,3047,"","It's weird not hanging out with Ryuji for a
change, but you're not bad company.","雖然大多是跟龍司一起……
但跟你這樣玩也很不錯啊。","","류지랑만 같이 다녔는데…
너랑 노는 것도 나쁘지 않네","Ganz schön komisch, nicht mit Ryuji unterwegs zu
sein, aber du bist auch nette Gesellschaft."
1142,3047,"","Let's do this again! And you better not invite
anyone else! He said, obviously joking.","要再約我喔！　要是你邀別人
我搞不好會吃醋喔。
……開玩笑的啦！　哈哈哈！","","또 불러라! 다른 녀석 부르면 질투할지도 모른다.
…농담이야! 핫핫하!","Lass uns das wiederholen! Frag ja niemand anders!
Ich meine das natürlich nicht ernst."
1103,3048,"","I'm glad I could tag along with you. Feel free to
invite me again.","今天你來約我，我好高興喔。
隨時都能再找我喔。","","오늘은 권유해줘서 기뻤어.
또 언제든 불러줘","Ich bin froh, dass ich mitkommen konnte. Lade mich
ruhig öfter ein."
1123,3048,"","I think I understand you a little better every
time we spend time together. It feels good.","能這樣一起，就能更加瞭解你了喔。
這樣我很高興呢。","","이렇게 같이 있으면 점점 너를
알아가게 돼. 난 그게 기뻐","Ich denke, jedes Mal, wenn wir Zeit zusammen
verbringen, verstehe ich dich ein wenig besser.
Das ist schön."
1143,3048,"","I don't think you get how happy I am when you ask
me along, do you?","你來約我的時候，我有多高興……
你一定不知道吧？","","네가 불러줘서 내가 얼마나 기쁜지…
너, 모르고 있지?","Du weißt gar nicht, wie sehr ich mich freue, wenn
du mich mitnimmst, oder?"
1104,3002,"","Whew, that was rough! We're done, right? See ya!","啊～真是累人～
今天可以解散了吧？　那就再見啦！","","하~힘들었어~
오늘은 이제 해산이지? 그럼 안녕―!","Uff, das war hart! Wir sind fertig, oder? Bis
dann!"
1124,3002,"","Don't you just feel so in sync now? Witness the
birth of EDEN's most ☆explosive☆ new duo!","我們好像很有默契啊！？
說不定是EDEN新搭檔的誕☆生喔！","","왠지 우리 호흡이 맞기 시작한 것 같지 않아!?
EDEN의 신 콤비 탄☆생일지도!","Findest du nicht, dass wir jetzt perfekt
aufeinander abgestimmt sind? Wir sind das
fetzigste neue Duo in EDEN!"
1144,3002,"","Our names will go down as legends of EDEN before
long!♪ See you again, [p]!♥","我們成為EDEN傳說的日子不遠了呢♪
要再來找我喔，[p]☆","","우리가 EDEN의 전설이 될 날도 그리 멀지 않았네♪
또 불러줘, [p] 군♥","Demnächst schon werden wir als Legenden in die
Annalen von EDEN eingehen!♪ Bis bald, [p]!♥"
1105,3004,"","Why don't you just invite Ryuji or Chitose next
time? I can't imagine having me along is a thrill.","……下次你去找龍司或千歲吧。
找我這種人一點都不有趣吧？","","…다음엔 류지나 치토세를 불러.
나같은 녀석이랑 같이 있어봐야 재미없지 않아?","Warum fragst du nächstes Mal nicht einfach Ryuji
oder Chitose? Ich glaube kaum, dass meine
Gesellschaft so spannend ist."
1125,3004,"","That was all right! I'd like to come with you
again sometime. I think I'm starting to get why
Ryuji's so taken with you.","還不錯喔，下次再找我吧。
……我好像多少能懂龍司那傢伙
會中意你的理由了。","","나쁘지 않았어. 또 불러줘.
……류지 녀석이 댁을 마음에 들어한 이유
조금 알게 된 것 같아","Das war ganz okay! Ich würde gerne mal wieder
mitkommen. Ich verstehe langsam, warum Ryuji so
viel von dir hält."
1145,3004,"","Being with you reminds me of my time in Jude.
...Because it's fun, I mean. Sheesh, do I have to
spell it out?","跟你組隊，會讓我想起Jude時代的回憶啊。
……是很開心的意思喔。別讓我一一解釋啊。","","댁이랑 같이 있다 보면, 쥬드 시절이 생각나.
……즐거웠단 뜻이야. 일일이 말하지 하게 말라고","Du erinnerst mich an meine Zeit bei Gamma. Weil
wir zusammen Spaß haben. Muss ich das wirklich
dazusagen?"
1106,3007,"","Well, hope you'll excuse me, but I've got other
business. See you later.","那麼，還有其他的事件。
我就先失禮啦。","","그럼, 다른 사건이 있어서
먼저 실례하마","Entschuldige bitte, aber ich habe anderes zu tun.
Bis später."
1126,3007,"","If something troubles you, give me a shout. If an
old corpse like me is of any help, of course.","要是還有其他困擾的事情，就來找我商量吧。
只要我這老骨頭能幫的，我都會幫你。","","또 뭔가 곤란한 일이 있으면 의논해라.
이런 늙은이라도 괜찮다면 힘이 되어주마","Sag Bescheid, wenn dir etwas Probleme macht.
Wenn denn ein alter Knacker wie ich behilflich
sein kann."
