ID,Speaker,Japanese,English,Chinese,EnglishCensored,Korean,German
548,9152,"","Master, will you do something for me? I'm a little
angry; let me take it out on you!","主人大人，你能聽一下我的願望嗎～？
我有點火大呢，請允許我輕～輕的踹飛你一下！","","주인님, 부탁 좀 들어주실래요~?
조금 짜증 나니깐 살~짝 날려버리게 해주세요!","Tust du mir einen Gefallen? Ich bin ein
wenig wütend. Kann ich es an dir auslassen?"
549,9152,"","Master, I hate losing! Please let me win!","嗚嗚～主人大人……不想要接待PLAY喵！
拜託，就讓我贏啦喵！","","으으~ 주인님……접대 플레이는 싫습니다냥!
부탁해요, 제가 이기게 해주세요냥!","Ich hasse Niederlagen!
Bitte lass mich gewinnen!"
550,3002,"","You're nothing much, but if you get in my way,
I'll have to make you leave!","就憑你們，我超──簡單就能解決喔──？
敢礙事的話，就馬上把你趕出去──！","","당신들 따윈 완전 가볍거든요~?
방해할 거라면 얼른 돌아가 줬으면 좋겠거든요~!","Du bist zwar ein kleiner Fisch, aber wenn du mir
in die Quere kommst, muss ich dich hier
rausschmeißen!"
551,9152,"","Making sure a master is properly disciplined is
part of a maid's work! Which means: ATTAAACK!","管教主人大人，也是女僕的重要工作喵！
所以說～……突擊喵～～～☆","","주인님께 예의범절을 가르치는 것도 메이드의 어엿한 업무다냥!
그러니까……돌격이다냐~~~앙♥","Dafür zu sorgen, dass ein Meister sich ordentlich
verhält, ist die Aufgabe einer Maid! Das bedeutet:
AAANGRIIIFF!"
552,9157,"","Your cockiness sickens me. Get out of my sight!","你們這群人，得意忘形的實在是很礙眼啊──
拜託趕快從我眼前消失啊──！！","","당신들, 까불어서 거슬리거든요~
눈앞에서 얼른 꺼져줬으면 좋겠거든요~!!","Deine Dreistigkeit widert mich an.
Geh mir aus den Augen!"
553,9152,"","Welcome back, Master! Aaaand get going!","歡迎回來，主人大人☆
然後，請直接回去吧☆","","어서 오세요, 주인님♥
그리고 아무쪼록 그대로 돌아가세요~♥","Willkommen zurück! Uuund los geht’s!"
554,9163,"","Urgh...urgh... Uwah!","嗚嗚──……嗚嗚嗚嗚──……
…………嗚嗚啊啊啊啊啊啊啊！！","","으으……으으으으……
…………우와아아아아아아앗!!","Argh ... argh ... uäääh!"
555,9163,"","How dare you defile our territory with your filthy
soul? When the black messenger roars, you will
be destroyed!","玷汙了吾之領土的不潔魂魄……
當漆黑的使者吠鳴之時，汝等之身軀也將毀滅……！","","나의 영토를 더럽히는 부정한 영혼…….
칠흑의 사자가 울부짖을 때, 그대의 몸과 함께 멸하리라……!","Du wagst es, unser Revier mit deiner unreinen
Seele zu entweihen? Wenn der schwarze Bote ruft,
wirst du vernichtet!"
556,9163,"","Did you know that Friday the 13th only comes up to
three times a year?","你知道嗎～？
13號星期五，一年中最多會有三次喔～","","알고 있어~?
13일의 금요일은 1년에 최대 3번 온다구~","Wusstest du, dass Freitag der 13. höchstens
dreimal im Jahr vorkommen kann?"
557,9163,"","You're no match for us, for we are invincible and
immortal.","你才敵不過我們呢～
因為，我們是無敵的不死之身嘛☆","","우릴 당해낼 수 없을 거야~
왜냐면 우린 무적이자 불사신인 존재거든☆","Du kannst es nicht mit uns aufnehmen.
Wir sind unverwundbar und unsterblich."
558,9163,"","Oh, I sure love a nice bloodbath! My little axe
and me are gonna pay you a visit!","我是華麗的傑森♪
今日也將會拿著空氣斧頭，跑去襲擊你家喔♪","","난 화려한 살인귀♪
오늘도 에어 도끼를 들고 당신 집으로 쳐들어가지♪","Oh, ich liebe ein nettes Blutbad! Meine kleine
Axt und ich kommen doch gern mal bei dir vorbei!"
559,9163,"","Trick or treat! If you don't get out of here,
we'll play a terrifying prank on you!","Trick・or・Treat！
如果不離去的話，
會有很～可～怕的惡作劇喔！","","트릭 오어 트리트!
물러가지 않겠다면 무서~운 장난을 쳐버릴 거야~!","Süßes oder Saures! Wenn du nicht abhaust, spielen
wir dir einen Streich, der sich gewaschen hat!"
560,3002,"","Hey! We have a potential shoplifter!","喔喔……這位客人！！
請協助防止偷竊的活動！！","","소, 소……손니이이이이이임!!
도둑질 방지 활동에 협력 부탁드립니다아아아아아!!","He! Ich glaube, wir haben einen Ladendieb!"
561,3002,"","I'm very sorry, but this is currently our
territory.","這位客人，實在是萬分抱歉。
現在這裡一帶都是我們的地盤。","","손님. 정말 죄송하지만
현재 이 일대는 저희 구역입니다","Es tut mir sehr leid, aber dies ist aktuell unser
Revier."
562,3002,"","Maybe battles could be a good way to promote the
store. Why not come shopping after our fight?","我在想，如果能透過戰鬥幫店裡做宣傳就好了！
分出勝負之後，你也要在我們這買東西喔♪","","내가 배틀해서 가게 PR이 되면 좋겠다 싶어서!
승부가 끝나면 너도 우리 가게에서 물건 좀 사줘♪","Vielleicht wären Kämpfe gut als Promo für den
Laden. Magst du nach unserem Kampf einkaufen?"
563,3002,"","Ah, you'll do! If I win, how about you cover my
shift tomorrow?","啊，你很適合呢！
如果我贏的話，你明天能幫我代班嗎？","","앗, 네가 적임자야!
저기, 내가 이기면 내일 일 좀 대신 해주지 않을래?","Ach, du reichst mir! Wenn ich gewinne, übernimmst
du dann meine Schicht morgen?"
564,3002,"","Welcome, Mas... No, I mean... Hello there!","歡迎回來，主……說錯了。
客人歡迎光臨！！","","어서 오세요, 주인……이 아니지.
어서 오세요, 손님!!","Willkommen, Meis... äh, ich wollte sagen ...
Grüß dich!"
565,3002,"","Are you looking for a Digimon battle? We can
provide that! Please enjoy!","您正在尋求數碼寶貝戰鬥的對手嗎？
是的，沒有問題喔！
那麼就請好好享受一下吧～","","디지몬 배틀을 찾고 계신가요? 네, 있지요!
그럼 느긋하게 즐기세요~","Suchst du einen Digimon-Kampf? Den gibt’s hier!
Viel Vergnügen!"
566,3002,"","Young punk! I'll teach you what a real Digimon
battle is all about!","小子！　數碼寶貝戰鬥為何物……
就由我來告訴你！","","애송이! 디지몬 배틀이란 무엇인지……
내가 네놈에게 가르쳐주마!","Frecher Jungspund! Ich bringe dir bei, wie ein
echter Digimon-Kampf aussieht!"
567,3002,"","My joints have been aching like mad lately. Will
you let me warm up before our battle?","最近，筋骨很痛啊……
開始戰鬥之前，能讓我先暖身一下嗎？","","요즘 하반신이 쑤셔서 말일세……
배틀 전에 준비운동 좀 하게 해주지 않겠나?","Meine Gelenke schmerzen in letzter Zeit sehr.
Darf ich mich vor dem Kampf warm machen?"
568,3002,"","I feel more full of life now than when I was in my
teens! Come here, take on my Digimon!","我覺得比起從前，現在更加青春呢！
來吧，跟生龍活虎的我來一決勝負吧！","","난 예전보다 지금이 더 청춘이라고 생각한다네!
자, 쌩쌩한 내 디지몬과 승부일세!","Ich fühle mich jetzt lebendiger als als Teenager!
Komm her und miss dich an meinen Digimon!"
569,3002,"","Forget golf! Digimon battles are far more exciting
and are a great way to keep your mind sharp!","比起槌球，數碼寶貝戰鬥比較刺激
對防止癡呆也很有益處喔！","","게이트 볼보다 디지몬 배틀이 더
자극적이고 치매 방지에도 좋다네!","Vergiss Golf! Digimon-Kämpfe sind viel spannender
und halten einen geistig besser fit!"
570,3002,"","Collecting all Digimon is my reason for living!
Give me your Digimon!","收集全部的數碼寶貝是我的生存意義啊！
你的數碼寶貝給我交出來！！","","모든 디지몬을 모으는 게 내 삶의 보람이라네!
자네의 디지몬을 내게 주게!!","Alle Digimon zu sammeln ist mein Lebenssinn!
Her mit deinen Digimon!"
571,3002,"","I may look old, but I'm young at heart!","外貌是老人！　內心卻是少年！
那就是……我啊啊啊！！！","","겉보기엔 노인! 마음은 소년!
그건……나라네!!!","Ich sehe vielleicht alt aus, bin aber im Herzen
jung geblieben!"
572,9149,"","Hehehe! Fight me if you dare! If I win, you can
buy me a sexy model figure!","呼呼呼呼！ 來吧，來跟我論輸贏啊～！
如果我贏了，就要買美少女模型給我喔♪","","듀후후후후! 자, 나와 승부다 승부~!
내가 이긴다면 미소녀 피규어를 사줘야 해♪","Hehehe! Kämpf mit mir, wenn du es wagst! Wenn ich
gewinne, kannst du mir eine sexy Figur kaufen!"
573,9149,"","I've overcome the barrier between the real and the
virtual to be with my Digimon wives! Now I'll show
you their power!","跨越了名為展示之牆，
所遇見的我那數碼寶貝老婆的力量！
就讓你看看吧！","","디스플레이라는 이름의 벽을 넘어
만난 내 아내 디지몬의 힘! 보여드리지요!","Ich habe die Grenze zwischen real und virtuell
überwunden, um bei meinen Digimonfrauen sein zu
können! Jetzt zeige ich dir ihre Macht!"
574,9149,"","Tremble before my dazzling military tactics!","就在我這軍事宅的華麗戰術面前
伏首稱臣吧！","","밀덕인 나의 화려한 전술 앞에 엎드리거라!","Erzittere vor meiner faszinierenden militärischen
Taktik!"
575,9149,"","I just...came with my friends! I c-can't fight!","我、我我我……我只是陪朋友過來而已！
戰、戰鬥我沒辦法啦～！！","","나, 나나나……난 동료를 따라왔을 뿐이니까!
스, 승부 같은 건 무리야~!!","Ich bin ... nur mit meinen Freunden hier!
Ich k-kann gar nicht kämpfen!"
576,9149,"","You there! Fight me! Right here! Right now!","那邊的那位！
跟我比一場。馬上就會定輸贏。此刻決鬥！！","","헤이, 거기 자네!
저와 승부입니다. 어서 승부입니다. 나우 승부입니다!!","Du da! Kämpf mit mir! Jetzt und hier!"
577,9149,"","How do you like my cutting-edge fashion?! Geek
chic is really big right now!","我的打扮很棒對吧！？
是現在宅宅界很流行的俗的可愛穿搭喔☆","","내 패션 최고지?!
지금 오타쿠계에서 유행하는 촌스러우면서 귀여운 코디야☆","Wie gefällt dir mein angesagter Style?! Der
Geek-Look ist gerade in!"
578,9159,"","Hot! So hot! Give me a battle and let me dissipate
some of this heat!","好熱……好熱啊啊……！
這洶湧而上的火熱，就讓我在戰鬥裡發散啊！","","뜨거워……아아, 뜨거워……!
이 용솟음치는 열기, 너와의 배틀로 발산하게 해줘!","Heiß! Zu heiß! Gib mir einen Kampf, damit ich
etwas von dieser Hitze ablassen kann!"
579,9159,"","Whoa, I'm so pumped! I'll take on anyone!","嗚喔喔喔喔，開始嗨起來了──！！
從哪都可以直接上！！","","우오오오오, 힘이 솟아난다~!!
어디서든지 덤벼라!!","Boah, ich bin voll in Schwung!
Ich nehme es mit jedem auf!"
580,9162,"","Hey! Let's see who's got the best Digimon!","喂！　要不要來比拼數碼寶貝啊！
比比看，我跟你哪邊比較厲害！","","여어! 디지몬 힘겨루기를 해보자고!
너와 나, 누가 더 단련했는지 승부다!","He! Schauen wir doch mal, wer die besten Digimon
hat!"
581,9162,"","So you wanna fight me? Fine, as long as you're
ready for a good thrashing!","想跟我對決嗎？　也就是說，
你也做好會被打倒的準備了吧。
那就沒問題啦！","","나와 싸우고 싶어? 그렇다는 건
쓰러질 각오도 된 거겠지. 그렇다면 좋다!","Du willst gegen mich kämpfen? Gern, solange du
darauf vorbereitet bist, ordentlich Prügel zu
kassieren!"
800,9154,"","You won, so get walking! I say so!","你這傢伙，既然贏了就快走啊！
我允許你！！","","네 이놈, 이겼다면 얼른 걸어가!
내가 허가한다!","Du hast gewonnen, also mach, dass du weiterkommst!
Weil ich es sage!"
801,9154,"","Gwaaah! I lost!!!","嗚哦哦，輸了啊──！！","","우오오오오오, 졌다~!!","Neeeiiin! Ich habe verloren!"
802,9154,"","GRAAA-uh?","哦啊啊啊啊……咦？","","오라아아아아아……응?","NEEEII... Hä?"
803,9154,"","Is my training regimen not brutal enough?","鍛鍊得還不夠嗎……？","","아직 단련이 부족하단 건가……?","Ist mein Trainingsprogramm nicht hart genug?"
804,3002,"","Whoa! I lost, and YOU are strong!","我輸了！　你好強喔！","","졌슴다! 당신 강함다!!","Boah! Ich habe verloren, und DU bist ganz schön
stark!"
805,9154,"","What? I'm in the way?! Then I'm moving!","我才礙事？　那就走吧！！","","내가 방해라고? 그럼 비키겠다!!","Wie? Ich bin im Weg?! Dann bewege ich mich mal!"
806,3002,"","That's a loss for me and a win for you!","你贏了！！　我輸了！！","","유 윈!! 미는 루즈!!","Eine Niederlage für mich, ein Sieg für dich!"
807,3002,"","I read you loud and clear! I'm in the way! Here,
go on through!","我知道你想說的！
我不會妨礙你的！　過去吧！！","","네가 말하고 싶은 건 알았다!!
나는 방해하지 않는다! 자, 지나가라!!","Ich höre dich laut und deutlich! Ich bin im Weg!
Hier, geh schon!"
808,3002,"","I have burned allll the way out to pure white ash.","燃燒殆盡了……燒成白灰了……","","불태웠어……새하얀 재로……","Ich alles gegeben."
809,9153,"","Welp, that's another notch for you! Let's do it
again sometime!","這次是你贏了！　要再來比一場啊！！","","이번에는 네가 이겼다! 또 대결해줘!!","Auweia, wieder ein Sieg für dich. Lass uns das
irgendwann wiederholen!"
810,3002,"","Guess I never made much of an opponent for you...","看來我沒辦法當大哥哥的戰鬥對手呢……","","나로는 오빠의 싸움 상대가
안 된 것 같네……","Ich war wohl nie eine besonders würdige Gegnerin
für dich ..."
811,9165,"","Looks like I'm the one who got cocky...","大意受苦的人，是我啊……","","얕보다 큰코다친 건 나, 인가…","Ich bin es wohl, die übermütig geworden ist ..."
812,9165,"","Whaaat, I lost?! Ugh! Watch out, 'cause next time
will go to me for sure!","咦～輸了喔～！
下次對戰的時候我一定會贏的！","","어~, 져버렸어!
다음에는 꼭 이길 거라고!","Wie, ich habe verloren?! Bah! Pass nur auf, das
nächste Mal gewinne ich bestimmt!"
813,9168,"","With this much power, why bother with Zaxon?","有這種實力，為什麼要聽從Zaxon……","","이 정도의 힘을 가졌으면서 왜 잭슨 따위에……","Warum gibst du dich mit Zaxon ab, wenn du so
stark bist?"
814,9168,"","Well, I've lost, so I won't hold you back any
longer. Go along!","對戰輸了就讓開道路。
好了，你過去吧！","","배틀에 졌으니까 길을 양보하마.
자, 가거라!","Ich habe verloren, ich werde dich also nicht
länger behindern. Geh schon!"
815,9168,"","Listen good: next time we tangle, I'm breaking
your nose!","哼，給我記住！
我下次一定會毀了你的囂張態度！！","","헷, 기억해두라고!
다음에야말로 네 코를 납작하게 해주겠어!!","Hör mal gut zu: Nächstes Mal breche ich dir die
Nase!"
816,9165,"","Your Digimon were way stronger than I imagined!","你的數碼寶貝比想像中還強呢！！","","당신의 디지몬, 상상 이상의 강함이었어!!","Deine Digimon waren viel stärker, als ich dachte!"
817,9165,"","Whew, you are strong! I got knocked right on my
butt!","你好強喔！
反而被你狠狠教訓了～！","","너, 강해~!
반대로 내가 때려 눕혀졌어~!","Puh, bist du stark! Ich habe ordentlich den
Hintern versohlt bekommen!"
818,9165,"","Can you hear it? The sound of my knees knocking?!","你聽得見嗎！
我的雙腳正在發抖的聲音啊！！","","너에게는 들리는가!
내 다리가 부들부들 떨리는 소리가!","Hörst du das? Wie meine Zähne klappern?!"
819,9168,"","The heat of your passion hit just the right pitch!","你的火熱感情，真是美妙的音色啊！！","","당신의 뜨거운 마음, 멋진 음색이었어!!","Dein Kampfgeist ist wirklich beeindruckend!"
820,9156,"","Well, time to follow the hacker code and bow out
gracefully.","輸家就乾脆的認輸吧，
這就是駭客的規矩。","","진 자는 깔끔히 물러난다.
그것이 해커의 룰이야","Jetzt muss ich dem Hacker-Ehrenkodex folgen und
mich würdevoll verabschieden."
821,9156,"","I...I guess my resolve wasn't strong enough...","沒做好覺悟的人……是我！？","","각오가 안 됐던 건……나!?","I-Ich ... war wohl nicht entschlossen genug ..."
822,9156,"","This is...incalculably far beyond the strength
I've seen before!","居然有這麼強……真是超出計算！！","","이렇게 강할 줄이야……계산 밖이다!!","Deine Stärke liegt weit jenseits von allem, was
ich bisher gesehen habe!"
823,9156,"","Extermination failed! Requesting immediate
assistance!!","驅除失敗！　要求緊急救援！！","","제거 실패! 긴급 구원을 요청한다!","Tilgung gescheitert! Bitte um sofortige
Unterstützung!"
824,9153,"","Ugh. Looks like I used too much power.","嗚……
看來用了太多力量了啊。","","끅……
아무래도 힘을 너무 쓴 것 같군","Puh. Ich habe mich wohl zu sehr verausgabt."
825,9153,"","Waaaah! I'm telling the boss on you!","嗚哇～！
我要跟老大告狀！！","","으아~앙!
보스한테 이를 거야~!!","Uäää! Ich verpetz dich beim Chef!"
826,9153,"","Guess age doesn't mean anything in the Digimon
arena.","數碼寶貝戰鬥跟年齡沒關係啊……","","디지몬 배틀에 연령은 상관없다, 인가……","Wenn es um Digimon-Kämpfe geht, kommt es wohl auf
das Alter nicht an."
827,9156,"","You're quite strong! Q.E.D.","你很強！　證明結束！","","너는 강하다! 증명 완료!!","Du bist ganz schön stark! Wie man sieht!"
828,9153,"","This was a battle worth fighting.","這是……有意義的戰鬥。","","이것은……유익한 싸움이었다","Das war ein würdiger Kampf."
829,9150,"","Well, we should head back to reality.","那麼，回到現實吧……","","그럼, 현실로 돌아갈까……","Wir sollten in die Realität zurückkehren."
830,3002,"","What?! My Digimon, losing? Impossible! I don't
believe it for a second!","怎麼會！！　我的數碼寶貝居然輸了，
真不敢相信！！","","그럴 수가!! 내 디지몬이 지다니
믿을 수 없어!!","Wie?! Meine Digimon verlieren?! Unmöglich! Das
kann ich niemals glauben!"
831,9150,"","You watch out. Fly too close to the sun, and
you'll get burned.","你要是太囂張，
總有一天會吃苦的喔。","","당신, 너무 우쭐대다간
언젠가 큰코다칠 거야","Pass du nur auf. Überflieger verbrennen sich
schnell mal die Finger."
832,9150,"","Oh, my—looks like there was no need to have her
along after all.","哎呀哎呀，看來不需要大姊姊陪你了呢。","","어라어라, 누나가 같이 있어줄 필요가
없었던 것 같네","Hoppla ... Wir hätten sie also gar nicht
gebraucht."
833,9150,"","Hm. Could I have picked the wrong opponent?","嗯……
是不是挑錯對戰的對手了呢～？","","음~……
배틀할 상대를 잘못 고른 걸까~?","Hm. Habe ich mir den falschen Gegner ausgesucht?"
834,9150,"","Awww, very good, very good job! You're one strong
little thing!","好的～做得很棒喔～
小弟弟，你很厲害呢～","","자~, 참 잘했어요~
도련님, 정말 강한 아이구나~","Ui, das hast du aber gut gemacht! So ein starker
kleiner Junge!"
835,3002,"","Y'know, you might not be so bad yourself...pfft.
HA! I couldn't keep a straight face saying that.","仔細看看後，你也不錯呢……呵呵。
開玩笑的啦。","","잘 보니까, 너도 나쁘지 않네……후훗
농담이야","Du bist aber auch gar nicht so schlecht ...
*Kicher* Das konnte ich einfach nicht sagen und
dabei ernst bleiben."
836,9155,"","Man, how can people nitpick the Digimon they like
so much?!","幹麼啦！
不要管別人喜歡什麼數碼寶貝啦！！","","뭐야!
남이 좋아하는 디지몬을 트집 잡지 마!!","Wie können Leute nur die Digimon so nerven, die
sie gernhaben?!"
837,9155,"","Ugh, I lost?! This is boring! I'm going home!","啊啊，輸掉了！
真無聊，我要回去了～！！","","아~아, 져버렸어!
시시하니까 이젠 가야지~!!","Wie, ich habe verloren?! Das ist langweilig hier!
Ich gehe nach Hause!"
838,9155,"","Come on! Your Digimon are so strong it's
practically cheating!","真卑鄙！　居然用那麼強的數碼寶貝！！","","치사해! 그렇게 강해 보이는 디지몬을 쓰다니!!","Menno! Deine Digimon sind so stark, das ist
schon fast Schummelei!"
839,9155,"","Hey, put *that* out front! It's not some ordinary
pushover!","大哥擱在那東西的面前，
也一步都不後退，真不是簡單人物！！","","오빠, 그걸 눈앞에 두고
한 걸음도 물러나지 않다니 범상치 않네!!","He, nimm doch das da ganz nach vorne! Das ist
nicht nur Fallobst!"
840,9155,"","So what do you think? Wanna join us?","怎麼樣？　想不想當我們的夥伴？","","어때? 우리 동료가 되어줄래?","Also, was meinst du? Willst du zu uns kommen?"
841,3002,"","All right, I know what I'm gonna do next! I'll
raise a super cool Digimon!","決定了！　我接下來
要培育帥氣的數碼寶貝！！","","정했다! 다음은 나
멋진 디지몬을 키울 거야!!","So, ich weiß jetzt, was ich als Nächstes mache!
Ich ziehe ein supercooles Digimon groß!"
842,3002,"","Just like I thought...adults can't be trusted!","大人果然很狡猾啊！！","","역시 어른은 치사해!!","Dachte ich es mir doch ... Erwachsenen kann man
nicht trauen!"
843,3002,"","Wooow! Those are some strong Digimon you have!","好強！！
大哥哥的數碼寶貝好棒喔！！","","강해!!
오빠의 디지몬도 멋지구나!!","Boah! Du hast aber starke Digimon!"
844,3002,"","Wish my birthday would hurry up and get here.","生日不能快點到嗎……","","빨리 생일이 오지 않을까……","Ich wünschte, mein Geburtstag wäre schon bald."
845,3002,"","I guess you win in a pure strength contest. So now
we're tied, 1 and 1!","實力比試是大哥哥贏了，
這樣就一勝一負，平手了喔！！","","강함 승부는 오빠가 이겼어.
이걸로 1승 1패, 무승부네!!","Wenn es nur auf Stärke ankommt, gewinnst du wohl.
Jetzt steht es also 1:1 zwischen uns!"
846,3002,"","Aww, c'mooon! You're so immature!!","好過份喔！
大哥哥果然是「不成熟」的人！","","너무해~!
오빠 역시「어른답지 못한」사람이다~!!","Och, was soll denn das! Du bist so kindisch!"
847,3002,"","Well, I lost...but I wasn't afraid!","輸了……
但我才不害怕喔！！","","져버렸어……
하지만 나, 겁먹지 않았어!!","Na, ich habe zwar verloren ... aber ich hatte
keine Angst!"
848,9152,"","Aww, Master, you're such a meanie!","真是的，主人大人真壞心！","","정말~, 주인님은 심술쟁이!","Ach, du bist so gemein!"
849,9152,"","Booo! How come you never let me win?","嗚，為什麼贏不了呢喵？","","으으~, 어째서 이기게 해주지 않는 거냥?","Buhu! Wieso lässt du mich nie gewinnen?"
850,3002,"","You know, you all REALLY ruffle my feathers.","你們讓我有點生氣了啊！","","당신들, 완전 짜증 나거든요~!","Ich glaube, bei euch piept’s wohl."
851,9152,"","Oh no! The attack was a cat-astrophic failure!","怎麼會～突擊失敗了喵～～～☆","","세상에냐~, 돌격 실패다냐~~~앙♥","Ach nein! Der Angriff ist katzastrophal
gescheitert!"
852,3002,"","I can't believe I lost to this piece of human
styrofoam!","居然輸給了路人臉─
我超不甘心的啊─","","잔챙이 얼굴 상대로 져버렸거든요~
완전 분하거든요~!","Ich kann nicht glauben, dass ich gegen so jemanden
verloren habe!"
853,9152,"","How splendid, Master!","真是厲害，主人大人☆","","훌륭하십니다, 주인님♥","Wie wunderbar!"
854,9163,"","Urgh... Ah...","嗚嗚……啊啊……","","으으……아아……","Argh ... ah ..."
855,9163,"","My soul is...undying!","吾魂……不滅……","","나의 영혼은……불멸이도다……","Meine Seele ist ... unsterblich!"
856,9163,"","Oopsies, I lost! Wait, what day of the week was
today again?","哎呀呀，輸了啊～
說起來，今天星期幾啊～？","","어라라, 져버렸네~
그건 그렇고 오늘은 무슨 요일이었지~?","Ups, ich habe verloren! Was war heute noch mal für
ein Wochentag?"
857,9163,"","I'll just keep reviving, again and again and
again!","不管幾次，我都會復活的～","","몇 번이든, 되살아날게~","Ich werde einfach immer und immer wieder
aufstehen!"
858,9163,"","That's all for today. Till our next playdate!♪","今天就到此為止♪　還要再來玩喔♪","","오늘은 여기까지♪ 또 놀러 올게♪","Für heute sind wir fertig. Bis zu unserer nächsten
Spielstunde!♪"
859,9163,"","Will you go away if I give you some candy? No?","給你糖果你就會走了嗎？
……不行？","","과자 주면 가주지 않을래?
……안 돼?","Ziehst du Leine, wenn ich dir Süßigkeiten gebe?
Nein?"
860,9163,"","Th-th-thankyouverymuch!!","啊啊……真是非常感謝你啊啊啊！！","","가, 가……감사합니다아아아아!!","Vielen, vielen, vielen Dank!!!"
