ID,Speaker,Japanese,English,Chinese,EnglishCensored,Korean,German
411,4078,,"Ho sentito anch'io qualcosa su questa banda.
Vogliono fare di Shibuya il loro quartier generale ora
che non c'è nessuno dopo le sommosse dei Digimon.","我也聽說過有關這一帶不良集團的傳聞。
涉谷地下因為數碼寶貝騷亂現在沒什麼人煙，
他們好像就把那裡做為據點之類的……",,"나도 들은 적이 있어. 이 부근의 불량 팀 이야기
디지몬 소동으로 사람이 없어진
시부야 지하를 본거지로 삼고 있다든가…","Ich habe auch von der Bande gehört. Sie wollen
sich jetzt in Shibuya niederlassen, weil nach
den Digimon-Unruhen niemand mehr dort ist."
421,4079,,"Nishio! Oh, sei come un fiore che sboccia nel campo che è
il mio cuore!","西尾小姐……！
啊～妳就像開在我內心原野中的一朵花……！",,"니시오 씨……!
아아, 그대는 내 마음의 들판에 핀 한송이의 꽃과 같도다…！","Nishio! Ach, du bist wie eine Blume, die im Feld
meines Herzens erblüht!"
431,4080,,"La metropolitana? ...Ho sentito che ci sono dei Digimon piuttosto
feroci laggiù. Se stai pensando di andarci, te lo sconsiglierei...","地下啊……我聽說那邊好像有凶暴的數碼寶貝出沒。
你想去的話，勸你還是打消念頭吧？",,"지하인가… 뭔가 흉포한 디지몬이 나온다고 들었던 적이 있네
갈 생각이라면 그만두는 건 어때?","Die U-Bahn? ... Ich habe gehört, dass da ein paar
fiese Digimon rumhängen. Wenn du da hinwillst,
würde ich dir davon abraten ..."
451,1701,,"...Quei tipi stanno cercando di usare i Digimon per scopi malvagi.
Probabilmente li stanno maltrattando in continuazione.","那些傢伙……想把數碼寶貝用在壞事上面。
不，他們可能平常就已經這麼做了。",,"……그 녀석들, 디지몬을 나쁜 짓에 쓰려고 하고 있어
아니지, 평소에도 그럴지도","Diese Typen versuchen, Digimon für böse Zwecke
einzusetzen. Sie misshandeln sie wahrscheinlich
ständig."
452,1701,,"Noi non usiamo mai gli umani per niente!
Non voglio mai avere quel tipo di relazione con un umano!","我們明明就不是被人類拿來用的！
我不希望和人類之間是這樣的關係……",,"우리는 인간에게 이용되는 존재가 아닌데!
그런 관계로 있고 싶은 게 아닌데…","Wir tun das Menschen nicht an! So einen Umgang
mit einem Menschen will ich nicht!"
453,2001,,"È come dice Terriermon.
Accarezza Terriermon sulla testa.
Andiamo lì e facciamogliela vedere a questi!","大耳獸你說得沒錯。
摸摸大耳獸的頭。
快點去找那些傢伙吧。",,"테리어몬의 말대로야
머리를 쓰다듬어준다
빨리 그 녀석들에게 가자","Was Terriermon sagt, stimmt.
Terriermon den Kopf streicheln.
Terriermon hinter dem Ohr kraulen."
454,1701,,"Sì, è proprio così...",嗯，就是呀……我沒有說錯。,,"응, 맞아… 나는 틀리지 않았어","Ja, genau ..."
455,1701,,...!,……！,,……!,...!
456,1701,,"Grazie, [p]...
Hehe, mi sono calmato un po' adesso.","謝、謝謝你，[p]……
嘿嘿，我稍微冷靜一點了。",,"고, 고마워 [p]…
에헤헤, 조금 진정됐어","Danke, [p] ...
Haha, ich habe mich jetzt etwas beruhigt."
457,1701,,Che diavolo!? Scendete!,當然了，這種事情一定是不對的……！,,"물론이지, 이런 건 분명 잘못됐어…!",Was zum Teufel? Lass das!
458,1701,,"Mi chiedo se quei tipi siano qui dentro?
...Andiamo!","那些傢伙就在這裡面嗎？
……我們走吧！",,"그 녀석들, 이 안쪽에 있으려나?
…가자!","Ich frage mich, ob diese Typen hier sind?
... Gehen wir!"
501,4082,,"Ben fatto, sei riuscito a trovarci!",嘿，居然追到這裡來了。,,"헤에, 여기까지 쫓아왔구나","Gute Arbeit, ihr habt uns gefunden!"
502,4077,,"Ad essere onesti, siete venuti qui solo per
essere sconfitti da noi, ma comunque ben fatto!","你是乖乖來被我們痛宰的吧，
佩服佩服！",,"순순히 우리한테 당하러 온 거구만―
좋아, 기특해!","Ehrlich gesagt, seid ihr nur hergekommen, um von
uns besiegt zu werden. Aber trotzdem
gute Arbeit!"
503,4077,,"Voi usate Digimon, vero?
Bene, guarda caso siamo anche noi hacker,
quindi andiamo!","你們會操控數碼寶貝吧？
其實我們也是駭客，就陪你們玩玩好了。",,"너희들, 디지몬을 쓸 거지?
실은 우리도 해커라서 말이지, 상대해줄게","Ihr benutzt Digimon, nicht wahr?
Zufälligerweise sind wir auch Hacker!
Los geht’s!"
504,4077,,"Noi siamo i Digimon master migliori, come vedrai.",我們操控數碼寶貝的技術比你厲害多了。,,우리들 쪽이 디지몬을 더 능숙하게 다른다고?,"Ihr werdet sehen, dass wir die besseren
Digimon-Meister sind."
505,4082,,"Ecco, ho portato questo con me,
usalo per combattere questo tipo.","我把那東西叫出來了，
你們就隨便跟它玩玩吧。",,"자, 저거 불러뒀으니까
적당히 상대해 줘","Hier, ich habe das mitgebracht. Nutze es, um
gegen diesen Typen zu kämpfen."
506,1701,,Ma che!?,那是……哇！,,저거라니… 왓!,Was ...?!
507,1701,,GroundLocomon!,超級火車獸！,,그랜드로코몬!,GrandLocomon!
508,4082,,"Questo è un Digimon che ho trovato qui intorno di recente.
Dopo che abbiamo fatto una o due ""chiacchiere"" con
lui è diventato un bravo e obbediente piccolo schiavo.","這是我們最近在這裡發現的數碼寶貝，
稍微對它動了一點手腳，
它就變成我們聽話的僕人了。",,"최근 여기서 발견한 디지몬이야
쬐―끔 손봐줬더니
우리들의 유순한 부하가 되어줬지 뭐야","Das ist ein Digimon, das ich hier vor Kurzem
gefunden habe. Nach einer kurzen „Unterhaltung“
wurde es ein gehorsamer, kleiner Sklave."
509,4077,,"L'orgoglio di Delight è stato insultato.
Vendicami, piccolo Digimon. Falli soffrire!!!","「Delight」的自尊被傷害，
帶著我的憤怒……大鬧一番吧，
小寶貝！！",,"「Delight」의 프라이드에 금이 간
내 분노를 담아서… 폭주해버려
내 디지몬!!","Der Stolz der Schadenfreudebande wurde gekränkt.
Räche dich für mich, kleines Digimon.
Tu ihnen weh!"
551,1701,,Oh... GroundLocomon!,啊、啊……你看超級火車獸！,,"아, 아……그랜드로코몬이!",Ach ... GrandLocomon!
552,4082,,"Ahhhhhhhh!!
P...per favore! Non uccidermi!","嗚……嗚哇——！！
饒、饒命啊，請不要殺我！",,"히…… 히이이이이익!!
요, 용서해줘, 죽이지 말아줘!","Ahhhhhh!
B-Bitte! Töte mich nicht!"
553,4077,,"Ma...COSA!? Ma questo...questo non ha alcun senso!
Come può quel Digimon essere sconfitto così facilmente!?","到……到底是怎樣啦！
居然這麼快就打倒那個失控的數碼寶貝……
根本是怪物吧……",,"뭐… 뭐야, 뭔데!
그 폭주 디지몬을 그렇게 빨리 쓰러뜨리다니…
너무 괴물이잖아…","W-WAS?! Aber das ergibt keinen Sinn!
Wie konnte dieses Digimon so schnell besiegt
werden?"
554,1701,,Mai... Non ti perdonerò mai!,我不會原諒你們的！,,"용서하지 않을 거야, 너희를 용서하지 않겠어!!",Niemals ... Das werde ich dir niemals verzeihen!
555,1701,,"I Digimon non sono strumenti da usare!
Siamo stati catapultati in questo mondo che non conosciamo,
ogni giorno lottiamo con terrore e paura...","數碼寶貝才不是什麼道具！
我們突然被彈飛到未知的世界，每天都很害怕不安……",,"디지몬은 도구 같은 게 아니야!
갑자기 모르는 세계로 날려와서 매일이 불안하고 무섭고…","Digimon sind keine Werkzeuge!
Wir wurden in diese unbekannte Welt gebracht und
stellen uns jeden Tag unseren Ängsten ..."
556,1701,,"Ci sono Digimon terrorizzati dagli umani!
Ma... ci sono anche Digimon che credono che possa esserci amicizia
tra umani e Digimon!","有數碼寶貝因為不安而出手傷害人類！
但……同樣也有想和人類友好共處的數碼寶貝啊！！",,"두려움 때문에 인간을 상처입히는 디지몬도 있어!
하지만… 인간과 사이좋게 지내고 싶어하는 디지몬도 있는데!!","Es gibt Digimon, die von Menschen terrorisiert
werden! Aber es gibt auch Digimon, die glauben,
dass Menschen und Digimon Freunde sein können."
557,1701,,"Probabilmente quel GroundLocomon pensava questo!","那個超級火車獸
說不定也是這樣想的！！",,"그 그랜드로코몬도
그렇게 생각했을지 모르는데!!","Dieses GrandLocomon hat das wahrscheinlich
gedacht!"
558,1701,,Gli umani sono... Gli umani sono...!,你們這些可惡的人類……！,,"인간 따위, 인간 따위……!",Menschen sind ... Menschen sind ...!
559,2001,,"Terriermon, basta.
Non tutti gli umani sono così!
Io sono tuo amico, Terriermon!","大耳獸，到此為止。
並非所有人類都是這樣。
我是站在大耳獸這邊的。",,"테리어몬, 거기까지야
그런 인간만 있는 건 아니야
나는 테리어몬 편이야","Terriermon, das reicht.
Nicht alle Menschen sind so!
Wir sind Freunde, Terriermon!"
560,1701,,...Uh! [p]...,唔！　[p]……,,……윽! [p]……,... Ah! [p] ...
561,1701,,"...È vero.
Tu non sei così, [p].","……你說得對，
[p]和這些人不同。",,"……그렇네
[p]는(은) 이 사람들과는 다르지","... Das stimmt.
Du bist nicht so, [p]."
562,1701,,"Aiuti qualsiasi umano che è nei guai...
e anche Digimon come me.","你無法丟下有困難的人不管……
不，像我這樣的數碼寶貝你也不會棄而不顧。",,"곤란해하는 사람을 그냥 두지 못하고…
아니, 나 같은 디지몬도 그냥 두지 못해","Du hilfst allen Menschen, die Probleme haben ...
und sogar Digimon wie mir."
563,1701,,"Non abbiamo passato molto tempo insieme, ma nonostante ciò, lo so.",雖然在一起的時間很短，我還是明白。,,함께 있었던 시간이 짧았어도 알 수 있어,"Wir haben noch nicht viel Zeit zusammen verbracht,
aber ich weiß es trotzdem."
564,1701,,"Sei gentile e di buon cuore, [p].","溫和、直率……
[p]就是這樣的人。",,"엄청 마음이 따뜻하고, 솔직한…
[p]는(은) 그런 사람이지","Du bist gütig und warmherzig,
[p]."
565,1701,,"Come ha detto [p], costituisciti alla polizia,
rifletti su quello che hai fatto e rimetti le cose a posto.","你們聽[p]的話去自首吧。
反省之後再重新來過。",,"[p]의 말대로 경찰에 자수해서
반성하고, 새 출발하도록 해","Wie [p] meinte ... Stellt euch der Polizei,
denkt über eure Taten nach und
tut das Richtige."
566,1701,,"Anche persone come te possono cambiare le cose...
Quindi, proverò a fidarmi di te.","就算是你們這樣的人，也能夠改過自新……
因為我想先相信你們看看。",,"너희들 같은 사람이라도 한 번 더 다시 시작할 수 있어
우선은 나부터 믿어보기로 했으니까","Selbst Leute wie ihr können sich ändern ...
Deshalb versuche ich, euch zu vertrauen."
567,4077,,S...sì! Me ne vado immediatamente...,是、是的！　我們會……直接過去的。,,"네, 네에엡! 이대로… 다녀오겠습니다",J-Ja! Ich werde gleich losgehen ...
568,1701,,"Beh... immagino che alla fine sia andata bene, non credi?",這樣……就可以了吧？,,이걸로… 된 거겠지?,"Na, das hat sich doch gut entwickelt, nicht wahr?"
601,1701,,"Bene, [p],
credo che questo concluda il mio caso.","聽我說，[p]。
我的委託到此為止就好了。",,"있잖아, [p]
내 의뢰는 여기까지로 할게","Also, [p],
ich glaube, mein Fall ist jetzt abgeschlossen."
602,1701,,"Sai, il motivo per cui ho scelto te non è stato solo perché
sei un detective capace.","我之所以選你當認識人類的對象，
並非只是因為你是一個有本領的偵探。",,"인간을 알기 위해 너를 선택한 건 말야
단지 실력이 좋은 탐정님이라서가 아니야","Weißt du, ich habe dich nicht nur ausgewählt,
weil du ein guter Detektiv bist."
603,1701,,"Volevo fare amicizia con gli umani, ma io stesso avevo paura di loro.
Quindi ho chiesto a voi ragazzi perché avete una buona reputazione
tra i Digimon.","我口口聲聲說想和人類友好共處，
但其實自己卻很害怕人類。
所以只好拜託在數碼寶貝間風評不錯的你們。",,"인간과 사이좋게 지내고 싶다고 하면서도
나 자신이 인간을 무서워하고 있었기 때문이라고 생각해
그러니까 디지몬에게 평판이 좋은 너희한테밖에 부탁할 수 없었어","Ich wollte mit Menschen befreundet sein, aber ich
hatte Angst. Also habe ich euch gefragt, weil
ihr bei Digimon einen guten Ruf habt."
604,1701,,"...Gli umani come quelli e io non ci capiremo mai.
Una parte di me avrà sempre paura e non vorrà mai stargli intorno.","如果是剛才那樣的人類，
我一定無法跟他們互相理解的。
因為我心中隱隱覺得好可怕、不想跟他們在一起……",,"……아까 그 녀석들 같은 인간이라면
분명 서로 이해하지 못할 거야. 무서워서 함게 있고 싶지 않다고
마음 속 어딘가에서 생각했을 거라고… 생각해","... Menschen wie diese Kerle und ich werden uns
nie verstehen. Ein Teil von mir wird immer Angst
haben und sich lieber von ihnen fernhalten."
605,1701,,"Ma quando vedo te, capisco.
Che si tratti di un Digimon o di un umano,
hai un modo di guardare qualcuno e guadagnarti la sua fiducia.","不過，看到你我就懂了。
不論對方是數碼寶貝還是人類，你都會正視對方。
你是一個值得信任的人。",,"하지만 말야, 널 보면서 깨달았어
너는 디지몬이든 인간이든 제대로 상대를 바라봐주는
신용할 수 있는 상대야","Aber wenn ich dich sehe, verstehe ich es. Egal, ob
Digimon oder Mensch, du siehst demjenigen in die
Augen und verdienst dir Vertrauen."
606,1701,,"Quindi, vorrei poter guardare le persone in faccia ed essere onesto,
come te. Vorrei poter fare amicizia, senza aver paura.","所以我也想變得跟你一樣，
不論對方是誰，我都可以直接面對他！
我想和更多人類好好相處，而不會感到害怕。",,"그러니까, 나도 너처럼
어떤 상대라도 올곧게 마주할 수 있게 되고 싶어!
무서워하지 않고 많은 인간과 사이좋게 지내고 싶어","Deshalb möchte ich Leuten ins Gesicht schauen und
ehrlich sein können, wie du. Ich möchte Freunde
finden, ohne Angst haben zu müssen."
607,1701,,"Più di questo, voglio uscire e dire ai Digimon
del mondo che ci sono umani come te,
che non devono avere paura.","然後告訴其他數碼寶貝，
世上有好多好多像你這樣善良的人類。
我想告訴它們，害怕是不行的。",,"그래서 좀 더 많이 디지몬들에게
너 같은 좋은 인간이 있다는 걸 전해주고 싶어
무서워하면 안된다고, 말해주고 싶어","Außerdem möchte ich der Digimonwelt erzählen,
dass es Menschen wie dich gibt und dass sie
keine Angst haben müssen."
608,1701,,"...E infine vorrei chiederti qualcosa, [p].","最後……
有件事想拜託[p]。",,"……마지막으로
[p]에게 부탁이 있어","... Und zu guter Letzt wollte ich dich etwas
fragen, [p]."
609,1701,,"La mia mano sarà piccola, ma...
promessa col mignolo?",我的手很小……不過你願意和我打勾勾嗎？,,"내 손, 작지만… 손가락 걸기 해주지 않을래?","Meine Pfoten mögen klein sein, aber ... gibst
du mir trotzdem die Hand darauf?"
610,1701,,"Promettimi che, per quanto difficile possa essere,
non ti arrenderai mai, creerai amicizie tra Digimon e umani
e farai del tuo meglio!","我要和你約好，不論再痛苦我都不會逃避，
要努力讓數碼寶貝和人類友好共處。",,"네게 약속할게. 아무리 괴로워져도 도망치지 않고
디지몬과 인간이 사이좋게 지낼 수 있도록 힘내겠다고","Versprich mir, egal wie schwer es ist, dass du nie
aufgibst und Freundschaften zwischen Digimon und
Menschen knüpfst und du dein Bestes gibst!"
611,2001,,È una promessa.,約好了哦。,,약속이야,Versprochen.
612,1701,,...Sì!,……嗯！,,……응!,Jippie!
613,1701,,"Beh, comunque, è stato davvero fantastico come hai gestito
quel caso, [p]!","可以委託[p]
真是太好了！",,"있지! [p]한테 의뢰해서
정말 다행이야!","Na, jedenfalls war es wirklich fantastisch, wie du
diesen Fall gelöst hast, [p]!"
614,1701,,"Grazie! Okay, allora vado!","謝謝你！
那我要走了。",,"고마워!
그럼, 갈게","Danke!
Ich bin dann mal weg!"
615,1701,,...A dopo!,再見！,,……또 봐!,Bis dann!
651,3006,,Un altro caso risolto con successo!,這次的委託似乎也圓滿達成了呢。,,이번에도 무사히 의뢰를 해결한 것 같군,"Noch ein Fall, der gelöst ist!"
652,3006,,"...Eh? Sarà solo una mia impressione o ti vedo un po' più maturo?
Beh, quando avremo tempo potrai raccontarmi tutto in dettaglio.","奇怪？
你的神情好像變了，是我看錯了嗎？
等我有空再來問你怎麼回事好了。",,"……음?
조금 표정이 바뀐 것 같은 건 기분 탓인가?
자세한 건 시간이 있을 때 듣도록 하지","Huch? Bilde ich mir das nur ein oder siehst du
reifer aus? Also, wenn wir mehr Zeit haben, musst
du mir das alles ganz genau erzählen."
681,3006,,"...Hmm, sembra che siamo stati in grado di soddisfare le aspettative
del cliente su questo incarico.
Tu e Terriermon siete maturati molto durante questo periodo.","嗯……看來你的表現讓委託人挺滿意的。
和大耳獸在一起，你自己本身應該也成長了不少吧？",,"……흠, 의뢰인이 기대한 만큼 일한 듯하군
테리어몬과 함께 너 자신도 크게 성장한 거 아닌가?","... Hm, wir haben bei dem Fall wohl die
Erwartungen des Klienten erfüllt. Du und
Terriermon seid dadurch beide reifer geworden."
