ID,Speaker,Japanese,English,Chinese,EnglishCensored,Korean,German
1,3010,"","Oooooh yeeeeeeah! How's everyone doing tonight~!
That's right, it's the one, the only, Jimmy KEN!","嘻哈！你好嗎？？
是本大爺啊！本大爺是吉米肯，有問題嗎！？","","히얏하―! 잘 지내고 있어??
이 몸이야 이 몸, 지미KEN인데, 뭔가 문제라도!?ㅋㅋ","Oooh yeah! Wie geht es euch allen heute?
Jawoll, ich bin der einzig wahre Jimmy KEN!"
2,3010,"","......","……","","……","..."
3,3010,"","Huh!?","哇！？","","왓!?","Hä?!"
4,3010,"","Hey! Your part is done already. You should be
gone, baby! What do you... What do you mean
one-hit-wonder?!","你、你、你應該已經完成使命了？
已、已、已、已經過氣的人？
曇、曇、曇、曇花一現的歌手？","","……네, 네, 네 역할은 이미 끝났을 텐데?
………과, 과, 과, 과거의 사람?
…………바, 바, 바, 반짝 스타?","He! Dein Teil ist schon vorbei! Du solltest weg
sein, Baby! Was heißt ... Was meinst du mit
Eintagsfliege?"
5,3010,"","......","……","","……","..."
6,3010,"","Rrraaaaaaaagh~!","什麼————！？","","와아아아――――앗!?","Grrraaaaaagh!"
7,3010,"","How dare you defy the Lord of Rock! That's just
cruel, baby!","你在說什麼鬼話啊——！
居然毫不留情地戳中別人會受傷、最在意的事！","","넌 대체 무슨 말을 하는 거야아――!
사람이 상처받는 말을, 신경 쓰고 있는 일을 아무렇지도 않게―!","Du wagst es, dem Herrn des Rock zu trotzen?!
Das ist gemein, Baby!"
8,3010,"","...Huh?","咦？","","…에?","... Was?"
9,3010,"","Okay, well maybe you didn't SAY it...","你什麼都沒說？","","…아무 말도 안 했다고?","Gut, GESAGT hast du es vielleicht nicht ..."
10,3010,"","......","……","","……","..."
11,3010,"","But you were totally thinking it!","但是你有覺得吧！
有在心裡想吧？沒錯吧？是吧！？","","…하지만 생각했잖아!
마음 속으로 그렇게 생각했지? 그렇지, 응!?","Aber gedacht! Ganz bestimmt!"
12,2001,"","Well...
Uh...
Yeah, totally was.","嗯，
那是
當然的。","","뭐
그야
당연","Na ja ...
Äh ...
Ja, absolut."
13,3010,"","I knew it! I hope you remember that when you're
facing me again! I've got a little surprise in
store, Cyber Sleuth! Hahaha!","哎，你會那樣想也是情有可原啦！
事實上，我就是覺得你是那樣想，才會聯絡你。","","뭐, 네가 그렇게 생각하는 것도 무리는 아니지!
그보다 그렇게 생각하고 있을 게 뻔하니까 이렇게 연락한 거라고ㅋㅋ","Ich wusste es! Hoffentlich denkst du dran, wenn
wir uns wieder gegenüberstehen! Ich habe eine
kleine Überraschung für dich, Cyber-Detektiv! Ha!"
14,3010,"","You are officially invited to Jimmy KEN's Mighty Comeback Tour! Yeeeeeah~!","我也受到你不少照顧，
就特別招待你參加本大爺的大復活祭典吧。","","잔뜩 신세를 진 너를
이 몸 대부활제에 특별히 초대해 주겠어ㅋㅋㅋ","Du bist offiziell eingeladen auf die
Super-Comeback-Tour von Jimmy KEN! YEAH!"
15,2001,"","!?","！？","","!?","?!"
16,3010,"","Isn't that awesome?! Aren't you so freaking
psyched! Oh, and guess who's Jimmy KEN's special
guest? I present to you... Miss Reiko Tawa!","專～心聽好囉。
田和玲子在我手上，她會是大復活祭典的活祭品！","","알겠지, 잘 들어
대부활제를 위한 인신 공양으로 타와 레이코를 데리고 있다!","Ist das nicht abgefahren?! Kannst du es glauben?
Und rate mal, wer Jimmy KENs Gaststar ist?
Ich präsentiere ... Fräulein Reiko Tawa!"
17,3010,"","......","……","","……","..."
18,3010,"","Huh? What do you mean, ""Who's that""?! That ain't
funny, kid!","哈？你問那是誰？
你這……搞什麼……哪有人這樣的啦。","","헤? 그게 누구냐고?
너, 잠깐, 그건… 아니지ㅋㅋ","Wie? Was soll das heißen, „wer ist das“?
Das ist nicht lustig!"
19,3010,"","Reiko Tawa! You know, Reiko... Tawa...
Ugh! The CD sales-girl!","就是淘兒唱片的店員——田和玲子啦！","","타워 레코드의 점원, 타와 레이코 말이야아아――!","Reiko Tawa! Na du weißt schon, Reiko ... Tawa ...
Uff! Die Verkäuferin in dem CD-Laden!"
20,3010,"","Whatever! If you want her back, you'd best make
an appearance! Come to the Tower Records, we're
gonna light it up and kick off the show!","你想要我放了她的話，就給我過來「涉谷的淘兒唱片前」！
地獄的表演要開始啦———！！","Whatever! If you want her back, you'd best make
an appearance! Come to Shibuya Records, we're
gonna light it up and kick off the show!","되찾고 싶으면「시부야의 타워 레코드 앞」으로 와라!
지옥 쇼의 시작이다아아아아아―――!!","Egal! Wenn du sie wiederhaben willst, solltest
du dich blicken lassen! Komm zu Shibuya Records,
da wird’s eine mächtige Show geben!"
21,3010,"","......","……","","……","..."
22,3010,"","You... You don't wanna go?","咦？
討厭？不想來？","","에?
싫다고? 가고 싶지 않다고?","Du ... Du willst nicht hin?"
23,3010,"","But you have to go! I submitted a case! You
accepted it! Haha! I got you trapped now!","但我已經委託你了耶！
你也已經接受委託了吧！","","하지만 이미 의뢰로 냈고―
넌 이미 의뢰를 받았고―ㅋㅋㅋ","Aber du musst! Ich habe einen Fall eingereicht!
Du hast ihn angenommen! Haha! Jetzt hab ich dich!"
24,3010,"","A real sleuth would never abandon a case! Hahaha!","身為一個偵探，你要好好完成委託啊！","","탐정으로서 받은 의뢰는 확실히 완수하라고ㅋㅋㅋ","Ein echter Detektiv gibt nie einen Fall auf!
Hahaha!"
25,2001,"","I'm actually kinda worried about Reiko, maybe I
should go to the Tower Records, just in case.","雖然那樣說，我還是很擔心熱愛音樂的田和玲子。
去淘兒唱片看看吧。","I'm actually kinda worried about Reiko, maybe I
should go to  Shibuya Records, just in case.","하지만 음악을 사랑하는 타와 레이코 씨가 걱정이야
타워 레코드로 가 보자","Ich mache mir Sorgen um Reiko. Vielleicht sollte
ich vorsichtshalber zu Shibuya Records gehen."
