ID,Speaker,Japanese,English,Chinese,EnglishCensored,Korean,German
100,9101,"","What's going on? Some kind of promotion for a
special effects movie?","這、這是什麼……？
是特攝電影的宣傳之類的東西嗎……？","","뭐, 뭐야, 이거…? 특수 촬영 영화의 선전 같은 거겠지…?","Was ist los? Ist das Werbung für einen Film mit
Spezialeffekten?"
101,9102,"","Wow, monsters in the real world! Now that's some
impressive 3D!","怪物竟然出現在現實世界裡了……！
這才是真正的3D啊……！","","괴물이 현실 세계에 있다니…!
이거야말로 진정한 3D야……!","Wow, Monster in der echten Welt! Der 3D-Effekt
ist echt beeindruckend!"
102,9103,"","I can't believe what's going on in Ikebukuro.
It's not really the time for me to be pushing new
games, is it?","感覺，池袋變得有點不太妙了啊……
我……現在不應該在這裡賣什麼
新商品才對吧……？","","뭔가, 이케부쿠로가 굉장한 상황이 되어버렸는데…
나…신상품 따위나 팔고 있을 상황이 아니지 않나…?","Ich kann nicht fassen, was in Ikebukuro geschieht.
Kein guter Zeitpunkt, um zu versuchen, neue
Spiele zu verkaufen, oder?"
103,9104,"","Could EDEN Syndrome and all the other strange
things that have happened so far have been
leading up to this major phenomenon?!","該不會，至今所發生的奇怪的事情或是
EDEN症候群都是這個大規模怪奇現象的
前兆吧……哈、哈哈……怎麼會嘛！","","어쩌면 지금까지 일어났던 이상한 일이나 EDEN 증후군은
이 대규모 괴현상의 전조였던 게……
하, 하하…설마!","Kann es sein, dass das EDEN-Syndrom und alle
anderen seltsamen Dinge nur die Vorboten dieses
Phänomens waren?"
104,9105,"","Buy your daily use products at Tokyo Handy down on
the right! For the aquarium, take the escalator!
But be careful of monsters! I better head home...","想、想買生活用品就去左後方的東京手創館……
想去水族館，就搭裡面的手扶梯下去……但是
要注意怪物喔……我也差不多該回去了吧……","","새, 생활용품을 사려면 왼쪽 안에 있는 도쿄 핸디…
수족관에 가고 싶다면 그 안쪽의 에스컬레이터를 내려가면 돼….
하지만 괴물은 조심해…나는 이제 돌아가볼까…덜덜덜","Alles für den täglichen Bedarf bei „Tokyo Handy“
rechts unten kaufen! Zum Aquarium die Treppe
nehmen! Vorsicht vor Monstern! Ich sollte heim ..."
105,9106,"","I can't believe what's happened to this place.","沒想到一直居住的地方會變成這樣……","","설마 지금껏 살아온 도시가 이런 꼴이
돼버릴 줄이야……","Ich kann nicht glauben, was hier passiert ist."
106,9107,"","I wonder what will happen. I'm worried for my
grandchildren.","接下來會變成什麼樣……
很擔心即將出生的孫子啊……","","앞으로 어떻게 되는 걸까…
태어날 손자가 걱정이야…","Ich frage mich, was passieren wird. Ich mache mir
Sorgen um meine Enkel."
107,9109,"","Boss! I've been working in EDEN again today.
There's a new security patch available. I think we
should update.","部長！　今天也是在EDEN做生意啊！
已經到手最新的防範措施了，
趕快更新一下比較好喔！","","부장님! 오늘도 EDEN에서 영업이셨군요!
최신 보안을 갖췄으니까
업데이트해두시는 편이 좋을 겁니다!","Chef! Ich habe heute wieder in EDEN gearbeitet.
Ein neuer Sicherheits-Patch ist verfügbar.
Ich glaube, wir sollten das Update installieren."
108,9108,"","Young people are so quick to adapt. You seem to
know your stuff. Are you sure you're not a hacker?","不虧是年輕人啊，很快就能適應環境了……
你竟然會這麼了解，該不會你是駭客吧？","","역시 젊은 녀석은 환경에 적응하는 것도 빠르네…
묘하게 자세한데, 설마 해커는 아니겠지?","Junge Leute passen sich so schnell an. Du scheinst
dich auszukennen. Bist du sicher, dass du kein
Hacker bist?"
109,9109,"","What? No way! As if! Haha...ha...","咦？　討厭啦！　怎麼可能嘛──！
啊哈哈……哈……","","에? 설마요! 그럴 리가 없잖습니까~!
아하하…하…","Was? Auf keinen Fall! Als ob! Haha ... ha ..."
110,9110,"","Please stay away from the area affected by the
strange phenomenon.","請不要靠近怪奇現象發生的場所。","","괴현상이 일어나고 있는 장소에는 다가가지 말아 주세요","Bitte halte dich von dem Bereich fern, in dem
das seltsame Phänomen aufgetreten ist."
111,1061,"","Hey, what's an aquarium? And what's a movie
theater?","那個那個，水族館是做什麼的地方呀？
電影院又是做什麼的地方呀？","","저기저기, 수족관이란 건 뭐 하는 곳이야?
영화관은 뭐 하는 곳이고~?","Hey, was ist ein Aquarium? Und was ist ein Kino?"
112,1058,"","They look fun! We've come all this way; we might
as well enjoy ourselves!","感覺這裡好熱鬧喔！
好不容易都來到這裡了，就來好好享受一下吧～","","뭔가 시끌벅적한 곳이네~!
모처럼 왔으니까 실컷 즐겨야지~","Wie cool! Wir haben eine lange Reise hinter uns.
Wir könnten etwas Spaß vertragen!"
113,9212,"","Have you heard the rumor about the Stealth Hide
hacking skill? They say it lets you move around
Kowloon without being seen by hackers.","你知道叫Stealth Hide的駭客技能嗎？
據說只要用那技能，就能不被駭客發現，
自由探索Kowloon耶。","","스텔스 하이드란 해킹 스킬에 대한 소문은 들었어?
이걸 쓰면 해커들에게 발견되지 않고
쿠롱을 탐색할 수 있다고 하더라","Hast du das Gerücht über die Hacking-Fertigkeit
„Tarnkappe“ gehört? Man kann sich damit in Kowloon
bewegen, ohne von Hackern gesehen zu werden."
114,9212,"","But they will be able to see you if they're on
high alert, like during a Territory Capture.","不過在領域爭奪戰、敵方駭客戒心很重時，
好像還是會被發現喔。","","엠블럼 쟁탈전같이 적 해커의 경계심이 강한 경우엔
탐지되고 마는 것 같지만","Aber sie können dich sehen, wenn sie gerade in
Alarmbereitschaft sind, wie zum Beispiel während
einer Revierübernahme."
200,9101,"","I saw a huge monster come out of that building.
It was terrifying. I thought I was a goner.","我從那裡的建築物，看到了有巨大的怪物跑出來。
非常有氣勢，還以為我會死掉呢……","","그쪽 건물에서 거대한 괴물이 나오는 걸 봤어.
굉장한 박력이라 이제 죽는 건가 싶었어……","Ich habe gesehen, wie ein riesiges Monster aus
dem Gebäude kam. Es war furchterregend. Ich
dachte, mein Ende naht."
201,9102,"","That was a massive explosion. It's a miracle that
more people weren't hurt.","明明發生了那麼大的爆炸，幸好傷者
只有一些人而已。幾乎可以說是奇蹟了呢……","","그렇게 굉장한 폭발이었는데 다행히 다친 사람이 좀 나온 정도로
끝난 모양이야. 정말 기적 같은 일도 다 있네…","Das war eine unglaubliche Explosion. Ein Wunder,
dass nicht mehr Leute verletzt wurden."
202,9103,"","Now there's a huge monster on top of everything
else that's been going on. I can't take any more!
Boss! I think it's time I quit!","街道變得怪怪的還有巨大的怪物跑出來，
我已經受夠了！店長！
我可以辭職了嗎！？","","도시는 이상해졌고, 거대한 괴물은 나오고, 이젠 싫어~!
점장님~! 알바 관둬도 되나요~!?","Zusätzlich zu allem anderen gibt es jetzt auch
noch ein riesiges Monster! Ich kann nicht mehr!
Chef! Ich glaube, ich muss kündigen!"
204,9105,"","Buy your daily use products at Tokyo Handy down on
the right! For the aquarium, take the escalator!
Whatever monsters show up, I'll always be here!","想買生活用品，就去左後方的東京手創館！
想去水族館，就搭裡面的手扶梯下去！
不論有什麼怪物跑出來，大叔我都會在這裡喔！","","생활용품을 사려면 왼쪽 안에 있는 도쿄 핸디!
수족관에 가고 싶다면 그 안쪽의 에스컬레이터를 내려가면 돼!
어떤 괴물이 나오더라도 아저씨는 항상 여기에 있을 거야!","Alles für den täglichen Bedarf bei „Tokyo Handy“
rechts unten kaufen! Zum Aquarium die Treppe
nehmen! Ich bin hier, auch wenn Monster kommen!"
205,9106,"","A giant monster came out of the building? I guess
we aren't even safe in our own homes anymore.","聽說從建築物裡面突然跑出來巨大的怪物？
這樣子的話，就連家裡也可能不是安全的了……","","건물 안에서 갑자기 거대한 괴물이 나왔다면서?
이젠 집도 안전하지 않을지도 모르겠어…","Ein riesiges Monster kam aus dem Gebäude? Nicht
mal in unseren Häusern sind wir mehr sicher."
206,9107,"","Maybe I should move away, for the sake of my
grandchildren.","為了孫子，搬去其他縣市應該會比較好呢……","","손주를 위해서도, 지방으로 이사하는 편이 좋으려나…","Vielleicht sollte ich wegziehen, um meiner Enkel
willen."
207,9108,"","First that strange phenomenon, and now a giant
creature. I can't work like this. I think I'll ask
my manager if I can evacuate to the suburbs.","怪奇現象導致巨大生物出沒，沒辦法
安心營業下去啊。要不要跟社長商量看看，
趁現在趕快去郊外避難。","","괴현상에 거대생물까지 나오니 마음 놓고 영업도 못 하겠어.
지금 이 틈에 도시 주변으로 피난 가자고 사장님께 건의해볼까","Erst das seltsame Phänomen und jetzt ein riesiges
Wesen. So kann ich nicht arbeiten. Ich frage den
Chef, ob ich die Stadt verlassen darf."
208,9109,"","I'm sure the company will cover the relocation
expenses.","搬家的資金之類……有辦法向公司請款嗎……","","이사 수당 같은 걸…회사에서 받을 수는 없을까… ","Die Firma wird die Kosten für die Verlegung sicher
übernehmen."
209,9110,"","There's a risk of debris falling from this
building. Please maintain a safe distance.","這個建築物，可能會有物體砸落的危險。
請勿靠近。","","이 건물은, 낙하물 등이 떨어질 위험이 있으니
다가가지 말아 주세요","Es besteht ein Risiko, dass von dem Gebäude
Trümmerteile hinabfallen. Bitte halte einen
Sicherheitsabstand ein."
210,1081,"","What was that Digimon that came out of there?
I've never seen one like that before.","從那邊跑出來的數碼寶貝，是什麼數碼寶貝啊？
沒有見過那種數碼寶貝呢。","","거기서 나온 디지몬, 무슨 디지몬이었을까~?
본 적도 없는 디지몬이었어~","Was war das Digimon, das dort herauskam? So eins
habe ich noch nie gesehen."
211,1058,"","There was a human on that big Digimon's shoulder!
It was so cool!","在很大隻的數碼寶貝的肩上坐著人類！
好帥氣啊！","","커다란 디지몬의 어깨에 인간이 타고 있었어!
멋지더라~!","Auf der Schulter des großen Digimon befand sich
ein Mensch! Das war so cool!"
