ID,Speaker,Japanese,English,Chinese,EnglishCensored,Korean,German
201,2000,"","...!","……！","","…!","...!"
202,2000,"","...?","……？","","……?","...?"
1,4806,"","It's over...
There's nothing else I can do...","夠了，已經不重要了……","","됐어요… 이제 됐어요…","Es ist vorbei ...
Mehr kann ich nicht tun ..."
2,4806,"","Everything I did...
It was all for nothing...","至今為止我所做的事情……
全都是白費的……","","지금까지 해 온 것들은…
전부 헛수고였어…","Alles, was ich getan habe ...
Es war alles umsonst ..."
3,4806,"","No one is coming back.
I'm out of options...","誰都不回來，
我手中什麼都沒有……","","그 누구도 돌아오지 않아
내 손 안에는 아무것도 없어…","Niemand kehrt zurück.
Ich habe keine Wahl mehr ..."
4,4806,"","No matter what I do, if I end up with nothing...","既然不管做什麼，結果都是徒勞無功的話，","","…무엇을 해도, 헛수고로 끝난다면","Was ich auch tue, wenn mir nichts bleibt ..."
5,4806,"","It doesn't matter anymore.","就，算了……","","…이제, 됐어요","Es macht keinen Unterschied mehr."
6,2000,"","...?","………？","","………?","...?"
