ID,Speaker,Japanese,English,Chinese,EnglishCensored,Korean,German
1,3045,,"Ho sentito tutto ciò che mi serviva. Voi due
avete capito?","這樣就足夠了。
你們兩個，都知道了吧？",,"……이걸로 탐문은 충분해.
둘 다 알겠어?","Ich habe genug gehört. Seid ihr zwei schon drauf
gekommen?"
2,1392,,"Intendi chi fosse la persona senza volto? Non ne ho
idea!","妳是說無臉鬼的真面目嗎？
我完全不曉得啊──！",,"달걀귀신의 정체 말야?
당연히 모르지!","Wer die gesichtslose Person war, meinst du?
Ich habe keine Ahnung!"
3,3045,,"Signor Akao, chiederò ai suoi amici e scoprirò chi
era la persona senza volto.","赤尾先生，大家請聽我說。
……我找到無臉鬼的真面目了。",,"아카오 씨, 그리고 다들 들어봐.
……달걀귀신의 정체를 찾아낼게","Ich werde deine Freunde befragen und herausfinden,
wer die gesichtslose Person war."
4,7350,,Okay.,我、我知道了。,,"아, 알았어",Okay.
