ID,Speaker,Japanese,English,Chinese,EnglishCensored,Korean,German
481,1057,"","But you have to make sure the villains look good
on screen.","但是，你們要把反派也拍得很帥氣喔。","","다만, 악역이라도 멋있게 찍어줘","Aber ihr müsst dafür sorgen, dass die Schurken
auf der Leinwand gut aussehen."
482,1737,"","Huh?... R-really!? You guys are okay with it?","咦？……什麼！？
真的可以嗎？","","어? …어!?
괜찮은 거야?","Wie? ... W-Wirklich?! Ihr habt damit kein Problem?"
483,1175,"","Best get started before we change our minds...","趁我們還沒改變主意前快點進行吧。","","우리 마음이 바뀌기 전에 진행하는 게 좋을 거다","Fangen wir lieber an, bevor wir unsere Meinung
ändern ..."
484,1175,"","Justimon, if we're gonna do this, let's do it
right!","裁決獸，
既然要做，我們就全力將它做好！！","","……저스티몬
이왕 할 거라면 전력으로 좋은 작품을 만들자!!","Justimon, wenn wir das machen, machen wir es
richtig!"
485,1737,"","...Thank you so much!","沒問題！拜託你們了！","","……그래! 잘 부탁한다!","... Vielen, vielen Dank!"
486,4277,"","It seems you've managed to work things out.","看來事情圓滿解決了呢。","","아무래도 잘 해결된 것 같네","Anscheinend hast du die Lage geklärt."
487,1425,"","Sorry. When I got here it didn't look like there
was anything I could do, so I just watched from
over there.","對不起，我覺得自己就算出來也無能為力，
所以從途中開始就一直在旁邊觀察情況。","","미안해. 내가 나서도 말리지 못할 것 같길래
중간부터 멀리서 보고 있었어","Tut mir leid. Als ich kam, sah es aus, als ob ich
nichts machen könnte. Also habe ich
einfach von hier aus zugeschaut."
488,1425,"","But BlackWarGreymon and his lot changed their
minds and are cooperating with the Justimon guys
to make a movie now, it seems.","不過沒想到，黑暗戰鬥暴龍獸它們
要和裁決獸它們一起合作演電影啊。","","하지만 블랙워그레이몬 녀석들
저스티몬 일행과 협력해서 영화에 출연하기로 했구나","Aber BlackWarGreymon und seine Leute haben ihre
Meinung geändert und arbeiten zusammen mit den
Leuten von Justimon an einem Film."
489,1425,"","It's all been settled amicably, thanks to you.","事情圓滿解決真是太好了，都是托你的福。","","원만하게 해결돼서 다행이야. 네 덕분이네","Dank dir wurde alles friedlich geregelt."
490,1425,"","Thank you for making our dream of making a movie
come true.","請讓我代替正熱中於製作電影的大家向你道謝，
真的非常謝謝你。","","영화 제작에 열중하고 있는 모두의 몫까지 말할게
정말 고마워","Du hast geholfen, unseren Traum von einem Film
zu verwirklichen. Danke!"
550,1175,"","We're gonna be super busy from now on! We've gotta
make sure to go over the script carefully...","好，之後會越來越忙碌了！
我得把劇本讀得透徹一點……","","자, 앞으로 바빠질 거다!
각본 리딩은 빈틈없이 해야 해…","Ab jetzt werden wir sehr viel zu tun haben!
Wir müssen uns das Skript genau ansehen ..."
551,1057,"","We need to practice action movie stunts and if we
want to get lots of fans, we have to make sure the
villains' performances are perfect!","還得進行演技和武打動作的特訓。
我要演出一個帥氣的反派來增加影迷。","","연기나 액션 특훈도 해야 해
팬을 늘릴 생각으로 멋진 악역을 연기해야겠지","Wir müssen Stunts für Actionfilme einstudieren.
Und wenn wir viele Fans wollen, müssen
die Schurken perfekt rüberkommen!"
552,1085,"","Okay, I'll play the main bad guy at the end.
I'll start trying out different villainous facial
expressions...","呼……我是演大魔王啊。
從現在開始就來多練一些凶狠的表情好了。","","호오… 내가 라스트보스 역이군
지금부터 흉악한 표정의 바리에이션을 찾아보도록 하지","Also gut, ich spiele den Bösewicht ganz am Ende.
Ich probiere schon mal ein paar
schurkische Gesichtsausdrücke aus ..."
553,1737,"","Okay, let's have prep session now! If anyone has
any good ideas, feel free to speak up!","馬上來開會討論吧！
大家有什麼好主意儘管說出來！","","그럼 바로 회의를 해볼까!
좋은 아이디어가 있으면 마구마구 말해다오!","Wir sollten uns jetzt vorbereiten! Wenn jemand
eine gute Idee hat, raus damit!"
554,1079,"","Hey, how about if both the good guys and the bad
guys each have a song? They'll both be cool, I'll
make them and show you!","大家聽我說！要不要幫正義方和邪惡方各做一首主題曲？
我會把這兩首曲子都寫得很棒的！","","있지! 정의 측과 악역 측의 노래를 각각 만드는 건 어떨까?
둘 다 멋있게 만들어 볼게!","He, wie wäre es, wenn die Helden und die Schurken
ein Lied haben? Sie werden beide cool sein.
Ich nehme sie auf und spiele sie euch vor!"
555,1014,"","Awesome! We've just doubled our cast! Things are
looking up!","好棒……太棒了！
一口氣增加了好多同伴！　真是讓人安心……！","","굉장해… 굉장하다고!
동료가 단숨에 두배야! 든든한걸…!","Fantastisch! Wir haben unsere Besetzung gerade
verdoppelt. Alles läuft hervorragend!"
556,1425,"","Heehee...looks like fun. With everyone pooling
their talents, I'm sure this will be a good movie.","呵呵……大家看起來好開心。
只要集合大家的力量，一定可以拍出有趣的電影。","","후후… 즐거워 보이네
모두의 힘이 모이면 분명 재미있는 영화가 될 거야","Hihi ... Klingt lustig. Wenn alle ihre Stärken
nutzen, wird es sicher ein guter Film."
