ID,Speaker,Japanese,English,Chinese,EnglishCensored,Korean,German
100,1425,"","Ah, great timing!","啊，你來得正好。","","아, 좋을 때 와줬어","Ah, gutes Timing!"
101,1425,"","Some Digimon friends of mine were summoned by this
letter. Here it is...","我的數碼寶貝朋友被一封信叫出去了。
內容是這樣的……","","누가 디지몬 친구들을 편지로 불러냈어
이 편지인데…","Ein paar meiner Digimon-Freunde haben diesen
Einladungsbrief erhalten.
Hier ist er ..."
102,4971,"","""To all villainous-looking Digimon: Wanna star as
a villain in a squadron hero movie I'm making?
Isn't this a great invitation you don't deserve?""","「給外表看起來像反派的各位
　我們要拍戰隊英雄的電影，可以請你們演出反派角色嗎？
　這個邀約對你們而言應該很值得感激吧？」","","「악역 같은 외모인 제군들에게
　전대 히어로 영화를 찍을 건데 악역으로 출연해주지 않겠나?
　자네들에겐 아까울 정도로 멋진 권유잖아?」","„An alle schurkisch wirkenden Digimon: Wollt ihr
den Schurken in meinem Superheldenfilm spielen?
Ist das nicht eine tolle, unverdiente Einladung?“"
103,4971,"","""This is a great chance to make use of your
villainousness! See you soon! Yours Truly, All of
Us in the Knights of Justice""","「這是一個能夠充分發揮你們壞人模樣的大好機會！
　那麼，日後就有勞你們了。
　　　　　　　　　　　　　　正義使者　上」","","「자네들의 악역다움을 살릴 좋은 찬스야!
　그럼, 나중에 잘 부탁한다
　　　　　　　　　　　　　　　　　　　　정의의 아군 일동」","„Dies ist eine super Chance, eure schurkischen
Fähigkeiten zu nutzen! Bis bald! Viele Grüße,
die Knights of Justice“"
104,1425,"","Isn't that just terrible?","很過份對不對？","","너무하지?","Ist das nicht furchtbar?"
105,1425,"","I mean, I guess they look a little villainy, but
this is just way too rude, right?","它們的外表看起來可能是有那麼一點像壞人，
但不管怎麼說，這封信也太沒禮貌了。","","확실히 그들의 외모가 좀 악역 같아보일지도 모르지만
아무리 그래도 이건 너무 무례하잖아","Ich meine, vielleicht sehen sie etwas schurkisch
aus, aber das ist doch schon unhöflich, oder?"
106,1425,"","These guys calling themselves the ""Knights of
Justice"" just contacted my friends and summoned
them to a place somewhere inside this dungeon.","剛才有個自稱是正義使者的人連絡我朋友，
然後我朋友就去對方指名的地點了。
就在這座迷宮的深處。","","아까 정의의 아군이라고 자칭하는 녀석한테 연락이 와서
친구들은 호출 장소로 갔어
이 던전 안쪽이야","Diese Leute, die sich „Knights of Justice“ nennen,
haben meine Freunde kontaktiert und sie an
einen Ort in diesem Dungeon bestellt."
107,1425,"","I'd like you to stop them before they do something
stupid. I'll follow afterwards, but could you go
ahead and check the situation out?","希望你可以在它們做出危險的事情之前阻止它們。
我等一下也會過去的，可以請你先過去看看情況嗎？","","그들이 위험한 짓을 하기 전에 말려줬으면 해
나도 나중에 갈 테니까 먼저 상황을 보러 가 줄래?","Ich möchte sie aufhalten, bevor etwas passiert.
Kannst du vorgehen und dir die Sache ansehen?
Ich komme später nach."
150,1425,"","If my friends are going to do something
ridiculous, please stop them. They're headed into
the dungeon. I'll follow you, please go on ahead.","如果我朋友要亂來的話，希望你可以阻止一下。
它們往這座迷宮的深處去了。
我等一下也會過去，拜託你了。","","친구가 엉뚱한 짓을 할 것 같을 경우 말려줬으면 해
이 던전 안쪽으로 갔어
나도 나중에 갈 테니까 부탁해","Wenn meine Freunde etwas Albernes vorhaben,
halte sie bitte auf. Sie sind auf dem Weg in den
Dungeon. Bitte geh vor, ich komme dann nach."
200,1175,"","Seriously, how long are they going to keep us
waiting!?","真是的，要讓我們等多久啊！","","정말이지, 언제까지 기다리게 하는 거야!","Also wirklich, wie lange müssen wir noch warten?!"
201,1057,"","They're the ones who called us here, and now they
make us wait? It's so insulting!","叫我們過來結果自己遲到……
看來我們真的被人瞧不起了。","","불러놓고 자기들이 늦다니…
우리를 바보 취급하고 있네","Sie haben uns herbestellt und jetzt müssen wir
warten? Was für eine Frechheit!"
202,1085,"","I'm going to make them sorry for this.
They'll regret it!","要叫那人反省的事情又增加一件了。
一定要好好地教訓他。","","이걸로 반성시킬 일이 또 늘었군
단단히 혼쭐을 내줘야겠어","Ich werde dafür sorgen, dass es ihnen leidtut!"
203,1175,"","...Huh?","嗯？","","……응?","... Was?"
204,2001,"","You were the ones called here by the letter?
Hi! What're you doing?","被那封信叫過來的就是你們嗎？
嗨！　你們在幹嘛？","","편지로 불려나온 게 너희들이야?
여어! 뭐하고 있어?","Ihr seid wegen dem Brief gekommen?
Hallo! Was treibt ihr so?"
205,1175,"","Took you long enough!","真是姍姍來遲啊……！","","드디어 납시셨군……!","Das hat ja ganz schön lange gedauert!"
206,1175,"","Don't play dumb.
You're the one who called us here!","少裝傻了，是你把我們叫過來的吧！！","","시치미 떼지 마라. 네가 우리를 불러낸 거잖아!!","Stell dich nicht dumm.
Du hast uns doch herbestellt!"
207,1057,"","Did you really think you'd get us to help with
such a rude letter!?
Sorry, we're not impressed!","你以為看到那封失禮的信
我們就會乖乖聽話地幫你的忙嗎！？
真遺憾，靠那種信是不可能打動我們的！","","그 무례한 편지로
우리가 순순히 협력해줄 거라고 생각했어!?
유감이네, 그런 걸론 우리 마음은 움직이지 않아!","Dachtest du wirklich, bei einem so unhöflichen
Brief würden wir helfen?
Da hast du dich geschnitten!"
208,1085,"","Is that how you ask someone for something?!
You will pay dearly for this!","你那是拜託別人的態度嗎！
看我們怎麼懲罰你！","","그게 사람에게 뭘 부탁하는 태도냐!
우리가 심판해주겠다!","So stellt man doch keine höfliche Bitte!
Das wird dich teuer zu stehen kommen!"
250,1175,"","You haven't beaten me yet! I'm not gonna let you
make fun of me like that!","唔……我還沒輸！
我不想就這樣一直被人當笨蛋！！","","큭…… 아직이다!
이대로 바보취급 당한 채로 있을까보냐!","Mich hast du noch nicht besiegt! Ich lasse nicht
zu, dass du dich so über mich lustig machst!"
251,1057,"","That's right, I'm still standing!
I demand a proper apology!","沒錯……我也還沒認輸。
一定要叫你對我們道歉！","","그래… 나도 아직 할 수 있어
제대로 사과하라고!","Genau, noch stehe ich hier!
Ich verlange eine richtige Entschuldigung!"
252,1085,"","We're gonna make you pay for pissing us off!","我要讓你後悔激怒了我們！","","우리를 화나게 한 걸 후회하게 해주겠다!","Du wirst dafür bezahlen, dass du uns wütend
gemacht hast!"
253,1085,"","What? You didn't send it?
What's this about then? Explain!","你說什麼？　那封信不是你寄的？
這到底是怎麼一回事，快點說來聽聽。","","뭐? 편지를 보낸 건 네가 아니라고?
무슨 말인지 설명해라","Was? Du hast ihn nicht geschickt?
Was soll das Ganze dann? Erkläre dich!"
254,1085,"","...What? You were sent here by Sakuyamon to stop
us?","什麼？
沙古牙獸拜託你來阻止我們？","","……뭐라고? 너는 샤크라몬에게
우리를 말려달라고 부탁받은 건가?","... Was? Sakuyamon hat dich geschickt, um uns
aufzuhalten?"
255,1057,"","So then you weren't the one who sent the letter?","這麼說，不是你寄出這封信的囉？","","그럼 네가 이 편지를 보낸 게 아니라는 거지?","Du hast den Brief also nicht geschickt?"
256,1175,"","I see. We misunderstood.
Sorry for lashing out at you like that.","這樣啊，看來是我們誤會了。
對不起，突然攻擊你。","","그런가. 우리가 오해한 거군
갑자기 덤벼서 미안했다","Verstehe. Das war ein Missverständnis.
Sorry, dass wir so auf dich losgegangen sind."
257,1175,"","You must have heard it from Sakuyamon...
To make fun of someone you don't even know kinda
pisses me off.","我想你應該聽沙古牙獸說了，
我們被陌生人認定是一群壞蛋，被對方瞧不起。
所以有點火大。","","샤크라몬에게 들었을 거라고 생각하지만
모르는 상대에게 악역이라며 실컷 바보취급 당해서
조금 화가 나 있었다","Dann hast du es von Sakuyamon gehört ...
Sich über jemanden lustig zu machen, den man
gar nicht kennt, macht mich wütend."
258,1057,"","We may all look like villains, but even people who
look like villains have feelings...
It's not very nice to talk to us like that.","我們幾個可能真的看起來像反派，
但這是我們每個人都很介意的地方……
他那樣說實在太過份了。","","우리들, 분명 악역 같은 외모일지도 몰라
하지만 모두 신경 쓰고 있는 부분인데…
그런 말은 너무했어","Wir sehen vielleicht alle wie Schurken aus, aber
selbst schurkisch wirkende Leute haben Gefühle ...
Es ist nicht nett, so mit uns zu reden."
259,1085,"","Anyway, these ""Knights of Justice"" still haven't
arrived.","話說回來，那個什麼正義使者的……還沒有來呢。","","그건 그렇고 정의의 아군 녀석… 언제 오는 거지","Wie dem auch sei, die „Knights of Justice“ sind
immer noch nicht da."
260,5002,"","Hahaha! Sorry for that wait, LOL!","哈哈哈！　讓各位久等了！","","핫핫하! 기다리게 했군!","Hahaha! Tut uns leid, dass ihr warten musstet!
LOL!"
261,1175,"","....Who's that!?","什麼人！？","","……누구냐!?","... Wer ist das?!"
262,5002,"","Huzzah!","喝啊！","","얍!","Wusch!"
263,5002,"","We cut through evil with light! We slice through
evil in a single stoke! In the depths of night,
we shine bright, a star in the hearts of all!","用光明斬斷邪惡之輩！
將邪惡內心一刀兩斷！
照亮夜晚的黑暗，大家心中最閃爍的一顆星！","","악한 일당을 빛으로 자른다!
악한 마음을 일도양단!
밤의 어둠조차 밝게 비추는, 모두의 마음 속 밝게 빛나는 별!","Mit Licht bekämpfen wir das Böse, mit nur einem
Hieb ist es aus! Tief in der Nacht leuchten wir
hell, wie ein Stern in den Herzen aller!"
264,1014,"","Starmon, Knight of Justice!","正義使者……星星獸！","","정의의 아군… 스타몬!","Starmon, Knight of Justice!"
265,5002,"","Huzzah!","喝啊！","","얍!","Wusch!"
266,5002,"","Evil weeps when we appear! Evil runs when we are
near! Whenever we hear the cry, we'll cross the
earth, we'll cross the sky!","有我在的地方邪惡就會哭泣！
有我在的地方邪惡就會逃散！
只要有人呼喚我，我會立刻穿越宇宙趕到你身邊！","","나타나는 곳에서 악이 운다!
나타나는 곳에서 악이 흩어진다!
부르는 목소리가 있다면, 우주에라도 달려가 보이겠다!","Das Böse weint, kaum sind wir da! Es läuft
davon, sind wir nah! Hören wir einen Hilfeschrei,
ist kein Weg zu weit, wir eilen herbei!"
267,1079,"","SuperStarmon, Knight of Justice!","正義使者……超級流星獸！","","정의의 아군… 슈퍼스타몬!","SuperStarmon, Knight of Justice!"
268,5002,"","Huzzah!","喝啊！","","얍!","Wusch!"
269,5002,"","The heavens, the earth and even evil knows! We are
justice incarnate! We'll burn evil from the world
with the light of justice! We are fate itself!","天知地知邪惡也知，
眾人皆知我等正義！
直到邪惡消失在這個世上，我等將會繼續燃燒生命！！","","하늘이 알고 땅이 알고 악도 안다
내가 정의란 것을 모두가 안다!
악이 이 세상에서 사라질 때까지 불태우겠다, 내 목숨을!!","Der Himmel, die Erde, auch das Böse ist im Bild!
Wir sind die Gerechtigkeit! Mit dem Licht brennen
wir das Böse aus der Welt! Wir sind das Schicksal!"
270,1737,"","Justimon, Knight of Justice!","正義使者……裁決獸！","","정의의 아군… 저스티몬!","Justimon, Knight of Justice!"
271,1737,"","We oppose evil in all its forms. We dedicate
ourselves to eradicating it! That which shines
within our hearts is a burning love for Justice!","勇於對抗邪惡勢力，用盡全力將之摧毀！
在我們胸中綻放光芒的，正是那熱愛正義的火熱之心！","","수많은 악에게도 맞서, 전력을 다해 때려부순다!
우리의 마음속에 빛나는 건, 정의를 사랑하는 불타는 마음!","Wir stellen uns allem Bösen entgegen und rotten
es aus! Denn in unseren Herzen brennt die Liebe
für Gerechtigkeit!"
272,4045,"","Justimon Squadron, assemble!","裁決獸戰隊，拜見各位！！","","저스티몬 전대, 등장!","Justimon-Trupp, versammelt euch!"
273,1057,"","...","…………","","…………","..."
274,1175,"","...","…………","","…………","..."
275,1085,"","...Are you insane?","…………它們瘋了嗎？","","…………제정신인가?","... Habt ihr sie noch alle?"
276,1175,"","So, lemme get this straight...
You guys called us out here just to tell us about
all this justice crap?","還是問一下好了……
你們就是把我們叫過來的
那個什麼正義使者嗎？","","일단 물어는 보겠는데…
너희가 우리를 불러낸
정의의 아군이라는 놈들인가?","Stellen wir das mal klar ...
Ihr habt uns bloß herbestellt, um von
Gerechtigkeit zu schwafeln?"
277,1014,"","Yes, sooo sorry for the wait!
Prepare yourselves, villains!","沒錯，讓你們久等了！　覺悟吧，壞人！！","","그래, 맞아. 기다렸지―! 각오해라, 악당!!","Ja, tut uns leid, dass ihr warten musstet!
Haltet euch bereit, Schurken!"
278,1057,"","Why should we prepare!?
You say all this awful stuff to us and then you
have the gall to talk about justice!?","為什麼我們是壞人啊！
對我們做了一堆沒禮貌的事，
你們怎麼還有臉說自己是正義？","","왜 우리가 악당인 거야!
우리한테 실례인 짓만 잔뜩 했는데
어째서 너희가 정의라고 단정짓는 거야!","Warum sollen wir uns bereithalten?! Ihr sagt so
schreckliche Sachen über uns und dann wagt ihr es,
von Gerechtigkeit zu faseln?!"
279,1079,"","Our very existence is justice itself!
...You guys are the bad guys.","正義的存在本身即構成了正義。
而相反一方的你們就是邪惡。","","정의는 그곳에 있는 것만으로 정의
…대립하는 너희가 악인 거다","Wir sind die Personifikation der Gerechtigkeit!
... Ihr seid die Bösewichte."
280,1737,"","Huh? Are you an ally of these villains?","嗯？　你也要成為它們反派的一夥嗎？","","응? 너도 저 악역들의 편이라는 건가?","Was? Gehörst du etwa zu diesen Schurken?"
281,1737,"","Fine, we'll start by dealing with you!
Bring it on!","那我就從你開始解決好了！
放馬過來吧！","","그럼 너부터 처치해주겠다!
자, 덤벼라!","Na schön, dann bist du zuerst dran!
Los geht’s!"
300,1175,"","Ridiculous.
They are just playing at being heroes...","真傻眼……
根本只是在玩英雄遊戲嘛……","","기가 막히네…
이거, 단순한 영웅 놀이잖아…","Lächerlich.
Was für Möchtegernhelden ..."
301,1057,"","What? You called me a villain numerous times!
Go get 'em guys!","煩死人了，一直壞人來壞人去的！
快點把它們打個落花流水！","","정말이지, 일일이 사람을 악당이라고 하고 말야―!
있는 힘껏 해치워줘!","Was? Mich habt ihr immer wieder als Schurken
beschimpft! Auf sie mit Gebrüll, Leute!"
302,1085,"","Looks like they've chosen you.
You already beat us, so you'll beat them,
no problem.","看來它們指名你上場呢。
你連我們都打贏了，那些傢伙就稍微給它們一點教訓吧。","","널 지명한 것 같네
우리한테도 이겼으니까, 저 녀석들 따위 가볍게 정리해버려","Ihre Wahl ist wohl auf dich gefallen. Du hast uns
bereits besiegt, also wirst du sie
ohne Probleme schlagen."
303,1079,"","Hah! We members of the Justimon Squadron don't
know the meaning of the word ""defeat""! We
challenge you to a fight!","我們裁決獸戰隊的字典裡沒有「輸」這個字！
來吧，乖乖接受裁決獸大哥的挑戰。","","우리들 저스티몬 전대의 사전에「패배」라는 단어는 없다!
자, 얌전히 저스티몬 형제의 도전을 받아라","Ha! Wir, die Mitglieder des Justimon-Trupps,
wissen nicht, was „Niederlage“ bedeutet!
Dies ist eine Herausforderung zum Kampf!"
304,1014,"","Aww, what's wrong?
You afraid of our leader Justimon!?","喂喂～怎麼啦！
難道你開始怕裁決獸大哥了嗎！？","","어이어이, 왜 그래!
저스티몬 형제가 무서워진 거냐―!?","Och, was ist denn los?
Hast du Angst vor Justimon, unserem Anführer?!"
350,1014,"","Hey, what's the matter?
Scaredy-cat's gonna run away?","喂～！　你對我們心生畏懼，打算逃跑嗎！？","","어이―! 우리가 무서워서 도망치는 거냐!?","He, was ist denn los?
Läuft der Angsthase davon?"
351,1079,"","Ah, let him go. He rushed in before he realized
what he was in for. He'll be back when he's
properly prepared.","算了，就讓他走吧。
他不顧大家的臉色就撤退了，
之後應該會充分準備再回來挑戰我們吧。","","자자, 보내주도록 하지
분위기를 못 읽고 퇴장할 정도다
단단히 준비를 하고 다시 돌아올 테니까 말이다","Ach, lass doch. Unser Feind hatte sich übernommen.
Er kommt wieder, wenn er vorbereitet ist."
400,4045,"","Justimon Squadron, move out!","裁決獸戰隊，我們上！！","","저스티몬 전대, 간닷!!","Justimon-Trupp, ausrücken!"
450,1079,"","I d-d-don't believe it!","這怎麼……可能！","","그런… 설마!","Ich g-g-glaube es nicht!"
451,1014,"","We...we lost to the villains!","我們居然輸給反派！","","우리들, 악역한테 져 버렸어!","Die ... Die Schurken haben uns besiegt!"
452,2001,"","It is the victors who are the virtuous!
Go apologize to them.","贏的一方才是正義！
向它們好好道歉。","","이긴 쪽이 정의인 거야!
제대로 그들한테 사과해","Die Sieger sind die Gerechten!
Entschuldigt euch bei ihnen!"
453,1014,"","W-wow!","好、好帥氣……！","","머, 멋있어…!","W-Wow!"
454,1079,"","Although that does sound pretty villainous...","但是他說的話有點像反派……！","","하지만 말하는 게 좀 악역 같아…!","Das klingt allerdings ziemlich schurkisch ..."
455,1014,"","We got a bit carried away there...","我們是不是太得意忘形了……？","","우리들, 너무 우쭐댔던 걸까…?","Wir haben es etwas übertrieben ..."
456,1079,"","Yeah, that's for sure...","嗯，肯定是的……","","응, 분명 그랬던 거야…","Ja, das steht fest ..."
457,1175,"","Hey, we demand an apology!
Did you think we'd be okay with you calling us all
villains?","喂，快點向我們道歉。
你以為我們被說像反派會覺得高興嗎？","","어이, 제대로 사과해라
악역 같다는 말을 듣고 우리가 기뻐할 거라고 생각하는 건가?","He, wir verlangen eine Entschuldigung! Dachtet
ihr, es wäre in Ordnung, uns
alle Schurken zu nennen?"
458,1085,"","We're really not happy about what you said.
Nor the way you made fun of us.","看到那個字眼我們一點都不覺得高興，
而且還被你們當作笨蛋。","","우린 그 말을 기쁘다고 느끼지 않아
실컷 바보취급 당했고 말야","Was ihr über uns gesagt habt, war nicht in
Ordnung. Das gilt auch dafür, wie ihr euch
über uns lustig gemacht habt."
459,1057,"","Don't just judge us by how we look!
You seriously pissed us off!","不要只用外表判斷我們！
真的很讓人火大耶。","","우리를 외견만으로 판단하지 말아줘!
정말 열받는다고","Beurteilt uns nicht nach unserem Aussehen!
Ihr habt uns wirklich wütend gemacht!"
460,1079,"","Sorry about that. Looks like we got a bit carried
away.","對不起……我們好像有點太得意忘形了。","","미안하다… 우리들이 너무 우쭐댔던 것 같다","Es tut uns leid. Wir haben es etwas übertrieben."
461,1175,"","That's it then. This stupid game is over.","那麼這個愚蠢的遊戲也結束了吧。","","그럼 이런 바보 같은 놀이는 끝이로군","Dann ist das jetzt abgehakt. Dieses alberne
Spiel ist beendet."
462,1737,"","It's not a game!","這可不是遊戲！","","놀이가 아니다!","Das ist kein Spiel!"
463,1737,"","I swear, we were just trying to make a cool action
hero movie!","我們想拍一部有趣的英雄電影，
這個心情是真的，我發誓！","","재미있는 히어로 영화를 찍고 싶다는 마음만은
맹세컨대 진심이다!","Ich schwöre es, wir haben nur versucht, einen
coolen Film mit Actionhelden zu drehen!"
464,1175,"","Go on...","聽聽看你怎麼說吧。","","……한번 말해봐라","Aha ..."
465,1737,"","Well...","嗯……","","응…","Also ..."
466,1737,"","I have always been drawn in by the heroes in old
films. I wanted to look cool on the big screen
like that, too!","我很崇拜以前看過的電影裡的英雄，
心想總有一天我也要在電影的世界發光發熱！","","옛날에 봤던 영화의 히어로를 줄곧 동경해왔다
나도 언젠가 영상 세계에서 저렇게 빛나고 싶어! 라고 생각했다","Ich habe immer die Helden in alten Filmen
bewundert. Ich wollte cool aussehen
wie sie, auf der Leinwand!"
467,1737,"","So I got together with these guys, all of whom
feel the same way, to make a masterpiece
screenplay. But...","然後聚集了這群和我有同樣想法的伙伴，
我們連劇本都寫好了，可是……","","같은 생각을 가진 이 녀석들과 모여서
걸작인 각본까지 만들었다. 하지만…","Also habe ich mich mit den anderen zusammengetan.
Sie haben das gleiche Ziel, ein erstklassiges
Drehbuch zu schreiben. Aber ..."
468,1737,"","Then we thought ""now we just need to scout out a
villain!"" and sort of got caught up in it. We
didn't really think about your feelings.","因為只剩下反派角色還沒找到，
所以我們太起勁了，沒有顧慮到你們的心情，
可能說了很多失禮的話。","","남은 건 악역을 스카우트하는 것 뿐이다! 라며
의욕만 높아진 탓에 너희들의 기분을
배려하지 못한 말만 잔뜩 해버렸을지도 모른다","Dann dachten wir, wir müssten einen Schurken
finden und haben uns etwas verzettelt.
An eure Gefühle hatten wir nicht gedacht."
469,1737,"","For that we are deeply sorry.","請讓我們道歉，真的很對不起。","","사과하게 해다오. 미안했다","Das tut uns wirklich leid."
470,1057,"","...","…………","","…………","..."
471,1085,"","...","…………","","…………","..."
472,1175,"","...","…………","","…………","..."
473,1737,"","What are we going to do now?
We can't just give up on making our movie! We'll
try asking other Digimon.","你問我之後打算怎麼辦？
只有拍英雄電影這件事，我是絕對不會放棄的。
我會再問問看其他數碼寶貝願不願意演反派角色。","","……이후엔 어쩔 거냐고?
히어로 영화를 찍는 것만은 포기할 수 없다
악역은 다른 디지몬에게 부탁해보겠다","Was sollen wir jetzt tun? Wir können unseren Film
nicht einfach aufgeben! Wir werden
andere Digimon fragen."
474,1014,"","Hey, I know! How about we get some villain
costumes and play the villain parts ourselves?","你們聽我說，既然這樣乾脆穿上布偶裝，
由我們自己來演反派怎麼樣！？","","저기 있잖아, 그거라면 인형 옷을 입고
악역도 스스로 연기해보는 건 어때!?","He, ich hab eine Idee! Wir könnten uns schurkische
Kostüme besorgen und selbst die Schurken spielen!"
475,1079,"","It'd look pretty cheap but...I suppose if there's
nothing else we can do...","那樣會變得很廉價……不過最壞的情況也只能這樣了。","","싸구려 같아 보이겠지만… 최악의 경우엔 어쩔 수 없지","Das wäre ein ziemlich billige Lösung, aber ...
Wenn sich sonst nichts machen lässt ..."
476,1737,"","All right then, we'll see you all later...","那我們就此告辭……","","그럼, 우리는 이만…","Na schön, man sieht sich ..."
477,1175,"","Wait... Can we have a look at that script?","等一下，
你們那個劇本，可以讓我們看一下嗎？","","기다려
그 각본이라는 거, 보여주지 않겠나?","Moment ... Können wir das Drehbuch sehen?"
478,1737,"","Huh?","什麼？","","뭐?","Was?"
479,1175,"","I'm interested. In being in your movie, I mean.","我們有興趣和你們一起演電影。","","흥미가 생겼다. 너희들과 영화에 출연하는 게","Ich habe Interesse. In eurem Film mitzuspielen,
meine ich."
480,1085,"","Well, you explained yourself and apologized. I
suppose I'm okay with helping out a bit.","看在你們老實道歉、坦承心意的份上，
我們可以陪你們一下。","","사과하고 솔직히 진심을 이야기해준 걸 봐서
조금이라면 도와줄 수 있어","Nun ja, ihr habt eure Beweggründe erklärt und euch
entschuldigt. Ich wäre bereit, euch etwas
zu helfen."
