ID,Speaker,Japanese,English,Chinese,EnglishCensored,Korean,German
150,4450,"","You want to go into the museum? Are you crazy?!
It's not a museum anymore, it's a monster den!","想進去博物館？　……你還是別去吧！
那裡現在可是叫做數碼寶貝的怪物的巢穴哦！","","박물관에 들어가겠다고? …그만 둬, 그만 둬!
지금은 디지몬인가 하는 괴물들의 소굴이 되었을 게야","Du willst ins Museum? Bist du wahnsinnig?!
Das ist jetzt eine Monsterhöhle und kein Museum
mehr!"
250,4451,"","The special exhibit down at the museum is...
flawless! I wish I could see it all again!
But... monsters....","之前看過的特別展覽真的很棒啊。
真希望能再去看一次……不過現在不是想那種事的時候。","","얼마 전에 봤었던 특별전이 굉장했단다
또 볼 수 있으면 좋았을 텐데… 지금은 그럴 상황이 아니구나","Die Sonderausstellung im Museum ist ... ganz
ausgezeichnet! Ich würde sie gerne noch einmal
sehen! Aber ... die Monster ..."
350,4452,"","What's up with that light coming outta the museum
entrance? Is it that, um... Y'know... The phenom-
thing they were talking about on TV?","哇，博物館的入口閃閃發光的……
這就是電視在說的某某現象嗎？","","굉장해, 박물관의 입구가 반짝반짝 빛나고 있어…
이게 TV에서 말했던 어쩌고 현상이라는 건가?","Was ist denn das Licht da im Museumseingang?
Ist das das, äh ... Phänomen, über das sie im
Fernsehen geredet haben?"
450,4453,"","This is no place for monsters to be running wild!
Ueno is the site of our nation's greatest
treasures! Our heritage as a proud people!","上野這裡有很多重要的文化財產，同時也是歷史悠久的土地。
不是妖怪可以肆意破壞的地方！","","이곳 우에노는 중요 문화재도 많고, 유서 깊은 토지다
결코 디지몬이 황폐케 해도 되는 장소가 아니야!","Hier gehören wilde Monster nicht hin!
Ueno birgt unsere größten Schätze!
Unser Vermächtnis als ein stolzes Volk!"
550,1070,"","Get outta my face! We ain't got nothing to do
with that crap!","煩耶，那種事跟我們無關啦！
快滾！","","시끄럽네―, 그런 거 디지몬들에게는 상관없어!
저리 가!","Hau ab! Wir haben mit diesem Mist nichts zu tun!"
650,4454,"","Requesting immediate backup in Ueno... Yes, I've
confirmed the presence of a number of Digimon
holed up inside... Awaiting new orders, over.","——這裡是上野博物館前。博物館裡似乎聚集了很多數碼寶貝。
請立即派增援到上野公園來……","","―이쪽, 우에노 박물관 앞. 박물관 내에는 다수의 디지몬이
모여 있는 모양. 즉시, 우에노 공원에 지원을 부탁합니다…","Bitte um sofortige Unterstützung in Ueno ...
Ja, mehrere Digimon im Inneren bestätigt ...
Erwarte neue Befehle, over."
750,1112,"","This place is niiice! I like it! I mean, if it
weren't for all those annoying humans, it'd be
almost perfect!","雖然說不出理由，但我很喜歡這座城市的氛圍呢。
如果沒有某些人們大聲嚷嚷的噪音，那就更棒了！","","나, 이 마을의 분위기가 왠지 좋아
시끄러운 인간의 목소리가 없었으면 더 좋았을 거야!","Das ist richtig schööön hier! Gefällt mir!
Wenn die ganzen nervigen Menschen nicht da wären,
wäre es geradezu perfekt!"
850,4015,"","This is no place for you! The whole area's
restricted! Go on, get!","喂！前面是禁止進入的！
快回去吧！","","이봐! 이 앞은 출입 금지다
돌아가, 돌아가!","Du hast hier nichts zu suchen! Hier ist gesperrt!
Na los, verschwinde!"
