ID,Speaker,Japanese,English,Chinese,EnglishCensored,Korean,German
1,3015,,"Puh, quanto sono felice...",呼～得救了……,,"후우, 살았다…","Puh, was bin ich froh ..."
2,3007,,"Uff, adesso hai un bel credito
con me.",啊啊，感恩啊。,,"아아, 신세를 졌다","Uff, jetzt hast du bei mir einen dicken Stein im
Brett."
3,3007,,"Sembra che sottoterra ci sia ancora un
Divoratore del genere in giro. Riesci a catturare
anche quello?","不過，地底下似乎也有和剛剛類似的怪物，
也可以拜託你處理嗎？",,"하지만, 방금 녀석과 비슷한 괴물이 지하에도 있는 모양이야
그쪽도 부탁할 수 있을까?","Im Untergrund scheint noch so ein Verschlinger
unterwegs zu sein. Kannst du dir den auch
schnappen?"
4,3007,,"Inoltre... ho visto Sanada
qui. Anche lui è sceso.","而且……其實呀，我在這裡看到了真田的身影，
看樣子是前往地下了。",,"…그리고…실은 말이다, 사나다의 모습을 여기서 봤다
아무래도 지하로 향한 모양이야","Außerdem ... habe ich Sanada hier gesehen.
Der ist auch nach unten gegangen."
5,2000,,?!,！？,,!?,?!
6,3007,,"Nelle circostanze non sono
riuscito a fermarlo, ma credo che il Divoratore
gli fosse dietro.","這種情形下也不可能叫住他，
他似乎是去追那些怪物了。",,"이런 상황이어서 불러 세우지 못했지만
그 괴물 녀석들을 쫓아간 것 같아","Unter den Umständen konnte ich ihn nicht
aufhalten, aber ich glaube, der Verschlinger war
hinter ihm her."
7,3007,,"Ma ora Sanada ha bisogno di voi più che di
questo vecchio. Seguitelo.","對現在的那傢伙來說，比起我，
他更需要你們啊……去吧！",,"…지금 그 녀석에겐, 나 같은 녀석보다
너희들이 필요해… 가 주려무나","Aber jetzt braucht Sanada euch mehr als mich
alten Mann. Geht ihm nach."
