ID,Speaker,Japanese,English,Chinese,EnglishCensored,Korean,German
124,3046,,"Vendicarsi in un modo che non desse
loro la possibilità di reagire. Codardo è
sicuramente la parola giusta.","讓全員無法反抗的這種作法，
不是姑息是什麼？",,"전원을 저항할 수 없게 만들고 반격이라니
얍삽 이외에 뭐가 있겠냐","Du hast dich gerächt, ohne ihnen die Chance zu
geben, sich zu wehren. Das ist wirklich feige."
125,3046,,"Nessuno potrebbe rispettarti per aver fatto una cosa del genere.","就算用這種做法來報復，
……也不會有人認同你。",,"이런 식으로 되갚아봐야
……아무도 너를 인정해주지 않는다",Für solch eine Tat kann dich niemand respektieren.
126,7320,,E guarda un po'?!,不要突然跑出來，還說得好像很瞭解我一樣！,,갑자기 나타나서는 다 아는 척 지껄이지 마!,Was wisst ihr schon?!
127,7320,,"Non capisci! Mi prendono in giro, ogni singolo
giorno! Mi tormentano e si prendono gioco di me!","你們到底懂什麼啊！
我被全班拿來使喚，每天每天
都被大家輕視嘲笑……！",,"너네가 뭘 아는데!
반 애들 전원이 멋대로 대하고, 매일매일
부려 먹히고 바보 취급당하고…!","Ihr kapiert das nicht! Jeden Tag ärgern sie mich!
Sie quälen mich und machen sich über mich lustig!"
128,7320,,"Non potresti mai capire cosa significa avere
persone che ti ridono in faccia e ti picchiano!","我被你們嘲笑，被打的時候，
我是什麼樣的心情，
你們怎麼可能瞭解！",,"나를 비웃고 때릴 때마다
내가 어떤 마음이었는지
너네들이 알 리 없잖아!","Ihr könntet niemals verstehen, wie es ist, wenn
Leute einen auslachen und schlagen!"
129,7320,,Dovevo farlo. Nessuno capisce il mio dolore!,"不這樣做的話，誰都不知道我的痛苦……
沒有人會知道啊！",,"이렇게라도 하지 않으면, 아무도 내 괴로움 따위…
알아주지 않았어!","Ich musste es tun. Niemand weiß, was ich
durchgemacht habe!"
130,7320,,"Ecco perché ho fatto quello che ho fatto! Se lo meritavano tutti!
Ora anche tu ti prendi gioco di me!!!","所以我才自己做了這件事！　我下手了！
如果你來嘲笑我……！！！",,"그러니까 내가 했어! 해준 거야!
그걸 바보 취급한다면……!!!","Darum habe ich es getan! Sie haben es alle
verdient! Jetzt macht sogar ihr euch über mich
lustig!"
131,7320,,"Ti farò saltare giù da un tetto, proprio come loro!",那我就把你們也一起推下屋頂！！！！,,너희들도 옥상에서 떨어트려주마!!!!,"Ich zwinge euch, vom Dach zu springen, genau wie
sie!"
132,3046,,Anche lui sa usare i Digimon?!,"這傢伙……！
也會用數碼寶貝！？",,"이 녀석…!
디지몬도 다룰 수 있나!?",Digimon kann er auch benutzen?!
