ID,Speaker,Japanese,English,Chinese,EnglishCensored,Korean,German
1,4842,,"Stavo cercando tutti.
Cercando per tutto questo tempo.","我在找大家
一直在找大家",,"모두를 찾았어
계속 찾았어","Ich habe euch alle gesucht.
Die ganze Zeit gesucht."
2,4842,,Finalmente ti ho trovato.,終於找到了,,"…겨우, 찾았어",Endlich habe ich dich gefunden.
3,4842,,"Non voglio più stare da solo.
Voglio tornare a casa, tornare a casa, tornare a casa...","我已經受夠孤單一人了
我想回去、我想回去、我想——",,"더 이상, 외톨이는 싫어
돌아가고 싶어, 돌아가고 싶어, 돌아가고―","Ich möchte nicht mehr alleine sein.
Ich möchte nach Hause, nach Hause, nach Hause ..."
4,4844,,No! Non è quello!,不對！不是……那樣的！,,…아니야…! 그렇지… 않아…!,Nein! So nicht!
