ID,Speaker,Japanese,English,Chinese,EnglishCensored,Korean,German
1,7387,"","There's nothing to do at this time of the day. I'm
so bored.","這時間能做的事還真少啊～
啊～好無聊好無聊。","","이 시간엔 의외로 할 일이 없는데~
아~ 한가해 한가해","Um die Uhrzeit läuft echt gar nichts. Mir ist so
langweilig."
2,7388,"","Still, it's better than taking a test. Isn't the
class almost over?","算了啦，總比麻煩的考試好太多了吧。
上課時間也快要結束了吧？","","뭐, 귀찮게 시험 치는 것보단 훨씬 낫잖냐.
근데 슬슬 수업시간이 끝날 때가 됐지?","Aber immer noch besser als Schularbeiten
schreiben. Ist der Unterricht nicht fast vorbei?"
3,7387,"","Let's go back to the others.","那麼，回去大家那吧。
走囉～","","그럼 슬슬 모두가 있는 곳으로 돌아갈까.
가자","Gehen wir zurück zu den anderen."
4,3046,"","The test's about to finish. Let's go.","考試差不多要結束了。
動作快。","","확실히 슬슬 시험이 끝날 시간이 됐군.
서두르자","Die Schularbeit ist fast vorbei. Gehen wir."
