ID,Speaker,Japanese,English,Chinese,EnglishCensored,Korean,German
0,4460,"","Kamishiro has ordered us to tighten up the
building's security. People do whatever she says.
She's a remarkable woman.","按照神代企業的指示，加深了建築物的警備。
……但是，竟然對上位者的建築物如此彰顯勢力，
不虧是天下的神代企業啊。","","카미시로의 지시로 건물의 경비를 강화했어.
…하지만, 관청 건물에 이렇게까지 영향력을 행사하다니
과연 천하의 카미시로 님이네","Kamishiro hat befohlen, die Sicherheitsmaßnahmen
für das Gebäude zu verschärfen. Alle Leute tun,
was sie sagt. Sie ist eine ungewöhnliche Frau."
1,4361,"","Some miasma has flooded the upper floors. I'd head
there to check it out, but the elevator's broken
down and there are monsters in the stairwell.","上層籠罩著異樣的氛圍……
雖然很想要過去探查看看，但是電梯不能使用。
在逃生梯又有怪物出現，狀況非常危險。","","위층에 이상한 분위기가 감돌고 있어…
상태를 확인하고 싶지만, 엘리베이터는 움직이지도 않고
비상계단에는 괴물이 출현해서 무척이나 위험한 상태야","In den oberen Etagen hat sich eine Pestwolke
ausgebreitet. Ich würde mich ja kümmern, aber der
Aufzug ist kaputt und im Treppenhaus sind Monster."
2,4361,"","Looks like landing a helicopter on the roof may be
our only option.","只好坐直昇機在屋頂上降落了。","","헬리콥터로 옥상에 낙하할 수밖에 없을 것 같아","Sieht aus, als hätten wir keine andere Wahl, als
mit einem Hubschrauber auf dem Dach zu landen."
