ID,Speaker,Japanese,English,Chinese,EnglishCensored,Korean,German
1,1392,,Wow! Il posto è pieno zeppo di Eater!,"咿、呃呃呃──！
到處都有侵食者！",,"히, 히에에!
여기저기에 이터가 있어!",Boah! Hier wimmelt es vor Verschlingern!
2,1392,,Deve essere perché hanno assimilato Erika?,這也是艾莉卡被侵食者給吞噬的影響嗎……！？,,이것도 에리카가 이터에 흡수당해버린 영향……!?,"Das liegt bestimmt daran, dass sie Erika
assimiliert haben."
3,1392,,Non riesco a raggiungerla su questo piano!,這一層還無法跟艾莉卡聯絡上……！,,이런 플로어에선 에리카와 통신도 불가능해…!,Auf dieser Ebene dringe ich nicht zu ihr durch!
4,1392,,"Continuiamo. Potrebbe esserci ancora un'area che
non hanno ancora raggiunto!","去裡面看看吧！
或許還有沒事的區域！",,"안쪽으로 가 보자!
아직 무사한 에어리어가 남아있을지도 몰라!","Gehen wir weiter. Vielleicht sind sie noch nicht
in jeden Bereich vorgedrungen."
