ID,Speaker,Japanese,English,Chinese,EnglishCensored,Korean,German
1,3046,"","Nngh...!","嗚……！","","큭…!","Urgh ...!"
2,3047,"","You chilled out yet, you stubborn jerk?!","怎樣啊老頑固！　冷靜一點了沒有！","","이 돌머리! 조금쯤은 머리가 식었냐!","Hast du dich nun beruhigt, du sturer Bock?!"
3,3046,"","Why are you doing this!
If I don't do what Kishibe wants, you know
what'll happen to Erika!","……為什麼要妨礙我！
要是岸部的委託失敗的話……艾莉卡就──！","","…왜 방해하지!
키시베의 의뢰에 실패하면… 에리카는――!","Warum tust du das?! Wenn ich nicht mache,
was Kishibe sagt – du weißt doch, was dann
aus Erika wird!"
