ID,Speaker,Japanese,English,Chinese,EnglishCensored,Korean,German
1,3002,"","Okay then.
So then what about the Digital World?","那麼，
果然數碼世界……？","","…그럼
역시 디지털 월드는…?","Na schön.
Was ist also mit der Digitalen Welt?"
2,1126,"","Everything was consumed by Eaters.
We were left with naught but despair.","全都被侵食者吃光了。
狀況可說是絕望……","","전부 이터에게 먹혀 버렸다
상황은 이젠 절망적이라 할 수 있지…","Dort wurde alles verschlungen.
Uns bleibt nur die Verzweiflung."
3,3002,"","H-How can that be?
If everything is really how Omnimon said...","怎、怎麼會……
奧米加獸所說的話竟然成真了……","","그, 그럴 수가…
오메가몬이 말한 대로 되어 있다니…","W-Wie kann das sein?
Wenn es so ist, wie Omnimon sagt ..."
4,1126,"","We Royal Knights kept fighting to rid the Digital
World of the Eaters.","我們皇家騎士為了將侵食者從數碼世界排除，
不停奮戰……","","우리들 로얄 나이츠는, 디지털 월드로부터
이터를 제거하기 위해, 계속 싸워 왔다…","Wir Royal Knights haben weiter gekämpft, um die
Digitale Welt von den Verschlingern zu befreien."
5,1126,"","The anger Leopardmon and the others hold for the human race being
the genesis of the Eaters is immeasurable.","人類是侵食者出現的原因，
芳香獸們對人類的憤怒是難以估計的。","","이터 발생 원인으로 여겨진 인간에 대한
두프트몬 일행의 분노는 헤아릴 수가 없어","Duftmon und andere sind unvorstellbar zornig
auf die Menschheit dafür, dass sie den Ursprung
der Verschlinger darstellt."
6,1126,"","That is why, in their obstinance, their hatred
drives them to wipe out humanity.","正因為如此，它們對人類的憎恨到了固執的地步，
打算毀滅人類。","","그렇기 때문에 그들은, 집요할 정도로 인간을 증오하고
없애려 하고 있어","Sturheit und Zorn bringen sie dazu, die
Menschheit auslöschen zu wollen."
7,1126,"","Eliminate the Eaters along with humanity--","為了消滅侵食者和人類――","","이터와 인간을 일소하기 위해―","Menschen und Verschlinger gemeinsam loswerden ..."
8,1126,"","That was the plan hatched by Leopardmon and those
in the Royal Knights who agreed with him.","芳香獸和贊成它的皇家騎士們開始惹是生非。","","두프트몬과, 그에게 찬동하는 로얄 나이츠들이
사건을 일으킨 거다","Das war der Plan von Duftmon und seinen
Anhängern unter den Royal Knights."
9,3002,"","J-Just how many Royal Knights are bent on human
destruction?!","有、有多少皇家騎士打算毀滅人類……！？","","어, 어느 정도의 로얄 나이츠가
인간을 없애려 하고 있는 거야…!?","W-Wie viele Royal Knights sind das denn, die alle
Menschen umbringen wollen?!"
10,1126,"","At least half of them, but there are many who yet
waver. It won't be impossible to convince them.","少說也有半數以上……但猶豫不決的也不在少數。
說服它們，讓它們成為伙伴也不無可能。","","적어도 반 이상이다만… 망설이고 있는 자도 적지 않아
그들을 설득해서, 동료로 삼는 건 불가능하지 않겠지","Mindestens die Hälfte von ihnen. Doch viele
zweifeln noch. Sie zu überzeugen ist nicht
unmöglich."
11,1126,"","Of course, whether that comes to pass depends on
you. Are you up to the task?","當然，那要看你們的意願……
你們願意幫我嗎？","","물론, 너희들 하기 나름이다만…
해 주겠나?","Letztendlich hängt von dir ab, ob das geschieht.
Bist du dem gewachsen?"
12,1088,"","It is our one option!","這樣才對嘛！","","…그렇게 나와야지!","Das ist unsere einzige Wahl!"
13,1088,"","When the Dimensional Door closed, the flow of
energy from the Digital World stopped.","由於次元之門關閉，
來自數碼世界的能源供給也停止了。","","차원의 문이 닫혀서
디지털 월드로부터의 에너지 공급은 멈춰 있어","Als das Dimensionstor geschlossen wurde, brach
der Energiefluss aus der Digitalen Welt ab."
14,1088,"","That means that Leopardmon and the others won't be
able to take action right away. They need to lay
low and store up energy first.","芳香獸它們恐怕無法立刻行動……
應該是潛伏在某處儲存能源。","","아마도, 두프트몬 일행이 바로 움직이는 일은 없을 거야…
어딘가에 숨어서 에너지를 축적할 게 분명해","Duftmon und die anderen können also nicht
sofort handeln. Sie müssen zunächst wieder
Energie ansammeln."
15,1088,"","We must seek out and locate the remaining Royal
Knights before they make a move in earnest.","在它們正式行動之前，
必須找出剩下的皇家騎士，設法處理……","","그들이 본격적으로 움직이기 전에
나머지 로얄 나이츠를 찾아 내서, 대처해야만 해…","Wir müssen die verbleibenden Royal Knights finden,
bevor sie bereit sind zuzuschlagen."
16,3002,"","But won't we have to fight any Digimon who ally
with Leopardmon?","可是呀……
必須和服從芳香獸的數碼寶貝戰鬥吧？","","하지만… 두프트몬에게 따르는 디지몬과는
싸워야만 하는 거지?","Aber müssen wir dann nicht gegen Digimon kämpfen,
die auf Duftmons Seite stehen?"
17,1088,"","Yes... That seems unavoidable.","嗯……那應該是無可避免的。","","그래… 그건 피할 수 없겠지","Ja ... das wird sich wohl nicht vermeiden lassen."
18,1088,"","But we should keep explaining our position as much
as possible. There are Digimon who may join us.","但是，盡可能繼續說服吧。
應該還有數碼寶貝願意成為我們的伙伴。","","하지만, 가능한 한 설득은 계속 해 보자
아직 동료가 되어 줄 디지몬은 있을 거야","Aber wir sollten unseren Standpunkt weiterhin
erklären. Vielleicht kommen Digimon zu uns."
19,1088,"","My sworn friends, like Gallantmon.","就像我的盟友――紅蓮騎士獸一樣。","","나의 맹우, 듀크몬처럼","Und meine eingeschworenen Freunde, wie Gallantmon."
20,1126,"","Indeed. When you are a prisoner to hatred, you
choose the wrong path by mistake.","是啊……
如果只被憎恨蒙蔽，就會看錯應該選擇的道路。","","그렇군…
증오에만 사로잡혀서는, 선택해야 할 길을 오인하게 되지","In der Tat. Wer sich vom Zorn übermannen lässt,
trifft zwangsläufig die falsche Wahl."
21,1126,"","I need to begin as you said, by knowing humans.","我也照你說的，先從瞭解人類開始吧。","","나도 네 말대로, 우선 인간을 알아 가는 것부터 시작하겠다","Ich muss damit anfangen, dass ich Menschen
kennenlerne, wie du sagtest."
22,3002,"","Yeah! Thanks Omnimon, and Gallantmon!","嗯！奧米加獸、紅蓮騎士獸！謝謝你們！","","…응! 고마워! 오메가몬, 듀크몬!","Jawohl! Danke, Omnimon und Gallantmon!"
23,1088,"","Now then...
Let's continue by looking for Royal Knights.","那麼，
繼續尋找皇家騎士吧。","","…그럼
계속해서, 로얄 나이츠를 찾자","Also ...
Suchen wir jetzt weiter nach Royal Knights."
24,1088,"","There are signals from other Royal Knights all
over the place. Gallantmon should stay here.
It's better if we split up to look.","其他皇家騎士的反應分散在各地……
紅蓮騎士獸也在，
我們分頭找吧。","","다른 로얄 나이츠의 반응은 각지에 흩어져 있어…
듀크몬도 있으니
분담해서 찾는 게 좋겠지","Ich empfange von überall her Signale von anderen
Royal Knights. Gallantmon sollte hier bleiben.
Wir teilen uns lieber auf."
25,3002,"","Okay!
You're on the case now, Cyber Sleuth!","OK～！
那拜託你囉，電腦偵探！","","OK!
그럼 잘 부탁해, 전뇌탐정!","Gut!
Jetzt bist du dran, Cyber-Detektiv!"
26,3002,"","We'll call if we find someone, too!","我們如果有找到，也會和你聯絡！","","우리들도 누군가 발견하면 연락할게!","Wir melden uns auch, wenn wir jemanden finden!"
27,2000,"","I'll help Nokia and the others search for the 
Royal Knights.","和諾奇雅等人協力，一起尋找皇家騎士吧。","","…노키아 일행과 협력해서 로얄 나이츠를 찾자","Ich helfe Nokia und den anderen, die Royal Knights
zu suchen."
28,2000,"","But I'd better check in at the agency before that.
Kyoko might be there.","在那之前，要先回事務所一趟嗎……
說不定杏子姊已經回來了。","","그 전에 한 번, 사무소로 돌아갈까…
쿄코 씨가 돌아오셨을지도 몰라","Aber vorher sollte ich im Büro vorbeischauen.
Vielleicht ist Kyoko wieder da."
