ID,Speaker,Japanese,English,Chinese,EnglishCensored,Korean,German
1,1308,"","Hey, human! Get out of our lair!","喂　人類
從我們　的　家園　離開","","어이 인간.
우리의 둥지에서 떠나라","He, Mensch! Verzieh dich aus unserem Versteck!"
2,1702,"","We don't have to listen to some human!","什麼！？不過是個人類，囉囉嗦嗦什麼。
真是讓人不爽的傢伙。","","아앙!? 인간 주제에 쫑알쫑알 시끄럽네.
짜증 나는 녀석이야","Wir müssen auf keinen Menschen hören!"
3,1015,"","Who do you think you are?! If you won't shut your
mouth, we'll shut it for you!","居然敢指使我們，真不知死活。
就讓我撕裂你這張嘴……
覺悟吧！！","","우리에게 말대꾸를 하다니, 주제를 모르는 녀석.
그 입을 찢어주도록 하지요.
……각오해라!!","Für wen hältst du dich eigentlich?! Wenn du nicht
die Klappe hältst, stopfen wir dir das Maul!"
