ID,Speaker,Japanese,English,Chinese,EnglishCensored,Korean,German
1,3048,,Ehi! State tutti bene?,喂！　沒事吧！？,,어~이! 괜찮은 거야!?,He! Geht es dir gut?
2,3048,,Non stai nemmeno sudando! Suppongo che mi sia preoccupato per niente.,"你很好啊……
真是白擔心了……",,"무사하잖아…
괜히 걱정했네…","Du schwitzt noch nicht mal! Habe ich mir wohl
umsonst Sorgen gemacht."
3,3048,,Suppongo che non sia una sorpresa.,……不過，真厲害呢。,,…그래도 역시 대단해,Wen wundert’s.
4,3048,,"Ehi, abbiamo superato la sicurezza. Sembra che la
strada sia libera.","解除防範措施了，
這樣能前進了喔。",,"보안이 풀렸어.
이제 앞으로 갈 수 있어","He, wir haben die Sicherheitsvorkehrungen
überwunden. Der Weg steht offen."
5,3048,,"Ah ah, questo è ciò che ti capita quando ti metti contro di noi!
Andiamo avanti!","嘿嘿，我們出馬的話，這種只是小事！
來吧，向前進吧！",,"헤헤…우리들한테 걸리면 이런 거지!
자, 앞으로 가보자고!","Haha, das kommt davon, wenn man sich mit uns
anlegt! Gehen wir weiter!"
