ID,Speaker,Japanese,English,Chinese,EnglishCensored,Korean,German
100,4372,"","There's monster spawns all over Akihabara!
I wonder what kinda loot we can get outta them!
Wait... Are they real?!","秋葉原裡出現了怪物！！
咦……這個、這是在現實裡嗎？","","아키하바라에 몬스터 출현!!
에…이거, 진짜로 리얼인가요?","In Akihabara sind überall Monster-Spawnpunkte!
Ob die wohl was Gutes droppen?
Wie? Die sind echt?!"
101,4373,"","Today's the Momotan live stream! I don't care how
many monsters are roaming the streets, they're not
gonna get in my way!","今、今天是小桃桃情報的直播日──！
就算有怪物出現，也無法阻擋我──！！　","","오, 오늘은 모모땅 정보를 생중계하는 날임다~!
설령 괴물이라고 해도 제 앞길을 가로막는 건
불가능할 것임다~~!!","Heute kommt der Livestream von Momotan! Mir ist es
egal, wie viele Monster auf den Straßen
herumlaufen, ich lasse ihn mir nicht entgehen!"
102,4374,"","All the other shops in the area are closed, like
any sane, reasonable person would expect, but our
crazy boss says we just cornered the market!","隔壁的店已經休業了……這也是理所當然的啊。
我們的店長說要營業到最後一刻……
還說什麼現在正是機會……","","옆 가게는 휴업이래…그야 그렇겠지.
우리는 점장님이 아슬아슬할 때까지 영업한대…
지금이 찬스라고 그러지 뭐야…","Alle anderen Läden in der Gegend haben zu,
was vernünftige Leute verstehen, aber unser irrer
Chef meint, jetzt hätten wir einen Marktvorteil!"
103,4379,"","Haven't you seen the TV? The streets aren't safe.
Avoid going out if possible!","你沒看電視嗎？　街上很危險喔。
盡可能不要外出！","","TV를 못 본 거냐? 거리는 위험해.
되도록이면 외출은 하지 말라고!","Hast du es nicht im Fernsehen gesehen? Die Straßen
sind nicht sicher. Geh lieber gar nicht vor
die Tür!"
104,1307,"","Someone who dresses up like Nyaromon and works in
a cafe is called a ""maid."" One of them just taught
me this: How may I serve you, Master?","聽說模仿貓貓獸，在店裡工作的人稱之為
「女僕」喔。這是剛才有人教我的～
會說什麼歡迎回來，主人大人～之類的喔。","","야옹몬을 흉내 내면서 가게에서 일하는 걸「메이드」라고
한대, 아까 그렇게 들었어~
다녀오셨어요, 주인님~ 이라고 하더라고~","Jemand, der sich wie Nyaromon kleidet und in einem
Café arbeitet, ist eine „Maid“. Das habe ich von
einer gelehrt: Wie kann ich dir dienen, Meister?"
105,1569,"","I just found a human coin on the ground. Now I can
play a game! But should I play a beat 'em up game
or a dancing game?","剛剛在路上撿到人類用的錢了，這樣就可以
玩遊戲了喔！拍貼機和格鬥遊戲，
哪個比較好呢──","","아까 길에서 인간의 돈을 주웠으니까 이걸로 게임을 할 수 있어!
스티커 사진하고 격투 게임, 뭐가 좋을까~","Ich habe gerade eine Münze der Menschen auf dem
Boden gefunden! Jetzt kann ich spielen! Hm, ein
Prügelspiel oder ein Tanzspiel?"
106,1393,"","This horrible place is full of machines. I much
prefer nature.","感覺是個很擠，又都是只有機械的地方啊──
我明明比較喜歡大自然的地方的說……","","뭔가 어수선하고 기계만 잔뜩 있는 곳이네~
난 자연이 가득한 곳이 좋은데…","Dieser furchtbare Ort ist voller Maschinen.
Ich mag die Natur lieber."
107,4374,"","*sigh* All right, time for work mode...","哈～……那麼接下來，就開始工作吧……","","하~…그럼, 일해볼까…","*Seufz* Na schön, Zeit, in den Arbeitsmodus
umzuschalten ..."
108,4374,"","Teehee! Hi, there! Wanna come back to my cute maid
cafe? You'll have the time of your life.","……哇～主人大人～
要不要跟我一起去店裡哇……？
被無視了嗚～嗚……","","…와~아 주인님~
저하고 같이 가게에 안 가실래요~…?
스킵룽루~웅…","Tihi! Hallöchen! Hast du Lust, in mein
schnuckeliges Maid-Café zu kommen? Du wirst
dich amüsieren wie nie zuvor."
