ID,Speaker,Japanese,English,Chinese,EnglishCensored,Korean,German
100,4620,"","*sigh* That's all we got... We can't give any
more.","唉，我不行了……對現在的我來說，這個負擔太重了……","","하아, 더 이상 무리… 나에게는 아직 무거운 짐이었어…","*Seufz* Wir haben unser Bestes gegeben ...
Mehr geht nicht."
200,4621,"","No! This is as far as I can go. It's all up to
the Captains now. Good luck to you all.","可惡！我就到此為止了嗎……！
再來只能交給隊長他們了……","","젠장~! 난 여기까지인 거냐…!
뒷일은 리더 일행에게 맡길 수밖에 없겠구만…","Nein! Weiter kann ich nicht gehen. Jetzt liegt
alles bei den Anführern. Viel Glück euch allen."
300,4622,"","*sniffle* M-My Digimon... They got wiped out...
They'll be okay, I just gotta find a way to heal
'em! *sniff*","啊～！
人家的數碼寶貝全都被打倒了！","","아앙~!
내 디지몬이 모두 당해 버렸어!","*Schnüff* M-Meine Digimon ... sind erledigt ...
Das wird schon, ich muss nur einen Weg finden,
sie zu heilen! *Schnüff*"
301,4622,"","Security always left Digimon alone before, what
was so different about today...? *sniff* Why?!","居然拿數碼寶貝代替防範措施……
這種事要一開始就告訴人家啦～！啊～～～！","","보안 대신에 디지몬을 풀어놓다니…
그럴 거면 처음부터 말해 달라구~! 아앙~~~!","Bisher haben die Sicherheitssysteme Digimon doch
nichts getan, was ist denn jetzt anders?
*Schnüff* ... Warum?!"
