ID,Speaker,Japanese,English,Chinese,EnglishCensored,Korean,German
1,1714,"","It's a Raremon! So that's what's been causing the
smell!","那是……是爛泥獸！
那傢伙就是惡臭的源頭！","","저건…레어몬이다!
저 녀석이 냄새의 근원이었어!","Es ist ein Raremon! Das stinkt da also so!"
2,1590,"","...","……","","…………","..."
3,1714,"","Hey! Quit spreading that stench! Spare a thought
for everyone else!","喂！你不要在這樣到處散佈惡臭了！
難道不知道給人添麻煩了嗎！","","어이 너! 심한 냄새를 뿌리고 다니지 마!
민폐잖아!","Hey! Hör auf, so einen Gestank zu verbreiten!
Denk doch mal an andere!"
4,1590,"","...","……","","…………","..."
5,1714,"","It seems to be acting on instinct alone. It
probably can't even talk. But it's enormous!","……好像只是靠本能活著，
說不定不會說話。
話說回來，他也太大了吧!","","……그냥 본능대로 사는 것 같군.
말을 못 하는 걸지도 몰라.
그건 그렇고 뭐가 이렇게 크냐!","Es scheint nur instinktiv zu handeln. Es kann
wahrscheinlich nicht mal sprechen. Aber es ist
riesig!"
6,1714,"","And the stench... Phew! It's unbearable!","唔唔……還有這惡臭！
實在太臭……了……","","으으…그리고 이 악취!
아무리 그래도 너무…지독…","Und der Gestank ... Puh! Einfach unerträglich!"
7,1714,"","I can't take it anymore. Get rid of it.","我、我撐不住了……
快、快將那傢伙打……倒……","","나, 나는 이제 한계다…빨리 저 녀석을
쓰러트려…줘…","Ich halte das nicht mehr aus. Schaff ihn weg."
