ID,Speaker,Japanese,English,Chinese,EnglishCensored,Korean,German
100,4402,,"Faresti meglio a stare lontano dall'incrocio diagonale.
Ci sono mostri dappertutto e hacker che fanno
casino. Che fine ha fatto il mondo?","不要去涉谷站前十字路口會比較好。
會出現怪物喔，還有駭客在暴動喔。
很危險呢。",,"스크램블 교차점 쪽으론 안 가는 편이 좋을 거야.
괴물이 나오고 해커가 날뛰어서 위험하니까","Halte dich lieber von der Kreuzung fern.
Überall laufen durchgeknallte Monster und Hacker
herum. Was ist bloß los mit der Welt?"
101,4403,,Non lo sapevi? Quelli si chiamano Digimon!,你知道嗎？那些東西，叫做數碼寶貝喔！,,"알고 있어? 저 녀석들, 디지몬이라고 해!",Das weißt du nicht? Sie werden Digimon genannt!
102,4404,,"Il concerto che aspettavo da una vita
è stato cancellato a causa del caos.
Questa è la goccia che fa traboccare il vaso!","因為駭客和怪物騷動的關係，
一直都很期待的演唱會中止了……
真的是很令人困擾啊！",,"해커랑 괴물 소동 때문에 기대하던 라이브가
중지당했어… 정말이지 완전 민폐야!","Wegen des Chaos wurde das Konzert abgesagt, auf
das ich mich schon so lange gefreut hatte.
Jetzt reicht es wirklich!"
103,1705,,"I CD che vendono qui hanno della musica, ma ne ho tenuto uno all'orecchio e non ho sentito niente. Mi chiedo perché?","聽說只要買了這裡賣的CD，
就可以聽得到音樂了喔。但是，把CD放在
耳朵旁邊卻什麼都聽不見，為什麼咧？",,"여기서 파는 CD를 사면 음악을 들을 수 있대.
하지만 CD에 귀를 대도 아무것도 안 들려.
왜 그런 걸까?","Auf den CDs, die sie hier verkaufen, ist Musik,
aber ich habe eine an mein Ohr gehalten und
nichts gehört. Ich frage mich, warum."
104,1112,,"Sto morendo di fame. Se non mangio presto, non sarò
responsabile delle mie azioni!","肚子餓到有點不太爽……
如果再不吃點什麼，感覺我就快發瘋了！",,"배가 고파서 짜증이 나…
뭔가 안 먹으면 날뛰어버릴 것 같아!","Ich bin am Verhungern. Wenn ich nicht bald was
esse, kann ich für nichts garantieren!"
105,4403,,"Se stabilisci un contatto visivo, beh, li farà
scattare. Non so te, ma io ho decisamente
imparato la lezione.","還有啊！
如果和那些東西對上眼的話，聽說會被襲擊喔？
……所以我決定，不去看那些東西了！",,"그런데 말이지!
녀석들하고 눈이 마주치면 습격한다고 그러던데?
…그래서 난 녀석들을 안 보기로 결정했어!","Wenn man Blickkontakt zu ihnen aufnimmt, drehen
sie durch. Ich habe definitiv aus meinen
Fehlern gelernt."
