ID,Speaker,Japanese,English,Chinese,EnglishCensored,Korean,German
1000,4463,"","Jimiken's as popular as ever... He's at the top of
the indies charts at every shop!","看來吉米肯還是一樣超受歡迎呢……
聽說無論是哪家店，他的專輯都是獨立音樂銷售排行榜上的第一名。","","여전히 지미켄, 인기가 굉장한 것 같네…
어느 매장에서도 인디스 매상 넘버 원이래","Jimiken ist immer noch total beliebt ... In jedem
Laden ist er ganz oben in den Indie-Charts."
1050,4463,"","Recently my friends really got me into Jimiken.
If I can't get to his live show, I'll just die!","我最近因為朋友的影響而喜歡上了吉米肯。
我不想在還沒有去聽吉米肯的現場演唱會之前就死掉！","","최근에, 친구의 영향으로 지미켄이 좋아졌어
지미켄의 라이브에 가 보지도 못하고, 인생을 끝내고 싶지 않아!","Meine Freunde sind schuld, dass ich so auf
Jimiken stehe. Wenn ich ihn nicht
live sehen kann, sterbe ich!"
1100,4311,"","It's hard to find smaller acts here...
There's a lot more selection at Tower Records in
Shibuya.","非主流歌手的CD都不好找呢。
涉谷的淘兒唱片會不會比較齊全呢……","It's hard to find smaller acts here...
There's a lot more selection at Shibuya Records in
Shibuya.","마이너한 가수의 CD는 별로 안 팔고 있네
시부야의 타워 레코드 쪽이 더 상품 구성이 좋으려나…","Es ist schwer, hier weniger bekannte Künstler zu
finden. Bei Shibuya Records in Shibuya
gibt es eine größere Auswahl."
1150,4311,"","The other day, the supermarket nearby was hit by a
hacker. Heard they took every yen. This really is
the end times!","聽說前陣子這附近的超市遭到駭客襲擊，
被搶走了不少錢。
真是的，這個社會沒救啦。","","얼마 전에, 근처에 있는 슈퍼가
해커의 습격을 받아서 돈을 뺏겼다고 해
정말이지, 세상도 말세라니깐","Neulich hat ein Hacker unseren Supermarkt in der
Nähe angegriffen. Hat alle Yen gestohlen.
Wir leben in schweren Zeiten!"
1200,4312,"","There've been reports of group hallucinations all
around Tokyo lately. People claiming they were
lost in other dimensions...crazy.","聽說東京到處都發生了集體歇斯底里事件耶。
不少人都說自己不小心闖進了異次元空間裡呢！","","도쿄 여기저기에서 집단 히스테리 사건이 일어나고 있나 봐
이차원 공간으로 잘못 들어갔어! 라고 몇 명이나 증언하고 있대","In ganz Tokio gab es Berichte von
Gruppenhalluzinationen. Leute, die behaupten,
sich in anderen Dimensionen verirrt zu haben."
