ID,Speaker,Japanese,English,Chinese,EnglishCensored,Korean,German
0,9213,"","Those clothes... Are you in Hudie? I didn't think
they were planning to grow the team.","那件衣服，難道是hudie嗎？
有新人加入的傳聞，原來是真的啊～
我以為他們不想擴大隊伍啊～","","그 옷, 혹시 후디에?
신입이 들어왔다더니 정말이네~
그 녀석들, 팀을 크게 키울 생각은 없는 줄 알았어~","Diese Kleidung ... Bist du bei Hudie? Ich dachte
nicht, dass sie das Team vergrößern wollten."
1,9133,"","I'm not letting anyone past. Please just turn
around and leave.","這裡，基本上是無法給人通過的喔～
我也不希望讓你通過，如果你能夠
察言觀色的話就好了～","","여긴 일단 의미가 있어서 통행을 막고 있는 거야~
너도 지나가지 않았으면 하는데, 분위기 좀 파악해주면 좋겠네~","Ich lasse niemanden vorbei. Bitte kehr einfach
um und geh wieder."
100,9213,"","I thought we'd be the new top dogs after what
happened to Zaxon in Under Zero. This is no time
to be a hacker.","Zaxon在Under Zero被弄得雞飛狗跳，
還以為總算換我們掌握局勢了啊～
這種狀況的話，根本不是做駭客活動的時候啊～","","언더 제로에서 잭슨이 박살난 후
드디어 우리의 천하가 왔다고 생각했는뎅~
이런 상황이어선 해커 활동이나 하고 있을 때가 아니다냥~","Ich dachte, nach dem, was mit Zaxon in
Unter Null passiert ist, hätten wir das Sagen.
Jetzt will man gerade kein Hacker sein."
200,2000,"","The hacker that was blocking the way is gone.","不讓人通過的駭客不見了。","","여길 막고 있던 해커가
없어졌어","Der Hacker, der den Weg versperrte, ist fort."
201,2000,"","Perfect chance to break through the Security Wall
and head further down.","趁現在突破防火牆，
到更下層去吧。","","이 틈에 방화벽을 돌파해서
더 아래층으로 가보자","Das ist die perfekte Gelegenheit, um den
Sicherheitswall zu durchbrechen und weiter
hinunterzugehen."
