ID,Speaker,Japanese,English,Chinese,EnglishCensored,Korean,German
1,2020,"","...!","……！","","…………!","...!"
2,2020,"","?!?!","！？！？","","!?!?","?!"
3,1428,"","Hahaha! The look on your face! You were so scared!","啊哈哈哈，嚇到啦嚇到啦！！
大哥哥，你表情真棒啊！！","","아하하하, 쫄았다 쫄았어!!
형, 좋은 표정이었어!!","Hahaha! Dein Gesicht! Du hattest solche Angst!"
4,1428,"","But that was nothing compared to what's coming
next!","看我再多嚇你一點！","","자, 더 쫄게 만들어줄게!","Aber das war nur ein kleiner Vorgeschmack!"
5,2020,"","...!!!","……！！","","……!!","...!"
