ID,Speaker,Japanese,English,Chinese,EnglishCensored,Korean,German
1,4839,,"Per cosa sei venuto qui?
Avevi bisogno di un'altra occhiata al mio patetico io?","你是來幹嘛的……
是還沒看夠我不堪的樣子嗎？",,"뭐하러 온 거냐…
아직 내 꼴사나운 모습을, 덜 봤다는 거냐","Was suchst du denn hier?
Wolltest du mein erbärmliches Ich unbedingt ein
letztes Mal sehen?"
2,2000,,...,………,,………,...
3,4839,,"Sei incredibile, sai.
Sempre in grado di fare la cosa giusta subito.","你真厲害呀……
不管何時都會做出正確的事情。",,"넌 참 대단하다니깐…
언제나 곧장 올바른 일을 할 줄 알아","Du bist toll, weißt du.
Du tust immer sofort das Richtige."
4,4839,,"Ma io non sono così.
Non posso fare niente. Preoccupato di come apparirà.","但是啊，我不像你。
瞻前顧後的話，什麼都辦不到……",,"하지만 말이야, 난 그렇지 않아
폼만 잡고, 아무것도 할 줄 몰라―…","Aber ich bin nicht so.
Ich kann gar nichts. Beschäftige mich nur damit,
wie ich dabei aussehe."
5,4839,,"E finisce di nuovo senza che io possa aiutare
un amico. Quanto è patetico?","又沒救到朋友就結束了……
真遜……",,"…또 친구를 구하지 못하고 끝나는 거야…
…꼴사나워…","Und am Schluss kann ich noch nicht mal einem
Freund helfen. Erbärmlich, was?"
