ID,Speaker,Japanese,English,Chinese,EnglishCensored,Korean,German
1,1311,"","Hey! You're getting a bit carried away!","你這傢伙在幹嘛！好粗魯啊！","","뭐야 너! 꽤 난폭하잖아!","He! Du übertreibst es ein bisschen!"
2,1311,"","Wait?! Is it... Is it possible?! You've become
such a rabid fan of me--Etemon? Such fierce
fandom that it spiraled into an obsession?!","難道是因為那樣！？
因為太喜歡我，所以變成狂熱的歌迷？","","…그거구나!?
내가 너무 좋아서, 광신도 팬이 되어 버린 그거구나?","Moment! Ist das möglich?! Bist du so ein großer
Fan von mir, Etemon, geworden? Dass du jetzt
besessen bist von mir?"
3,1311,"","And that love--Oh, that love!--turned to cruel
hatred. You would kill me, so that none else can
have me...","那份情感最後變成憎恨……
為了要獨占我，所以甚至想奪走我的生命！","","그 애정은 이윽고 증오로 변하고…
날 독점하기 위해서, 목숨까지 앗아가려는 거구나!","Und diese Liebe, diese unbändige Liebe, hat sich
in Hass gewandelt. Du willst mich töten, damit
mich niemand anders haben kann ..."
4,1311,"","No! I can't allow that! I'm simply too much for
one Hacker to handle!","我才不會讓你那樣做！
我不是你一個人的東西啊！！","","그렇게는 안 되지!
난 너만의 것이 아니야아아―!!","Nein! Das darf ich nicht zulassen!
Ein Hacker allein kommt mit mir nicht klar!"
