ID,Speaker,Japanese,English,Chinese,EnglishCensored,Korean,German
1,3003,,"Cosa stavi facendo, [p]?",[p]，你在做什麼？,,"[p] 씨, 뭘 하고 계셨던 건가요?","Wo warst du denn so lange, [p]?"
2,3003,,"Ho aspettato un po' al luogo dell'incontro, ma
quando non ti sei fatto vivo sono andato a Kowloon Lv. 5.","我在集合地點等了半天，你都沒有出現……
我就先來「Kowloon Lv. 5」了。",,"합류 지점에서 잠시 기다렸는데, 안 오시길래…
먼저「쿠롱 Lv.5」까지 와 버렸어요","Ich habe am Treffpunkt gewartet, aber nachdem du
nicht gekommen bist, bin ich weiter zur fünften Ebene
in Kowloon."
3,3003,,"Per favore, vieni e raggiungimi qui non appena puoi.",你也趕快過來吧。,,"당신도, 빨리 와 주세요",Bitte komm so bald wie möglich zu mir.
4,2000,,...,……,,………,...
