ID,Japanese,English,Chinese,EnglishCensored,Korean,German
7050,,"Controlla. Di che colore è la lama
sulla coda di BaoHuckmon?","問答題喔！　巴歐哈克獸的尾巴上
裝著的刀刃是什麼顏色呢？",,"퀴즈. 바오헉몬의 꼬리에 달린
칼의 색은 무슨 색일까?","Rate mal! Welche Farbe hat die Klinge
an BaoHackmons Schwanz?"
7051,,"Controlla. Perché improvvisamente non sei
riuscito ad accedere a EDEN qualche mese fa?","問答題喔！　數個月前，你突然無法
登入EDEN了，原因是什麼？",,"퀴즈. 몇 개월 전, 당신이 갑자기 EDEN에
로그인하지 못하게 된 것은, 무엇이 원인이었지?","Rate mal! Warum konntest du dich vor ein
paar Monaten nicht in EDEN einloggen?"
7052,,"Controlla. Qual è il nome del sito
dove puoi acquistare Digimon?","問答題喔！　能用YEN來購買數碼寶貝的
地下網站，名稱是什麼？",,"퀴즈. 디지몬을 YEN으로 구입할 수 있는
뒷거래 사이트의 이름은 뭐라고 할까?","Rate mal! Wie heißt die Seite, auf der
man Digimon kaufen kann?"
7053,,"Controlla. Cosa c'è scritto sulla porta
della stanza di Erika al bar?","問答題喔！　網路咖啡廳hudie裡，在艾莉卡
房間的房門上寫的單字是什麼？",,"퀴즈. 인터넷 카페 에리카의 방
문에 적혀있는 단어는 뭘까?","Rate mal! Was steht an der Tür in
Erikas Zimmer im Café?"
7054,,"Controlla. Come si chiama il peluche
preferito di Erika?","問答題喔！　艾莉卡很重視的娃娃，
名稱是什麼？",,"퀴즈. 에리카가 소중히 하는
인형의 이름은 뭘까?","Rate mal! Wie heißt Erikas geliebtes
Kuscheltier?"
7055,,"Controlla. Di che colore sono i capelli
del tuo amico Yu Nogi?",問答題喔！　你的好朋友，乃木優的髮色是什麼色？,,"퀴즈. 당신의 친구, 노기 유우의 머리 색은 무슨 색?","Rate mal! Welche Haarfarbe hat dein
Freund Yu Nogi?"
7056,,"Controlla. Quale caratteristica è disponibile per i
Digimon con una frequenza di scansione superiore al 100%?","問答題喔！　數碼實驗室裡，能夠實體化
掃描率超過100％的數碼寶貝的機能叫什麼？",,"퀴즈. 스캔율이 100%를 넘은
디지몬을 실체화시키는 디지랩의 기능은 뭘까?","Rate mal! Welche Funktion haben Digimon
mit einem Scanwert von über 100 %?"
7057,,"Controlla. Quale delle seguenti azioni puoi fare
per aumentare il tuo livello Hacker?","問答題喔！　能夠代表你的駭客技術的
「駭客等級」要怎麼提昇呢？",,"퀴즈. 당신의 해커로서의 실력을 보여주는
「해커 랭크」는 무엇을 하면 오르는 걸까?","Rate mal! Mit welcher Option kannst du
deinen Hackerrang erhöhen?"
7058,,"Controlla. Cosa succede quando
equipaggi un Digimon con un accessorio?","問答題喔！　讓數碼寶貝裝備「飾品」的話，
會發生什麼事呢？",,"퀴즈.「액세서리」를 디지몬에게
장비시키면 무엇이 일어날까?","Rate mal! Was passiert, wenn du einem
Digimon ein Accessoire gibst?"
7059,,"Controlla. Dov'è il net café
Hudie?","問答題喔！　網路咖啡店「hudie」
在哪裡呢？",,"퀴즈. 인터넷 카페「후디에」는
어디에 있을까?","Rate mal! Wo ist das Internetcafé von
Hudie?"
7060,,"Controlla. Qual è il numero della
cabina che usi di solito nel internet café?","問答題喔！　在網路咖啡店裡，你每次
都使用的隔間是幾號呢？",,"퀴즈. 인터넷 카페에서 항상 당신이
이용하고 있는 부스의 번호는 몇 번일까?","Rate mal! Was ist die Nummer der Kabine,
die du meist im Internetcafé benutzt?"
7061,,"Controlla. Che beneficio si ottiene se
un Digimon ha un ABI alto?","問答題喔！　數碼寶貝的「才能」提高的話，
農場裡會有什麼好事發生呢？",,"퀴즈. 디지몬의「재능」이 높으면
팜에서 어떤 좋은 일이 있을까?","Rate mal! Welchen Vorteil gewährt ein
Digimon mit hoher FÄH?"
7062,,"Controlla. Quale dei cibi dei Digimon
aumenta l'INT massima?","問答題喔！　在數碼農場中，能將INT
提升到最大的食物是什麼？",,"퀴즈. 디지팜에서 디지몬에게 주는
식사로 지력의 최대치가 오르는 음식은 어느 것일까?","Rate mal! Welches Digimon-Essen erhöht
das Maximum an INT?"
7063,,"Controlla. Quale dei prodotti agricoli
aumenta la precisione per Investigare?","問答題喔！　能夠提升數碼農場的調查精準度
的農場道具是什麼？",,"퀴즈. 디지팜 조사의 정밀도를
상승시키는 팜 굿즈는 뭘까?","Rate mal! Welches Farmprodukt erhöht die
Genauigkeit von „Ermitteln“?"
7064,,"Controlla. Qual è l'azienda che
gestisce Cyberspace EDEN?",問答題喔！　經營電腦空間EDEN的企業是誰？,,"퀴즈. 전뇌공간 EDEN을
운영하는 기업은 어디일까?","Rate mal! Welche Firma betreibt den
Cyberspace EDEN?"
7065,,"Controlla. La prima volta che sei andato
a Kowloon, quale hacker stavi inseguendo?","問答題喔！　你第一次到Kowloon時，
你追趕的駭客是誰？",,"퀴즈. 당신이 처음으로 쿠롱에 갔을 때
쫓던 해커는 누구였지?","Rate mal! Welchen Hacker hast du beim
ersten Ausflug nach Kowloon verfolgt?"
7066,,"Controlla. Qual era il Digimon compagno di Ryuji
quando l'hai incontrato per la prima volta?","問答題喔！　你第一次遇到龍司的時候，
他的夥伴數碼寶貝是誰？",,"퀴즈. 당신이 류지와 처음으로 만났을 때
그 사람이 파트너로 데리고 있던 디지몬은?","Rate mal! Was war Ryujis Partnerdigimon,
als du ihn kennengelernt hast?"
7067,,"Controlla. Come puoi aumentare la tua
memoria massima per le feste?",問答題喔！　提昇隊伍容量的方法是什麼？,,"퀴즈. 파티 메모리의 상한을
올리는 방법은 뭘까?","Rate mal! Wie kannst du deinen maximalen
Gruppenspeicher erhöhen?"
7068,,"Controlla. Quale tipo di
Digimon Virus danneggia di più?","問答題喔！　能給病毒種數碼寶貝
嚴重損傷的是哪個種族？",,"퀴즈. 바이러스종이 큰 대미지를
줄 수 있는 것은 어느 종족일까?","Rate mal! Welcher Typ von Virus-Digimon
richtet den meisten Schaden an?"
7069,,"Controlla. Una domanda sugli attributi:
quale attributo danneggia di più i Digimon Vegetali?","問答題喔！　能給木屬性數碼寶貝
嚴重損傷的是哪個屬性？",,"퀴즈. 속성에 대한 문제를 낼게요. 풀속성의
디지몬이 큰 대미지를 줄 수 있는 상대는 무슨 속성일까?","Rate mal! Welchem Attribut fügen
Pflanzen-Digimon den meisten Schaden zu?"
7070,,"Controlla. Durante la battaglia, quale stato
anomalo inverte l'affinità di tipo?","問答題喔！　戰鬥時，能把種族相性逆轉的
異常狀態是什麼？",,"퀴즈. 배틀 중, 종족 상성이 역전되어버리는
상태 이상은 뭘까?","Rate mal! Welches Statusleiden kehrt
beim Kampf Typ-Affinität um?"
7071,,"Controlla. Quale equipaggiamento
aumenta l'EXP che ottieni in battaglia?","問答題喔！　只要讓數碼寶貝裝備，
就能增加戰鬥獲得EXP的裝備是什麼？",,"퀴즈. 디지몬에게 장비시켜 두면
배틀로 받을 수 있는 EXP가 늘어나는 장비품은 뭘까?","Rate mal! Welche Ausrüstung erhöht die
EP, die man beim Kämpfen erhält?"
7072,,"Controlla. Quale abilità di hacking aumenta
la velocità di movimento?","問答題喔！　能夠提昇移動速度的
駭客技能是什麼？",,"퀴즈. 이동속도를 상승시키는
해킹 스킬은 뭘까?","Rate mal! Welche Hacking-Fertigkeit
erhöht das Tempo?"
7073,,"Controlla. Cosa succede quando dai la
Carne Miracolosa a un Digimon?",問答題喔！　天降奇蹟肉能給數碼寶貝什麼效果？,,"퀴즈. 미라클 고기를 디지몬에게 주었을 때의
효과는 뭘까?","Rate mal! Was passiert, wenn du einem
Digimon Wunderfleisch gibst?"
7074,,"Controlla. Clockmon può avanzare e tornare
indietro liberamente durante quale periodo?","問答題喔！　時鐘獸只要在某段期間
就能自在操作時間，那個期間是？",,"퀴즈. 타임몬은 어느 기간 사이에 있으면
시간을 자유자재로 조종할 수 있다고 하는데. 그 기간이란?","Rate mal! Während welcher Periode kann
Clockmon Zeit vor- und zurückdrehen?"
7075,,"Controlla. Quale arma è incastrata nella
testa di Pumpkinmon?",問答題喔！　南瓜獸頭上刺著的刀具是什麼？,,"퀴즈. 펌프몬의 머리에 박혀있는
날붙이는 뭘까?","Rate mal! Welche Waffe steckt im Kopf
von Pumpkinmon?"
7076,,"Controlla. Quale Digimon usa la mossa
speciale Assorbimento dell'Anima?","問答題喔！　必殺技是將對手的資料分解吸收的
「靈魂吸收」的數碼寶貝是誰？",,"퀴즈. 상대의 데이터를 분해해서 흡수하는
「소울 앱소프션」이 필살기인 디지몬은?","Rate mal! Welches Digimon benutzt den
Spezialmove „Seelenabsorption“?"
7077,,"Controlla. Quale delle seguenti è una
delle mosse speciali di Arcadiamon Evoluto?","問答題喔！　阿卡迪獸超究極體的必殺技
「oo矩陣」，oo是什麼字？",,"퀴즈. 알카디몬 초궁극체의 필살기
「○ 매트릭스」. ○에는 무엇이 들어갈까?","Rate mal! Welcher der Folgenden ist ein
Spezialmove von Ultimatives Arkadimon?"
7078,,"Controlla. Quale dei seguenti
Digimon usa le arti marziali orientali?","問答題喔！　使用東洋武術戰鬥
並寄宿著傳說的十鬥士之力的數碼寶貝是誰？",,"퀴즈. 동양의 무술을 구사해서 싸우는
전설의 10투사의 힘을 간직한 디지몬은 뭘까?","Rate mal! Welches der folgenden Digimon
setzt orientalische Kampfkünste ein?"
7079,,"Controlla. Quale Digimon umanoide bestia
usa l'attacco Pugno del Re Bestia?","問答題喔！　有著究極奧義「獸王拳」這必殺技，
被稱為崇高勇者的獸人型數碼寶貝是誰？",,"퀴즈. 궁극 오의「야수주먹」을 필살기로 가진
고귀한 용사로 불리는 수인형 디지몬은 뭘까?","Rate mal! Welches Tiermenschen-Digimon
hat den Angriff „Königsfaust“?"
7080,,"Controlla. Quale Digimon è
quasi identico a Frigimon?","問答題喔！　跟雪人獸很像
身體幾乎是由土的資料組成的數碼寶貝是誰？",,"퀴즈. 프리지몬과 닮았지만
몸 대부분이 흙 데이터로 이루어진 디지몬은?","Rate mal! Welches Digimon sieht fast
genau wie Frigimon aus?"
7081,,"Controlla. Quale Digimon ibrido
porta la spada Ryugonken?","問答題喔！　持有傳聞中，封印著龍之魂的
「龍魂劍」的數碼寶貝是誰？",,"퀴즈. 용의 혼을 봉인했다는
「용혼검」을 가진 초월종 디지몬은?","Rate mal! Welches Hybrid-Digmon benutzt
das Ryogonken-Schwert?"
7082,,"Controlla. Quale Digimon animale
mitologico digievolve in Gryphonmon?","問答題喔！　據說只要進化
便會成為獅鷲獸的幻獸數碼寶貝是誰？",,"퀴즈. 진화하면 그리폰몬이 된다고
하는 환수 디지몬은 뭘까?","Rate mal! Welches mythische Tier-Digimon
digitiert zu Gryphonmon?"
7083,,"Guarda. Cosa lancia DemiDevimon durante la
sua mossa speciale Demi Darts?","問答題喔！　小惡魔獸的必殺技
「小惡魔飛鏢」是丟出什麼的招式？",,"퀴즈. 피코데블몬의 필살기
「피코주사기」는 무엇을 날리는 기술일까?","Rate mal! Womit wirft DemiDevimon beim
Spezialmove „Giftpfeile“?"
7084,,"Controlla. Quale Digimon è nato
quando molti Diaboromon si sono fusi?","問答題喔！　大量融合超惡魔獸的幼年期，
引發突變而誕生的數碼寶貝是誰？",,"퀴즈. 디아블로몬의 유년기가 대량으로
융합하여, 돌연변이를 일으켜 탄생한 디지몬은?","Rate mal! Welches Digimon wurde aus der
Fusion vieler Diaboromon geboren?"
7085,,"Controlla. Qual è l'alias con cui è conosciuto
anche Rapidmon?","問答題喔！　能用接近光速的動作
確實收拾掉敵人的拉比獸，他的別名是？",,"퀴즈. 광속에 가까운 움직임으로 확실히 적을 끝장내는
래피드몬의 다른 이름은 뭘까?","Rate mal! Wie wird Rapidmon noch
genannt?"
7086,,"Controlla. Cosa ha Ankylomon
alla fine della coda?","問答題喔！　成熟期的鎧龍型數碼寶貝
戰甲獸的尾巴前端連著什麼東西？",,"퀴즈. 성숙기인 갑룡형 디지몬
황금아르마몬의 꼬리 끝에는 무엇이 붙어있을까?","Rate mal! Was hat Ankylomon am Ende
seines Schwanzes?"
7087,,"Controlla. Chaosmon DNA digievolve da
BanchoLeomon e da quale altro Digimon?","問答題喔！　混沌獸的合體進化
需要的是番長獅子獸跟哪一隻數碼寶貝？",,"퀴즈. 카오스몬의 조그레스 진화에
필요한 것은 반쵸레오몬과 나머지 하나는 뭘까?","Rate mal! Chaosmon DNA-digitiert aus
BanchoLeomon und welchem Digimon?"
7088,,"Controlla. Quale Digimon si ottiene
quando Ankylomon DNAdigievolve con Angemon?","問答題喔！　戰甲獸跟天使獸
合體進化的突變型數碼寶貝是誰？",,"퀴즈. 황금아르마몬과 엔젤몬이
조그레스 진화한 돌연변이형 디지몬은 뭘까?","Rate mal! Welches Digimon entsteht, wenn
Ankylomon und Angemon DNA-digitieren?"
7089,,"Controlla. Quale mossa speciale di Betamon
genera più di 1 MV di elettricità?","問答題喔！　能用百萬伏特以上的電擊
來攻擊敵人的比特獸必殺技是什麼？",,"퀴즈. 100만 볼트 이상의 전격으로 적을 공격하는
베타몬의 필살기는 뭘까?","Rate mal! Welcher Betamon-Spezialmove
generiert 1 MV Elektrizität?"
7090,,"Controlla. Dorugoramon è stato creato come
avatar della distruzione. Di che tipo è?","問答題喔！　由數碼核所創造的破壞源頭
被稱為究極之敵化身的多路戰龍獸的種族是什麼？",,"퀴즈. 디지코어가 창조한 파괴의 화신
궁극의 적의 화신이라고 하는 돌고라몬의 종족은?","Rate mal! Dorugoramon ist ein Avatar der
Zerstörung. Zu welchem Typ gehört es?"
7091,,"Controlla. La cultura cinese ha cinque
elementi: legno, fuoco, terra, acqua e?","問答題喔！　中國的五行思想中，被稱為萬物之源的
五種元素，除木、火、土、水之外，最後一個是？",,"퀴즈. 중국의 오행 사상으로 만물의 근원이라 하는
5개의 원소는 목, 화, 지, 수와 나머지 하나는 뭘까?","Rate mal! Die chinesische Kultur kennt 5
Elemente: Holz, Feuer, Erde, Wasser und?"
7092,,"Controlla. Quale di questi è il pianeta più
grande: Marte, Giove o la Terra?","問答題喔！　木星、火星、地球之中，
最大的行星是哪一個？",,"퀴즈. 목성, 화성, 지구 가운데
가장 큰 행성은 뭘까?","Rate mal! Welcher Planet ist der größte,
Mars, Jupiter oder die Erde?"
7093,,"Controlla. Chi ha scritto il primo romanzo
poliziesco, ""I delitti della Rue Morgue""?","問答題喔！　被稱為史上第一本推理小說的
「莫爾格街兇殺案」的作者是誰？",,"퀴즈. 사상 최초의 추리소설이라 불리는
「모르그 가의 살인」의 작가는 누굴까?","Rate mal! Wer schrieb den ersten Krimi,
„Der Doppelmord in der Rue Morgue“?"
7094,,"Controlla. Quale di questi è un pesce:
una balena, uno squalo o un'orca?","問答題喔！　鯨魚、鯊魚、虎鯨之中，
誰才是魚類呢？",,"퀴즈. 고래, 상어, 범고래 중에서
어류인 것은 어느 것일까?","Rate mal! Welcher ist ein Fisch: ein
Wal, ein Hai oder ein Orca?"
7095,,"Controlla. Quale dei seguenti
è il fiume più lungo?",問答題喔！　世界最長的河流是？,,퀴즈. 세계에서 가장 긴 강은 뭘까?,"Rate mal! Welcher der folgenden 
ist der längste Fluss?"
7096,,"Controlla. Quale di questi è un
anfibio: un geco o un tritone?",問答題喔！　壁虎跟蠑螈，誰才是兩棲類？,,"퀴즈. 도마뱀과 도롱뇽, 양서류은 어느 쪽일까?","Rate mal! Welcher ist eine Amphibie, ein
Gecko oder ein Molch?"
7097,,"Controlla. Come si calcola l'area
di un trapezio?",問答題喔！　你知道梯形面積的計算方法嗎？,,"퀴즈. 사다리꼴의 면적을 구하는 방법, 알아?","Rate mal! Wie berechnet man die Fläche
eines Trapezes?"
7098,,"Controlla. ""Girasoli"" è stato dipinto da
quale pittore postimpressionista olandese?","問答題喔！　以「向日葵」所聞名的
荷蘭後印象派畫家是誰？",,"퀴즈.「해바라기」 등의 작품으로 유명한
네덜란드의 후기 인상파 화가는 누굴까?","Rate mal! Welcher spätimpressionistische
Holländer malte die „Sonnenblumen“?"
7099,,"Controlla. In quale guerra tra Inghilterra e
Francia combatté Giovanna d'Arco?","問答題喔！　聖女貞德所活躍的
英國與法國之間的戰爭名稱是什麼？",,"퀴즈. 성녀 잔 다르크가 활약한
영국과 프랑스 전쟁은 뭘까?","Rate mal! In welchem anglofranzösichen
Krieg kämpfte Jeanne d’Arc?"
7100,,"Controlla. Quale delle
seguenti prelibatezze deriva dal pesce?","問答題喔！　被稱為世界三大美味的食材有
松露、魚子醬跟什麼？",,"퀴즈. 세계 3대 진미라고 일컬어지는 식재는
트뤼프, 캐비아와 나머지 하나, 뭘까?","Rate mal! Welche der folgenden
Delikatessen stammt von Fischen?"
8001,,"Ascolta. Qual è il logo del team di
hacker Hudie a cui appartieni?","那我來出問答題囉。　你所屬的駭客隊伍
hudie的象徵標誌是什麼？",,"그럼, 퀴즈. 당신이 소속된 해커팀
후디에의 트레이드 마크는 뭐였어?","Hör zu! Was zeigt das Logo von Team
Hudie, zu dem du gehörst?"
8002,,"Ascolta. In che lingua si
dice ""Hudie""?",那我來出問答題囉。　Hudie是哪國語言呢？,,"그럼, 퀴즈. 후디에란
어느 나라 말일까?","Hör zu! Aus welcher Sprache stammt das
Wort „Hudie“?"
8003,,"Ascoltate. Che tipo di Digimon
è Gabumon?",那我來出問答題囉。　加布獸是什麼型數碼寶貝呢？,,"그럼, 퀴즈. 파피몬은 무슨형 디지몬일까?","Hör zu! Was für ein Digimon ist
Gabumon?"
8004,,"Ascoltate. Quale dei seguenti non fa parte
dell'Olympos XII?","那我來出問答題囉。　新月獸、狄安娜獸、
墨丘利獸中，誰不是奧林帕斯十二神呢？",,"퀴즈. 디아나몬, 크레세몬,
메르크리몬 중에서 올림푸스 12신이 아닌 것은?","Hör zu! Wer ist kein Mitglied von
Olympos XII?"
8005,,"Ascoltate. Chi ha più
corna, Lopmon o Terriermon?","那我來出問答題囉。　黑大耳獸跟大耳獸，
誰的角比較多呢？",,"그럼, 퀴즈. 테리어몬과 로프몬
뿔의 수가 많은 것은 어느 쪽일까?","Hör zu! Welches hat mehr Hörner,
Lopmon oder Terriermon?"
8006,,"Ascoltate. Come si chiama la lancia
brandita da Gallantmon Crimson Mode?","那我來出問答題囉。　紅蓮騎士獸真紅蓮型態所持的
光之神槍，名稱是什麼？",,"그럼, 퀴즈. 듀크몬 크림존 모드가 가진
빛의 신창의 이름은 뭐라고 할까?","Hör zu! Wie heißt die Lanze von
Gallantmon Crimson Mode?"
8007,,"Ascolta. Come si chiama la
spada di Slayerdramon?","那我來出問答題囉。　斬龍獸所持的大劍，
名稱是什麼？",,"그럼, 퀴즈. 슬레이어드라몬이 가진
대검의 이름은 뭐라고 할까?","Hör zu! Wie heißt das Schwert
von Slayerdramon?"
8008,,"Ascolta. Quante trivelle
ha Brakedramon sul suo corpo?",那我來出問答題囉。　破壞龍獸全身上下有幾個鑽頭？,,"그럼, 퀴즈. 브레이크드라몬 온몸에
붙어있는 드릴의 개수는 몇 개 있을까?","Hör zu! Wie viele Bohrer hat
Breakdramon an seinem Körper?"
8009,,"Ascolta. Che tipo è
Arcadiamon (in formazione)?",那我來出問答題囉。　阿卡迪獸幼年期是什麼種族？,,"그럼, 퀴즈. 알카디몬 유년기의
종족은 뭘까?","Hör zu! Zu welchem Typ gehört
Ausbildungs-Arkadimon?"
8010,,"Ascoltate. Groundramon ha delle braccia
giganti sulla schiena, ma a che livello è?","那我來出問答題囉。　背上有著巨大手臂的地龍型數碼寶貝
地龍獸的世代是什麼？",,"그럼, 퀴즈. 등에 커다란 팔을 가진 
지룡형 디지몬, 그라운드라몬의 세대는 뭘까?","Hör zu! Groundramon hat Riesenarme.
Welcher Stufe gehört es an?"
8011,,"Ascolta. Quale oggetto serve per
far digievolvere KendoGarurumon?","那我來出問答題囉。　要進化成銀狼獸，
不可或缺的道具是什麼？",,"그럼, 퀴즈. 가름몬이 진화하는데
필요한 아이템은 뭘까?","Hör zu! Was ist nötig, damit
KendoGarurumon digitiert?"
8012,,"Ascoltate. Quale dei Sistermon è un
campione, il Blanc o il Noir?","那我來出問答題囉。　修女獸姊妹的雪白與漆黑，
誰的世代是成熟期呢？","Listen up. Which of the Sistermon is a
Champion, Blanc or Ciel?","퀴즈. 시스터몬 자매인 블랑과 느와르 중
세대가 성숙기인 것은 어느 쪽일까?","Hör zu! Welches Sistermon ist ein
Champion, Blanc oder Ciel?"
8013,,"Ascolta. Come si chiama l'uccello
dorato di Valkyrimon?","那我來出問答題囉。　女戰神獸所帶的黃金鳥，
他的名字是什麼？",,"그럼, 퀴즈. 발키리몬이 데리고 다니는
황금의 새 이름은 뭘까?","Hör zu! Wie heißt der goldene Vogel
von Valkyrimon?"
8014,,"Ascoltate. Quale mossa sfrutta al meglio la
grande potenza di salto di Turuiemon?","那我來出問答題囉。　活用兔爺獸優異的跳躍力，
使出高速敏捷的拳法，名稱是什麼？",,"그럼, 퀴즈. 토리에몬의 높은 도약력을
살린 재빠른 닌자 권법의 이름은 뭘까?","Hör zu! Bei welchem Move nutzt man
Turuiemons Sprungkraft?"
8015,,"Ascoltate. Quando Sistermon Noir si risveglia,
dove appare il Sacro Stigma?","那我來出問答題囉。　修女獸漆黑覺醒後會出現的
神聖烙印，在身體的哪邊呢？","Listen up. When Sistermon Ciel awakens,
where does the mark appear?","그럼, 퀴즈. 시스터몬 느와르가 각성하면
나타나는 홀리 스티그마. 몸 어디에 나올까?","Hör zu! Wenn Sistermon Ciel erwacht,
wo erscheint das Mal?"
8016,,"Ascoltate. Quale Digimon usa la
mossa speciale Iper Cannone Infinito?","那我來出問答題囉。　必殺技是超弩級能源波
「高能無限加農砲」的數碼寶貝是什麼？",,"그럼, 퀴즈. 초대형 에너지파
「하이퍼 빔 캐논」이 필살기인 디지몬은?","Hör zu! Welches Digimon benutzt den
Spezialmove „Hyp-Unendlichkeitskanone“?"
8017,,"Ascoltate. Quale Digimon NON ha
le ali?","那我來出問答題囉。　黃金鼻涕獸、白金鼻涕獸、
黑帝鼻涕獸之中，沒有翅膀的是誰？",,"퀴즈. 골드워매몬, 플래티넘워매몬,
블랙킹워매몬 중에서 날개가 없는 것은?","Hör zu! Welches Digimon hat KEINE
Flügel?"
8018,,"Ascoltate. Riserve incluse, quanti
Digimon potete avere in un gruppo?","那我來出問答題囉。　包含後備隊員，
隊伍中最多可以帶幾隻數碼寶貝？",,"그럼, 퀴즈. 보류 멤버도 포함해서
디지몬은 최대 몇 마리까지 데리고 갈 수 있을까?","Hör zu! Wie viele Digimon kann eine
Gruppe haben, inklusive Reserve?"
8019,,"Ascoltate. Dov'è il vecchio che
compra le medaglie Digimon?","那我來出問答題囉。　會購買數碼寶貝獎牌的
獎牌大叔，他在哪個地方呢？",,"그럼, 퀴즈. 디지몬 메달을 사들여주는
메달 아저씨가 있는 곳은 어디에 있을까?","Hör zu! Wo ist der alte Mann, der
Digimon-Medaillen kauft?"
8020,,"Ascoltate. Quale caratteristica aumenta di più se il
leader ha una personalità vivace?","那我來出問答題囉。　個性「活力型」的數碼寶貝
當作隊長，在特訓時容易提昇哪種能力呢？",,"그럼, 퀴즈. 개성이「활력형」인 디지몬을
리더로 해서 특훈했을 때 오르기 쉬운 능력은?","Hör zu! Welcher Wert steigt, wenn der
Anführer lebhaft ist?"
8021,,"Ascoltate. Chi ha scritto la
commedia ""Romeo e Giulietta""?","那我來出問答題囉。　戲劇「羅密歐與茱麗葉」
作者是誰呢？",,"그럼, 퀴즈. 희곡「로미오와 줄리엣」의
작가는 누구일까?","Hör zu! Wer hat das Theaterstück
„Romeo und Julia“ geschrieben?"
8022,,"Ascoltate. Quale Digimon è anche
conosciuto come il Monaco Depravato degli Abissi?","那我來出問答題囉。　有「海底的破戒僧」別名的
數碼寶貝是誰呢？",,"그럼, 퀴즈. 별명「해저의 파계승」이라고 불리는
디지몬은 뭘까?","Hör zu! Welches Digimon trägt den
Namen „Verderbter Priester der Tiefe“?"
8023,,"Ascoltate. La spada Zanjintou di
Titamon è scolpita dalle ossa di quale Digimon?","那我來出問答題囉。　泰坦獸所持的「斬神刀」
原料是來自哪個數碼寶貝呢？",,"그럼, 퀴즈. 타이타몬이 가진「참신도」의
재료에 사용된 디지몬은 뭘까?","Hör zu! Aus wessen Knochen
besteht Titamons Zanjintou-Schwert?"
8024,,"Ascoltate. Qual è il lago più grande del
mondo?",那我來出問答題囉。　世界最大的湖泊是什麼？,,"그럼, 퀴즈. 세계에서 가장 넓은 호수는 뭘까?","Hör zu! Wie heißt der größte See der
Welt?"
8025,,"Ascoltate. Quale pezzo degli scacchi
può muoversi in diagonale?","那我來出問答題囉。　西洋棋的棋子中，可以
不限格數斜著移動的棋子是什麼？",,"그럼, 퀴즈. 체스의 말로, 대각선 방향으로
몇 칸이라도 이동할 수 있는 말은 뭘까?","Hör zu! Welche Schachfigur kann sich
diagonal fortbewegen?"
8026,,Ascoltate. Dove si trova la Basilica di San Pietro?,"那我來出問答題囉。　8世紀時，聖武天皇
所建立的東大寺在哪裡？",,"그럼, 퀴즈. 8세기 쇼무 천황이 세운
도다이지가 있는 곳은 어디일까?",Hör zu! Wo steht der Petersdom?
8027,,"Ascoltate. Chi è stato il primo
presidente degli Stati Uniti?",那我來出問答題囉。　美國首任總統是誰？,,"그럼, 퀴즈. 미국의 초대 대통령은 누구일까?","Hör zu! Wer war der erste Präsident
der Vereinigten Staaten?"
