ID,Speaker,Japanese,English,Chinese,EnglishCensored,Korean,German
1,7233,"","Huh? Who are you?","嗯？　你是誰？","","음? 자네는 누구지?","Was? Wer bist du?"
2,7233,"","I'm Datamon, but people usually call me
Dr. Datamon.","我是分子獸。
大家都喜歡稱我為分子獸博士。","","나는 데이터몬.
모두들 친근함을 담아 데이터몬 박사라고 부르지","Ich bin Datamon.
Die meisten nennen mich Dr. Datamon."
3,7233,"","I'm busy collecting medicinal ingredients right
now. If you want to ask me something, please make
it quick.","如你所見，我現在正忙著收集藥的材料。
有事的話請簡短說明。","","나는 지금, 자네도 아는 대로 약재료를 모으느라 바쁘다네.
용건이라면 간단하게 말해줘","Ich bin damit beschäftigt, Zutaten für Medizin
zu sammeln. Wenn du mich etwas fragen willst,
mach es bitte schnell."
4,7233,"","What? Another Digimon has contracted the disease?","……什麼！
還有受到那個流行病所苦的患者嗎！？","","…세상에나!
그 유행병으로 고통스러워하는 환자가 아직 있었는가!?","Was? Ein weiteres Digimon hat sich angesteckt?"
5,7233,"","Then I'll administer the new medicine I developed.
Although unfortunate, this is a good opportunity.","原來如此，那就給他吃我的新藥吧。
……呵呵，真是來了一個求之不得的機會。","","그렇군. 그렇다면 내 신약을 투여해주도록 하지.
……후후, 이거 뜻밖의 기회가 들어온 것 같군","Dann werde ich die neue von mir entwickelte
Medizin anwenden. Es ist zwar bedauernswert,
aber eine gute Gelegenheit."
6,7233,"","The other day I successfully increased the
strength of this medicine.","其實前幾天，成功開發了把流行病藥
藥效增強的新藥。","","사실은 일전에 유행병의 약을 파워업 시킨
신약 개발에 성공했다네","Vor ein paar Tagen ist es mir gelungen, die
Medizin zu verstärken."
7,7233,"","But I didn't have any subjects to test it on. This
is a chance to test its efficacy.","正煩惱著找不到可以實驗的對象。
這是測試新藥效果的大好機會。","","피험자를 찾지 못해 곤란했었는데
신약 효과를 시험해 볼 좋은 기회다","Aber ich hatte keine Testobjekte.
Jetzt kann ich ihre Wirkung testen."
8,7233,"","I'll administer it in person. No payment
necessary.","就由我親自把新藥拿給那位痛苦的患者吧。
不需要付我錢。","","괴로워하고 있는 그 환자에게
내가 직접 신약을 투여해주지. 대가는 필요 없어","Ich werde sie persönlich verabreichen. Keine
Bezahlung nötig."
9,7233,"","Take me to the patient!","好了，快前往患者的所在處吧！！","","자, 환자가 있는 곳으로 서둘러 가자!","Bring mich zu dem Patienten!"
