ID,Speaker,Japanese,English,Chinese,EnglishCensored,Korean,German
1,3013,"","Now, Mastemon, show me this power.","來吧，「混沌神魔獸」，讓我見識你的力量。","","자「마스테몬」, 네 힘을 보여 주렴","Nun, Mastemon, zeig mir diese Macht."
2,3013,"","I opened an entrance to a parallel world with
Mastemon's power. You can use it to leap across
the dimensions.","混沌神魔獸的力量開啟了通往平行世界的入口……
通過這裡，就能跳躍到別的次元時空。","","마스테몬의 힘으로, 평행 세계로 가는 입구가 열렸어…
여길 통과하면, 다른 차원시공으로 갈 수 있어","Ich habe mit Mastemons Macht ein Portal in eine
Parallelwelt geschaffen. Damit kannst du die
Dimensionen durchqueren."
3,3013,"","You should find what you seek there.","在那裡應該能找到你在尋找的東西。","","네가 찾는 건, 그곳에서 찾을 수 있겠지","Dort solltest du finden, wonach du suchst."
