ID,Speaker,Japanese,English,Chinese,EnglishCensored,Korean,German
100,4324,"","Whenever I get too tired at TRF on the fourth
floor, I come by here.","我在4樓的TRF玩累時，
總是會繞來這裡。","","4F의 TRF에서 놀다가 지치면
항상 이곳에 들르게 된다니깐","Immer, wenn ich bei TRF im vierten Stock müde
werde, komme ich hierher."
150,4324,"","The skies opened up, stuff started falling... I
thought it was rubble but it was actually alive--
giant monsters--enough! This is too unbelievable!","當天空開了一個大洞後，還以為是掉下像瓦礫一樣的東西，
沒想到是生物，而且裡面還有非常巨大的怪物，
然後……啊，總之，真的是難以置信啊！","","하늘에 구멍이 뚫리더니, 건물 잔해 같은 게 떨어지나 싶더니
생물이었고, 그 중에서도 커다란 괴물이 떨어져 오더니
그래서… 아―, 어쨌든 정말 못 믿겠어!","Der Himmel öffnete sich und Sachen regneten
herunter. Ich hielt es für Schutt, aber es war
lebendig – riesige Monster! Einfach unglaublich!"
200,4325,"","Today I'm going to challenge the triple scoop!
Strawberry, chocolate, and...hmm, what else?","今天來挑戰三種口味的冰淇淋好了。
草莓、巧克力跟……還有一種口味要選哪個好呢～！","","오늘은 3단 아이스크림에 도전해 볼까
스트로베리랑 초콜릿이랑… 나머지 하나, 뭐로 하지―!","Heute werde ich mich an drei Kugeln wagen!
Erdbeere, Schokolade und ... hm, was noch?"
250,4325,"","Did you see that hacker [c4241],
who was put on the national wanted list? He's
kinda hot...","電視新聞說警方正在通緝叫做
[c4241]的駭客呢……欸，他長得挺帥的耶！？","","[c4241]라고 하는 해커가 지명수배가 됐다고
텔레비전에서 그랬는데… 저기, 그 사람 꽤 멋지지 않았어!?","Hast du [c4241], den Hacker, gesehen?
Er wird jetzt landesweit gesucht.
Er ist irgendwie süß ..."
300,4757,"","Welcome to the best takoyaki in the universe!
You're not a true Nakanoan until you try it!","噢，歡迎光臨！本店的章魚燒是全宇宙最好吃的哦！
不來一份就不算是中野人啦！","","오, 어서 오십쇼! 우주 제일로 맛있는 타코야끼다!
안 먹으면 나카노의 사람이라고 말할 수 없지!","Wir bieten die besten Takoyaki überhaupt!
Wenn man sie nicht gekostet hat, ist man kein
echter Nakanoaner!"
350,4757,"","Welcome to the best takoyaki in the universe!
You're not a true Nakanoan until you try it!","噢，歡迎光臨！本店的章魚燒是全宇宙最好吃的哦！
不來一份就不算是中野人啦！","","오, 어서 오십쇼! 우주 제일로 맛있는 타코야끼다!
안 먹으면 나카노의 사람이라고 말할 수 없지!","Wir bieten die besten Takoyaki überhaupt!
Wenn man sie nicht gekostet hat, ist man kein
echter Nakanoaner!"
351,4757,"","...You're not a customer, you're new at the
detective agency? Well, that's a true Nakanoan!","……什麼，你不是客人？是偵探事務所的新人？
也就是說，你是道道地地的中野人！？","","…뭐, 손님이 아니야? 탐정사무소의 신인이라고?
그렇다면, 진짜 나카노의 사람이란 거잖아!?","Du bist kein Kunde. Bist du neu im
Detektivbüro? Dann bist du ein echter Nakanoaner!"
352,4757,"","Well, that's just great. Need to get more young
folk in here to breathe life into Nakano!","這真是令人開心呢！
只要年輕人越來越多，中野也會越來越有活力啊！","","이거 기쁘구만!
젊은이가 늘어나면, 나카노도 더욱 활기를 띠게 되는 법이지!","Na, das ist toll. Wir brauchen hier mehr junge
Leute, die etwas frischen Wind nach Nakano
bringen!"
353,4757,"","At your service any time! Wahaha!","今後還請你多多指教啦！？哈哈哈！！","","오래도록, 잘 부탁한다!? 아하핫!!","Ich stehe jederzeit zu Diensten! Wahaha!"
