ID,Speaker,Japanese,English,Chinese,EnglishCensored,Korean,German
1,3007,"","Hey there. Huh? What's this leaflet?","唷，是你啊。
……嗯？　這是什麼傳單？","","여어, 너냐.
…음? 이 전단지는 뭐냐?","Hallo. Was? Was soll der Zettel?"
2,3007,"","You're not in this church, are you?","……我說你，
該不會是這個教團的信徒吧？","","…너
설마 이 교단 신자냐?","Du gehörst nicht zu der Kirche, oder?"
3,3007,"","You don't have to hide it. Freedom of religion is
guaranteed in this country. You can believe
whatever you want.","不，你不用隱瞞也沒關係。
這個國家保障信仰的自由，
要信什麼是你的自由。","","아니, 숨기지 않아도 돼.
이 나라는 신앙의 자유를 보장하고 있어.
네가 뭘 믿든 자유지","Du musst es nicht verstecken. In diesem Land
gilt Religionsfreiheit. Du kannst glauben,
was du willst."
4,3007,"","But there's something fishy about this church...","只是這個教團，
有一些可疑的謠言……","","단, 이 교단에는
심상치 않은 이야기가 있어서 말이지…","Aber irgendwas stimmt mit dieser Kirche nicht."
5,3007,"","Our hotline gets a lot of people reporting that
they've been swindled.","本廳的諮詢熱線，
頻繁地收到了被教團騙的相關諮詢。","","본청의 상담 핫라인에도
교단에 속았다는 상담이
자주 들어와","Bei unserer Hotline rufen ständig Leute an, die
sagen, dass sie betrogen worden sind."
6,3007,"","I'm afraid I can't say any more than that.","什麼，要我講更詳細點？
抱歉，我做不到。","","뭐야, 자세히 들려달라고?
미안하지만 그건 못 해","Du willst mehr wissen? Leider darf ich nicht mehr
sagen."
7,3007,"","There's a pesky little thing called the Personal
Information Protection Law. Sorry, but you'll have
to ask someone else.","有一條麻煩的法律，
叫個人資訊保護法。
抱歉，你去問別人吧。","","개인정보보호법이라는
귀찮은 법률이 있어서 말야.
미안하지만 다른 데를 알아봐 줘","Es gibt da dieses nervige Gesetz zum Schutz
persönlicher Informationen. Da musst du leider
jemand anderen fragen."
8,2020,"","(There's something suspicious going on. I'll ask
the woman who used to be in the church for more
details.)","（總覺得很可疑……
　再去向那個隸屬於教團的女性
　請教更詳細一點的事情吧）","","(뭔가 심상치 않다……
 교단에 있었다는 아까 그 여성에게
 한 번 더 자세하게 이야기를 들어보자)","(Irgendwas ist hier komisch. Ich bitte die Frau,
die mal in der Kirche war, um genauere
Informationen.)"
