ID,Speaker,Japanese,English,Chinese,EnglishCensored,Korean,German
1,7278,"","Hmm... She loves me, she loves me not, she loves
me, she loves me not... Hmph!","唉……
喜歡，討厭，喜歡，討厭……嗚啊！！","","하아……
좋아한다, 싫어한다, 좋아한다, 싫어한다……하으아!!","Hm ... Sie liebt mich, sie liebt mich nicht, sie
liebt mich, sie liebt mich nicht ... Hmpf!"
2,1055,"","...","…………","","…………","..."
3,4916,"","Hey? Aren't you Chitose's protégé?!","嗯？　我記得你是千歲那邊的後輩！","","응? 너는 분명 치토세 씨의 후배인!","He! Bist du nicht Chitoses Schützling?!"
4,4916,"","You look like a nice guy. You don't mind if I tell
you about my problem, do you?","你那張臉，該不會是願意聽聽看我的煩惱！？　
可以嗎！？","","그 얼굴은 혹시 고민하는 내 이야기를
들어주려는 겁니까!? 괜찮슴까!?","Du machst einen freundlichen Eindruck. Macht’s
dir was aus, wenn ich dir von meinem Problem
erzähle?!"
5,4916,"","It's a long story! And if I tell you, you have to
promise you'll help!","會很長喔！？
而且，一旦聽了之後就要你幫我囉！？！？","","길어질 검다!?
게다가 듣고 나면 협력을 받을 검다!?!?","Es ist eine lange Geschichte! Und wenn ich sie dir
erzählen soll, musst du versprechen, mir zu
helfen!"
6,4916,"","Then I should submit a case to Hudie? I guess
cyber sleuths need to do things by the book.
I understand.","如果很長的話，希望可以向hudie提出委託？
啊啊，很像電腦偵探的那種嘛！　我知道了！","","길어진다면 후디에로 의뢰를 넣어달라고요?
아아, 전뇌탐정 같은 그거군요! 알겠슴다!","Ich soll also einen Fall an Hudie schicken? Ich
schätze, Cyber-Detektive müssen sich an Regeln
halten. Das verstehe ich."
7,4916,"","Oh, I forgot to introduce myself. I'm Yasu, from
the Rebels! I'll submit the case right away!","啊，雖然現在才自我介紹有點晚了。
我是反叛者的阿康！
那麼，我會提出委託的，請多指教喲～！","","아, 자기소개가 늦어졌는데 전 리벨리온즈의 야슴다!
그럼 의뢰를 내둘 테니 잘 부탁함다~!","Oh, ich habe vergessen, mich vorzustellen. Ich bin
Yasu von den Rebels. Ich werde den Fall gleich
einsenden!"
