ID,Speaker,Japanese,English,Chinese,EnglishCensored,Korean,German
1,3004,"","It never ceases to amaze me, the sight of the 
Digital World, where the real and the electronic 
intersect.","不管什麼時候看都很精彩呢！
介於真實世界和數碼世界之間的電腦世界。","","언제 봐도 느낌이 좋은걸
리얼과 디지털이 교차한 전뇌세계라는 건","Der Anblick der Digitalen Welt fasziniert mich immer
wieder. Wo das Echte und das Elektronische sich
überschneiden."
2,3004,"","This place looks like it always did before, like
a dive without an exit.","照這樣看來，這裡似乎也跟之前一樣，
是不會有出口的類型。","","보아하니, 여기도 저번처럼
출구가 없는 타입인 모양이야","Hier sieht es so aus wie immer.
Eine Gasse ohne Ausgang."
3,3004,"","So all we have to do is take out that Bakemon and
change everything back to normal.","所以只有打倒那個怪物，
才能解決事情了！","","그 괴물을 쓰러뜨리고
원래대로 되돌릴 수밖에 없다는 거군","Wir müssen also den Verschlinger erledigen
und den Normalzustand wiederherstellen."
