ID,Speaker,Japanese,English,Chinese,EnglishCensored,Korean,German
518,3014,,"Chiudiamo il becco e combattiamo, okay!?
Pronti!? 3...2...1...VIA!","不要囉哩叭嗦的，對戰對戰對戰！
我要上囉——！！",,"이러쿵저러쿵 말하지 말고 배틀 배틀 배틀!
간다아―――!!","Hören wir auf zu reden und kämpfen wir jetzt,
okay?! Bist du bereit?!
3 ... 2 ... 1 ... LOS!"
519,2001,,...,……,,………,...
601,3014,,"Cavolo, sei forte... Wow.",好、好強……,,"가, 강해에…","Mann, du bist stark ... Wow."
602,3014,,"È stato un combattimento davvero grandioso.
Io... non ho più niente da trasmetterti, mio... studente.
Ora sei tu... il maestro. Vai, lasciami... *coff coff*","真是場好比賽呢……
你就……跨過我的屍體……向前進吧……唔。",,"좋은 승부였군…
내… 시체를 넘어서… 가라… 꼴까닥","Das war ein echt toller Kampf. Ich kann dich
nichts mehr lehren ... Du bist jetzt der Meister.
Lass mich jetzt allein ... *Hust, hust*"
603,2001,,...,……,,………,...
604,3014,,"Vuoi ancora sapere perché ti ho sfidato oggi?",……咦？　為什麼要找你一決勝負？,,…뭐? 어째서 너한테 승부를 걸었냐고?,"Du willst immer noch wissen, warum ich dich
heute herausgefordert habe?"
605,3014,,"Haha, chi se ne frega?
Non pensarci troppo su.
È noioso dare una ragione per ogni cosa, non trovi?","嗯～我覺得這種事怎樣都無所謂啦。
一直在意理由、原因的話，就不好玩了呀——",,"으음~, 아무래도 좋다고 생각하는데―, 그거
이치에 맞는 이유만 있으면 재미없잖아―","Haha, wen interessiert das? Zerbrich dir nicht den
Kopf darüber. Es ist langweilig, für alles die
Gründe zu wissen, oder?"
606,3014,,"Volevo solo mettere alla prova la mia forza contro di te
e vedere chi è più forte. Tutto qui!",我只是，只是想跟你比比看而已！,,나는 단지 너랑 힘겨루기를 하고 싶었을 뿐이야!,"Ich wollte nur meine Stärke gegen dich austesten,
um zu sehen, wer stärker ist. Das war alles!"
607,3014,,"Ecco a cosa servono i combattimenti e a cosa
serve anche diventare più forti!
Paragonarsi agli altri e vedere chi è veramente il migliore!",這就是戰鬥者追求強大的本能，對吧！,,"그게 파이터의,
강함을 갈구하는 자의 본능, 이잖아!","Darum geht es bei Kämpfen und beim Stärkerwerden!
Sich mit anderen zu messen und herauszufinden,
wer wirklich stärker ist!"
608,3014,,"Ufff, sei davvero un osso duro, [p].
Vedere questo di persona è tutta la ricompensa di cui ho bisogno!","唉呀～，真強！　你真的很強！
光是見識到這點也算是大收穫了！",,"이야―, 강했네! 너는 정말 강했어!
그걸 알게 된 것만으로도 큰 수확이야!","Puuuh, du bist eine harte Socke, [p].
Für mich ist es eine Belohnung,
das mit eigenen Augen zu sehen!"
609,3014,,"Bene, è tutto il tempo che ho per oggi! Me ne vado ora! Ci
vediamo dopo!",那就再見啦～～！,,그럼― 안녕―――!,"Das war’s für heute! Ich muss jetzt gehen!
Bis dann!"
610,2001,,...,……,,………,...
611,3014,,"Vedo quello sguardo sulla tua faccia.
Ti stai chiedendo qual è il punto di tutto questo.
Ce n'è uno, ma non te lo dico! Mwahahaha!","你剛剛在想「這是在搞什麼」對吧？
我可是知道的哦！",,"지금「뭐였던 걸까」라고 생각했지!
난 알 수 있다구!","Ich kenne diesen Blick. Du fragst dich, was das
alles soll. Es gibt eine Erklärung, aber ich
verrate sie dir nicht! Muhahahaha!"
701,3006,,"Ah, quindi voleva una battaglia con te per vedere chi di
voi è più forte.",嗯～只是想比比看而已嗎？,,"흐음, 단지 힘겨루기를 하고 싶었을 뿐, 이라","Ach, sie wollte also mit dir kämpfen, um zu sehen,
wer stärker ist."
702,3006,,"Hmm... Sai, in fondo, scommetto che è preoccupata di come sta andando
il nostro mondo in questi giorni e stava cercando un suo modo
per esprimerlo.",……說不定，她是用她的方式在擔心這邊的世界呢。,,"…어쩌면 그녀는 그녀 나름대로
이쪽 세계를 걱정해 준 것일지도 모르겠군","Hm ... Weißt du, ich glaube, sie macht sich
Sorgen um unsere eigene Welt und wollte
das auf ihre Art ausdrücken."
703,3006,,"Forse voleva metterti alla prova per vedere se eri all'altezza
del compito di aiutare a tenere questo posto in un unico pezzo.","所以，想測試看看你的力量夠不夠強大。
應該是這麼一回事吧……",,"그래서 네 힘이 충분한지 시험해보고 싶었다
라는 거겠지…","Vielleicht wollte sie dich auf die Probe stellen,
um zu sehen, ob du helfen kannst,
dass hier alles im Lot bleibt."
704,3006,,"Heh, potrei essere un po' di parte, data la compagnia presente,
ma voi ragazzi siete davvero diventati qualcosa di speciale.",嗯……自己都覺得下了個很漂亮的結論呢。,,흐음… 내가 생각해도 깨끗하게 정리해 버렸군,"Ha, vielleicht bin ich wegen Anwesenden
voreingenommen, aber ihr Kids habt euch ganz
schön gemacht."
705,3006,,"Detto questo, sono d'accordo con il suo pensiero sul cercare una
ragione per ogni cosa. Non sono neanche io troppo incline a soffermarmi
su queste cose.","不過我贊成她的說法。
我也不喜歡做什麼都需要理由的人。",,"그녀의 말에는 찬성이다
나도 모든 것에서 이유를 찾으려는 녀석들은 좋아하지 않아","Allerdings stimme ich ihr zu, was die ständige
Suche nach Gründen angeht. Auch ich denke
nicht zu lange über so etwas nach."
706,3006,,"Il mondo è troppo pieno di cose che nonn possono essere risolte con la
pura ragione per valutarlo troppo nel mio libro, heehee.","畢竟這個世界上，
無法用理論解釋的事多的是啊。",,"이 세상은 이치에 맞게 정리할 수 없는 것들이
넘쳐나니까 말이다","Ich finde, dass es in der Welt zu viele Dinge
gibt, die man mit dem Verstand allein nicht lösen
kann. Also gib nicht zu viel darauf, haha."
