ID,Speaker,Japanese,English,Chinese,EnglishCensored,Korean,German
100,3014,,"[p]! Dove sei e cosa stai combinando adesso!?","[p]～！
你到底在哪裡幹什麼啊————！",,"[p]―! 넌 대체
어디서 뭘 하는 거야―――――――――!","[p]! Wo bist du und was machst
du gerade?!"
101,3014,,"Io, fremo dalla voglia di fare a botte da morire qui!
Sento che devo farne una o impazzirò! Sul serio!","我現在非～常想戰鬥！
熱血沸騰，正渴望著上戰場啊！",,"난 지금 맹렬하게 싸우고 싶어!
뜨거운 혈액이 전장을 원하고 있다고!","Ich will gerade mit Kämpfen loslegen!
Ich muss unbedingt kämpfen, sonst
werde ich verrückt! Ganz im Ernst!"
102,3014,,"Vorrei fare una scaramucc-- no, non è quello.
Più come una rissa--aaaaaugh, il mio cervello sta andando
troppo veloce perché la mia bocca riesca a stargli dietro!","合咻！　交咻……不對！
合手……也不對！算了！",,"슝뷰! 슝부, 가 아니지!
숭브…도 아니야! 뭐, 됐어!","Ich will einen Partner – nein, das ist es nicht.
Vielleicht eine Runde – argh, mein Gehirn ist
zu schnell! Mein Mund kommt nicht hinterher!"
103,3014,,"Voglio che il tuo Digimon si scontri con il mio Veevee!
Oh, ehi, è questo!
Sì, è quello che voglio! Un incontro! Tra te e me!","請你跟我的VV交手……啊，說對了！
那就，正大、正大光明地一決勝負吧！",,"내 브이브이랑 승부를 가려보자…아, 말했다!
그런 이유로 정정당당히, 정정당당하게 승부하자!","Ich will, dass dein Digimon gegen mein Veevee
kämpft. Oh, ja! Genau das will ich!
Ein Kampf, du gegen mich!"
104,3014,,"Ma non possiamo farlo in un posto qualunque...
Deve essere un posto speciale.
Sai, per creare l'atmosfera giusta per l'occasione!",啊，但是我不想在很普通的地方……畢竟氣氛也很重要嘛。,,"아, 하지만 평범한 곳은 싫네― …분위기도 중요하니까 말이야","Aber nicht einfach irgendwo ... Es muss ein
besonderer Ort sein. Damit auch gleich die
richtige Stimmung aufkommt!"
105,3014,,"Ce l'ho! Facciamolo in quel nostro ""posto memorabile""!
Sai quale intendo!","對了！就在我們的「回憶之地」決鬥吧！
沒錯，就這麼辦！",,"그렇지! 우리의「추억의 장소」에서 결투하자!
그래, 그렇게 하자!","Ich hab’s! Unser „denkwürdiger Ort“ ist perfekt
dafür! Du weißt schon, welchen ich meine!"
106,3014,,"Sì, sarà perfetto! Vado avanti io!
Faresti meglio a non farmi aspettare troppo,
perché questo è super importante, sai!","嗯～！那就在我們的……回憶之・地★
等你囉……",,"응응! 우리들의… 추억의 장 소♥에서
기다릴 테니까………","Ja, der ist perfekt! Ich gehe schon mal vor!
Aber lass mich nicht lange warten. Das ist
nämlich superwichtig, weißt du!"
107,3014,,"L'ho già archiviato come caso presso la tua agenzia,
quindi ora non puoi dire di no!","我剛才去提出委託了！
這樣你就沒辦法拒絕我了吧！？",,"아까 의뢰해 뒀으니까 말이다!
이제 거절할 수 없겠지!?","Ich habe es schon als Fall in deinem Büro
angemeldet. Du kannst also nicht Nein sagen!"
108,3014,,"Ci vediamo presto, okay?
Okay!? Già!? Wahahahaha--*coff coff*","要來哦！　你絕～對要來哦！？
再會了！　噢呵呵呵呵呵————咳咳！",,"와라! 무~~~조건 오는 거다!?
그럼 이만! 오홋오홋오호호호호――― 콜록콜록!","Bis bald, ja? Ja?! JA?!
Uahahahaha– *Hust* *Hust*"
201,3006,,"Ooooh, un caso con quella ragazza dal Mondo Parallelo.
Se questo non è un segno che hai fatto molta strada come detective,
non so cosa lo sia.","嗯……你竟然收到來自平行世界的人的委託……
看來你身為電腦偵探的名號，似乎也逐漸傳開了呢。",,"흐음… 패럴렐 월드의 주민에게서 의뢰가 올 줄이야…
너도 전뇌탐정으로 널리 알려진 것 같군","Oooh, ein Fall mit dem Mädchen aus der
Parallelwelt. Wenn das mal nicht ein Zeichen ist,
dass du es als Detektiv geschafft hast."
202,3006,,"Quindi, di cosa avete parlato voi due? Cosa
vuole da te?",然後呢？　你和委託人談了什麼？,,그래서? 의뢰인과는 어떤 이야기를 한 거지?,"Worüber habt ihr zwei denn geredet? Was will sie
von dir?"
203,3006,,"...Huh, vuole che tu torni in un ""luogo memorabile"" che voi due
condividete? Non so proprio a cosa si stia riferendo io stesso, ma...","喔……，「回憶之地★」啊。
雖然我不是很清楚……",,"…호오,「추억의 장소♥」라
나는 의미를 잘 모르겠지만…","... Sie will, dass du zu einem „denkwürdigen Ort“
gehst, den ihr beide kennt? Keine Ahnung, was
sie meint, aber ..."
204,3006,,"Per lo meno, quando si tratta di cose come il Mondo Parallelo,
nessuno è più esperto della nostra unica e sola Mirei.","關於平行世界之類的事，
御神樂米蕾是最清楚的吧。",,"패럴렐 월드 같은 것들을 물어보기엔
미카구라 미레이가 제일이겠지","Wenn es um Sachen wie die Parallelwelt geht,
ist die gute Mirei unschlagbar."
205,3006,,"Vai a trovarla e vedi se ha qualche consiglio per te su come
affrontare al meglio questa situazione.",你去她那裡一趟，和她談談看吧。,,그녀에게 가서 상담해보도록,"Statte ihr einen Besuch ab. Vielleicht hat sie
Tipps, wie du am besten an die Sache rangehst."
221,3006,,"Un ""luogo memorabile,"" eh? Hmm... Scommetto che se parlassi con Mirei,
potresti ottenere degli indizi su cosa dovresti fare.","「回憶之地★」……
御神樂米蕾應該能給一點提示吧？",,"「추억의 장소♥」…
미카구라 미레이라면 무언가 힌트를 줄 지도 모른다","Ein „denkwürdiger Ort“, was? Hm ... Wenn du mit
Mirei redest, könnte sie dir sicher Hinweise
geben, was du tun solltest."
301,3013,,"State lavorando a un caso per Rina? Oh, voi due detective
avete davvero ampliato il vostro raggio d'azione, direi.","來自四之宮莉娜的委託？
……你的偵探事務所業務範圍還真廣呢。",,"시노미야 리나에게서 의뢰?
…네 탐정사무소는 꽤 광범위하게 일하고 있구나","Du arbeitest an einem Fall für Rina? Na, ihr
zwei Detektive kennt mittlerweile einige Leute."
302,3013,,"Immagino che tu sia qui perché hai bisogno di chiedermi qualcosa, allora?","所以呢？　你到我這裡來，
是想要我告訴你一些事情對吧？",,"그래서? 나한테 왔다는 건
뭔가 알려줬으면 하는 게 있어서지?","Du bist wahrscheinlich hier, um mich um Rat zu
fragen, nicht wahr?"
303,3013,,"Hmm? Stai cercando di capire dove si trovi
questo suo ""posto memorabile""?",……咦？　你想知道「回憶之地★」？,,…뭐?「추억의 장소♥」를 알고 싶다고?,"Hm? Du versuchst herauszufinden, wo sich
dieser „denkwürdige Ort“ von Rina befindet?"
304,3013,,"Beh, se è un posto che connette entrambi,
sicuramente dovresti sapere dove andare, no?","如果那是你和莉娜的回憶之地，
你不是應該知道嗎？",,"…만약 그게 너와 리나의 추억의 장소라면
네가 알고 있어야 한다고 생각하는데","Also, wenn dieser Ort euch beide verbindet,
solltest du doch wissen, wo du hinmusst, oder?"
305,2001,,...,……,,………,...
306,3013,,"Sei proprio sicuro di non ricordare nulla?
Non ti suona niente?",……我姑且問問，你真的沒有半點頭緒？,,"…일단 물어는 보겠는데, 짐작가는 곳은 없어?","Bist du dir sicher, dass dir nichts einfällt?
Überhaupt keine Idee?"
307,3013,,"Beh, ora che ci penso, c'è Shibuya.
Forse Nakano?
Potrebbe essere Shinjuku...","說到回憶之地，就是涉谷。
說到回憶之地，就是中野。
說到回憶之地，就是新宿。",,"추억의 장소라고 하면 시부야다
추억의 장소라고 하면 나카노다
추억의 장소라고 하면 신주쿠다","Jetzt, wo ich überlege ... Vielleicht Shibuya.
Vielleicht Nakano?
Es könnte in Shinjuku sein ..."
308,3013,,Che tipo di ricordi avete voi due di quel posto?,你們曾有過什麼樣的回憶？,,어떤 추억이 있는데?,Was habt ihr beiden denn dort erlebt?
309,3013,,...,……,,………,...
310,3013,,Niente del tutto? Allora dovresti pensarci meglio.,"……沒有……嗎？
你好好想想。",,"…없는… 거야?
잘 떠올려 봐",Gar nichts? Dann solltest du weiter überlegen.
311,3013,,Che tipo di ricordi avete voi due di quel posto?,你們曾有過什麼樣的回憶？,,어떤 추억이 있는데?,Was habt ihr beiden denn dort erlebt?
312,3013,,...,……,,………,...
313,3013,,"Non particolarmente? Allora riproviamo.
Pensa a un altro posto adesso...","……沒有什麼特別的回憶……嗎？
你好好回想看看。",,"…딱히 없는… 거지?
잘 떠올려 봐","Nichts Besonderes? Dann versuch es noch mal.
Denk jetzt an einen anderen Ort ..."
314,3013,,Che tipo di ricordi avete voi due di lì?,你們曾有過什麼樣的回憶？,,어떤 추억이 있는데?,Was habt ihr beiden denn dort erlebt?
315,3013,,"Esatto...
Shinjuku è dove voi due vi siete incontrati per la prima volta.","……沒錯。
你們第一次相遇是在新宿。",,"…그래
…신주쿠에서 처음 만났구나","Richtig ... In Shinjuku habt ihr zwei euch
das erste Mal getroffen."
316,3013,,"Era Shinjuku nel Mondo Parallelo,
ma era comunque Shinjuku.","的確是這樣呢。
你們確實是在平行世界的新宿相遇的……",,"그랬지
분명 너희들은 패럴렐 월드의 신주쿠에서 만났어","Es war Shinjuku in der Parallelwelt, aber es war
nichtsdestotrotz Shinjuku."
317,3013,,"Ma non può essere tornata nel Mondo Parallelo.
Servirebbe il potere della mia Mastemon per facilitare un
viaggio del genere.","但是，她沒有回去平行世界哦。
沒有我的混沌神魔獸的力量，她是無法回到那裡的。",,"하지만 그녀는 패럴렐 월드로 돌아가지 않았어
내 마스터몬의 힘이 없으면 그쪽 세계로는 갈 수 없는걸","Aber sie kann nicht in der Parallelwelt sein.
Für solch eine Reise bräuchte man die Macht
meines Mastemons."
318,3013,,"Allora, dove altro potrebbe essere?",有沒有可能是其他地方？,,어딘가 다른 장소인 게 아닐까?,Wo sonst kann sie sein?
319,2001,,"...??
......???","……？
……？？",,"…??
………???","...?
...??"
381,4002,,"Questo è il Shinjuku del Mondo Parallelo?
Di cosa stai blaterando? Stai bene?","這裡是平行世界的新宿？
你在說什麼啊？",,"여기가 패럴렐 월드의 신주쿠?
너 뭐라는 거야?","Ist das Shinjuku in der Parallelwelt? Wovon
redest du? Fühlst du dich nicht gut?"
382,4030,,"Un ""luogo memorabile""... Non saprei dirti qual è, ragazzino.
Questo genere di cose sono di solito abbastanza diverse per tutti.","回憶之地……
所謂的回憶之地可能是因人而異呢。",,"추억의 장소…
추억의 장소라는 건 사람마다 다를지도 모르겠네","Ein „denkwürdiger Ort“ ... Keine Ahnung, wo das
sein soll, Jungchen. Solche Orte sind meist sehr
persönlich."
391,2001,,"Immagino che Rina non sia qui, dopotutto...",莉娜不在這裡……,,리나는 없었다…,Rina ist wohl doch nicht hier ...
392,2001,,"Se è così, allora forse... potrebbe essere dove abbiamo combattuto
Kentaurosmon in EDEN?","如果不在這裡的話……
只剩下和八腳馬獸戰鬥的EDEN嗎？",,"여기에 없다면…
남은 건 슬레이프몬과 싸운 EDEN인 걸까?","Wenn das so ist, ist sie vielleicht ... dort, wo
wir in EDEN gegen Kentaurosmon gekämpft haben?"
393,2001,,Dovrei tornare indietro e parlare con Mirei.,總之，先回米蕾那裡吧。,,아무튼 미레이에게 돌아가자,Ich sollte noch mal mit Mirei reden.
401,3013,,"Quindi, non sei riuscito a capirlo.
Sapevo che sarebbe finito così, però.",果然……你似乎完全沒有想到呢。,,역시… 전혀 떠오르지 않나 보네,"Du konntest es dir also nicht zusammenreimen.
Ich wusste allerdings, dass das passiert."
402,2001,,?,？？,,??,?
403,3013,,"Ti sei dimenticato che sono una chiromante?
Ovviamente, lo so. È il mio lavoro.","我可是占卜師哦，
早就知道結果了。",,"나는 점쟁이야
결과는 알고 있었어","Hast du vergessen, dass ich eine Wahrsagerin bin?
Natürlich wusste ich es. Das ist mein Job."
404,2001,,!!!,！！,,!!,!!!
405,3013,,"Perché non te l'ho detto prima?
È... un'osservazione giusta, te lo concedo. Ma il futuro è in continuo
cambiamento, quindi sono rimasto in silenzio per sicurezza.","……知道的話就早點說？
你說的可能沒錯。
但是，未來是不斷地在改變的……所以之前我還不敢斷言。",,"…그럼 좀 더 일찍 말해주라고?
…네 말이 맞을지도 몰라
하지만 미래는 끊임없이 변화하는 것… 혹시나 싶어서 말이야","Warum ich es dir nicht gesagt habe? Das hätte ich
tun können, stimmt. Aber die Zukunft ändert sich
immer wieder, also habe ich lieber nichts gesagt."
406,3014,,"Ehi, [p]! Che diavolo stai combinando!?
Cos'è così importante da far aspettare una ragazza così a lungo!?","喂，我說！　你在做什麼啊～！？
你到底在做什麼啊————！？",,"저기, 잠깐! 뭐하는 겁니까아―!?
무슨 짓을 하고 있는 겁니까――――――!?","He, [p]! Was ist denn los?
Was ist denn so wichtig, dass du mich
so lange warten lässt?"
407,3014,,"Ti ho aspettato qui per tutto questo tempo.
Questo non significava che avevi il permesso di prendertela comoda!","我從剛才就一直在等你耶！
你都一直沒有來！",,"아까부터 계―속 기다리고 있었는데요!
왜 계속 안 오는데요!","Ich habe die ganze Zeit hier auf dich gewartet.
Das hieß aber nicht, dass du alle Zeit
der Welt hast!"
408,3014,,Non dirmi che mi stai dando buca!,咦？這算什麼啊，難道是所謂的放鴿子嗎！？,,"어, 뭐야 이거, 설마 약속 취소인 겁니까!?","Jetzt sag nicht, dass du mich sitzenlässt!"
409,3014,,"Sei tu, vero!? Scommetto che non me lo stavi nemmeno per dire, eh!?
Hai detto di sì solo per farmi stare zitto,
scommetto! Quale altra ragione potresti avere per--","還是爽約？　毫無音訊？
又或者是，所謂的已讀不回！？",,"아니면 바람맞힌 거야? 감감무소식이야?
혹은 읽고서도 무시한다는 그거입니까아―!?","Das machst du, oder? Du wolltest es mir nicht mal
sagen, oder?! Du hast nur Ja gesagt, damit ich die
Klappe halte! Was für einen anderen Grund–"
410,3014,,"Eh? Non ti ricordi dove sono?",……咦？　回憶之地是哪裡？,,…어? 추억의 장소는 어디냐고?,"Was? Du erinnerst dich nicht an den Ort,
an dem ich bin?"
411,3014,,"Awww, che cattivo! Come hai potuto
dimenticare il nostro posto speciale,
[p]!?","好……過……份……
好過份，太過份，超過份！",,"무… 너… 해…
너무해, 너무해, 너무해!","Ach, das ist so gemein! Wie konntest du nur
unseren besonderen Ort vergessen,
[p]?!"
412,3014,,"È Asakusa! Mi hai sentito!? Asakusa!
Cos'altro potrebbe essere!?",說到回憶之地，當然是「淺草」啊！,,"추억의 장소라고 하면
「아사쿠사」인 게 당연하잖아!","Es ist Asakusa! Verstanden?! Asakusa!
Wo sonst sollte es sein?"
413,2001,,!?,！？,,!?,?!
414,3014,,"Cosa? Non ti dice niente!? Non ci posso credere!","……咦？　你不知道？
哇啊～！笨蛋笨蛋笨蛋！真不敢相信！",,"…어? 모른다고?
으아앙―! 바보바보바보오! 믿기지 않아!","Was? Du erinnerst dich nicht?! Das kann ich
nicht glauben!"
415,3014,,"Sarebbe una cosa se ti fossi solo dimenticato perché
era Asakusa, ma non saperlo proprio!
Non ci posso credere! NON CI POSSO CREDERE!","如果是不記得的話倒好，竟然是不知道——！
你這惡鬼！　惡魔！　廢物！",,"기억나지 않는 거면 몰라도, 모르겠다니―!
귀신! 악마! 아무짝에도 쓸모없는 녀석!","Wenn du nicht wüsstest, warum es Asakusa war,
na gut, aber dass du dich gar nicht erinnerst!
ICH FASSE ES NICHT!"
416,3014,,"Ma che importa! Ora lo sai!
Muovi il sedere ad Asakusa così possiamo già combattere!
Capito!?","總之————！
我在淺草等你————！你這個混蛋現在馬上給我過來——！",,"아무튼――――!
아사쿠사에서 기다리겠다―――――! 한시라도 빨리 와라 이 자식―!!","Egal! Jetzt weißt du es! Also beweg deinen Hintern
nach Asakusa, damit wir kämpfen können!
Verstanden?!"
417,3013,,"...avevo predetto che sarebbe successo, anche questo.",……我也早就知道會變成這樣了。,,…이렇게 될 것도 알고 있었어,"Dass das passieren würde, wusste ich auch."
418,2001,,...,……,,………,...
419,3013,,"Hmm? Che c'è con quella faccia?
Ti sto solo dicendo la verità.",唉呀，你那是什麼表情啦？,,"어라, 뭘까 그 표정은","Hm? Warum schaust du denn so? Ich sage dir doch
nur die Wahrheit."
420,3013,,"Ascolta. Per ottenere risultati nella vita,
c'è un processo che si deve affrontare e quel processo è già
scolpito nella pietra.","聽好囉？要得到結果，是必須經過一些過程的。
而那個過程早已注定。",,"알겠어? 결과를 이끌어내기 위해선 과정이 필요해
그 과정은 이미 정해져 있어","Hör zu. Um im Leben etwas zu erreichen, muss man
einen Prozess durchlaufen und der ist bereits
in Stein gemeißelt."
421,3013,,"In effetti, la storia stessa, il flusso e riflusso della vita di ogni
anima è tutto predeterminato. Gli umani sono semplicemente incamminati
lungo il sentiero tracciato davanti a loro.","在靈魂的紀錄……也就是阿卡西紀錄裡，
人類只是在那個過程中前進。",,"영혼의 기록―… 아카식 레코드에 말이지
사람은 그 과정을 더듬어 나아가고 있을 뿐","Sogar die Geschichte selbst, die Lebensspanne
jeder Seele ist vorherbestimmt. Menschen folgen
nur dem vorgegebenen Pfad."
422,3013,,"Certo, a volte puoi assumere un ruolo più proattivo in questi
procedimenti e, di fronte a un punto critico,
imboccare uno dei diversi percorsi.","有時，走到一個分水嶺，
我們必須積極地選擇命運，看清楚會出現何種未來。",,"때로는 분수령으로서 적극적으로 운명을 선택해
어느 쪽의 미래가 나타날지 지켜봐야만 하지만","Gut, manchmal kann man bei diesem Prozess die
Initiative ergreifen und an einer wichtigen
Kreuzung einen von mehreren Wegen einschlagen."
423,3013,,"Il risultato finale è che possono esistere molteplici futuri potenziali.
Vai a destra e c'è un futuro. Vai a sinistra, un altro.","向右走的話就會出現右邊的未來——
向左走的話就會出現左邊的未來——",,"오른쪽으로 가면 오른쪽의 미래―
왼쪽으로 가면 왼쪽의 미래―","Das Ergebnis ist, dass es mehrere potenzielle
Zukunftsversionen gibt. Nach links, Zukunft eins.
Nach rechts, Zukunft zwei."
424,3013,,"Il luogo in cui ti trovi ora è deciso in quei momenti cruciali.
Tali scelte rivedono persino il passato stesso.","然後，在你選擇的瞬間決定了“現在＂，
過去也會因那一瞬間而改變。",,"그리고 ""현재""는 네가 선택한 순간에 결정되며
그 순간에 과거도 바뀌게 돼","In den Schlüsselmomenten wird entschieden, wo du
jetzt bist. Mit solchen Entscheidungen kann sogar
die Vergangenheit geändert werden."
425,3013,,"Le scelte che facciamo nella vita sono profondamente potenti e non
devono essere ignorate del tutto come macchinazioni del mero destino.",“選擇＂擁有改變過去的力量哦。,,"""선택""이란 과거까지도 바꿀 수 있는 힘이 있어","Die Entscheidungen, die wir im Leben treffen,
sind äußerst wichtig. Man darf sie nicht als
Intrigen des Schicksals abtun."
426,3013,,"Di conseguenza, nessuno può essere veramente certo di ciò che accadrà
dopo finché una scelta non sarà stata definitivamente fatta
in un modo o nell'altro.",因此很遺憾地，那個瞬間直到選擇之前誰都不知道。,,따라서 아쉽게도 그 순간은 선택이 이루어지기 전까지 알 수 없어,"Deshalb kann man nie genau wissen, was als
Nächstes passiert, bis eine Entscheidung
wirklich endgültig ist."
427,3013,,"È vero per tutti. Anche io sono soggetto a
quelle limitazioni, ahimè, ehehehe.",無論是什麼樣的存在……當然，我也是如此。,,"어떤 존재도… 당연히 나도, 말이지","Das gilt für alle. Selbst ich muss mit diesen
Einschränkungen leben. Leider. Haha."
428,3013,,"Basta filosofeggiare, però. Rina ti sta aspettando ad Asakusa.
Vai avanti e vedi che tipo di destino ti attende nel farla fare
quella scelta.","好了，莉娜在淺草等你呢。
去看看選擇“等待＂的她會有什麼樣的命運吧。",,"자, 아사쿠사에서 리나가 기다리고 있어
""기다리는"" 것을 선택한 그녀의 운명을 지켜보고 와","Aber genug philosophiert. Rina wartet auf dich in
Asakusa. Geh und finde heraus, welches Schicksal
dort durch ihre Entscheidung auf dich wartet."
451,3013,,"Ho detto tutto quello che potevo qui. Tutto quello che puoi
fare ora è dirigerti verso Asakusa e incontrare Rina.
Qualunque cosa accada da qui in poi, accadrà.",好了，莉娜在淺草等著你呢。,,"자, 아사쿠사에서 리나가 기다리고 있어","Mehr kann ich dir jetzt nicht sagen. Du musst nach
Asakusa gehen und dich mit Rina treffen.
Was auch immer geschieht, geschieht."
501,3014,,Mwahahahaha! Aaaaahahahahaha!,呼哈哈哈哈！哈——哈哈哈哈哈！,,후핫핫핫하! 핫―핫핫핫핫하하핫!,Muhahaha! Hahahahaha!
502,3014,,"Aha, ahaha, a, guhaha. *tosse*",哈哈哈……咳咳！！,,하하하학어윽허억하아!!,"Hahaha, haha, ha! *Hust*"
503,3014,,"Ce l'hai fatta finalmente,
[p]! Sono così sollevato!
...Aspetta, perché ti ho chiesto di venire qui di nuovo?","……你、你可終於來了，[p]！
是說，我為什麼要叫你……",,"…드, 드이어 왔군, [p]여!
…그보다 나는 왜 너를…","Endlich bist du hier, [p]!
Ich bin so erleichtert! ... Warum du
noch mal herkommen solltest?"
504,3014,,"Oh, ovvio! Certo!
Volevo fare un po' di allenamento con te e il tuo Digimon!","啊！　對了！
我非常想戰鬥！
那就，正大光明地一決勝負吧！",,"하우왓! 그렇지!
나는 맹렬하게 싸움을 원하고 있었어!
…자, 정정당당히 승부하자!","Ach nee! Natürlich! 
Ich wollte einen kleinen Kampf mit dir
und deinem Digimon!"
505,2001,,...,……,,………,...
506,3014,,"Eh? Perché Asakusa? Ancora questa domanda!
Te l'ho detto, custodisce un sacco di ricordi!","咦？　你問我為什麼是淺草？
真是的！淺草正是我的回憶之地吧！",,"어? 왜 아사쿠사인 거냐고?
정말! 아사쿠사야말로 나의 추억의 장소잖아!","Was? Warum Asakusa? Immer diese Frage! Wie schon
gesagt ... so viele Erinnerungen!"
507,3014,,Ho...un ricordo molto affettuoso di questa zona.,——是我的哦。,,"―나의, 말이야",Ich ... Ich denke immer gern an diesen Ort.
508,2001,,...,……,,………,...
509,3014,,"Cosa? Cosa vuoi dire che sono solo io?
Tu non provi la stessa cosa?",咦？　不是你和我的哦！？,,"어? 너랑 나의, 같은 게 아니거든!?","Was? Was meinst du damit, dass das nur für mich
so ist? Dir geht es nicht so?"
510,3014,,"Beh, per me, Asakusa è un luogo importante che ricorderò
sempre perché è lì che ho assaggiato per la prima volta un po' di dozeu!",淺草是我第一次吃到“泥鰍鍋＂的回憶之地！,,"아사쿠사는 내가 처음 ""추어탕""이라는 걸 먹은
추억의 장소야!","Für mich ist Asakusa wichtig und unvergesslich,
weil ich dort zum ersten Mal Dozeu
gegessen habe!"
511,3014,,"...Non farmi quella faccia! Dozeu! Sai, dojo! 
Non il posto per le arti marziali, cobiti! Pesci! Ne ho mangiato uno,
in una pentola calda! Asakusa è famosa per questo!",……啊，順帶一提，“泥鰍鍋＂就是吃泥鰍哦？,,"…아, 참고로 추어탕은 미꾸라지로 만든 거다?","... Guck nicht so! Dozeu! Du weißt schon, Dojo!
Nicht der Kampfkunst-Dojo, Schmerlen! Fisch!
Asakusa ist für seine Eintöpfe berühmt!"
512,2001,,...,……,,………,...
513,3014,,Huh? Non è questo che ti confonde?,啊，不是這個意思？,,"아, 그런 게 아니라고?","Was? Das ist es nicht, was dich verwirrt?"
514,3014,,"Oh, silenzio! Ti stai preoccupando troppo adesso!
Acqua passata! Andiamo avanti!",沒關係沒關係沒關係啦，那種事怎麼樣都行！,,"괜찮아 괜찮아 괜찮아, 그런 거 어찌됐든 괜찮아!","Ach, hör auf! Du machst dir zu viele Sorgen!
Schwamm drüber! Machen wir weiter!"
515,3014,,"Dobbiamo combattere! Combatti, combatti,
combatti! Sì! Sono super carico! Facciamolo!","來吧來吧來吧來吧！
正大光明地一決勝負勝負勝負！",,"자자자자자!
정정당당히 승부 승부 승부!!","Wir müssen kämpfen! Kämpfen, kämpfen, kämpfen!
JA! Ich bin so bereit! Los geht’s!"
516,3014,,"...Accidenti, che ti prende con tutte queste domande?
Adesso vuoi sapere perché voglio combattere contro di te,
tanto per cominciare?","……咦？
你問我為什麼想要戰鬥？",,"…뭐?
어째서 내가 싸움을 원하고 있냐고?","... Mann, was sollen all die Fragen? Jetzt willst
du wissen, warum ich überhaupt mit dir
kämpfen will?"
517,3014,,"Quante volte dovrò ripeterlo ancora!?
Voglio solo! Lo sento! Fin nel midollo!
Devo farlo o altrimenti continuerò a sentirmi irrequieto!","真是的————！
沒有什麼怎樣、那樣、這樣的啦！",,"정말――――――――!
어째서도 저째서도 이째서도 그째서도 아니얏!","Wie oft muss ich mich wiederholen? Ich will
einfach kämpfen! Ich muss! Wenn ich das
nicht tue, komme ich nicht zur Ruhe!"
