ID,Speaker,Japanese,English,Chinese,EnglishCensored,Korean,German
706,3006,"","When it comes to programming, an AI and a Digimon
are basically the same...","以程式上來講，虛擬人格和數碼寶貝
都是類似的東西嗎……","","가상 인격도 디지몬도 프로그램이라는 점에선
비슷한 건가…","Was die Programmierung angeht, sind eine KI und
ein Digimon mehr oder weniger gleich ..."
707,3006,"","I seems that more and more strange things are
happening in cyberspace.","看來電腦空間還會繼續發生許多不可思議的事情呢。","","아직 전뇌공간에는 불가사의한 일이 일어날 것 같군","Im Cyberspace scheinen sich immer seltsamere
Dinge abzuspielen."
708,2001,"","Yeah, it's really freaky! It's completely bizarre!","嗯嗯，真是曲折離奇！
嗯～這就叫稀奇古怪。","","응응, 정말 엄청 불가사의해!
으음~, 이거야말로 이상하네","Ja, das ist wirklich irre! Einfach bizarr!"
709,3006,"","Even you could be referred to as ""strange,"" don't
you think?","你本身也是一個“不可思議”哦？","","너도 ""불가사의"" 그 자체라고?","Selbst dich könnte man als „seltsam“ bezeichnen,
nicht wahr?"
710,3006,"","...Indeed.","原來如此。","","…과연","... Ja, das ist wohl wahr."
711,3006,"","You nod and say ""Uh-huh"" just like everyone
else, but...","看你一副事不關己地在那邊點頭稱是……","","…응응, 이라며 남의 일인 것마냥 고개를 끄덕이고 있지만…","Du nickst und sagst „jaja“ wie alle anderen,
aber ..."
800,4410,"","Hey, you're Yuuko's friend, right?","唉呀，你是悠子的朋友……","","어라, 너 유코 씨의 친구인…","He, du bist doch mit Yuuko befreundet, nicht wahr?"
801,4410,"","Huh? Yuugo's room?
We can't just let anyone go in there, you know.","什麼？　YUGO先生的病房？
那間病房是不能讓一般人隨便進去的……","","어? 유고 씨의 병실?
그 병실에는 일반인을 들여보내면 안 되지만…","Was? Yuugos Zimmer?
Da können wir nicht einfach irgendwelche
Leute hineinlassen."
802,4410,"","...Okay, tell you what, I didn't see you or anyone
else, so just go ahead. It'll be our secret.","……好吧，大姐姐會當作什麼都沒看到的。
你要保密哦。","","…좋아, 누님은 아무것도 못 본 걸로 해 줄게
……비밀이다?","... Na gut, weißt du was ... Ich habe dich und
auch sonst niemanden gesehen. Mach einfach.
Es bleibt unser Geheimnis."
850,5000,"","I learned that Yuugo is on Kowloon lv.2 through
the Keyword system. Progress + 1","關鍵字系統取得Kowloon Lv. 2
目擊到YUGO的情報。進展＋1","","키워드 시스템으로 쿠롱 Lv.2에서 유고를
봤다는 정보를 입수합니다. 진척+1","Dank des Stichwortsystems habe ich erfahren,
dass Yuugo auf der zweiten Ebene von Kowloon ist.
Fortschritt: +1."
860,3017,"","Oh! [p]! I heard there have been
more sightings of the ""White Boy""! If that's true,
it could be a good chance to take a few photos!","喔！[p]！　我聽說Kowloon
好像又有人目擊到「白色少年的幽靈」了耶！
如果是真的，可能又是打工的好機會哦！？","","오! [p]! 뭔가 말야! 쿠롱에서 또
「하얀 소년의 유령」목격담이 늘어나고 있나봐!
정말이라면 또 알바 찬스려나!?","Ach! [p]! Ich habe gehört, dass der „weiße Junge“
wieder gesichtet wurde! Wenn das stimmt,
sollten wir mehr Fotos machen!"
