ID,Speaker,Japanese,English,Chinese,EnglishCensored,Korean,German
1,3047,,"Okay, qui va bene. Grazie.",好了，這裡就可以了，辛苦你啦。,,"좋아, 여기면 충분해. 수고했어","Okay, hier ist es gut. Danke."
2,3047,,Ti connetti anche tu a EDEN. Ti aspetterò a Piazza Junk.,"那麼，你也一起登入EDEN吧。
到達那邊後，就在破銅爛鐵公園匯合吧。",,"그러면 너도 EDEN에 로그인해줘.
저쪽에 도착하면 잡동사니 광장에서 합류하자","Du musst dich auch in EDEN einloggen. Ich werde an
der Müll-Plaza warten."
3,3047,,Ti racconterò del caso quando saremo lì.,然後，我會告訴你委託的內容的。,,거기서 의뢰 내용을 전달할게,"Ich erzähle dir mehr über den Fall, wenn wir
dort ankommen."
4,3047,,"Oh sì, assicurati di essere ben preparato prima di venire!",啊對了……要做好萬全的準備再過來喔！,,아참 그렇지…제대로 준비해서 와!,"Ach ja, und bereite dich gut vor, bevor du kommst."
