ID,Speaker,Japanese,English,Chinese,EnglishCensored,Korean,German
1,4839,"","I'm such an idiot. I kept telling myself that 
since this world was digital, Yuugo would be safe,
since none of it was real.","我很蠢吧……
「因為是電腦世界，不是現實世界，
所以勇吾一定沒事……」","","…바보란 말이지
「전뇌세계니까, 현실이 아니니까
유고는 분명 무사할 거야…」","Ich bin so ein Trottel. Ich habe mir immer gesagt,
dass die Welt ja digital ist und Yuugo nichts
passiert. Weil es nicht echt ist."
2,4839,"","But that's not the case.
And I knew it better than anyone, since I watched
the whole thing happen.","怎麼可能嘛……
看著那副光景到最後一刻的我，應該比誰都清楚啊。","","…그럴 리 없다는 건
그 광경을 마지막까지 본 내가 가장 잘 알았는데 말이야","Aber das stimmt nicht.
Und ich wusste es besser als sonst irgendwer,
da ich ja alles mitangesehen hatte."
3,4839,"","Curse Suedou for having made us forget something
that important.","我恨末堂……這麼重要的事情……
居然讓我們忘記……","","스에도가 원망스러워… 이런 중요한 일을…
잊게 만들다니…","Suedou soll dafür verflucht sein, dass er uns
etwas so Wichtiges hat vergessen lassen."
4,4839,"","And look at me, putting the blame on someone else.
I'm a disgrace. Haha.","怪到別人頭上還真難堪……哈哈。","","…남 탓을 하는 것도, 꼴사납구만… 하하","Und schau nur, wie ich jemand anderem die Schuld
gebe. Ich bin eine Schande. Haha."
5,4839,"","Whatever the case, I shouldn't have forgotten.
I was the one who decided to run and leave Yuugo
behind.","不論發生什麼事，我都不該忘記……
決定丟下勇吾逃走的人，就是我……","","무슨 일이 있어도, 잊어서는 안 됐어…
유고를 내버려 두고 도망치자고 결정한 건, 나야…","Ich hätte es jedenfalls nicht vergessen sollen.
Ich bin weggelaufen und habe Yuugo zurückgelassen."
