ID,Speaker,Japanese,English,Chinese,EnglishCensored,Korean,German
1,3006,,Capisco. Quindi un nuovo Royal Knight è nato.,這樣啊……新的皇家騎士誕生了嗎……,,그런가… 새로운 로얄 나이츠가 탄생했나…,"Verstehe. Es ist also ein neuer Royal Knight
erwacht."
2,3006,,"No, non sono sorpreso.
Il mondo vede costantemente questo tipo di aggiornamenti
accadere ancora e ancora.","不，我並不驚訝。
因為世界就是會這樣，
不斷重複更新。",,"아니, 놀라진 않아
세계는 항상 이러한 갱신(업데이트)을
반복해 가니까 말이지","Nein, das überrascht mich nicht.
Solche Veränderungen gibt es in der Welt immer
wieder."
3,3006,,È vero nel mondo reale e nel Mondo Digitale.,不管是現實世界或電腦世界，都沒有什麼不同。,,"그건 현실 세계도, 전뇌세계도, 별로 다르지 않지","Das trifft auf die echte Welt genauso zu wie auf
die Digitale Welt."
4,3006,,"Anche tu, un giorno, potresti superarmi.
Attendo con ansia quel giorno.","或許有一天你會超越我吧……
我會期待那天的來臨。",,"너도 언젠가 나를 넘어설지도 모르겠군…
그 날이 오는 걸 기대하고 있겠어","Vielleicht übertriffst du mich auch eines Tages.
Ich freue mich darauf, das zu sehen."
