ID,Speaker,Japanese,English,Chinese,EnglishCensored,Korean,German
1,3003,"","...","……","","……","..."
2,3008,"","Oh my, you're awake?
Welcome home, Yuuko!","哎呀，妳醒啦？
歡迎回來，小悠子★","","어머, 깼니?
어서 와♪ 유코♥","Hoppla, du bist wach?
Willkommen zu Hause, Yuuko!"
3,3003,"","M-Miss Rie?!","里、里繪姊……","","리, 리에 씨…","F-Fräulein Rie?!"
4,3003,"","You were controlling those monsters? Then that
means... every EDEN Syndrome case has been because
you...","是妳……操控那個怪物的嗎……？
這麼說，也是妳……害大家得到EDEN症候群……？！","","당신이, 그 괴물을 조종하고 있었던 건가요…?
그럼… EDEN 증후군도 전부 당신이…!?","Sie haben diese Monster gesteuert?
Das heißt ja ... Alle Fälle von EDEN-Syndrom ...
sind wegen Ihnen passiert ..."
5,3008,"","Oh, no.
I wasn't doing it all from the very beginning.","討厭啦～
並不是一開始就是人家做的唷！","","어머 싫어라~
처음부터 전부 내가 한 건 아니야","Nicht doch.
Ganz am Anfang war ich es noch nicht."
6,3008,"","But I was fascinated by the existence of the
Eaters. I knew there was a way to control them if
only I looked hard enough!","不過侵食者實在太有吸引力，
所以我才想試試看能不能操縱它們！","","하지만 이터의 존재는 무척 매력적이었으니까
어떻게 조종할 수 없을까~ 하고 줄곧 시험해 보고 있었어","Aber die Verschlinger haben mich fasziniert.
Ich wusste, irgendwie kann man sie beherrschen,
man muss es nur wollen!"
7,3008,"","The experiments were a big success! All that's
left to do is to tear down the world's walls!","最後，實★驗★成★功～♪
接下來只要利用這個，打破這世界的圍牆就好囉♪","","실험은, 대♥성♥공~~♪
이제 이걸 이용해서, 세계의 벽을 없애는 것 뿐이야♪","Die Experimente waren ein durchschlagender Erfolg!
Jetzt gilt es nur noch, die Mauern der Welt
einzureißen!"
8,3003,"","?!","……？！","","…!?","?!"
9,3008,"","And to do that, I'll need your mental data... Your
memories.","為了達到目的，我需要妳的精神資料，
也就是妳的“記憶”。","","그러기 위해서는, 너의 정신 데이터가―
""기억""이, 필요해","Und dazu brauche ich deine Mentaldaten ...
Deine Erinnerungen."
10,3008,"","Work with me just a little bit longer, dear Yuuko!","小悠子，妳願意再幫我一個小．忙．吧★","","유코, 조금만 더 협 력 해 줘♥","Mach nur noch ein klein wenig länger mit,
liebe Yuuko!"
11,3008,"","!!!
Oh my. It's you.","！！
哎呀，你是？","","!!
…어머? 너는","!!!
Oha. Du wieder."
12,3008,"","Looks like your annoying little friend followed
you back.","麻煩的小蟲也跟來了啊～","","방해하는 벌레가 붙어 있었구나~","Deine nervtötende Begleitung ist dir offenbar
gefolgt."
13,3008,"","That ability of yours is getting to be a tad bit 
bothersome. Would you mind getting out my hair?!","你的能力有點棘手耶。
可以請你先滾一邊去嗎～！！","","네 능력은 좀 성가셔
지금은 다른 데로 좀 가 줄래~!!","Dein kleiner Trick wird mir langsam arg lästig.
Würdest du dich bitte vom Acker machen?"
14,3008,"","There, now that that nuisance is out of the way...","好了，這下就不會有人來礙事了～","","자 그럼, 이걸로 방해꾼은 사라졌네~","So, jetzt, wo dieses Ärgernis beseitigt ist ..."
15,3003,"","Miss Rie!","里繪姊……！！","","리에 씨…!!","Fräulein Rie!"
16,3008,"","Now, now, you mustn't move!
You have to relax for your first time, remember?","哎呀！不・可・以・亂動喔！
第一次要放輕鬆才行唷。","","어머, 움직이면 안 돼!
처음 할 때는, 힘을 빼야지… 응?","Na, na, nicht bewegen!
Du sollst dich doch nur entspannen!"
17,3003,"","...?!","唔！？","","…읏!?","...?!"
18,3008,"","What's great about this terminal is that not only
can I log into EDEN with any avatar I want...","這個裝置真正厲害的地方呀，
可不只是能用“自由製作的化身”登入EDEN喔！","","이 장치의 굉장한 점은, ""자유롭게 작성한 아바타""로
EDEN에 로그인을 할 수 있는 것… 만이 아니야!","Über dieses fabelhaften Terminal kann ich mich
nicht nur mit jedem beliebigen Avatar in EDEN
einloggen ..."
19,3008,"","It creates the personality, and imports it as
memories into the Digital World.","它還可以創造整個人格，
以“記憶”的方式，帶進電腦世界裡……","","인격 그 자체를 크리에이트해서
""기억""으로서 전뇌세계에 가져간 후, 적용하는 게 가능해…","Er erschafft auch die Persönlichkeit und
importiert sie als Erinnerungen in die Digitale Welt."
20,3008,"","Did you not catch on, dear Yuuko?","小悠子，妳有沒有發現呀？","","유코, 알고 있었어?","Klingelt’s noch nicht, liebe Yuuko?"
21,3008,"","You thought you were the real Yuugo when you were
logged in as Yuugo? But no. I created that
personality.","妳以YUGO的身份登入EDEN時，
妳就是真正的YUGO了！不過這個人格是我創造出來的！","","네가 유고로서 EDEN에 로그인하고 있을 때
넌 진짜 유고였던 거라구? 내가 만든 인격으로서, 말이야","Du dachtest, du bist der echte Yuugo, wenn du als
Yuugo eingeloggt bist? Nicht doch. Diesen
Charakter habe ich erschaffen."
22,3003,"","N-No. That was of my own free will...","才、才不是！我是以自己的意志——","","…아, 아니야, 난 스스로의 의지로――","N-Nein. Das habe ich freiwillig ..."
23,3008,"","Your own *free will*?
There's hardly any of that left.","小悠子的意志？
根本沒有那種東西～","","유코의 의지?
그런 건 거의 없었어~","Freiwillig?
Von deinem freien Willen ist nicht viel übrig."
24,3008,"","If your free will was in charge, you'd never have
taken part in that farce to fool all those
hackers.","不然就算妳再怎麼會演，
也不可能騙過那些駭客呀！","","그렇지 않고서야, 아무리 네가 연기를 잘한다고 해도
그만큼의 해커들을 속일 수 있을 리 없잖아","Wenn du frei handeln könntest, hättest du nie
mitgemacht bei der Falle für die ganzen Hacker."
25,3003,"","To fool... the hackers?
I did that... to those hackers?","騙了那些駭客？
我……騙了他們？","","해커들을… 속였어?
내, 내가… 해커들을…?","Falle ... für die Hacker?
Ich habe ... den Hackern das angetan?"
26,3008,"","Hee hee! In other words, this terminal can spoof
your memories via the Digital World!","呵呵，也就是說，
這個裝置能夠透過電腦世界竄改“記憶”★","","후훗, 즉 이 장치는
전뇌세계를 통해 ""기억""을 뜯어고칠 수 있다는 거야♥","Hihi! Anders gesagt kann dieses Terminal über
die Digitale Welt deine Erinnerungen simulieren!"
27,3008,"","It can write them in and, of course, extract them.","既然能夠寫入記憶，當然也能取出來……","","새로 써넣는 것도 가능하고, 물론, 빼내는 것도 말이야…","Ich kann sie eingeben und natürlich auch wieder
extrahieren."
28,3008,"","Well, then, shall we begin?
I'm going to steal allllll your secrets!","那我們就開始吧！
把小悠子的“記憶（秘密）”……全部奪走♪","","그럼, 시작해 볼까
유코의 ""기억(비밀)""을…… 빼앗아 버릴 거야♪","Nun denn, wollen wir?
Ich hole mir aaalle deine Geheimnisse!"
29,3003,"","Ahhh... Nnnnnnngh! Nnngaaaaaaaaahhhh!","嗚啊啊……啊啊啊啊———！！","","아아아…… 으으―――으아아아―――!!","Ahhh ... Nngh! Aaaah!"
