ID,Speaker,Japanese,English,Chinese,EnglishCensored,Korean,German
1,4842,"","Why did you run away and leave me?
Did you not like me?","為什麼、把我丟下、逃走了？
因為、討厭我嗎？","","어째서, 날 내버려 두고, 도망친 거야?
내가, 싫은 거야?","Warum seid ihr weggelaufen und habt mich allein
gelassen? Hattet ihr mich nicht gerne?"
2,4842,"","Is that why I'm locked in here?","所以、才把我關在裡面？","","그래서, 날 가두고 있는 거야?","Bin ich deshalb hier eingeschlossen?"
3,4844,"","Don't listen to that voice!","不要聽……那個聲音！","","그 목소리를… 듣지 마…!","Hör nicht auf diese Stimme!"
4,4842,"","I hate you all!
All of you, just go away!","我、最討厭大家了！
大家、都消失吧！","","모두, 정말 싫어!
모두, 사라져 버려!","Ich hasse euch alle!
Haut einfach ab, ihr alle!"
5,4842,"","All of you... Just die!","大家都……去死吧！","","모두…… 죽어 버려!","Ihr alle ... geht doch einfach sterben!"
6,4844,"","Don't listen to ""my"" voice...","不能聽“我”的聲音——","","""내"" 목소리를, 들으면 안―","Hör nicht auf „meine“ Stimme!"
7,4842,"","Somebody find me!","誰來、找我呀！","","누군가, 날 찾아 줘!","So such mich doch jemand!"
8,4842,"","Somebody help me!","誰來、救救我呀！","","누군가, 날, 구해 줘!","So hilf mir doch jemand!"
9,4842,"","Help, help, help, help!","救救我、救救我、救救我、救救我！","","구해 줘, 구해 줘, 구해 줘, 구해 줘!","Hilfe, Hilfe, Hilfe, Hilfe!"
