ID,Speaker,Japanese,English,Chinese,EnglishCensored,Korean,German
1,3002,"","Okay, who's next?! They won't stand a chance!","來吧來吧來吧！　下一個對手是誰啊～！？
讓我來當你的對手吧～！！","","자자자! 다음 상대는 어디 있는 어떤 놈이냐아~?!
상대가 돼주마아~!!","Okay, wer ist der Nächste? Die haben keine
Chance!"
2,3002,"","Oh? Was that the last one?","……咦！？　剛剛的傢伙已經是最後一個了？
啊──……這樣、嗎～……？","","……호엣?! 방금 녀석이 끝?
아……그랬, 던가……?","Oh? War das der Letzte?"
3,3002,"","What? There's something unusual about me today?","咦！？　你說我今天感覺有哪裡怪怪的？","","어?! 오늘 내가 어쩐지 이상하다구?","Was? An mir ist heute etwas anders als sonst?"
4,3002,"","I can't hide anything from you.","……唉，沒辦法對你隱瞞呢～","","……에휴, 너한텐 뭘 숨길 수가 없구나아~","Ich kann nichts vor dir verbergen."
5,3002,"","Do you want to ask me what it is? You do, right?
If you do, you'll have to listen to everything!","想聽嗎？
你想聽對吧？　我的NGT（煩惱的事）！
都變成這樣，你可要負起責任，好好聽到最後啊！","","듣고 싶어?
듣고 싶지? 내 GMGR(고민거리)!
이렇게 된 이상 책임지고 끝까지 들어달라구!","Willst du mich fragen, was es ist? Willst du doch,
oder? Wenn ja, musst du dir alles anhören!"
6,3002,"","I... I got a love letter at school!","那個啊、我……
我在學校收到情書了！！","","저기 말야, 나…….
학교에서 연애편지 받아버렸어!!","Ich ... habe in der Schule einen Liebesbrief
bekommen!"
7,3002,"","Amazing, right? To look at me you'd think I've
gotten hundreds of them, wouldn't you?","如何、怎麼樣！？　很厲害吧！
畢竟我的身材可是性感又可愛～
那是當然的吧～？","","어때, 어때?! 대단하지!
그야 내가 에로귀염보디니까아~?
당연하다고 생각하는데요오~?","Verblüffend, oder? Wegen meines Aussehens
dachtest du sicher, ich bekäme Hunderte davon,
was?"
8,3002,"","But this is actually the first time. I don't know
what to do.","……那個、嗯。其實這是第一次……
我在思考要怎麼辦才好。","","……그게, 네. 실은 이런 거 처음이라서…….
어떡해야 좋을지 싶어서","Aber tatsächlich ist es das erste Mal. Ich weiß
nicht, was ich tun soll."
9,3002,"","The boy who sent it is in my class. We get along
well, but I've never seen him as anything more.","那位男生，是我的同班同學。
雖然感情很好，但是問我想不想
跟他當戀人，感覺又有點不太對～……","","상대는 남자앤 같은 반 앤데 말야.
사이는 좋지만 남자친구 삼고 싶냐고 물으면
조금 아닌데~라고나 할까……","Der Junge, der ihn geschickt hat, ist in meiner
Klasse. Wir kommen gut miteinander aus, aber mehr
habe ich nie in ihm gesehen."
10,3002,"","I know I should be glad. I never thought I'd be so
annoyed about getting a love letter...","明明能和誰在一起，我可是非常嚮往的啊。
從來沒有想過收到情書後，還會感到困擾…","","누군가와 사귄다거나 하는 거 엄청 동경했을 텐데 말야.
연애편지 받고 난감해질 거라곤 생각도 못 했어……","Ich weiß, ich sollte mich glücklich schätzen.
Ich hätte nie gedacht, dass ich mich so über
einen Liebesbrief ärgern würde ..."
11,2020,"","Because you've got more important things to do?
Because you like someone else?
Because you don't feel the same way about him?","是不是因為，比起交往還有更重要的事情呢？
是因為有其他在意的人了嗎？
是因為不喜歡對方嗎？","","사귀는 것보다 해야 할 게 있어서?
따로 신경 쓰이는 사람이 생겨서?
좋아하지 않는 상대한테 받아서?","Weil du Wichtigeres zu tun hast?
Weil du jemand anderes magst?
Weil du seine Gefühle nicht erwiderst?"
12,3002,"","Yeah, exactly! Exactly! You nailed it! You're
smart, [p]!","就……就是這個～～！！
就是那樣子啊[p]，不虧是你！！","","그……그거다아~~!!
그거야, [p] 군, 여억시나아!!","Ja, genau! Ganz genau! Voll ins Schwarze! Du hast
Köpfchen, [p]!"
13,3002,"","I'm devoting everything to Digimon and the Rebels
right now. It wouldn't be fair to accept if
I couldn't be fully committed.","現在我光是要照顧數碼寶貝跟反叛者，
就已經很吃力了！如果不好好正視對方，
還答應的話一定很失禮吧。","","지금 난 디지몬이랑 리벨리온즈를 돌보는 것만 해도 빡빡해!
상대와 마주할 수 없는데 OK 해버리면 아마 실례겠지","Ich konzentriere mich zurzeit voll auf die Digimon
und die Rebels. Es wäre nicht fair, darauf
einzugehen, wenn ich andere Verpflichtungen habe."
14,3002,"","Someone else? No, I don't think so...","……嗯？　其他在意的人？
應該是沒…沒有吧……嗯……","","……헤? 따로 신경 쓰이는 사람?
없다, 고, 생각하는데……으음……","Jemand anderes? Nein, ich glaube nicht ..."
15,3002,"","He'd just end up getting hurt if I accepted even
though it's not something I really want.","總之，如果是用這種隨便的態度答應，
一定會讓對方受傷的……","","암튼 이런 마음으로 가볍게 OK 해버렸다간
아마 상대방을 상처입히겠지……","Es würde ihn nur verletzen, wenn ich darauf
einginge, obwohl ich es gar nicht wirklich
möchte."
16,3002,"","That's what I thought, but I'm not exactly sure
how I feel.","雖然我也覺得一定就是那樣，
但總覺得還是想不透啊。","","나도 아마 그런 거라고 생각했는데
어쩐지 마음속 응어리가 안 걷히네에","Das dachte ich zumindest, aber ich bin mir nicht
sehr sicher, was ich fühle."
17,3002,"","He'd just end up getting hurt if I accepted even
though I don't feel that way about him.","總之，如果明明不喜歡對方還答應，
總有一天會傷害到那個人的……","","암튼 상대방을 좋아하지도 않는데 OK 해버리면
언젠가 걜 상처입히겠지……","Es würde ihn nur verletzen, wenn ich darauf
einginge, obwohl ich nicht dasselbe für ihn
empfinde."
18,3002,"","I think it's best if I decline!","嗯，果然還是好好拒絕好了！","","응, 역시 제대로 거절하자!","Ich glaube, ich weise ihn lieber ab!"
19,3002,"","He might be disappointed, but I have to be honest
with him.","說不定會讓對方失望，
但是必須得正面答覆，他說喜歡我的這份心意！","","상대방에게 유감스런 마음이 들게 해버릴지도 모르지만
좋아한다고 말해준 마음엔 솔직하게 대답해줘야겠지!","Er wird vielleicht enttäuscht sein, aber ich muss
ehrlich zu ihm sein."
20,3002,"","I might not be ready for a relationship now, but
hopefully one day!","但是啊但是，就算現在不去想會不會交往，
要是有一天出現了交往對象，那也很令人開心呢♪","","그치만 그치만, 지금은 사귄다거나 하는 생각이 없지만
언젠가 그런 상대가 나타나면 좋겠다♪","Vielleicht bin ich jetzt nicht bereit für eine
Beziehung, aber hoffentlich eines Tages!"
21,3002,"","If I ever do have a boyfriend, hopefully it's
someone who's a good listener like you.","對了～ 如果要當戀人的話，
像你這樣認真聽我說話的人，應該很不錯吧？","","그렇지이~ 남자친구로 삼는다면
이렇게 진지하게 이야길 들어주는 사람이 좋을지도?","Wenn ich je einen festen Freund habe, dann
hoffentlich jemanden, der ein guter Zuhörer ist,
wie du."
22,3002,"","Ah! Wait! I didn't mean it like that! Don't get
the wrong idea!","……話說話說，啊──！！
不、不是那樣子的！？　不要搞錯了喔！？！？","","……아니 아니, 응갸아~~~~악!!
아, 아니라구?! 착각하면 싫다구?!?!","Ah! Warte! So habe ich das nicht gemeint! Bild dir
bloß nichts ein!"
23,3002,"","I just mean someone who listens like you!
Not that I want you to be my boyfriend!","我只是說，像你這種會好好聽我說話的人，
這類型應該不錯而已喔。
並不是說我想跟你交往啊！！","","너처럼 이야길 들어주는 사람이 내 타입일지도~라는 것뿐이고
너랑 사귀고 싶단 뜻은 아니니까 말야!!","Ich meinte nur jemanden, der mir zuhören kann wie
du! Nicht dass ich mit dir zusammen sein will!"
24,3002,"","By the way, do you want this? I thought you might
find it useful.","啊、對了。這個你需要嗎？
之前就想說，如果下次見面，就把這個拿給你。","","아, 맞다. 이거 필요해?
다음에 만나면 너한테 줘야지 하고 가져왔거든","Übrigens, möchtest du das hier? Ich dachte, es
wäre dir vielleicht nützlich."
25,3002,"","And don't think this means anything either!
Argh, I'm going! Bye!","……話說，這也不要搞錯了喔！？
啊～真是的，我要回去了啦！　掰掰！","","……잠깐, 이것도 착각하면 안 되는 거라구?!
아~ 진짜, 나 돌아간다! 바이바이!","Und glaub nicht, dass es irgendeine Bedeutung hat!
Argh, ich bin weg! Tschüs!"
26,2020,"","(Nokia seems a little more tempestuous than
usual.)","（……總覺得，比起往常的諾奇雅
　還更像暴風雨）","","(……어쩐지 노키아가 평소보다 더 폭풍 같았던 듯하네) ","(Nokia wirkt ein bisschen stürmischer als sonst.)"
27,2020,"","(It looks like Nokia really trusts me now.)","（似乎變得被諾奇雅更加信賴的樣子……）","","(노키아에게 상당히 신뢰받게 된 것 같군……)","(Anscheinend vertraut Nokia mir nun.)"
