ID,Speaker,Japanese,English,Chinese,EnglishCensored,Korean,German
1000,4427,,"Questo è il Reparto Speciale. A meno che tu non sia un
familiare o membro del personale ospedaliero, l'accesso è
severamente proibito.","這裡是特殊病房所在的樓層。
嚴格禁止病患家屬與醫院相關人員以外的人進入。",,"이곳은 특별 병동입니다
환자의 가족분이나 병원 관계자 이외의 출입은 엄격히 금지하고 있습니다","Dies ist die Spezialstation. Nur Angehörigen und
Mitarbeitern des Krankenhauses ist der Zutritt
gestattet."
1050,4427,,"Questo è il Quartiere Speciale. A meno che tu non sia un
familiare o personale ospedaliero, l'accesso è
severamente proibito.","這裡是特殊病房所在的樓層。
嚴格禁止病患家屬與醫院相關人員以外的人進入。",,"이곳은 특별 병동입니다
환자의 가족분이나 병원 관계자 이외의 출입은 엄격히 금지하고 있습니다","Dies ist die Spezialstation. Nur Angehörigen und
Mitarbeitern des Krankenhauses ist der Zutritt
gestattet."
1100,4428,,"A chiunque non abbia il permesso è proibito
entrare in quest'area!
In altre parole, fuori dai piedi!","我不能放沒有獲得許可的人進去。
好了，快離開吧！",,"허가가 내려지지 않은 사람을 안으로 들일 수는 없어
자, 돌아가 돌아가!","Ohne Befugnis ist der Zutritt zu diesem Bereich
streng verboten!
Mit anderen Worten: raus hier!"
1150,4428,,"Chiunque non abbia il permesso non può
entrare in questa
zona! In altre parole, vattene!","我不能放沒有獲得許可的人進去。
好了，快離開吧！",,"허가가 내려지지 않은 사람을 안으로 들일 수는 없어
자, 돌아가 돌아가!","Ohne Befugnis ist der Zutritt zu diesem Bereich
streng verboten!
Mit anderen Worten: raus hier!"
