ID,Speaker,Japanese,English,Chinese,EnglishCensored,Korean,German
1050,4402,,"Voglio solo tornare a casa... *sbadiglio*
Non posso tornare a casa... Il mostro sta solo
aspettando... aspettando di attaccare...","我很想趕快回家，
但如果隨便亂動害自己變得顯眼，應該會遭到妖怪襲擊吧……？",,"빨리 집에 돌아가고 싶지만…
섣불리 움직이다가 눈에 띄면, 괴물에게 습격당하잖아…?","Ich will einfach nur heim ... *Gääähn*
Darf ich aber nicht ... Monster wartet ...
Wartet ... und wird angreifen ..."
1051,4402,,"Inoltre... se finisco in una rissa, e la
mia tuta... la tuta si strappa... la mia ragazza
mi ucciiiiderà! Ahahaha! *sbaaaaglio*","要是西裝因為遭到妖怪襲擊而變得破破爛爛的，
我、我絕對會被我老婆給宰了！？",,"습격당해서, 정장이 엉망진창이 됐다간…
마, 마누라에게 살해당하는 거 아니야…!?","Außerdem ... wenn es zum Kampf kommt ...
Und mein Anzug ein Loch bekommt, bringt meine
Liebste mich um! Hahaha! *Gääähn*"
1150,4403,,"Tutti quei mostri sono chiamati Digimon.
Ma ovviamente lo sapevi già, vero?
Solo un promemoria amichevole.",你知道嗎？它們叫做數碼寶貝哦！,,"알고 있어? 저 녀석들, 디지몬이라고 한대!","Diese ganzen Monster nennt man Digimon.
Das wusstest du natürlich schon, nicht wahr?
Nur noch mal zur Erinnerung."
1151,4403,,"Se stabilisci un contatto visivo, beh, questo li farà scattare.
Non so te, ma io ho imparato la lezione.","然後，聽說只要跟它們對上目光，它們就會立刻襲擊你哦！
所以我決定不要再看它們了！",,"그리고! 저 녀석들, 눈을 마주치면 공격해 온다던데?
…그래서 나, 저 녀석들을 안 보기로 결정했어!","Wenn man Blickkontakt zu ihnen aufnimmt, drehen
sie durch. Ich zumindest habe aus meinen
Fehlern gelernt."
1250,4404,,"Cos'è successo alla mia Shibuya?
Solo ieri era tutto così perfetto.",昨天還在的涉谷的街道是跑到哪裡去了啊！,,어제까지 있었던 그 시부야의 거리는 어디로 간 거야…!,"Was ist denn mit Shibuya passiert?
Gestern war doch noch alles perfekt."
1350,1705,,"Wow, questo è uno dei leggendari negozi di CD!
Woooooow...! È così bello! Hey, cos'è un CD?","原來這個東西叫做唱片行啊，哦～。
對了，唱片是指什麼啊？",,"이곳을 CD 숍이라고 해. 헤에―…
그런데, CD가 뭐야?","Oha, das ist einer von den legendären CD-Läden!
Ahhh ... Er ist wunderschön!
He, was ist eigentlich eine CD?"
1450,1112,,Sono affamato! C'è del cibo?,好餓哦……是該吃飯的時間了嗎？有沒有什麼東西可以吃的……？,,배고파… 벌써 밥 먹을 때구나. 뭔가 먹을 거 없을까―…,Ich bin am Verhungern! Gibt’s irgendwas zu essen?
1550,4407,,"Non importa cosa siano realmente, da dove vengano
realmente. Alla fine, sono invasori. La guerra è l'unico
risultato possibile. Prima o poi.","無論它們的真面目為何，這很明顯是侵略行為。
應該遲早會開戰吧……",,"녀석들의 정체가 뭐든 간에, 이것은 명백한 침략 행위다…
조만간, 전투가 일어나겠지…","Es ist egal, was sie sind und wo sie herkommen.
Letzten Endes sind es Invasoren. Und das bedeutet
Krieg. Früher oder später."
