ID,Speaker,Japanese,English,Chinese,EnglishCensored,Korean,German
0,4335,,"L'architettura di Broadway non ti fa un po'...
impressione? È come se ci fosse una stanza
o qualcosa nascosto dentro.","不覺得BW這個建築……很妙嗎？
總覺得好像會在哪，藏了一個祕密的房間。",,"BW의 이 구조…묘하다고 생각되지 않아?
왠지 어딘가에 비밀의 방이라도 숨겨져 있을 것 같아","Findest du den Broadway nicht irgendwie ...
komisch von der Architektur her? Als ob drinnen
irgendwo ein Raum versteckt wäre."
1,4336,,"Sapevi che c'è un'agenzia investigativa a Nakano
Broadway? A volte si sentono urla e si percepiscono strani
odori... cosa potrebbe succedere lì dentro?","你知道中野BW有家偵探事務所嗎？
偶爾會從那傳來怪味或慘叫……到底在做什麼呢？",,"나카노 BW에 탐정사무소가 있는 거 알고 있어?
가끔 고약한 냄새나 비명이 들려오는데…뭘 하는 걸까?","Wusstest du, dass es im Nakano-Broadway ein
Detektivbüro gibt? Manchmal hört man Schreie und
es riecht seltsam ... Was da wohl los ist?"
2,4337,,"COSA?! Qualcuno ha battuto il mio punteggio più alto? Me lo riprenderò prima che finisca la giornata, vedrai!","哇！
你說有人破了我的最高記錄……！？
看著吧！　我今天一定會再刷新記錄的！",,"끄아~!
내 최고기록을 깬 녀석이 있다고…!?
두고 보자~! 오늘 중에 갱신해주겠어!","WAS?! Jemand hat meinen Rekord geschlagen? Den
hole ich mir noch heute zurück, pass nur auf!"
3,4032,,Ah!,啊！！！,,아!!!,Ah!
4,4032,,"Gah, perché le persone continuano a parlarmi? Sto giocando
a nascondino! Senti, prendi questo, vai via!","為什麼大家都要找我搭話啊！
明明就正在玩躲貓貓，被發現的話要怎麼辦啦！
我給你這個，快走開啦！",,"어째서 모두 말을 거는 거야~
숨바꼭질하고 있는데, 걸리면 어쩔거냐고!
이거 줄 테니까 저쪽으로 가!","Pah, warum reden ständig Leute mit mir? Ich spiele
Verstecken! Nimm das und geh endlich weg!"
100,4335,,"Ho sentito dire in giro che Broadway
non ha alcuna planimetria! Non è strano?
Questo posto diventa sempre più curioso...","我聽到風聲，說這個BW是沒有設計圖的！　
為什麼會這樣？這樣謎團更深了……",,"들리는 소문으론 이 BW에는 설계도가
없다고 해! 어째서 그런 짓을 한 거지?
점점 더 수수께끼가 깊어져 가네…","Mir ist zu Ohren gekommen, dass es für Broadway
gar keinen Grundriss gibt! Ist das nicht komisch?
Das wird immer seltsamer hier ..."
101,4337,,"Qualcuno qui intorno ha visto quegli hacker ricercati. Devo essere onesto, la cosa mi innervosisce... ma non cambia il fatto che devo giocare.","有人在這附近看到被通緝的駭客……好可怕喔。
雖然覺得可怕，但我還是忍不住來玩遊戲……",,"지명수배 중인 해커를 이 근처에서 봤다는 녀석이
있어…무섭다 무서워.
무섭지만 나도 모르게 게임을 하러 와버렸어…","Hier hat jemand die gesuchten Hacker gesehen. Das
macht mir, ehrlich gesagt, Angst ... Aber trotzdem
muss ich hier weiterzocken."
