ID,Speaker,Japanese,English,Chinese,EnglishCensored,Korean,German
802,4965,"","""The basement of Broadway once housed a vacuum
tube computer within its walls.""","BW的地下有台真空管式電腦。","","BW의 지하에는 진공관식 컴퓨터가 있었다","„Früher befand sich im Keller, in den Wänden des
Broadway-Gebäudes, ein Röhrencomputer.“"
803,4965,"","""It had been brought into the building after the
end of WWII by war criminals who evaded arrest,
shielded from the prying eyes of MacArthur's GHQ.""","據說這是在第二次世界大戰結束後，逃過逮捕的戰犯偷偷帶進來，
以避免被GHQ奪走的東西。","","이것은 제2차 세계대전 종결 후 전범 체포에서 도망친 자들이
몰래 가지고 들어와 GHQ의 손으로부터 지켰다고 한다","„Nach Kriegsende wurde er von Kriegsverbrechern
auf der Flucht ins Gebäude gebracht, um ihn
vor MacArthurs Hauptquartier zu verstecken.“"
804,4965,"","""The vacuum tube computer's purpose in those days
remains a mystery.""","而那是作為計算裝置使用，
還是用來解讀暗號……","","연산 장치로 쓰인 것인지
암호 해독용으로 쓰인 것인지…","„Wozu der Röhrencomputer damals verwendet wurde,
ist nicht bekannt.“"
805,4965,"","""It's possible it could have been utilized for
things such as mathematical computations or code-
breaking, but such speculation is unconfirmed.""","用途不明。","","용도는 정확하지 않다","„Es ist möglich, dass er für mathematische
Berechnungen oder Dechiffrierung von Codes diente,
aber dafür gibt es keinerlei Beweise.“"
806,4965,"","""As time went on, there was eventually nobody
left to carry on the originally purpose set forth
for the terminal.""","在時過境遷，
已經沒有人繼承隱藏在裡頭的意志時……","","시간이 흘러 진공관식 컴퓨터에 담겨 있는 의사를 이어받을 자가
아무도 없어졌을 무렵…","„Mit der Zeit gab es niemanden mehr, der das
Terminal im ursprünglichen Sinne bedienen konnte.“"
807,4965,"","""At that point, the computer was apparently buried
inside a wall somewhere.""","似乎就這樣不為人知地被埋在牆中。","","아무도 모르게 벽 안에 넣어 메워졌다고 한다","„Zu dem Zeitpunkt wurde der Computer wohl
irgendwo in einer Wand versteckt.“"
851,4965,"","""Today something terrible happened.""","今天發生了大事。","","오늘은 큰일이 있었다","„Heute ist etwas Furchtbares geschehen.“"
852,4965,"","""A strange Digimon appeared in the middle of my
bed. It was so cold in there...""","有一隻數碼寶貝跑進我的床裡。
好冷好冷……就算求救……","","내 침상 안으로 디지몬이 들어왔다
춥고 너무 추워서… 도와줘― 라고 말해도…","„Mitten auf meinem Bett erschien ein fremdes
Digimon. Es war dort so kalt ...“"
853,4965,"","""Even when I tried calling out for help, nobody
came for me...""","也沒有人來幫我。","","아무도 와 주지 않았다","„Als ich versuchte, um Hilfe zu rufen, kam
niemand ...“"
854,4965,"","""But these two detectives eventually showed up.""","但是，偵探大人們來救了我。","","하지만 탐정님들이 와 줬다","„Doch schließlich kamen zwei Detektive.“"
855,4965,"","Kyoko and [p].","杏子和[p]。","","쿄코와 [p]","Kyoko und [p]."
856,4965,"","[p] asked me who I was,
but I said I didn't know.","[p]問我，我是誰？
我回說，我也不知道。","","[p]에게 넌 누구야? 라는 질문을 받았다
나는 모른다고 대답했다","[p] fragte mich, wer ich war,
aber ich sagte, dass ich es nicht wisse."
857,4965,"","So Kyoko gave me a name.","然後，杏子就幫我取了個名字。","","그랬더니 쿄코가 이름을 지어 주었다","Also gab Kyoko mir einen Namen."
858,4965,"","She decided to call me ""Pete"" because I'm some
sort of ""time capsule.""","因為我是個時空膠囊，
所以取名叫『皮特』。","","타임 캡슐이니까
『피트』라고","Sie nannte mich „Pete“, weil ich eine Art
„Zeitkapsel“ war."
859,4965,"","Yep, Pete. That's my name.","我的名字是『皮特』。","","내 이름『피트』","Jep, Pete. So heiße ich."
860,4965,"","It made me so happy to have one.
Names really are special things to have.","我好開心。
有名字真好。","","굉장히 기뻤다
이름이란 건 좋네","Ich war so froh, einen Namen zu haben.
Namen sind etwas Besonderes."
901,4965,"","""Yoshito really likes this girl named 'Fuyume
Yuki.'""","嘉人最喜歡“雪冬女＂了。","","요시토는 ""유우키 후유메""를 정말 좋아한다","„Yoshito mag das Mädchen mit den Namen ‚Fuyume
Yuki‘ sehr.“"
902,4965,"","""He always sits me on his lap and tells me all
about her.""","他總是把我放在他的大腿上，說著雪冬女的事。","","언제나 나를 무릎에 앉히고 유우키 후유메에 대한 이야기를 한다","„Er nimmt mich immer auf seinen Schoß und
erzählt mir von ihr.“"
903,4965,"","""Everything is perfect about her, he says. Her
singing, her dancing, her looks, everything. He
says she's one in a million among idols.""","不僅能歌善舞，身材也很完美，
他說再也沒有那麼完美的偶像了。","","노래도 춤도 용모도 완벽
그렇게 모든 걸 갖추고 있는 아이돌은 없다고 한다","„Alles an ihr sei perfekt, meint er. Ihr Singen,
ihr Tanzen, ihr Aussehen, alles. Er sagt, sie
sei ein einzigartiges Idol.“"
904,4965,"","""I can't do any of those things. I can't sing and
I can't dance. But what I can do is curl up and
fall asleep on Yoshito's lap. I love doing that.""","我無法唱歌跳舞，
還喜歡在嘉人的腿上睡覺。","","나는 노래도 춤도 못하고
요시토의 무릎 위에서 자는 걸 좋아하지만","„Ich habe dafür kein Talent. Ich kann weder singen
noch tanzen. Aber ich kann mich zusammenrollen
und auf Yoshitos Schoß schlafen. Ich liebe es.“"
905,4965,"","""I also just love hearing Yoshito talk to me so
happily.""","但是，我最喜歡聽嘉人開心地說話了。","","하지만 요시토가 즐거운 듯이 이야기를 하는 건 정말 좋아해","„Außerdem mag ich es, wenn Yoshito so glücklich
ist, während er mit mir redet.“"
951,4965,"","""Yoshito told me that he and his son have been to
a 'world's fair' once.""","嘉人好像曾經跟兒子去過“萬博＂。","","요시토는 아들이랑 ""만국 박람회""에 간 적이 있다고 한다","„Yoshito hat mir erzählt, dass er und sein Sohn
einmal bei einer ‚Weltausstellung‘ waren.“"
952,4965,"","""He said that the line to see the 'moon rocks' was
really long, so long that it made them tired.
But he said his son still had a good time.""","為了看“月石＂，還排了很長的隊伍，很累人。
但是，他的兒子們好像很開心。","","""월석""을 보는 줄이 엄청 길어서 녹초가 됐다고 한다
하지만 아들들은 즐거워 보였다고","„Er meinte, die Schlange für das ‚Mondgestein‘ sei
so lang gewesen, dass sie müde wurden. Aber
sie hatten beide trotzdem Spaß.“"
953,4965,"","""People also call Yoshito 'Chief Mizushima.'
His full name is 'Yoshito Mizushima.'""","嘉人也被稱作“水嶋主任＂，
他的名字叫做『水嶋嘉人』。","","요시토는 ""미즈시마 주임""이라고도 불린다
『미즈시마 요시토』가 요시토의 이름","„Die Leute nennen Yoshito ‚Herrn Mizushima‘.
Sein voller Name lautet ‚Yoshito Mizushima‘.“"
954,4965,"","""Yoshito is a big, important man in the 'computer
room,' so he doesn't get to go out with his son
much. He's glad they got to see the world's fair.""","嘉人是電腦室的重要人物，
平常沒有辦法帶兒子出門，所以去萬博那天似乎玩得很開心。","","요시토는 컴퓨터 룸의 높은 사람이라
아들과 함께 놀러갈 시간이 없어서, 만국 박람회가 즐거웠던 것 같다","„Im ‚Computerraum‘ ist Yoshito sehr wichtig.
Deshalb hat er nicht viel Zeit für seinen Sohn.
Er ist froh, dass sie bei der Ausstellung waren.“"
955,4965,"","""I wish I could have seen the world's fair with
Yoshito, too. But he and I are always together
in the computer room.""","我也好想跟嘉人去啊。
但是，我一直都和嘉人待在電腦室。","","나도 요시토랑 가고 싶었어
하지만 나는 언제나 컴퓨터 룸에서 요시토랑 함께지","„Ich wünschte, ich hätte die Ausstellung mit
Yoshito gesehen. Aber wir sind ja im
Computerraum immer zusammen.“"
956,4965,"","""So that's okay. I'm content.""","所以不要緊。","","그러니까 괜찮아","„Das ist also in Ordnung. Ich bin zufrieden.“"
1001,4965,"","""Yoshito always has me sitting on his lap, petting
my head all nice and gently.""","嘉人總是把我放在他的大腿上，
不停地撫摸著我的頭。","","요시토는 언제나 나를 무릎 위에 앉히고
머리를 계속 쓰다듬어 준다","„Yoshito nimmt mich immer auf den Schoß und
streichelt ganz zärtlich meinen Kopf.“"
1002,4965,"","""I love Yoshito.""","我最喜歡嘉人了。","","나는 요시토가 정말 좋아","„Ich liebe Yoshito.“"
1003,4965,"","""Yoshito always calls me...""","嘉人總是，","","요시토는 언제나, 나를","„Yoshito nennt mich immer ...“"
1004,4965,"","""Miko.""","叫我『咪子』。","","『미코』라고 불러 준다","„Miko.“"
1005,4965,"","""Miko is a girl's name.""","雖然，我是公貓。","","나, 수컷이지만","„Miko ist ein Mädchenname.“"
1006,4965,"","""But Yoshito gave it to me, so I love it.""","但我最喜歡嘉人幫我取的名字。","","요시토가 불러 주는 이름이 정말 좋아","„Aber Yoshito hat ihn mir gegeben, also liebe
ich ihn.“"
1051,4965,"","""It's dark in here.""","好黑。","","깜깜해","„Hier ist es dunkel.“"
1052,4965,"","""All dark. I can't see a thing.""","變得好黑喔。","","깜깜해져 버렸어","„Ganz dunkel. Ich kann nichts sehen.“"
1053,4965,"","""I'm okay being in the dark. I'm not scared of
it or anything. But it's never been this dark
before.""","雖然我不怕黑，
但這還是第一次變得這麼黑。","","나는 어두운 곳에서도 아무렇지 않지만
이렇게 깜깜한 건 처음","„Die Dunkelheit macht mir nichts aus. Ich habe
keine Angst vor ihr. Aber so dunkel war
es noch nie.“"
1054,4965,"","""Yoshito's not here.""
""I don't even smell him.""","嘉人不在，
也沒有他的味道。","","요시토가 없어
냄새도 없어","„Yoshito ist nicht hier.“
„Ich kann ihn nicht mal riechen.“"
1055,4965,"","""I can't go back outside.""
""Yoshito, where are you?""","我沒有辦法出去。
嘉人在哪裡？","","밖으로 나갈 수 없어
요시토 어디야?","„Ich kann nicht wieder nach draußen.“
„Yoshito, wo bist du?“"
1056,4965,"","""Yoshito.""
""Yoshito.""","嘉人，
嘉人。","","요시토
요시토","„Yoshito.“
„Yoshito.“"
1057,4965,"","""Please, sit me on your lap.""
""And pet my head again.""","摸摸我的頭，
把我放在大腿上。","","머리 쓰다듬어 줘
무릎에 앉혀 줘","„Bitte nimm mich auf deinen Schoß.“
„Und streichle wieder meinen Kopf.“"
1058,4965,"","""Yoshito.""
""Yoshi...""","嘉人，
嘉——","","요시토
요시―","„Yoshito.“
„Yoshi ...“"
1059,4965,"","""to...""","人——","","토―","„...to ...“"
1101,4878,"","Now you know... Now you know who I really am...","……你知道了呢。
……被你知道了呢。","","…알아 버렸구나
…알려지고 말았구나","Jetzt weißt du es ... Jetzt weißt du, wer ich
wirklich bin ..."
1102,4878,"","I'm...","我……","","나는…","Ich bin ..."
1103,4878,"","I'm......!","我……","","나는………","Ich bin ...!"
1201,3006,"","So it's begun...! Though I have to say this is a
bit more than what I bargained for!","開始了嗎……！
比預想中的……還要糟糕啊……！","","시작됐나…!
예상, 했던 것보다도, 터무니없이, 엄청나, 군…!","Es hat also begonnen ...! Wobei ich sagen muss,
dass ich mir das so nicht vorgestellt hatte!"
1202,3006,"","If this keeps up, the building's going to collapse
for sure!","再這樣下去，這棟大樓會倒塌！","","지금 이대로는, 빌딩, 이 무너, 지, 고 말아!","Wenn das so weitergeht, stürzt das Gebäude mit
Sicherheit ein!"
1301,4879,"","Who...am...I...?","我……是誰？","","나는……… 누구?","Wer ... bin ... ich ...?"
1302,4879,"","Somebody...anybody...tell me...","誰來……告訴我……","","누군가…… 알려줘","Sag ... es mir ... doch jemand ..."
1401,4879,"","Please... Who am...I...?","我是……誰……告訴我……","","나는…… 누구…… 알려줘……","Bitte ... Wer bin ... ich ...?"
1402,4879,"","Pete...?","皮特……？","","피트…?","Pete ...?"
1403,4879,"","No... That's...not right... That's not right!","不……對……不對！","","아니… 야… 아니야!","Nein ... Das ... stimmt nicht ... Das stimmt
nicht!"
1404,4879,"","Yoshito...Mizushima?","水嶋……嘉人……？","","미즈시마… 요시토…?","Yoshito ... Mizushima?"
1405,4879,"","Ah, aaaaaugh! No, that's not me! I'm...I'm...!","啊啊……啊啊啊！　不對，我是……！","","아아… 아아아! 아니야, 나는…!","Ah, arrrgh! Nein, das bin nicht ich! Ich bin ...
Ich bin ...!"
1406,4879,"","Miko...?","咪子……？","","미코…?","Miko ...?"
1407,4879,"","I'm...Miko... Ah, aaaaargh!","我是……咪子……啊，啊啊啊啊！","","나는… 미코…… 아아, 아아아아!","Ich bin ... Miko ... Ah, aaaaaargh!"
1501,4880,"","Yeah, that's right... My name is Miko...","對啊……我是咪子。","","맞아… 나는, 미코","Ja, das stimmt ... Mein Name ist Miko ..."
1502,4880,"","Yoshito is...my friend.
Pete is...your friend...","嘉人是……我的朋友。
皮特是……你的朋友。","","요시토는…… 친구
피트는…… 네 친구","Yoshito ist ... mein Freund.
Pete ist ... dein Freund ..."
1503,4880,"","Yoshito's calling out for me...
He's been looking for me this whole time...","……嘉人在叫我，
嘉人一直都在找我。","","…요시토가 부르고 있어
요시토, 계속 찾아줬구나","Yoshito ruft nach mir ...
Er hat mich die ganze Zeit über gesucht ..."
1504,4880,"","He found me...","你找到了我……","","나를 찾아 줬어…","Er hat mich gefunden ..."
1505,4880,"","Yoshito.","嘉人。","","요시토","Yoshito."
1601,3006,"","Whew, looks like the tremors have stopped.
Just in the nick of time, too.","……平息了嗎？
唉……好像趕上了呢。","","…진정됐나
이런이런… 늦지 않았던 것 같군","Puh, das Rütteln hat wohl aufgehört.
Gerade rechtzeitig."
1602,3006,"","That's my assistant for you. You've done well.
Now I don't have to worry about any broken coffee
cups, heehee...","真不愧是我的助手……技術真好。
多虧了他，那些咖啡杯都完好無缺。","","역시 내 조수… 좋은 실력이다
덕분에 커피 컵이 깨지지 않고 끝났다","So ist mein Hilfsdetektiv eben. Gute Arbeit.
Jetzt brauche ich mir wegen kaputter
Kaffeetassen keine Sorgen mehr machen, haha ..."
1701,4133,"","Miko... Miko, it's really you!","喔喔……咪子……是咪子啊……！","","오옷… 미코… 미코야……!","Miko ... Miko, du bist es wirklich!"
1702,4134,"","Yoshito... I'm so sorry.
You've been waiting for me for so long...","……嘉人……對不起，
讓你等了那麼、那麼久……","","…요시토… 미안해
계속, 계속 기다리게 해서…","Yoshito ... Es tut mir so leid.
Du hast so lange auf mich gewartet ..."
1703,4133,"","I'm the one who should be apologizing here, Miko.
I'm the one who left you alone this whole time...
I'm so sorry, my friend...","該道歉的是我啊……
咪子，讓你這麼孤單，真的很抱歉。","","사과하는 건 내 쪽이란다…
미코, 혼자 둬서 정말 미안하구나","Ich sollte mich entschuldigen, Miko. Ich habe
dich so lange allein gelassen ... Es tut mir
so leid, mein Lieber ..."
1704,4134,"","No, it's okay, really. You don't have to be sorry.
I know you've been waiting for me since the day
you had to go.","不會，不要緊的……
因為嘉人一直都在等著我啊。","","아니, 괜찮아…
왜냐하면 요시토는 계속 나를 기다려 줬으니까","Nein, ist schon gut. Du musst dich nicht
entschuldigen. Ich weiß, du hast auf mich
gewartet seit dem Tag, an dem du gehen musstest."
1705,4133,"","Oh, Miko...","咪子……","","미코","Ach, Miko ..."
1706,4133,"","Thank you... If it wasn't for you, I'd have never
lived to see Miko with my own eyes again...","謝謝你……多虧了你，
我才能再次見到咪子……","","고맙구나… 네 덕분에
미코와 다시 재회할 수 있었다","Danke ... Ohne dich hätte ich Miko nie wieder
mit eigenen Augen gesehen ..."
1707,2001,"","...?","……？","","…?","...?"
1708,4133,"","I should probably explain... You see, back when
the vacuum tube computer room was still around, I
lived here in this building, away from my family.","喔……其實，當真空管式電腦室還存在時，
我是和家人分居，住在這個館內的。","","아아… 실은 말이지, 진공관식 컴퓨터 룸이 존재했던 당시
나는 가족과 떨어져 이 관내에 살고 있었단다","Das sollte ich vielleicht erklären ... Als es den
Raum mit dem Röhrencomputer noch gab, wohnte
ich in diesem Gebäude, nicht bei meiner Familie."
1709,4133,"","That computer room was where I used to work.","因為我的工作地點就是電腦室。","","컴퓨터 룸은 내 직장이었지","In dem Computerraum habe ich gearbeitet."
1710,4133,"","The only family I ever had with me that whole time
was Miko here.","唯一一個帶來這裡的家人，就是咪子。","","유일하게 데려온 가족이, 이 미코란다","Miko war die ganze Zeit über die einzige
Familie, die ich hatte."
1711,4133,"","I talked with Miko about everything there... My
memories of my family, Fuyume Yuki... Anything to
help keep my loneliness at bay in there.","我對咪子說了很多與家人的回憶，
以及喜歡偶像雪冬女的熱情，
藉此消除寂寞。","","미코를 상대로 가족과의 추억이나
마음에 드는 아이돌 유우키 후유메를 향한 뜨거운 마음을 이야기하며
외로움을 달래고 있었지","Ich redete mit Miko über alles ... Meine
Erinnerungen an meine Familie, Fuyume Yuki ...
Alles, um dort nicht so einsam zu sein."
1712,4133,"","He would join me in the computer room and we spent
many, many hours together over the years...","咪子也跟我來到電腦室，
我跟咪子一起共度了很長一段時間。","","미코는 컴퓨터 룸에도 따라왔다
긴 시간을 미코와 함께 보냈단다","Er kam zu mir in den Computerraum und wir haben
dort über die Jahre viele, viele Stunden
zusammen verbracht ..."
1713,4133,"","Eventually, they closed down the room and sealed
the whole thing off with a thick wall, like it was
never there to begin with.","但電腦室終究決定要關閉，
連房間的門都一起被塗成厚牆……","","이윽고 컴퓨터 룸의 폐쇄가 결정되어
방의 문까지 통째로 두꺼운 벽으로 덧칠해졌지…","Schließlich wurde der Raum geschlossen und
hinter einer dicken Wand versteckt.
Es war fast, als ob es ihn nie gegeben hätte ..."
1714,4133,"","It was around that time that I lost Miko, too.
I couldn't find him wherever I looked...","咪子剛好就在那時不見了。","","미코가 없어진 건 마침 그 무렵이었단다","Zu dem Zeitpunkt habe ich auch Miko verloren.
Egal, wo ich suchte, er war nicht zu finden ..."
1715,4133,"","I had a bad feeling about where he might have
ended up and came back here who knows how many
times to rescue him...","我曾想，牠該不會在裡頭吧。
所以不斷地來到這裡。","","설마, 라고는 생각했지
몇 번이나 이 곳으로 발길을 옮겼다","Ich hatte so ein ungutes Gefühl, was mit ihm
geschehen war, weshalb ich immer wieder herkam,
um ihn zu retten ..."
1716,4133,"","But in the end, I couldn't do anything for him.
I gave up and over time nearly forgot about him...","但是，我什麼也辦不到，
一段時間後我就放棄了，並棄之於遺忘的深淵——","","하지만 어떻게 할 수도 없어서
머지않아 포기하고 망각의 저편으로 보내서―","Doch letztendlich konnte ich nichts für ihn tun.
Ich gab auf und vergaß ihn mit der Zeit fast ..."
1717,4133,"","Before I knew it, it had been decades since we'd
last been together.","當我注意到時，已經過了幾十年。","","깨닫고 보니 수십 년의 세월이 흘렀더구나","Bevor ich mich versah, waren Jahrzehnte vergangen,
seit wir uns zuletzt gesehen hatten."
1718,4133,"","I can't thank you enough for making this happen.
We couldn't have been reunited without you, kid...","我能夠像這樣與咪子再次相會，都是多虧了你啊。","","이렇게 미코와 재회할 수 있었던 건 네 덕분이다","Ich kann dir dafür nicht genug danken. Ohne dich
hätte es kein Wiedersehen gegeben, Jungchen ..."
1719,4133,"","Thank you... Thank you so much...
Now we can go back to living together again...","謝謝……謝謝你……
多虧了你，我能再度和咪子一起生活……","","고마워… 고맙구나…
덕분에 다시 미코와 함께 살 수 있어","Danke ... Vielen, vielen Dank ...
Jetzt können wir wieder zusammenleben!"
1720,4133,"","Thank you. I'll never, ever forget this day!","真的，很謝謝你……！","","정말, 고맙다…！","Danke. Diesen Tag werde ich nie im Leben
vergessen!"
1801,3006,"","I see... Nice work. I can only imagine how hard it
was, but you really did a good job.","這樣啊——
辛苦你了。","","그렇군―
수고했다","Ich verstehe ... Gute Arbeit. Ich kann mir nur
ausmalen, wie schwer es war, aber das hast
du wirklich gut gemacht."
1802,3006,"","So our Pete was actually a cat named Miko, sealed
deep inside a wall along with that old vacuum tube
computer from the American occupation days...","和真空管式電腦一起
被封在牆壁中的貓，咪子……","","진공관식 컴퓨터와 함께
벽 속에 갇힌 고양이, 미코","Unser Pete war also ein Kater namens Miko, der
seit der US-Besatzung in einer Wand mit dem alten
Röhrencomputer eingeschlossen war ..."
1803,3006,"","And somehow, using the building's intranet...or
rather the power of its ley line, he merged with
the computer and became a Digimon.","那隻咪子透過內部網路……得到龍脈的力量，
與電腦同化，變成了數碼寶貝。","","그 미코가, 인트라넷… 용맥의 힘을 얻어
컴퓨터와 동화해 디지몬의 모습이 되었다","Und irgendwie, mithilfe des Intranets des Gebäudes
oder dank der Kraft der Ley-Linie, ist er mit dem
Computer verschmolzen und ein Digimon geworden."
1804,3006,"","That old cat's had a hell of a life, wouldn't you
agree, [p]?","那就是我們所知的“皮特＂。","","그것이 우리가 아는 ""피트""다","Der alte Kater hat ganz schön was erlebt, meinst
du nicht, [p]?"
1805,3006,"","We can't say for sure what the actual assimilation
process entailed, but at this point, we know
better than to doubt it happened.","雖然不知道它被同化的詳細過程，
但我們可以知道這種事是有可能發生的。","","동화한 자세한 프로세스는 불명이지만
우리는 그런 현상이 일어날 수 있다는 걸 알고 있다","Wir wissen nicht mit Sicherheit, wie die
Verschmelzung passiert ist, aber es gibt keine
Zweifel, dass sie stattgefunden hat."
1806,3006,"","It's amazing just how much and yet how little the
digital and real worlds are siphoned off from one
another...","電腦世界與現實世界的牆相當厚，也相當薄……","","전뇌세계와 현실세계의 벽은 두껍기도 하고, 얇기도 하다…","Es ist erstaunlich, wie sehr und wie wenig die
Digitale Welt und die echte Welt sich überschneiden ..."
1807,3006,"","I imagine the reason Pete showed up again after
all those years is because of the Digital Wave
abnormalities we've seen.","經過數十年的時光，皮特會再次出現，
是受到最近數碼波異常的影響吧。","","수십 년의 시간을 건너 피트가 나타난 이유는
최근 발생한 디지털 웨이브 이상의 영향이겠지","Ich glaube, dass Pete aufgrund der abnormen
digitalen Wellen nach all den Jahren wieder
erschienen ist."
1808,3006,"","But you know... There's still one thing about the
whole story that bugs me a little.","但是，有一件事我很在意。","","…하지만 한 가지 신경 쓰이는 점이 있다","Aber weißt du was ... Ein Aspekt an der ganzen
Geschichte stört mich immer noch etwas."
1809,2001,"","?","？？","","??","?"
1810,3006,"","You mentioned that towards the end, Old Man
Mizushima said ""Now we can go back to living
together again,"" right?","聽你說，水嶋老人說，
「能再度和咪子一起生活」……對吧？","","네 이야기에 따르면, 미즈시마 할아버지는
「다시 함께 살 수 있다」… 그렇게 말했다고 했지?","Du hast erwähnt, dass der alte Mizushima am Ende
sagte: „Jetzt können wir wieder zusammenleben!“
Richtig?"
1811,3006,"","...What do you think he meant by that?","你覺得……那是什麼意思呢？","","그건… 어떤 의미라고 생각하나?","... Was er damit wohl gemeint hat?"
