ID,Speaker,Japanese,English,Chinese,EnglishCensored,Korean,German
1812,3006,"","Not only that, but in the case you solved earlier
where he was the one behind the urban legends...
How did he keep breaking into the building?","而且，在我們知道水嶋老人是都市傳說真相的事件中——
他是怎麼入侵至館內的？","","게다가 미즈시마 할아버지가 도시전설의 정체라는 걸 알게 된 사건―…
그는 어떻게 관내에 침입했던 거지?","Nicht nur das. Auch bei dem Fall, den ihr
gelöst habt, steckte er hinter den Legenden.
Wie gelangte er immer wieder in das Gebäude?"
1813,3006,"","Let's assume for the sake of argument that he
somehow had access to an entrance that let him
come and go at the timing he did.","就算在那個時間還有出入口開著——","","설사 그 타이밍에 열려 있는
출입구가 있었다고 해도―","Sagen wir mal, dass er irgendwie Zugang zu einem
Eingang hatte, mit dessen Hilfe er zu gewissen
Zeiten kommen und gehen konnte."
1814,3006,"","If he'd physically been getting into the building
so much that way that he was being reported, you'd
think something would have gone differently.","如果頻繁地進出到出現目擊證詞，那又是另外一回事了。","","목격자가 생길 정도로 빈번히 출입하고 있었다고 하면 이야기는 달라진다","Wenn er so oft ein und aus ging, dass es anderen
aufgefallen wäre, dann wäre die Geschichte
vielleicht anders verlaufen."
1815,2001,"","...!","……！","","…윽!","...!"
1816,3006,"","Got any theories you'd like to propose?","關於這個謎題，你能說出令人信服的推理嗎？","","이 수수께끼에 너는 납득이 가는 추리를 펼칠 수 있나?","Hast du andere Theorien?"
1817,3006,"","Yoshito Mizushima...","……水嶋嘉人。","","…미즈시마 요시토","Yoshito Mizushima ..."
1818,3006,"","If we looked into his backstory, we might be able
to find our answers pretty easily...","如果調查看看這個人，
或許會比較容易得到解答。","","이 인물을 조사한다면
쉽게 답을 얻을지도 모르겠군","Wenn wir uns seine Vorgeschichte ansehen, finden
wir vielleicht schnell unsere Antworten ..."
1819,3006,"","What do you think? Should we dig a little more?","你想確認看看嗎？","","너는 그걸 확인하고 싶은가?","Was meinst du? Sollten wir noch etwas
nachforschen?"
1820,4878,"","""Please, leave us be... Don't go looking for us.""","“不要找尋　我們＂","","""우리를 찾지 말아줘""","„Bitte lasst uns in Ruhe ... Sucht nicht nach
uns.“"
1821,3006,"","Ah, that's understandable... Then it's probably
best we do indeed let sleeping dogs lie.","……是啊……對，那才是正確解答吧。","","…그렇군… 그래, 그게 정답이겠지","Ach, das ist verständlich ... Dann ist es wohl am
besten, schlafende Hunde nicht zu wecken."
1822,3006,"","Alternatively, we could let the occult club kids
know about this. I bet they'd have a real field
day going after it.","不過，若是讓超自然研究社的人聽到，
應該會欣喜若狂吧。","","하지만 오컬트 연구부 녀석들이 알게 되면
분명 기뻐서 춤을 추겠지","Oder wir könnten den Kids vom Okkultismus-Club
Bescheid sagen. Das wäre ein gefundenes
Fressen für sie."
1823,3006,"","I mean, they came face-to-face with a real--","畢竟，他們看到的是真正的——","","뭐니뭐니 해도 그들이 직접 본 건 진짜로―","Ich meine, sie haben persönlich einen echten–"
1824,3006,"","...You know what, nah, let's keep it to ourselves.","……呵，不，還是算了。","","……훗, 아니, 그만두지","... Weißt du was? Behalten wir es für uns."
1901,3006,"","Not all mysteries in this world need to be solved.","這世界上有很多謎是不需要解開的。","","해명할 필요가 없는 수수께끼도 이 세상에는 잔뜩 있다","Nicht alle Rätsel in dieser Welt müssen gelöst
werden."
1902,3006,"","Nakano Broadway brings many things together...","中野這個地方……","","여기는, 이 나카노는…","Nakano-Broadway verbindet viele Dinge ..."
1903,3006,"","The world of spirits, and the world of the
living...","黃泉與現世。","","영계와 현세","Die Geisterwelt und die Welt der Lebenden ..."
1904,3006,"","The normal and the surreal...","常規與怪異。","","상도와 괴이","Das Normale und das Surreale ..."
1905,3006,"","Even the physical and the digital...","真實與數碼的模糊界線。","","리얼과 디지털의 교차점","Selbst das Analoge und das Digitale ..."
2001,3006,"","Truly, nothing is impossible in this crazy hole
in the wall we call home.","……也就是說，凡事都有可能。","","…즉, 무슨 일이든 있을 수 있다는 거다","In diesem verrückten Loch in der Wand, das unser
Zuhause ist, ist wirklich nichts unmöglich."
3000,5000,"","Use Keyword
Pete/Yoshito Mizushima/Miko
The correct choice is Miko.","使用關鍵字
皮特／水嶋嘉人／咪子
正確的選項為咪子。","","키워드 사용
피트 / 미즈시마 요시토 / 미코
정답인 선택지는 미코","Benutze Stichwort
Pete/Yoshito Mizushima/Miko
Miko ist korrekt."
3001,5000,"","Use Keyword
Penalty applied if wrong keyword is chosen.
Proceed as if Pete was chosen.","使用關鍵字
使用錯誤關鍵字將會受到處罰，
您選擇了皮特繼續前進。","","키워드 사용
틀린 키워드 사용으로 페널티 있음
피트를 선택하면 진행할 수 있습니다","Benutze Stichwort
Das falsche Stichwort wird bestraft.
Fahre fort, als ob Pete gewählt wurde."
4000,4041,"","An earthquake? No, I didn't feel anything of the
sort.","地震？　沒有，我沒有感覺啊。","","지진? 아니, 알아차리지 못했는데","Ein Erdbeben? Nein, so etwas habe ich nicht
bemerkt."
4100,4262,"","Welcome! Grab a drink, have a seat, and stay as
long as you like!","歡迎光臨～　請您慢慢坐——","","어서오세요~ 천천히 둘러보세요","Willkommen! Hol dir was zu trinken, setz dich
und bleib solange du willst!"
4200,2001,"","Let's head for the K-Cafe. Old Man Mizushima
should hopefully be there at this hour...","去K-Cafe看看吧。
現在這個時間，水嶋老人會在嗎……？","","K-카페로 가 보자
이 시간이라면 미즈시마 할아버지가 있을까…?","Gehen wir zum K-Café. Der alte Mizushima sollte
um diese Zeit da sein ..."
4250,2000,"","Let's head for the K-Cafe.","去K-Cafe看看吧。","","K-카페로 가 보자","Gehen wir zum K-Café."
