ID,Speaker,Japanese,English,Chinese,EnglishCensored,Korean,German
100,4408,"","Eeeee! I found Jimiken's first single!!!
Jimiken was so cute even back then!!!","呀啊～！　發現吉米肯的第一張單曲了！
這時候的吉米肯還很可愛呢！！","","꺄―! 지미켄의 퍼스트 싱글을 찾았어!
이 시절의 지미켄, 엄청 귀여워―!!","Oooh! Ich habe die erste Single von Jimiken
gefunden! Schon damals war Jimiken so süß!"
150,4409,"","I listened to this album on a whim and really
liked it. Ever since, I've always enjoyed coming
by this store.","這張專輯聽起來的感覺非常棒。
就是因為會有這樣意外的發現，我才喜歡逛唱片行呢。","","이 앨범, 한번 들어 봤는데 엄청 좋은 느낌이었어
이런 뜻밖의 만남도 있어서, 매장에 들르는 게 좋아","Ich habe mir das Album zufällig angehört und es
hat mir sehr gefallen. Seitdem komme ich immer
gern in diesen Laden."
200,4060,"","If you don't see the CD you'd like, I can
backorder it for you, so don't hesitate to ask.","如果找不到想聽的CD，我們也可以為您調貨哦。
若有需要請儘管提出。","","듣고 싶은 CD가 없으면, 주문도 가능해요
편하게 상담하러 와 주세요","Wenn du die CD, die du möchtest, nicht finden
kannst, kann ich sie für dich bestellen.
Frag also ruhig nach."
250,4003,"","There's just something about flipping through a
rack of CDs that's not like anything else!","CD這種東西，果然還是要到店裡邊看封面邊找，
感覺才對啊！","","역시 CD는, 매장에서 커버를 보면서 찾지 않으면
기분이 안 난다니깐―!","Ach, nichts ist schöner, als in einem Regal mit
CDs zu stöbern!"
300,4001,"","Look at this spectacular lineup!
Surrounded by all these CDs, I just... I feel...!","請看看這些種類豐富的商品！　
光是受到這麼多CD包圍……我就、我就……！！","","보세요, 이 상품들을!
많은 CD에 둘러싸여 있는 것만으로도… 저는, 저는…!!","Schau dir diese spektakuläre Zusammenstellung an!
Umgeben von all diesen CDs bin ich ... Hach!"
350,4012,"","There, um, there are so many anime CDs here...
It's really the best. And, um, also, today,
Miss Reiko looks really, c-cute...","這、這裡連動畫的CD也很豐富……真的是太棒了。
……不、不過話說回來，田和玲子小姐今天也……很、很可愛啊。","","여, 여기는 애니메이션의 CD도 충실해서… 정말 최고예요
…그, 그건 그렇고 오늘의 타와 레이코 씨도… 귀, 귀여워","Hier, ähm, gibt es so viele Anime-CDs ...
Der Laden ist wirklich der beste. Ach und, äh,
Fräulein Reiko sieht so s-süß aus ..."
5000,4060,"","It's [p], master Cyber Sleuth!
Thank you for your help before!
Etemon and I have become fast friends.","啊！　是電腦偵探[p]！
上次真的很感謝你！
我跟悟空獸已經成為好朋友了♪","","아! 전뇌탐정 [p] 씨!
그때는 감사했습니다!
에테몬 씨와는, 이제 완전히 친구가 됐어요♪","[p], der meisterhafte Cyber-Detektiv!
Danke noch mal für deine Hilfe!
Etemon und ich haben uns schnell angefreundet."
5001,4060,"","...Hm? You're surprised I'm not afraid of Digimon?","……咦？　你問我會不會怕數碼寶貝？","","…에? 디지몬이 무섭지 않냐고요?","Hm? Du bist überrascht, dass ich vor Digimon
keine Angst habe?"
5002,4060,"","Of course I'm not! Music is what joins the world
together... Once we could commune together through
music, it didn't take long to become friends.","我完全不怕哦！　音樂能把不同的世界連結在一起……
只要一起談論音樂，馬上就成為朋友了！","","전혀 괜찮아요! 음악은 세계를 잇는 것…
함께 음악으로 이야기를 나누면, 바로 친구가 될 수 있어요!","Natürlich nicht! Musik bringt Leute zusammen ...
Seit wir musikalisch kommunizieren können,
sind wir schnell Freunde geworden."
5010,4060,"","Did you hear about what the Demons' Jimiken did?
Using music for evil...unforgivable!","你有聽說由惡魔亂舞的吉米肯所引發的那個事件嗎？
居然把音樂用在做壞事上，我饒不了他！","","데몬즈의 지미KEN이란 사람이 일으킨 사건,
들으셨어요? 음악을 나쁜 일에 사용하다니… 용서할 수 없어요!","Hast du gehört, was Jimiken von den Demons getan
hat? Er hat Musik für böse Zwecke eingesetzt ...
Unverzeihlich!"
5011,4060,"","...Ah? [p],
you were the one who resolved everything?","……咦？　
解決那個事件的人是[p]？","","…에?
사건을 해결한 게, [p] 씨인 건가요?","... Ach? [p],
du hast den ganzen Fall gelöst?"
5012,4060,"","That's wonderful! As befitting a Cyber Sleuth.
As a music-lover, I give you my thanks!","好厲害！　真不愧是電腦偵探呢♪
身為一個熱愛音樂的人，我要好好感謝你！","","굉장해요! 역시 전뇌탐정님이네요♪
음악을 사랑하는 한 사람으로서, 감사를 표할게요!","Wunderbar! Wie es sich für einen Cyber-Detektiv
gehört. Als jemand, dem Musik wichtig ist,
danke ich dir!"
5020,4060,"","Etemon's CD has been selling rather steadily.","最近悟空獸的CD賣得還不錯呢。","","최근, 에테몬 씨의 CD가 가끔 팔리고 있어요","Die CD von Etemon hat sich über längere Zeit gut
verkauft."
5021,4060,"","With such musicality at its core, it can only be
received well.","這表示大家慢慢接受
他那熱情的曲風了對吧！","","그 독창적인 음악성이
받아들여지고 있다는 거겠죠!","Wenn man so musikalisch ist,
kann das einfach nur gut ankommen."
5022,4060,"","While Etemon has some frightening sides, his
single-minded attention to music is wonderful.","悟空獸有些地方是挺可怕的，
不過他總是很認真地面對音樂，所以我很喜歡他♪","","에테몬 씨는, 조금 무서운 점도 있지만
진지하게 음악을 바라보고 있어서, 전 좋아해요♪","Etemon mag furchterregende Seiten haben, aber
seine völlige Hingabe zur Musik ist wunderbar."
5030,4060,"","Actually, Etemon and I have grown quite close.
After hours, we debate music late into the night.","其實我跟悟空獸的私交還不錯，
常常會在店裡打烊後跟他暢談音樂呢。","","실은 저, 에테몬 씨와 개인적으로 친하게 지내서
폐점 후에, 자주 음악 이야기로 꽃을 피우고 있어요","Ehrlich gesagt, stehen Etemon und ich uns wirklich
nah. Nach dem Feierabend reden wir nachts
stundenlang über Musik."
5031,4060,"","Lately he invited me to come visit his world...","他最近一直邀請我到他那邊的世界去……","","최근에,「이쪽 세계로 놀러 와」라고
초대를 받았는데요…","Vor Kurzem hat er mich eingeladen,
ihn in seiner Welt zu besuchen ..."
5032,4060,"","It's not a problem to go there, is it?
I mean, it's not as though I could never return to
the real world...right?","去那邊也沒關係吧？
應該不會發生再也回不了現實世界……之類的事吧？對吧？","","이건, 가도 괜찮겠죠?
두 번 다시 현실 세계로 돌아오지 못한다던가… 그럴 일은 없겠죠? 네?","Es ist kein Problem, dort hinzukommen, oder?
Schließlich kann ich ja immer in die echte
Welt zurückkehren ... nicht wahr?"
5040,4060,"","Hello, [p]!
I went to visit Etemon the other day.","啊，[p]！
其實我之前有到悟空獸那裡去玩了一趟。","","아, [p] 씨!
저 실은, 얼마 전에 에테몬 씨가 계신 곳에 놀러 갔다 왔어요","Hallo, [p]!
Ich habe Etemon neulich besucht."
5041,4060,"","Our passions for music burned the whole night
through... Etemon told me I was his soulmate.","我們互相吐露彼此對音樂的熱情，忘我地聊到了天亮……
悟空獸還說我是他的靈魂伴侶呢。","","서로의 음악을 향한 열정을 아침까지 이야기해서…
에테몬 씨, 저를 소울메이트라고 말씀해 주셨어요","Wir sind die ganze Nacht lang unserer Leidenschaft
für Musik nachgegangen ... Etemon meinte, wir
seien Seelenverwandte."
5042,4060,"","To think a human from the real world and a Digimon
from the digital world could have such a
relationship... Isn't it wonderful?","現實世界的人類居然能跟電腦世界的數碼寶貝
發展成這種關係……　真的很棒對吧♪","","현실 세계의 인간과, 전뇌세계의 디지몬이
그런 관계가 되다니… 멋지네요♪","Dass ein Mensch aus der echten Welt und ein
Digimon aus der Digitalen Welt sich so gut verstehen
können ... Ist das nicht wunderbar?"
5050,4060,"","Oh! [p],
I hope you've been all right!","啊！　[p]！
原來你平安無事啊！","","아! [p] 씨
무사하셨군요!","Ach! [p],
ich hoffe, dir geht es gut!"
5051,4060,"","What a thing to happen!
I'm used to it, due to Etemon, but still...","總覺得事情變得很棘手呢。
我因為跟悟空獸相處較久，已經很習慣了，
所以並不會感到特別在意，可是……","","왠지 큰일이 되어 버렸네요
전 에테몬 씨와 지낸 적이 있어서 익숙하니까 괜찮지만…","Was für ein Schock!
Ich bin wegen Etemon dran gewöhnt,
aber trotzdem ..."
5052,4060,"","...What's to become of us now?","接下來，
究竟會變得如何呢……","","…앞으로,
대체 어떻게 되는 걸까요","... Was wird jetzt aus uns werden?"
5060,4060,"","When the Digimon started appearing in the real
world, I was startled at first...","當數碼寶貝們開始在現實世界裡現身後，
我一開始也感到有些害怕……","","디지몬들이 현실 세계에 나타나게 돼서
처음엔 조금 무서웠지만…","Als die Digimon anfingen, in der echten Welt
zu erscheinen, war ich erst erschrocken ..."
5061,4060,"","But it meant I could speak directly with Etemon,
and music-loving Digimon could come to the shop.","但現在能直接跟悟空獸玩，
而且喜歡音樂的數碼寶貝也會到店裡來光顧。","","에테몬 씨와 직접 놀 수 있기도 하고
음악을 좋아하는 디지몬도 매장에 찾아오게 되었어요","Aber es bedeutete, dass ich direkt mit Etemon
sprechen konnte und dass Musik liebende Digimon
in den Laden kamen."
5062,4060,"","A world with that isn't so bad.","像這種世界也不錯吧♪","","이런 세계도, 나쁘지 않네요♪","Eine Welt, in der das passiert, ist nicht
schlecht."
5070,4060,"","The other day, Etemon gave me a pair of sunglasses
as a ""soulmate gift.""","之前悟空獸送了我一副墨鏡，
說是作為靈魂伴侶的證明。","","얼마 전에, 에테몬 씨에게서
소울메이트의 증표로, 선글라스를 받았어요","Neulich hat Etemon mir eine Sonnenbrille gegeben,
als ein „Geschenk für Seelenverwandte“."
5071,4060,"","I think they're actually one of Etemon's spares,
so they really seem expensive and rare...","那副墨鏡跟悟空獸戴的好像是一對的，
而且似乎是很昂貴的稀有款式……","","아무래도 에테몬 씨가 쓰고 계시는 선글라스의 예비용인 모양이라
고가에 레어한 물건인 것 같은데요…","In Wirklichkeit ist es wohl die Ersatzbrille von
Etemon. Sie sieht sehr teuer und exklusiv aus ..."
5072,4060,"","But I can't wear them while speaking with
customers... I don't know what to do.","但是我不能在店裡戴著墨鏡接待客人……
該怎麼辦才好呢……","","매장에서 선글라스를 쓰고 접객할 수도 없고…
어떻게 해야 좋을까요…","Ich kann sie aber nicht tragen, wenn ich mit
Kunden spreche ...
Ich weiß nicht, was ich tun soll."
5080,4060,"","Ehh-feee-mee-ralll hummingbiiiird~","苦～戀～的蜂鳥♪","","애달~ 프은~ 허밍 버드으으♪","Kuuurzleeebiiigeeer Koliiibriiiii~"
5081,4060,"","Oh! [p]!
Sorry, I'm still working...","啊！　[p]！
對不起，我這人真是的，居然在上班時唱起歌來……","","앗! [p] 씨!
죄송해요, 저도 참 근무중에…","Ach! [p]!
Ich muss leider noch arbeiten ..."
5082,4060,"","Lately, more than just listening to music,
I've been interested in singing...
I wonder if I could form a band with anyone?","我最近不只是聽音樂，還對唱歌產生了興趣。
啊～啊，我也好想跟別人組個樂團哦。","","저 최근, 음악을 듣는 것만이 아니라, 부르는 쪽에도 흥미가 있어서…
아~아, 저도 누군가랑 밴드 같은 걸 짜고 싶어요","In letzter Zeit höre ich nicht nur Musik, ich habe
auch angefangen zu singen ... Ob ich wohl mit
jemandem eine Band gründen könnte?"
5090,4060,"","Lately, Etemon has really been down in the dumps.
It seems he's worried about his ""musicality""...","悟空獸最近好像沒什麼精神。
似乎是在為自己的“音樂性＂煩惱的樣子。","","최근에 정말, 에테몬 씨의 기운이 없어요
아무래도 자신의 ""음악성""에 대해 고민하고 계신 것 같아서…","Etemon war in letzter Zeit so niedergeschlagen.
Er scheint sich um seine „Musikalität“ zu sorgen."
5091,4060,"","I want to help, but it's the sort of thing an
artist needs to get past on his own to advance...","我很想助他一臂之力，
但為音樂性煩惱是每一位歌手的必經之路……","","힘이 되어 주고 싶은데
아티스트가 음악성에 대해 고민하는 건, 피할 수 없는 일이고…","Ich möchte ihm helfen, aber mit so was muss ein
Künstler allein fertigwerden, um
weiterzukommen ..."
5092,4060,"","All I can do is be there to support him.","我只能在一旁溫柔地守護他嗎……","","…그저 지켜볼 수밖에 없는 걸까요","Ich kann nichts tun, außer für ihn da zu sein."
5100,4060,"","Apparently, Etemon used to be in a band with some
Digimon friends.","聽說悟空獸以前曾經跟志同道合的數碼寶貝
合組過樂團。","","예전에 에테몬 씨는, 마음이 맞는 동료 디지몬들과
밴드를 짰었다고 해요","Früher war Etemon wohl in einer Band mit ein paar
Digimon-Freunden."
5101,4060,"","But their musical styles were different,
so they ended up breaking up.","不過後來卻因為音樂性的差異而產生對立，
最後不歡而散……","","하지만 음악성의 차이로 대립해서
해산한 모양이라…","Aber sie konnten sich auf keine Musikrichtung
einigen, also hat die Band sich aufgelöst."
5102,4060,"","Etemon's been worrying so about his musicality.
Maybe his old friends could offer some advice.","既然悟空獸似乎正在為音樂性煩惱，
如果是以前的同伴，或許會給他不錯的建議呢。","","에테몬 씨, 음악성에 대해 고민하고 계신 것 같으니, 예전 동료라면
좋은 어드바이스를 해 줄지도 모르는데 말이죠","Etemon macht sich solche Sorgen wegen seiner
Musikalität. Vielleicht könnten seine Freunde von
damals ihm Ratschläge geben."
5110,4060,"","Etemon used to be in a band with Gekomon and
Shogun Gekomon.","據說悟空獸以前是跟「怪蛙獸」和「怪蛙皇」
一起組樂團的。","","에테몬 씨는 예전에,「개굴몬」과「왕개굴몬」과
함께 밴드를 짰었던 것 같아요","Früher war Etemon in einer Band mit Gekomon
und ShogunGekomon."
5111,4060,"","Both Gekomon and Shogun Gekomon ought to be here
in the real world somewhere...","怪蛙獸和怪蛙皇
應該都存在於這個世界的某處才對……","","개굴몬도 왕개굴몬도,
이 세계의 어딘가에 있을 거예요…","Sowohl Gekomon als auch ShogunGekomon sollten
irgendwo hier in der echten Welt sein ..."
5112,4060,"","If only I could have Etemon meet with his old
friends. Surely it would help ease his worries...","如果能讓為音樂性煩惱的悟空獸
跟以前的同伴碰面就好了……","","음악성에 대해 고민하고 있는 에테몬 씨를
예전 동료와 만나게 해 주면 좋을 것 같은데요…","Wenn ich es doch nur arrangieren könnte, dass
Etemon seine Freunde von damals wiedersieht.
Das würde ihm sicher helfen ..."
5120,4060,"","Lately, the world's music scene has been on fire!","最近全球的音樂風格越來越多變了！","","최근, 세계의 음악 세계가 점점 열기를 띠고 있어요!","In letzter Zeit ist in der Musikszene
weltweit einiges los!"
5121,4060,"","Ever since Digimon appeared, the chaos has amped
up this ""end of the world"" feel! So I thought I'd
follow the music's lead.","數碼寶貝的登場再加上這個混沌世界的“世紀末＂感！
我也差不多該伴隨音樂唱出屬於自己的歌了♪","","디지몬의 등장, 그리고 이 혼돈한 세계의 ""세기말""감!
…저도 슬슬, 음악으로 자신을 표현할까 해요♪","Seit die Digimon aufgetaucht sind, herrscht noch
mehr Chaos und Endzeitstimmung! Also dachte ich,
ich lasse mich davon musikalisch inspirieren."
5122,4060,"","Come to think of it, there was a band brimming
with that end of the world feel that messed up
EDEN, right? Jimmy...somebody was the vocalist?","這麼說來，之前在EDEN有個轟動一時、充滿世紀末感的
樂團呢。　我記得主唱是叫吉米什麼的。","","그러고 보니, 한때 EDEN을 뒤흔든, 세기말감이 넘쳐 흐르는
밴드가 있었죠… 지미… 어쩌고 씨가 보컬인 밴드요","Da fällt mir ein, dass es eine Band gab, die
Endzeitstimmung verbreitete und in EDEN für Chaos
sorgte. Jimmy ... Dingsda war der Sänger?"
5130,4060,"","[p]...
Sorry for making you worry.","[p]。
似乎讓你為我擔心了，真是對不起。","","[p] 씨
걱정을 끼쳐 드린 것 같아서, 죄송해요","[p] ...
Tut mir leid, dass du dir Sorgen gemacht hast."
5131,4060,"","But it seems like Etemon was able to meet up with
his old friends, so everything worked out!","不過，悟空獸好像也已經跟以前的同伴碰面了，
這麼一來，所有的事情都解決了呢！","","하지만, 에테몬 씨도 예전 동료들과 무사히 만나신 것 같고
이것으로 만사 해결이네요!","Aber Etemon konnte sich wohl mit seinen Freunden
von damals treffen und alles ist wieder gut!"
5132,4060,"","Well, for live shows, it all starts here.
Please go have a blast!","好啦，演唱會才正要開始。
請盡情享受吧♪","","자, 라이브는 지금부터 시작이에요
마음껏 즐기다 가세요♪","Was Liveshows angeht, beginnt alles hier.
Bitte lass es krachen!"
5140,4060,"","Oh! [p]!
Welcome back.","啊！　[p]。
歡迎光臨♪","","아! [p] 씨
어서 오세요♪","Ah! [p]!
Willkommen zurück."
5141,4060,"","Etemon and Jimmy...
So many things happened in so short a time...","悟空獸的事與吉米先生的事。
雖然在這短短時間內發生了許多事情……","","에테몬 씨의 일, 지미 씨의 일
짧은 기간 동안 다양한 일이 있었지만…","Etemon und Jimmy ...
In so kurzer Zeit ist so viel geschehen ..."
5142,4060,"","But no matter what, music was playing! It goes to
show, ""no music, no life"" is the real truth!","但那些地方總是充滿著音樂！
果然還是No Music No Life！對吧！！","But no matter what, music was playing! It goes to
show music is the soundtrack of our lives!","항상 그곳에는 음악이 흐르고 있었어요!
역시, NO 뮤직 NO 라이프, 네요!!","Aber egal, was war, es war immer Musik zu hören!
Es stimmt also doch: Musik ist Leben!"
