ID,Speaker,Japanese,English,Chinese,EnglishCensored,Korean,German
1000,4041,,"Benvenuto!
Prego, mettiti pure a tuo agio.","哎呀，歡迎光臨！
請坐著慢慢休息吧。",,"아, 어서 오세요!
느긋히 쉬다 가렴","Willkommen!
Fühl dich ganz wie zu Hause."
1050,4041,,"Ah... Kyoko...
Giusto, b-benvenuto!","唉……杏子小姐……
哎、哎呀，歡迎光臨！",,"하아…… 쿄코 씨……
이, 이런, 어서 오세요!","Ach ... Kyoko ...
Äh, w-willkommen!"
1100,4262,,"Posso prendere il suo ordine?
Raccomando la nostra miscela di caffè speciale!","您要點餐嗎？
我推薦這個特調綜合咖啡！",,"주문하시겠어요?
추천은 스페셜 블렌드 커피입니다!","Darf ich deine Bestellung aufnehmen?
Ich empfehle unsere spezielle Kaffeemischung!"
1101,4262,,"È il nostro prodotto più venduto del menu delle
bevande, e per una buona ragione!","這是菜單裡面價格最高的飲料，
但喝起來可不同凡響哦♪",,"드링크 메뉴 중에서는 가장 비싸지만
그만큼 가치 있는 한 잔이에요♪","Das ist unser Verkaufsschlager,
aus gutem Grund!"
1150,4262,,"Non importa quanto le cose diventino assurde
fuori, siamo aperti e felici di servire!
Che ne dici di una tazza della nostra miscela speciale?","無論發生什麼事，本店依然熱情營業中！
要不要來杯特調綜合咖啡呢♪",,"그 어떤 소동이 벌어져도, 저희 가게는 힘차게 영업중!
스페셜 블렌드 커피는 어떠신가요♪","Egal, wie durchgeknallt es da draußen zugeht, wir
haben geöffnet und bedienen gerne!
Wie wär’s mit einer Tasse unserer Spezialmischung?"
2000,4041,,"Apprezziamo sempre la tua attività. E saluta
la signorina Kuremi, ahaha.","非常感謝您的光臨……
請替我向暮海小姐問好……　嗚嗚。",,"매번 감사합니다…
쿠레미 씨에게도 안부 잘 전해 주렴… 흑흑","Wir wissen es zu schätzen, dass du zu uns kommst. 
Und grüße Ms. Kuremi, haha."
2100,4262,,"Okay, di quanto hai bisogno stavolta? Hee hee hee!",好～啦，這次會增加多少呢～？　呵呵呵呵呵♪,,"그~럼, 이번에는 얼마나 오를까~? 우후후후후♪","Okay, wie viel brauchst du dieses Mal? Hihihi!"
