ID,Japanese,English,Chinese,EnglishCensored,Korean,German
1,,"Non c'è nessun Digimon destinatario, quindi il messaggio
non può essere inviato.",由於沒有可發送訊息的數碼寶貝，因此無法發送訊息,,"송신 대상의 디지몬이 존재하지 않아
메시지를 보내지 못했습니다.","Kein Empfänger-Digimon vorhanden.
Nachricht konnte nicht gesendet werden."
2,,Ricevuti [n0] nuovi messaggi.,收到[n0]件新訊息,,신규 메시지 [n0]건 수신,[n0] neue Nachrichten.
100,,"Ci sono Digimon di livello massimo nella fattori,
incluso [d0].","像是[d0]等等，
農場島裡有好幾隻LV MAX的數碼寶貝囉",,"[d0] 등, 팜에 
몇 마리 정도 최대 레벨에 도달한 디지몬이 있어","Auf der Farm sind Digimon auf
Höchstlevel, unter anderem [d0]."
101,,"[d0] nella fattoria è al livello massimo.","農場島裡的[d0]
已經達到LV MAX了呢",,"팜의 [d0]이(가)
Lv. MAX가 된 것 같아.","Auf der Farm hat [d0]
das Höchstlevel erreicht."
200,,"Comando di addestramento Farm [n0] completato!
Per favore, dai un comando alla tua DigiFarm.","農場島[n0]的特訓指令已執行完畢
記得去數碼農場發出指令唷",,"팜 [n0]의 특훈지시가 완료되었어.
디지팜에서 지시를 내려줘.","Trainingsbefehl auf Farm [n0] beendet!
Erteile deiner Digifarm einen Befehl."
300,,"Comando di sviluppo Farm [n0] completato!
Sviluppo di [d0] riuscito.","農場島[n0]的開發指令已執行完畢
似乎成功開發出了[d0]喔",,"팜 [n0]의 개발지시가 완료되었어.
[d0]의 개발에 성공한 것 같아.","Entwicklungsbefehl auf Farm [n0]
beendet! [d0] erfolgreich entwickelt."
400,,"Comando di indagine Farm [n0] completato!
Trovati [n1] casi.","農場島[n0]的調查指令已執行完畢
似乎發現了[n1]件委託喔",,"팜 [n0]의 조사 지시가 완료되었어.
의뢰를 [n1]건 발견한 것 같아.","Ermittlungsbefehl auf Farm [n0] beendet!
[n1] Fall/Fälle gefunden."
401,,"Comando di indagine Farm [n0] completato.
Nessun nuovo caso, ma trovati [d0].","農場島[n0]的調查指令已執行完畢。
雖然調查沒有斬獲，但似乎發現了[d0]喔",,"팜 [n0]의 조사지시 완료. 의뢰 조사는 없었지만
[d0]을 발견한 것 같아.","Ermittlungsbefehl auf Farm [n0] beendet!
Kein neuer Fall, aber [d0] gefunden."
1101,,"Ehi, è vero quello che dicono di tutti gli umani
spaventosi?",吶吶，我聽說人類有很多可怕的傢伙，是真的嗎？,,"저기저기, 인간 중엔 무서운 사람이 많다는 게 진짜야?","Sag mal, stimmt es, was man über all die
grusligen Menschen sagt?"
1102,,"Allenarsi non è divertente, portami subito fuori!",訓練什麼的好無趣……快帶我去外頭！,,트레이닝 같은건 재미없어…빨리 밖으로 데려가줘―!,"Das Training macht keinen Spaß,
nimm mich endlich mit!"
1103,,"Ho fatto un sogno pazzesco stanotte! Era tipo, uh...
ehm... cavolo, me ne ero dimenticato.","我昨天做了一個很有趣的夢喔！　聽我說、聽我說！
唔～嗯……啊咧，我不記得了",,"어제 재미있는 꿈을 꿨어! 있잖아 있잖아!
그게 그게… 어라, 잊어버렸네.","Letzte Nacht hatte ich einen irren
Traum, äh ... ähm ... Mist, vergessen."
1104,,"Oggi mi sono svegliato prima del solito!
Non sono un bravo Digimon?","我今天比平時還要早起床喔！
吶，快誇我、快誇我！",,"오늘은 평소보다 빨리 일어났어!
자자, 칭찬해줘 칭찬해줘!","Ich bin heute früher aufgewacht als
sonst! Bin ich nicht ein gutes Digimon?"
1105,,"Un altro Digimon mi ha invitato provare questa cosa
di DigiLine. Alla gente piace?","因為其他數碼寶貝的邀請，所以我試了一下……
數碼連線好困難呢，大家都喜歡這樣做嗎？",,"다른 디지몬이 권유해서 해 봤는데…
디지라인은 어렵네. 다들 이런게 재밌는거야?","Ein Digimon sagt, ich soll dieses
Digiline-Zeug probieren. Macht das Spaß?"
1106,,"La prossima volta portami un regalo dall'esterno!
Qualcosa di buono, ok? Promesso?","下次你來玩的時候，我想要外頭的土產吶！
例如說好吃的東西之類的，吶～可以吧～？",,"다음에 놀러올 땐 바깥에서 선물을 사다줘!
맛있는거 같은걸로. 응? 괜찮지?","Bring mir nächstes Mal ein Geschenk von
draußen! Was Leckeres, ja? Versprochen?"
1107,,"Quei hacker cattivi di EDEN fanno un po' spavento...
Non hai paura di loro?","在EDEN裡的壞蛋駭客，有點可怕呢……
你不覺得害怕嗎？",,"EDEN에 있는 나쁜 해커는 좀 무섭네에…
넌 무섭지 않아?","Die fiesen EDEN-Hacker sind irgendwie
unheimlich. Hast du keine Angst?"
1108,,"Non ho voglia di pulire la Fattoria oggi...
Forse dovrei andare a dirlo a Mirei?","今天輪到我打掃農場島，真提不起幹勁啊……
現在去跟米蕾說「我不幹」吧？",,"오늘은 팜 청소당번이야. 하기 싫다…
지금이라도 미레이한테「싫어」라고 말하고 올까?","Ich will heute nicht die Farm putzen ...
Vielleicht sollte ich das Mirei sagen?"
1109,,"Uno di voi “detective” può aiutarmi a indagare!
E' vero?","聽說在名為偵探的人類指導下，
就會變得很擅長調查！　你也是偵探對吧？",,"탐정이라는 이름을 가진 인간에게 배우면 조사가
잘 된대! 너도 탐정이지?","Einer von euch „Detektiven“ kann mir
beim Ermitteln helfen! Stimmt das?"
1110,,"Ultimamente mi piace molto prendere il sole.
Spaziare sotto il Signor Sole è il massimo!","我最近喜歡上了日光浴～
我很喜歡像這樣在太陽底下發呆的時光……",,"요즘엔 일광욕을 좋아해. 이렇게 햇님
아래에서 멍하니 있는 시간이 좋아...","In letzter Zeit sonne ich mich so gerne.
Mit Frau Sonne ist es am schönsten."
1111,,Oggi mi sento un po' fiacco...,嗚……總覺得身體好沉重，很倦怠……,,우…어쩐지 몸이 무겁고 나른해…,Ich bin heute etwas träge ...
1112,,"Ehi, che genere di cose ti piacciono?
Non so molto di te...","吶，告訴我你喜歡什麼吧！
話說回來，我似乎不太了解你呢",,"저기, 네가 좋아하는 걸 가르쳐줘!
생각해보니 너에 대해 잘 모르고 있는 것 같아서","Hey, was magst du so?
Ich weiß nicht gerade viel über dich ..."
1113,,"""Investigare"" significa cercare casi o oggetti,
giusto? Beh, farò del mio meglio!","所謂調查，就是去尋找委託或道具對吧？
聽起來很困難呢……但我會努力的！",,"조사란건 의뢰나 아이템을 탐색하는거지?
어려울 것 같네…그래도 열심히 해볼게!","Ermitteln heißt, Fälle oder Items
suchen, ja? Ich gebe mein Bestes!"
1114,,"Il solo allenamento può davvero renderti più forte?
Bene, mettiamoci al lavoro!","嗯～只有這項訓練，真的能夠變強嗎？
多進行一些訓練吧！",,"으음, 정말로 이곳의 트레이닝만으로 강해
질 수 있는걸까? 좀 더 트레이닝 해보자!","Kann Training allein einen wirklich
stärker machen? Probieren wir’s aus!"
1115,,"Un amico mi ha chiesto cosa farei se diventassi
un essere umano, ma non mi viene in mente nulla...","前陣子朋友問我，如果變成人類，想做些什麼？
……但我腦筋一片空白",,"얼마 전에 인간이 되면 뭘 하고 싶어? 하고 친구가
물어봤는데…아무것도 떠오르지 않았어.","Ein Freund hat gefragt, was ich als
Mensch tun würde – keine Ahnung ..."
1116,,"Ehi, che tipo di musica ti piace?
Porta la tua canzone preferita la prossima volta!","吶，你平時都聽哪種音樂呀？
下次告訴我你喜歡的曲子吧！",,"있잖아, 너는 평소에 어떤 음악을 들어?
이번엔 네가 좋아하는 곡을 가르쳐줘!","Hey, was für Musik magst du? Bring
nächstes Mal dein Lieblingslied mit!"
1117,,"Ehi! È vero che c'è del cibo umano che
sembra una nuvola? Voglio toccarlo!","吶吶！　我聽說人類的食物之中，
有像天上的雲朵一樣的食物，是真的嗎？　我想摸看看！",,"저기저기, 인간들의 음식 중엔 구름 같은 것이 있다는게
진짜야? 만져보고 싶다!","Gibt es echt Menschenessen, das aussieht
wie Wolken? Das will ich anfassen!"
1118,,"Mirei mi ha detto di parlarti di più,
quindi lo farò! A presto!","米蕾要我和你多多交流
所以讓我們多多聊天吧！　我會再和你聯絡～！",,"미레이가 너와 커뮤니케이션을 하라고 했으니까
더 이야기하자! 또 연락할게!","Mirei sagt, ich soll mehr mit dir reden,
also tue ich das! Bis bald!"
1119,,"Ehi, giochiamo a ""Luce rossa, luce verde"" quando hai
di nuovo tempo. Per favore?","吶，下次一起玩「123木頭人」吧？
等你有空時再陪我就行！……可以嗎？",,"저기, 다음에 같이「무궁화 꽃이 피었습니다」하고 놀자!
시간이 있을 때라도 괜찮아!   …싫어?","Hey, spielen wir „Ochs am Berg“, wenn
du wieder Zeit hast? Bitte, bitte!"
1120,,"Sapevi che quest'isola ha una ferrovia?
Significa che una volta c'era un treno?","你知道這座島上有短途鐵軌嗎？
也就是說，以前這裡有電車～？",,"이 섬에는 짧은 선로가 있는데 알고 있어?
그렇단건 옛날엔 여기에 전차가 다녔단 뜻?","Wusstest du, dass es auf der Insel
Schienen gibt? Fuhr hier mal ein Zug?"
1121,,"Scuotere gli alberi della fattoria fa cadere i frutti!
Li adoro, ma non ne posso sopportare troppo.","農場島裡的樹，只要搖一搖，就會有果實掉落喔！
雖然很好吃，但我被教訓說不能拿太多",,"팜에 있는 나무는 흔들면 열매가 떨어져!
맛있지만 너무 떨어뜨리면 안된다고 그러더라.","Schüttelt man die Bäume, fallen Früchte
runter. Köstlich, aber so sättigend."
1122,,"Oh, OH,
domanda! Che tipo di persona è tua madre?","來來，我～有問題！
你的媽媽，是什麼樣的人？",,"저요저요, 질―문!
너희 엄마는 어떤 사람이야?","Oh, oh, Frage!
Was ist deine Mama für ein Mensch?"
1123,,"Ehi, raccontami dei tuoi amici!",吶，告訴我你的朋友的事吧！,,"저기, 네 친구에 대해 가르쳐줘―!","Hey, erzähl mir was über deine Freunde!"
1124,,"Voglio diventare abbastanza forte per
aiutarti, quindi insegnami un sacco di cose fantastiche!","能夠變得更強、幫上你的忙的話，我會很開心！
所以教我更～多知識吧！",,"더 강해져서 너에게 도움이 되면 기쁘겠는걸!
그러니까 이것저것 잔뜩 가르쳐줘!","Ich will stark genug werden, um dir zu
helfen, also zeig mir die coolen Moves!"
1125,,"Hai davvero avuto un incidente facendo volare un
aquilone a scuola?","吶吶！　聽說你小學的時候，因為想飛上天空，
所以跨在掃把上玩，結果摔成骨折，是真的嗎～？",,"저기저기, 초등학생 때 하늘을 날고 싶어서 빗자루에
올라타고 놀다가 뼈가 부러졌다는게 진짜야?","Hattest du in der Schule echt einen
Unfall beim Drachenfliegen?"
1126,,"Ciao, hai fratelli o sorelle?",吶吶，你有兄弟姊妹嗎？,,"저기저기, 넌 형제같은거 있어?",Hast du eigentlich Geschwister?
1127,,"Il mio amico ha detto che la fattoria è sicura,
ma fuori è pericoloso, vero? Che paura.","朋友們說農場島裡很安全
不過外頭更危險吧？　嗚嗚，好可怕……",,"팜은 안전하다고 친구가 그랬어.
그렇지만 바깥은 더 위험한거지? 으으 무서워…","Mein Freund sagt, die Farm ist sicher,
aber draußen ist es gefährlich. Gruslig."
1128,,"Oggi ho sonno... prendiamocela comoda.
Sarebbe più divertente così, no?","今天也好想睡……我想過得更悠閒吶
悠哉過活比較快樂吧？",,"오늘도 졸려… 좀 더 느긋하게 지내고 싶다아.
그러는 편이 즐겁잖아?","Ich bin heute müde ... Mach langsam,
dann macht alles mehr Spaß, ja?"
1129,,"Ho sentito dire che le danze popolari dei Digimon
stanno diventando popolari. Non vedo il problema...","你知道嗎～？現在數碼歌舞伎似乎很流行唷。
數碼松數碼衛門，一樣是數碼寶貝喔！",,"그거 알아? 지금 디지가부키라는게 유행하고 있대.
디지마츠 디지에몽, 같은 디지몬이라구!","Digimon-Kabuki soll gerade angesagt
sein. Weiß nicht, was so toll daran ist."
1130,,"Non sono ancora abituato alla presenza di tutti qui.
Sarebbe bello se andassimo d'accordo, però!","唔……其實，我和這裡的大家還不太熟
雖然我很想很想和它們融洽地聊天",,"우... 실은, 아직 여기에 있는 모두와 아직 친해지지 못했어.
사실은 더 더 친하게 대화하고 싶은데에.","Ich hab mich noch nicht an alle gewöhnt.
Aber wir sollten miteinander auskommen."
1201,,"Ora che ci penso, ci sono molti esseri umani
spaventosi là fuori?",我覺得……人類似乎有許多性格可怕的人？,,생각해봤는데… 인간 중엔 무서운 성격인 사람이 많은건가?,"Apropos, gibt es da draußen viele
gruselige Menschen?"
1202,,"Sono stufo di allenarmi sempre qui.
Che ne dici di portarmi fuori adesso?","光是在這裡鍛鍊自己，有點無聊啊
快點帶我去外頭吧？",,"여기서 자신을 단련하기만 하는건 따분하군.
빨리 밖으로 데려가 주지 않겠나?","Ich will nicht dauernd nur trainieren.
Nimm mich doch mal mit nach draußen!"
1203,,"Allora...la scorsa notte ho fatto uno strano sogno.
Vedi, io, uh... cos'era di nuovo?","你願意聽我說嗎？　昨天我做了一個奇妙的夢
那個夢很有趣……唔，是什麼夢呢",,"들어보겠나? 오늘은 조금 이상한 꿈을 꿨어.
그래서 재미있었는데…으음, 뭐였지.","Stellt dir vor, letzte Nacht hatte ich
einen komischen Traum. Ich, äh ... was?"
1204,,"Ho dormito benissimo e mi sono alzato un po' presto.
Oggi sarà una bella giornata!","今天起床時覺得神清氣爽
能這麼早起，今天似乎會是美好的一天呢",,"오늘은 개운하게 일어났어.
빨리 일어났으니 좋은 하루가 될 것 같아.","Ich habe gut geschlafen und war früh
wach. Heute wird ein guter Tag!"
1205,,"Ho visto gli altri farlo, quindi ci ho provato,
ma questa cosa della DigiLine è dura.","農場島裡的數碼寶貝們都在數碼連線
我也試了一下……但果然很困難吶",,"팜 디지몬들이 하고 있길래
처음으로 해 봤는데…디지라인은 어렵군.","Ich wollte es auch mal ausprobieren,
aber dieses Digiline ist kompliziert."
1206,,"Che ne dici di portare qualcosa la prossima
volta che vieni a trovarci? Del cibo sarebbe l'ideale.","下次你來農場島的時候，能準備一些土產之類的嗎？
如果是食物就太感謝了",,"다음에 팜에 올 땐 뭔가 선물같은걸
준비할 수 없나? 먹을거면 고맙겠어.","Bring bei deinem nächsten Besuch doch
eine Kleinigkeit mit. Essen wäre gut."
1207,,"Non ti spaventi quando affronti un hacker cattivo?","當你面對壞蛋駭客的時候
不會感到恐懼嗎？",,"너는 나쁜 해커와 맞설 때
공포를 느끼진 않나?","Hast du keine Angst, wenn du gegen einen
bösen Hacker kämpfst?"
1208,,"Oggi tocca a me pulire la fattoria...
Caspita, che seccatura. Dovrei lamentarmi?","今天似乎輪到我打掃農場島什麼的……
但打掃真是太無趣了，我該找御神樂米蕾抗議嗎",,"오늘은 팜 청소당번인가 뭔가 하는걸 맡았는데…
청소는 너무 지루해. 미카구라 미레이에게 항의해야겠군.","Heute muss ich die Farm putzen ... So
was Ödes. Soll ich mich beschweren?"
1209,,"Sento che gli umani chiamano gli investigatori
esperti ""segugi""... Sei uno di quelli?","人類之中似乎有調查的專家
應該是叫做偵探……你也是偵探嗎？",,"인간 중엔 조사 전문가가 있다고 하더군.
탐정, 이라고 부르나보던데… 너도 그런가?","Die Menschen nennen Profi-Ermittler
„Detektive“. Bist du einer von denen?"
1210,,"Ultimamente mi piace prendere il sole. Quando ho
tempo, vado a rilassarmi sotto un raggio di sole.","我最近很喜歡日光浴。只要有自由時間，
我就會一邊曬太陽，一邊發呆",,"최근엔 일광욕을 좋아하지. 자유시간이 되면 햇빛을
받으며 멍하니 지내고 있어.","In letzter Zeit sonne ich mich gerne.
Das ist meine Freizeitentspannung."
1211,,Ugh... non mi sento tanto bene.,不妙……身體狀況似乎不太好,,안되겠군…아무래도 몸 상태가 좋지 않은 것 같다.,Puh ... Mir geht’s nicht so gut.
1212,,"Che tipo di cose ti piacciono? Non so molto di te.","你喜歡什麼東西？
沒什麼……只是覺得對你還不太了解",,"너는 어떤 것을 좋아하지?
아니…너에 대해 아직 잘 모르는 것 같아서.","Was magst du so? Ich weiß nicht
besonders viel über dich."
1213,,"Le indagini raccolgono casi e oggetti, eh?
Potrebbe volerci un po', ma farò del mio meglio.","所謂調查，就是去尋找委託或道具就好了吧？
似乎是有點花時間的工作，但我會努力的",,"조사는 의뢰나 아이템을 찾아오면 되는건가?
제법 시간이 걸릴 것 같은 작업이지만 열심히 해 볼게.","Ermittlungen bringen Fälle und 
Items? Ich gebe mein Bestes."
1214,,"Dubito fortemente di poter diventare più forte solo
allenandomi... Forse se facessi più ripetizioni?","光是靠這裡的訓練，真的能夠變強嗎……
我抱持懷疑。是否該增加訓練量……",,"정말 여기서 트레이닝만 해도 강해질 수 있을까?
…매우 의문이다. 양을 늘려야할까…","Ob ich nur durch Training stärker werde? 
Durch mehr Wiederholungen vielleicht?"
1215,,"L'altro giorno la mia amica mi ha chiesto cosa
farei se diventassi umana. Non riesco a immaginare...","前幾天朋友問我，如果變成人類，想做些什麼。
變成人類什麼的，現階段我無法想像吶",,"얼마 전 친구가 혹시 인간이 된다면 뭘 하고 싶냐고
묻더군. 인간이 된다니 지금은 상상도 할 수 없겠는데.","Neulich fragte ein Freund, was ich als
Mensch tun würde. Keine Ahnung ..."
1216,,"Che tipo di musica ascolti di solito?
La prossima volta, portane una che ti piace.","你平時喜歡聽什麼樣的音樂？
下次告訴我你喜歡的曲子吧",,"너는 평소에 어떤 음악을 즐겨듣지?
이번엔 네가 좋아하는 곡을 가르쳐줬으면 해.","Was für Musik hörst du so? Bring
nächstes Mal was mit, das dir gefällt."
1217,,"Ho sentito che esiste del cibo umano
a forma di nuvola, lo sai? È buono?","人類的食物中，似乎有種像雲的食物
你知道是什麼嗎？　不知道好不好吃……",,"인간의 음식 중에 구름과 비슷한 것이 있다던데
뭔지 알고 있나? 그건 맛있을까…","Es soll Menschenessen in Wolkenform
geben. Kennst du es? Schmeckt es?"
1218,,"Mirei dice che dovremmo conoscerci
meglio... Ti contatterò di nuovo.","據御神樂米蕾所言，我最好多和你溝通交流……
我會再與你聯絡",,"미카구라 미레이가 너와 좀 더 의사소통을
꾀하는 편이 좋다고 해서… 또 연락하지.","Mirei sagt, wir sollten einander besser
kennenlernen ... Ich melde mich."
1219,,"Ho appena imparato il gioco ""Semaforo rosso,
semaforo verde"", perché non ci giochiamo qualche volta?","同伴們教了我一種叫「123木頭人」的遊戲，
有時間的話，我們一起玩吧？",,"동료에게「무궁화 꽃이 피었습니다」라는 놀이를 
배웠는데 시간이 있다면 같이 해보지 않겠나?","Habe gerade das Spiel „Ochs am Berg“
gelernt. Wollen wir es mal spielen?"
1220,,"Sapevi che c'è una breve ferrovia
su quest'isola? C'era anche un treno?","你知道這座島上有短途鐵軌嗎
在遠古之前，這裡曾有電車運行嗎……？",,"이 섬에 짧은 선로가 있다는 것을 알고 있나?
먼 옛날엔 이곳에 열차가 다녔던 걸까…?","Wusstest du, dass es auf der Insel eine
Bahnstrecke gibt? Gab’s mal einen Zug?"
1221,,"Scuotere gli alberi della fattoria fa cadere i frutti.
Anche se sono gustosi, non ne possiamo prendere troppi.","農場島裡的樹，只要搖一搖，就會有果實掉落
雖然很好吃，但島上規定不可以拿太多",,"팜에 있는 나무는 흔들면 열매가 떨어지지.
맛있지만 지나치게 따지 않는 것이 섬의 규칙이다.","Von den Bäumen fallen Früchte runter.
Lecker, aber ziemlich schwer für uns."
1222,,"Dimmi, che tipo di persona è tua madre?",我方便問你嗎？你的母親是什麼樣的人？,,물어봐도 될까. 네 어머니는 어떤 사람이지?,"Sag mal, was ist deine Mutter für ein
Mensch?"
1223,,"Ehi, che tipo di persone sono i tuoi amici?",吶，你的朋友都是怎麼樣的傢伙？,,"이봐, 네 친구는 어떤 녀석이지?","Hey, wie sind denn deine Freunde so?"
1224,,"Vuoi che diventi più forte qui? Bene, darò il
massimo. Aiutatemi!","……在這裡變強的話，你會很高興吧？
明白了，我會竭盡全力，希望你也能協助我",,"……여기서 강해지면 너는 기뻐하겠지?
알겠다. 힘껏 노력해보지. 너도 협력해줘.","Du möchtest, dass ich hier stärker
werde? Gut, ich gebe alles. Hilf mir!"
1225,,"Ho sentito dire che eri il miglior lavavetri
della tua scuola elementare, è vero?","我聽說……比賽用抹布擦地板時，你經常得到第一名，
是你小學時唯一能自豪的事，這是真的嗎？",,"들은 이야기인데…걸레질 경쟁에서 항상 톱이었다는게
초등학생 시절의 유일한 자랑이었다는게 사실인가?","Du sollst an deiner Schule der beste
Tafelputzer gewesen sein. Stimmt das?"
1226,,"Mi chiedevo solo se hai fratelli o sorelle.",我有點好奇，你有兄弟姊妹嗎？,,조금 신경쓰이는데 너에게 형제는 있나?,"Ich hab mich gerade gefragt, hast du
eigentlich Geschwister?"
1227,,"Qui è così sicuro. È così facile rilassarsi...
ma è davvero una buona cosa?","這裡是安全的地方，讓人很平靜
但是……這麼悠哉沒問題嗎……",,"여기는 안전한 장소인거지. 마음이 진정된다.
하지만…느긋하게 눌러앉아 있어도 되는걸까…","Hier ist es so sicher. So einfach, sich
zurückzulehnen, aber ist das was Gutes?"
1228,,"La vita in fattoria ha un limite. Un po' noiosa, in
realtà.","在農場島裡生活，能做的事也有限
感覺有些無聊吶",,"팜에서는 할 수 있는 것이 한정되어 있는 듯하다.
조금 지루하겠군.","Auf der Farm ist nicht gerade viel los.
Irgendwie langweilig."
1229,,"Le danze popolari dei Digimon sembrano decollare.
Alcuni gareggiano a modo loro, eh?","數碼松數碼衛門的數碼歌舞伎，現在似乎很流行
即使同為數碼寶貝，也有以其他方式戰鬥的傢伙啊",,"디지마츠 디지에몽의 디지가부키가 유행하고 있다던데.
디지몬도 다른 측면에서 싸우는 녀석이 있군.","Digimon-Kabuki scheint angesagt
zu sein. Jedem sein Steckenpferd, was?"
1230,,"Ehi, la verità è che non ho ancora rotto il
ghiaccio con questi ragazzi. Hai qualche idea?","你願意聽我說嗎？　其實，我和大家還是有隔閡
雖然我想和大家更親密地交流……該怎麼做呢",,"들어보겠나? 실은 아직 모두와 마음을 터놓지 못해서
더 친하게 대화하고 싶다곤 생각하지만…어떻게 해야 할지.","Hey, ich bin mit den anderen hier noch
nicht warm geworden. Vorschläge?"
1301,,"Ehi, ci sono molti umani spaventosi là fuori?",吶，人類是不是有很多可怕的傢伙？,,"이봐, 인간 중엔 무서운 녀석이 많은건가?","Gibt es da draußen viele gruselige
Menschen?"
1302,,"Mi annoio ad allenarmi. Lasciate che ne faccia
buon uso! Forza, portatemi fuori di qui.","光是訓練，已經讓我覺得厭倦了。
果然還是需要實戰！　吶，帶我去外頭吧",,"트레이닝만 하는 것도 질렸어. 역시 실전을
해야 하는거잖아! 이봐, 바깥으로 데려가줘―","Das Training wird langweilig. Zeit für
etwas Praxis! Na los, nimm mich mit."
1303,,"Ho fatto un sogno strano stanotte... Uh, non ricordo.
Era anche bello!","那個呀，我昨天做了一個有趣的夢……咦，我夢到什麼
來著？　我可是從剛才就一直想告訴你的說！？",,"있잖아, 오늘은 재미있는 꿈을 꿔서… 응? 어라? 뭐더라?
아까부터 말하고 싶어서 근질근질했었다고!?","Ich hatte einen lustigen Traum ... Mist,
hab ihn vergessen. Der war echt gut!"
1304,,"Mmm, mi sono alzato presto per cambiare...
ma un po' più di tempo non guasterebbe, vero?","啊～難得這麼早起
……再多睡一會兒，也不要緊吧？",,"아― 왠일로 일찍 일어났네.
…좀 더 자도 천벌은 받지 않겠지?","Hm, ich bin mal früh aufgestanden ...
aber etwas Schlaf schadet nicht, oder?"
1305,,"Agli altri sembra piacere questa cosa di DigiLine,
ma... è divertente? Io non lo capisco.","因為其他傢伙都躍躍欲試的樣子，所以我也試了一下
所謂的數碼連線……很有趣嗎？　我真是搞不懂",,"다른 놈들이 즐겁게 하고 있길래 시작해 봤는데
디지라인이란거… 재밌나? 잘 모르겠는거얼","Den anderen scheint dieses Digiline zu
gefallen, aber ... Ich versteh’s nicht."
1306,,"Ehi, portami qualcosa di buono da mangiare la
prossima volta che vieni. Giurami il mignolo!","吶吶，你下次來的時候，記得帶些好吃的來！
說定了喔！",,"이봐이봐, 다음에 여기 올 땐 뭔가
맛있는거라도 가져와줘! 약속하는거다!","Hey, bring mir nächstes Mal was Gutes zu
essen mit. Versprich es mir!"
1307,,"Ci sono un sacco di hacker cattivi a EDEN, vero?
Andarci non ti spaventa?","在EDEN裡，有很多壞蛋駭客出沒吧？
你去那種地方，不覺得害怕嗎？",,"EDEN에는 나쁜 해커가 바글대는거지?
그런 곳으로 가다니 무섭지 않은거야?","Es gibt unzählige böse Hacker in EDEN,
stimmt’s? Fürchtest du dich dort nicht?"
