ID,Speaker,Japanese,English,Chinese,EnglishCensored,Korean,German
101,3001,"","I need to discuss Nokia...of the Rebels.
Can you come to EDEN?","我想找你談談關於反叛者的……諾奇雅的事。
你可以來一下EDEN嗎？","","리벨리온즈의… 노키아에 대해 상담하고 싶은 게 있다
EDEN으로 와주지 않겠나","Wir müssen über Nokia sprechen ... und ihre
Rebels. Kannst du nach EDEN kommen?"
102,3001,"","I understand. I will send a formal request to your
office concerning this matter.","我知道，
我會將這件事當作正式委託告知你們事務所的。","","알고 있다
정식 의뢰로서 네 사무소에 이야기해 두지","Ich verstehe. Ich werde eine formelle Anfrage dazu
an dein Büro schicken."
151,3001,"","...Thank you for coming. How is the Cyber Sleuth
business going for you?","你來啦，
電腦偵探的工作還順利嗎？","","…잘 와줬다
전뇌탐정 일은 순조롭나?","Danke, dass du gekommen bist. Wie läuft es
denn so für dich als Cyber-Detektiv?"
152,2001,"","Good.
Not so good.
Not bad.","很順利。
說不上是順利。
還可以。","","응
그렇지도 않아
그럭저럭이려나","Gut.
Nicht so gut.
Nicht schlecht."
153,3001,"","I see...","這樣啊……","","그렇군……","Ich verstehe ..."
154,3001,"","...","……","","……","..."
155,2001,"","...","……","","……","..."
156,3001,"","...","……","","……","..."
157,2001,"","...","……","","……","..."
158,2001,"","Didn't you say you had something to discuss about
Nokia? Why aren't you saying anything?
Do you have a stomach ache or something!?","你不是要找我談諾奇雅的事嗎？
為什麼你一直不說話！？
你肚子痛嗎！？","","노키아에 대해 상담할 게 있지 않았어?
왜 조용한 거예요―!?
배라도 아픕니까―!?","Wolltest du nicht über Nokia reden? Warum sagst du
denn nichts? Hast du etwa Bauchschmerzen?"
159,3001,"","...Ah, sorry.
That was what I sent the request about.","啊，不好意思。
是我發出委託的那件事吧。","","…아아, 미안하다
의뢰를 한 것에 대해서였지","... Ach, tut mir leid.
Das ist der Grund für die Anfrage."
160,3001,"","Okay, I'll get straight to the point.
I...want you to put an end to Nokia's activities
with the Rebels.","我就單刀直入地說了，
我希望你讓諾奇雅……停止反叛者的活動。","","……단도직입적으로 말하겠다
네가 노키아의… 리벨리온즈의 활동을 그만두게 만들어줬으면 한다","Okay, dann komme ich sofort zum Punkt.
Ich ... möchte, dass du Nokias Aktivitäten mit
den Rebels beendest."
161,2001,"","?","？？","","??","?"
162,3001,"","Do you understand?
Her existence is nothing but an annoyance to me.","你也知道吧？
她的存在對我來說只是一個阻礙。","","…알잖아?
그녀의 존재는 내게 있어선 방해일 뿐이다","Hast du mich verstanden?
Ihre Existenz wurmt mich."
163,3001,"","I want to unite all the hackers once more under my
leadership and restore order to EDEN.","我要用我的力量再一次把駭客們整合起來，
給這個EDEN帶來秩序。","","나는 내 힘으로 다시 한 번 해커들을 모아
이 EDEN에 질서를 가져오고 싶어","Ich will alle Hacker wieder vereinen,
als ihr Anführer, und die Ordnung in EDEN
wiederherstellen."
164,3001,"","...It would be better to cooperate?
Of course you'd say that...","既然這樣協助她不就好了，是嗎……
很像你會說的話呢。","","…그러면 협력하면 된다, 라
너다운 생각이군","... Es wäre besser zu kooperieren?
Es überrascht mich nicht, dass du das sagst."
165,3001,"","...","……","","……","..."
166,3001,"","...This world...this EDEN...do you like it?","你喜歡這個世界……喜歡EDEN嗎？","","…너는 이 세계가… EDEN이 좋은가?","... Diese Welt ... dieses EDEN ... Gefällt es dir?"
167,2001,"","I love it!
I don't really like it all that much.
Sometimes I like it, sometimes not.","我最愛了。
好像也沒有那麼喜歡。
不喜歡也不討厭。","","그야 물론 정말 좋아해요
그렇게까지 좋아하진 않을지도
좋지도 싫지도 않은 느낌임다","Ich finde es toll!
So besonders finde ich es nicht.
Manchmal gefällt es mir, manchmal nicht."
168,3001,"","I see...
...I love EDEN.","這樣啊……
我很喜歡這個EDEN。","","그렇군…
……나는 이 EDEN이 정말 좋다","Verstehe ...
... Ich liebe EDEN."
169,2001,"","...","……","","……","..."
170,3001,"","...How about we go for a short walk?","我們稍微走走吧？","","…조금 걷지 않겠나?","... Wie wäre es mit einem kleinen Spaziergang?"
171,3001,"","I want to feel more at one with EDEN...","我現在想要多感受一點EDEN……","","지금은 왠지 조금이라도 EDEN을 느끼고 싶은 기분이야…","Ich will mich mehr mit EDEN verbunden fühlen ..."
172,3001,"","Right, let's go to the Eden Community Area...","對了……
我們去EDEN公共區域好了。","","…그렇군
EDEN 커뮤니티 에어리어에라도 가볼까…","Also, gehen wir zum Gemeinschaftsbereich
von EDEN ..."
201,3001,"","There... How about we talk on that bench?","嗯……去那張長椅上說話吧。","","그렇군… 저 벤치에서 이야기할까","So ... Wie wäre es, wenn wir uns auf der Bank
unterhalten?"
210,4910,"","Huh? Do I like EDEN? Whether I like it or not, it
has become an integral part of life now, and it
has made my life easier.","咦？　你問我喜不喜歡EDEN？
也沒什麼喜不喜歡，因為EDEN是生活必須的基礎設施啊。
使用起來很方便呢。","","뭐? 나는 EDEN을 좋아하냐고?
그야 좋아하고 나발이고 생활에 필요한 인프라니까
편리하게 사용하고 있어","Was? Ob EDEN mir gefällt? Ob es mir gefällt oder
nicht, es ist ein wichtiger Teil meines Lebens
geworden und erleichtert mir vieles."
220,4911,"","Do I like EDEN?
That's a stupid question.","問我喜不喜歡EDEN？
真是蠢問題。","","EDEN을 좋아하냐구?
…어리석은 질문이구먼","Ob mir EDEN gefällt?
Was für eine blöde Frage."
221,4911,"","I used to be skeptical of the virtual world, but
since my retirement EDEN has completely changed my
life.","以前看它是虛擬世界還疑神疑鬼的……
不過退休後，EDEN卻完全改變了
我晚年遲暮的人生。","","옛날엔 가상 세계 같은 거라고 사서 걱정했지만…
정년퇴직 후 져가던 내 인생을
EDEN이 일변시켜줬단다","Einst sah ich die virtuelle Welt mit Skepsis, aber
seit ich in Rente gegangen bin, hat EDEN
mein Leben von Grund auf verändert."
222,4911,"","In EDEN, I can leave my worldly, restrictive body
behind and do whatever I wish.","在EDEN，我可以離開不自由的肉體
做自己想做的事情。","","EDEN에선 자유롭지 못한 신체와도 떨어져서
내가 하고 싶은 대로 할 수 있지","In EDEN kann ich meinen eigentlichen Körper, der
mich so einschränkt, zurücklassen und
tun, was ich will."
223,4911,"","In the real world I was a late-bloomer and never
got the girls, but here in EDEN I'm a hottie!
I have ten girlfriends! Ahahahahaha!!!","在現實世界因為害羞而不受歡迎的我，
在這個EDEN裡可是搶手貨……
我現在有10個女朋友呢！　哇哈哈哈哈！","","현실 세계에선 소심해서 인기가 없었던 나도
이 EDEN에선 인기폭발이라 말이여…
지금은 애인이 10명이나 되지! 카―핫핫핫하!","In der echten Welt war ich ein Spätzünder und
habe nie Freundinnen abbekommen, aber hier in
EDEN habe ich jetzt zehn Freundinnen! Hahaha!"
230,4912,"","I reeeeeally love EDEN!","我最愛EDEN了！","","나, EDEN이 정―말 좋아!","Mir gefällt EDEN toootaaal!"
231,4912,"","My best friend moved away so I couldn't see her,
but here in EDEN I can play with her right away!","因為在這裡，
就算是搬家的朋友也可以馬上玩在一起！","","왜냐면 이사간 친구랑도
여기서라면 바로 놀 수 있는걸!","Meine beste Freundin ist weggezogen und ich konnte
sie nicht besuchen, aber hier in EDEN kann ich
jederzeit mit ihr spielen!"
240,4913,"","Everyone always says that people in EDEN just lie
about who they are and you can never know their
true intentions, but...","雖然有人說在網路上的虛擬世界，
大家都偽裝自己，沒辦法講真心話……","","넷상의 가상세계는 모두 자신을 거짓으로 꾸며서
진심으로 이야기할 수 없다고 하지만…","Es heißt, dass die Leute in EDEN immer darüber
lügen, wer sie sind, und dass man ihre wahren
Absichten nicht kennen kann, aber ..."
241,4913,"","People aren't bound by the ties of their real
lives here, so actually they can say how they
really feel. That's why I love EDEN.","但我覺得正因為是這樣一個無設限的世界，
反而有辦法吐露出自己的心聲。
就這層意義來說，EDEN真的是個很厲害的地方。","","이런 벽이 없는 세계라서
반대로 진심을 털어놓을 수 있기도 하거든
그런 의미에선 EDEN은 굉장하다고 생각해","Hier werden die Leute nicht durch Dinge
zurückgehalten, wie im echten Leben. Hier können
sie ehrlich sein. Dafür liebe ich EDEN."
251,3001,"","Hmm...","呼……","","…후우","Hm ..."
252,3001,"","Just as I thought. It is indeed a good place.","這裡果然是個好地方呢。","","역시 좋은 곳이군, 여기는","Wie ich es mir gedacht hatte. Es ist tatsächlich
ein guter Ort."
253,2001,"","...","……","","……","..."
254,3001,"","Do you know why EDEN was created?","你知道這個EDEN
為什麼會被創造出來嗎？","","…너는 왜 이 EDEN이 만들어졌는지
알고 있나?","Weißt du, warum EDEN erschaffen wurde?"
255,2001,"","I think that pretty much goes without saying...
Actually, no, I have no idea.
Somewhat.","當然知道囉。
其實我完全不知道。
好像知道，又好像不知道。","","그야 당연히 이미 알고 있지
실은 전―혀 몰라
알 것 같기도 하고 모를 것 같기도 하고","Das weiß doch jedes Kind ...
Ehrlich gesagt, nein, keine Ahnung.
So in etwa."
256,3001,"","EDEN was created to set the mind free.","EDEN被創造出來的理由……
是為了“解放心靈”。","","EDEN이 만들어진 이유…
그건 ""마음의 해방""을 위해서야","EDEN wurde erschaffen, um den Geist zu befreien."
257,3001,"","This world is the pursuit of a dream to free the
self from the shackles of the earthly body...","這裡是可以離開不自由的肉體，
解放自己的夢幻世界……","","여기는 불편한 신체에서 벗어나
자기 자신을 해방시킬 수 있는 꿈의 세계…","Diese Welt ist die Verwirklichung des Traums,
das Ich von den Fesseln des irdischen
Körpers zu befreien ..."
258,3001,"","EDEN is a truly unique place where people are
freed from the obligations of their everyday
lives, where they can express their true selves.","EDEN對許多活在“限制”中的人們來說，
是一個可以展現自我、無可取代的場所。","","EDEN은 많은 ""벽"" 안에 살아가는 사람들에겐
진실된 자신을 표현할 수 있는 둘도 없는 장소다","EDEN ist ein einzigartiger Ort, wo die Leute von
den Zwängen des Alltags befreit sind, wo sie
sich ausdrücken können, wie sie wollen."
259,2001,"","...","……","","……","..."
260,3001,"","The developers of EDEN worked themselves to the
bone trying to achieve such an ideal world.","為了創造這個理想的世界，
EDEN開發者們真的是費盡了心血。","","그런 이상적인 세계를 만들기 위해
EDEN 개발자들은 그야말로 피를 쏟는 노력을 했어","Die Entwickler von EDEN haben sich die Finger
wund gearbeitet, um eine solch ideale Welt
zu erschaffen."
261,3001,"","The developers passed their enthusiasm on to the
users, and EDEN become a haven for the virtuous as
they gathered here.","而開發者們的熱情也傳達給用戶，
善意的人們聚集在EDEN，這裡就是一片人間樂土。","","개발자들의 열의는 유저에게도 전해져
EDEN은 선의의 사람들이 모이는 그야말로 이 세계의 낙원이 되었다","Die Entwickler haben ihren Enthusiasmus auf die
Nutzer übertragen, und EDEN ist zur Zuflucht
für die Rechtschaffenen geworden, die herkamen."
262,3001,"","But what has become of EDEN now?","然而現在的EDEN呢？","","…하지만 지금의 EDEN은 어떻지?","Aber was ist jetzt aus EDEN geworden?"
263,3001,"","The hackers are on the rampage, oppressing the
weak with their evil will. Such are the reports
flooding in. This world is in turmoil.","駭客肆虐，弱者遭欺，
惡意的資訊氾濫，讓世界產生混沌……","","해커가 날뛰며 돌아다니고 약자는 괴롭힘당하며
악의적인 정보가 범람해 세계에 혼돈을 낳는다…","Hacker treiben ihr Unwesen und unterdrücken die
Schwachen mit ihren bösen Absichten. Überall hört
man davon. Die Welt ist im Aufruhr."
264,3001,"","EDEN as it is now is not how it was supposed to
be...not at all.","現在的EDEN並非它原有的樣貌……
絕對不是。","","…지금의 EDEN은 원래 있어야 했을 모습이 아니야
……절대로","EDEN, wie es jetzt ist, ist nicht so, wie es sein
sollte ... ganz und gar nicht."
265,2001,"","...","……","","……","..."
266,3001,"","I understand them, the developers who poured their
hearts and souls into the great ideal that EDEN
represents.","我知道那些抱持遠大理想，
投注心血在EDEN開發上的人們是什麼的心情。","","나는 커다란 이상을 갖고
EDEN의 개발에 심혈을 기울인 사람의, 그 마음을 알고 있다","Ich verstehe sie, die Entwickler, die ihr Leben
dafür geopfert haben, um das große Ideal zu
verwirklichen, das EDEN repräsentiert."
267,3001,"","So for that reason I want to protect EDEN.
More than that, it is my duty to do so.","所以我才想保護這個EDEN……
不對，是我有義務保護。","","그래서 더더욱 나는 이 EDEN을 지키고 싶다
…아니, 지킬 의무가 있다","Aus diesem Grund möchte ich EDEN schützen.
Nein, es ist sogar meine Pflicht, das zu tun."
268,3001,"","I will preserve their legacy.","我繼承了他們的想法。","","그들의 의지는 내가 이어받았어","Ich werde ihr Vermächtnis schützen."
269,2001,"","...","……","","……","..."
270,3001,"","Nokia is a good kid. She genuinely loves EDEN and
Digimon, from the bottom of her heart.","諾奇雅，她是個非常好的女孩。
純真率直，愛著數碼寶貝以及EDEN。","","…노키아, 그 아이는 정말 좋은 아이다
순수하고 솔직하며 디지몬이나 EDEN을 사랑해주고 있어","Nokia ist ein liebes Mädchen. Sie liebt EDEN
und Digimon aufrichtig, von ganzem Herzen."
271,3001,"","The hackers...well, tamers really...who follow
her, they are the same as her.","追隨她的駭客……
不，馴獸師們應該也是如此。","","그 아이를 따르는 해커…
아니, 테이머들도 그렇겠지","Die Hacker ... also eigentlich die Digimon-Zähmer ...
die ihr folgen, sind genau wie sie."
272,3001,"","So, I don't want to get them mixed up in any of
this...","所以，我才不想將他們捲進來……","","그래서 나는 그들을 끌어들이고 싶지 않다…","Deshalb will ich nicht, dass sie in diese Sache
mit hineingezogen werden ..."
273,3001,"","Myself and those self-centered, egotistical
hackers are the only ones who should be at risk.","受傷的人，只要我和
那些腦中只有個人利益的駭客就夠了。","","위험해지는 건 나나
사리사욕에 눈이 먼 해커들뿐으로 충분해","Ich und diese selbstsüchtigen Hacker sind die
einzigen, die Gefahren ausgesetzt werden
sollten."
274,2001,"","...","……","","……","..."
275,3001,"","You are the only one who can stop her...","可以阻止她的人只有你……","","그녀를 막는 게 가능한 건 너뿐이다…","Nur du kannst sie aufhalten ..."
276,3001,"","Please...I need you to convince her.","拜託你……
可以想辦法說服她嗎？","","부탁이다…
어떻게든 그녀를 설득해주지 않겠나?","Bitte ... Du musst sie überzeugen."
277,2001,"","Well...
Let me think on it...
Okay...","這……
讓我想一下……
嗯……","","그건…
생각할 시간을 줘…
으음―…","Nun ja ...
Lass mich darüber nachdenken ...
Na gut ..."
278,3001,"","Just the answer I'd expect from you...","我就知道你會這麼說。","","…너다운 대답이군","Ich hatte nichts anderes von dir erwartet ..."
279,3001,"","You get my point, but you can't abandon Nokia, is
that it?","你了解我的主張，
但又不能拋下諾奇雅不管——是這麼回事吧……","","내가 하는 말도 이해하지만
노키아를 내버려 둘 수는 없다, 라는 건가…","Du verstehst mich, kannst Nokia aber nicht im
Stich lassen. Ist es das?"
280,3001,"","You are very kind.
You always were, even back then...","你人真的很好。
說起來，那個時候也是這樣……","","역시 다정하군, 너는
그러고 보면 그 때도 그랬지…","Du bist wirklich nett.
Das warst du schon immer, sogar damals ..."
281,2001,"","?","？？","","??","?"
282,3001,"","That time you sneaked into the head office of
Kamishiro... Even then you were always running
around concerned for everyone else.","潛入神代總公司時……
你那個時候也是為了大家拼命奔走。","","카미시로 본사에 침입했을 때…
그 때도 너는 모두를 위해 필사적으로 뛰어다녔다","Damals hast du dich in die Zentrale von Kamishiro
geschlichen ... Schon damals hast du dir um alle
anderen Sorgen gemacht."
283,2001,"","!?","！？","","!?","?!"
284,4914,"","Uh...um... [p], isn't it?","不、不好意思，你是……[p]對吧？","","저, 저기, [p] 씨… 죠?","Äh ... Ähm ... [p], nicht wahr?"
285,2001,"","?","？？","","??","?"
286,4914,"","I tried to contact Nokia, but it seems she was
caught up inviting someone to join us, so I didn't
get through to her.","我想連絡諾奇雅小姐，
但她好像招新人招得正起勁，完全連絡不到人……","","노키아 씨에게 연락하려고 했는데
아무래도 권유하는 것에 정신이 팔렸는지 연결이 안 돼서…","Ich habe versucht, Nokia zu kontaktieren, aber sie
war gerade dabei, jemanden zu rekrutieren, also
konnte ich nicht mit ihr sprechen."
287,4914,"","She said I should contact you if I was ever in
trouble.","不過她有說
遇到什麼麻煩的話就連絡[p]！","","곤란한 일이 있다면
[p] 씨에게 연락하라는 얘길 들었으니까 말임다!","Sie meinte, dass ich dich kontaktieren solle,
falls ich jemals in der Patsche sitzen sollte."
288,2001,"","That little...
What's happened?
I have a bad feeling about this...","太隨便了吧……
發生什麼事了？
我有不好的預感……","","그렇게 멋대로…
무슨 일이 있었어?
나쁜 예감이…","Diese kleine ...
Was ist passiert?
Ich habe ein ungutes Gefühl ..."
289,4914,"","I'm in a bit of trouble here... I'm in Kowloon.
Please, come and help me!","我現在有點不妙……
我人在「Kowloon」，總而言之！　請你快來救……","","나, 지금 좀 위험한 느낌임다…
「쿠롱」에 있으니 아무튼! 빨리 구하러…","Ich stecke hier etwas in der Klemme ... Ich bin in
Kowloon. Bitte komm und hilf mir!"
290,4914,"","Wha'!? Wai'... No... Stop...
Wahhhhh!!!","嗚哇！？　等等、你們、不要……
嗚哇啊啊啊啊啊————！！","","우왓!? 잠, 너, 그만…
우와악아아―――――― 아아, 아아아아―――――!!","Waaas?! Mom– ... Nein ... Stopp.
Aaahhh!"
291,3001,"","It seems like an emergency...aren't you going to
go help him?","情況看來似乎很危急……
你要去救他吧？","","아무래도 긴급사태인 것 같군…
…구하러 갈 거지?","Es scheint ein Notfall zu sein ... Wirst du ihm
nicht helfen?"
292,3001,"","...I'll come too.","我也跟你一起去。","","…나도 같이 가지","... Ich komme mit."
401,4914,"","Ah...wait, no...that hurts! Stop! Ahhhh!!!","等等、我說……
不要再……傷害我了……噫！！","","잠깐, 그러니까…
아픈 짓은… 하지 말아 주… 히이이익!!","Ah ... Aufhören ... Das tut weh! Stopp! Ahhh!"
402,4915,"","Huh!? Don't say such selfish things!
You're talkin' outta your ass!","啊！？　你少自說自話了，
明明是你先來找我碴的好不好！！","","뭐어라!? 편한 소리 하지 마라 어이
네놈이 먼저 시비걸어 왔잖아아아아!!","Was?! Sag nicht so was Egoistisches!
Das ist völliger Schwachsinn!"
403,4914,"","Wha!? N-no...","哇啊！？　哪、哪有……不對，不是的！","","히익!? 아, 아니야… 아니, 아닙니다아!","Was ...?! N-Nein ..."
404,4915,"","Don't lie to me! You called me a ""has-been
hacker"", didn't you!?","少騙人了，
你剛才說了“駭客什麼的已經落伍了”對吧！？","","거짓말 치지 마라
너, ""해커 따윈 시대에 뒤쳐졌지""라고 했잖아!?","Lüg mich nicht an! Du hast mich einen „Ex-Hacker“
genannt, oder etwa nicht?"
405,4914,"","Eh, no, it wasn't me, I didn't do anything!
I...I didn't say anything about you!","呃，不是、那個……
我、我那句話並沒有否定你的意思……","","아 아니 그건 그러니까 그…
벼, 별로 그건 당신들을 부정한 게 아니라…","Äh, nein, das war ich nicht! Ich habe nichts
getan! Ich ... Ich habe nichts über dich gesagt!"
406,4914,"","Ah! [p]!?
And...is that Yuugo from the Zaxons?","啊！　[p]！？
還有這位……該不會是Zaxon的YUGO先生！？","","앗! [p] 씨!?
게다가… 혹시 당신은 잭슨의 유고 씨!?","Ah! [p]?!
Und ... ist das Yuugo von den Zaxons?"
407,4914,"","P...please help!","請、請救救我！","","사, 살려주세요!","B-Bitte helft mir!"
408,4914,"","I was just trying to help out Nokia by getting
this has-been hacker to join us, but...
well...then this happened!","我想說可以幫忙諾奇雅小姐，
就問落伍的駭客要不要加入我們……結果就變成這樣……！","","조금이라도 노키아 씨의 도움이 되고 싶어서
시대에 뒤쳐진 해커를 권유했더니… 이런 사태가…!","Ich wollte gerade Nokia helfen, indem ich diesen
Ex-Hacker dazu bringe, bei uns mitzumachen,
aber ... dann hat sich die Lage zugespitzt."
409,4915,"","Whaat!?","你說什麼！？","","뭐어라고오오!?","Waaas?!"
410,4914,"","Ahh! [p]! Yuugo! Help!!!","哇啊啊啊！？　[p]、YUGO先生，
請、請、請你們救救我——！！","","히이이익!? [p] 씨, 유고 씨
사, 사, 살려주세요오오――!!","Ahhh! [p]! Yuugo! Hilfe!"
411,3001,"","...","……","","……","..."
412,3001,"","A has-been hacker, eh?","落伍的駭客啊……","","시대에 뒤쳐진 해커인가…","Ein Ex-Hacker, was?"
413,2001,"","?","？？","","??","?"
414,3001,"","We will need to change with the times too, I
suppose...","或許我們
也該有所改變了呢……","","우리도
변해야만 하는 걸지도 모르겠군","Wir müssen wohl auch mit der Zeit mitgehen,
schätze ich ..."
415,4915,"","Y...you're going to stand up for that little
shrimp...? He was mocking us hackers!","你、你……打算包庇這個無名小卒嗎……？
他可是把我們駭客當笨蛋耶！？","","다, 당신… 그 쫄따구를 감싸는 거야…?
그놈은 우리들 해커를 바보 취급했다고!?","D-Du verteidigst diesen Wurm?
Er hat sich über uns Hacker lustig gemacht!"
416,3001,"","...So what?","那又怎樣？","","…그래서 뭐지?","... Na und?"
417,3001,"","If what that little shrimp blurted out is enough
to hurt your pride then I guess your pride is
pretty easily hurt, don't you think?","你口中的無名小卒就算脫口說了什麼，
難道你的自尊心會因為這點程度就受到傷害嗎？","","네가 말하는 쫄따구가 뭔가 엉겁결에 지껄였다고 하더라도
네 긍지는 그 정도로 상처가 날 만큼 약한 것인가?","Wenn dich die Worte dieses Wurmes verletzt
haben, braucht es ja nicht viel, um dich
zu treffen, was?"
418,4915,"","Whaaa'!? What are you talking about!?
Now you're mocking me too!?","你說什麼——！？
是怎樣！　連你也要瞧不起我嗎？","","뭐어어어어엇!?
뭔데! 당신까지 나를 바보 취급하는 거야?","Waaas?! Wovon redest du?
Machst du dich jetzt auch über mich lustig?!"
419,3001,"","...I could easily smash a pathetic poser like you
to pieces. Come on, let's go!","像你這種假駭客就由我來徹底打垮。
……來吧！","","…너 같은 모조품은 내가 분쇄해 주지
……와라!","So einen armseligen Möchtegern wie dich könnte
ich im Handumdrehen zerlegen. Los geht’s!"
420,4915,"","I don't care if they call you a living legend...
Tha'...that's just a load of hot air!","我、我是不曉得什麼活著的傳說還怎樣的，
反反反正一定只是虛有其表……！！","","사, 살아 있는 전설인지 뭔지는 몰라도
어어어어차피 겉만 번지르르한 거겠지…!!","Ist mir egal, ob andere dich eine lebende Legende
nennen ... Das ist doch alles bloß leeres
Geschwätz!"
421,3001,"","[p], let's do it.","[p]，我們上。","","[p], 하자","[p], auf geht’s."
422,4915,"","Bring it on!!!","來就來啊……看我把你們打得落花流水！！","","해 주겠어… 당할까 보냐!!","Zeigt, was ihr könnt!"
