ID,Speaker,Japanese,English,Chinese,EnglishCensored,Korean,German
501,4915,"","S...so...this...this is the power of Yuugo of the
Zaxons... He's on a whole different level from me!","這這這這這就是……Z、Zaxon的YUGO……
等、等級……也差太多了吧……！","","이이이이이게… 재, 잭슨의 유고…
겨, 격이… 너무 다르잖아…!","S-So mächtig ist Yuugo von den Zaxons also.
Ich kann ihm nicht einmal annähernd das Wasser
reichen!"
502,3001,"","You have the ability to change, to improve.","你現在還有改變的機會。","","…너는 지금부터라도 바뀔 수 있다","Du hast die Fähigkeit, dich zu ändern, dich
zu bessern."
503,3001,"","If you want, you can visit the Zaxon forum.
...Our door is open to everyone.","有那個心的話，可以過來Zaxon廣場。
那裡的大門會為有所求之人平等敞開。","","그럴 생각이 있다면 잭슨 포럼으로 오도록 해라
…원하는 자에게는 동등하게 문이 열릴 것이니","Wenn du willst, kannst du dem Zaxon-Forum einen
Besuch abstatten ... Unsere Tür steht allen offen."
504,4915,"","...","……","","………","..."
505,4914,"","Just what I'd expect from Yuugo of the Zaxons.
Demonic strength and an ability to bring new
members in with ease...","不、不愧是Zaxon的YUGO先生。
不只實力堅強，擴增成員好像也很輕而易舉……","","여, 역시 잭슨의 유고 씨임다
귀신 같이 강한 데다 순식간에 멤버도 늘린 것 같고…","Von Yuugo von den Zaxons hatte ich nichts anderes
erwartet. Dämonische Stärke und die Fähigkeit,
schnell neue Mitglieder zu rekrutieren ..."
506,4914,"","It would have been better to do this with Nokia...","如果你和諾奇雅小姐一起聯手就好了。","","…노키아 씨와도 함께하면 좋을 텐데","Mit Nokia wäre es besser gewesen ..."
507,3001,"","...Tell me, why did you join her Rebel team?","請告訴我，
為什麼你會加入她的團隊……加入反叛者呢？","","…들려주겠나
너는 어째서 그녀의 팀에… 리벨리온즈에 들어간 거지?","... Verrate mir, warum hast du dich ihren Rebels
angeschlossen?"
508,4914,"","...Huh? Why?","咦？　為、為什麼？","","…어? 어, 어째서?","... Was? Warum?"
509,4914,"","...Um...well, I...I suppose it's because Nokia is
honest.","呃，這、這個嘛。
因為諾奇雅小姐個性很直率。","","……으음, 그, 그검다
…노키아 씨가 올곧았기 때문임다","... Ähm ... nun ja, ich ... Ich würde sagen, weil
Nokia ehrlich ist."
510,3001,"","?","？？","","??","?"
511,4914,"","I like EDEN. Actually, to be honest it's more than
that. I am a complete EDEN fanatic.","我喜歡EDEN。
說白一點，根本是個重度的EDEN御宅族……","","저, EDEN이 정말 좋슴다
좋다고 할까 까놓고 말해 이미 중증의 EDEN 오타쿠라…","Ich mag EDEN. Um ehrlich zu sein, ist das noch
untertrieben. Ich bin völlig verrückt nach EDEN."
512,4914,"","I hate what EDEN has become.","我絕對不想看到EDEN變得怪異失常。","","…EDEN이 이상해지는 건 절대로 싫슴다","Ich hasse, was aus EDEN geworden ist."
513,4914,"","So I wanted to do something about it, but...I had
no idea what I should do... I was lost...","所以我也想為EDEN做點什麼……
但我完全沒有頭緒該怎麼做才好……一直很迷惘……","","그러니까 저도 EDEN을 위해 뭔가 하고 싶었지만…
어쩌면 좋을지 전혀 모르겠어서… 헤맸는데…","Deshalb wollte ich etwas dagegen unternehmen, aber
ich wusste nicht, was ... Ich war ziellos ..."
514,4914,"","Nokia is protecting EDEN and the Digimon in her
own straightforward and honest way.","而諾奇雅小姐只是很單純地
用她自己的方式在保護EDEN和數碼寶貝。","","노키아 씨는 심플하게 단순히
자신의 방법으로 EDEN이나 디지몬을 지키려고 하고 있슴다","Nokia schützt EDEN und die Digimon auf ihre
eigene Weise, ehrlich und geradeheraus."
515,4914,"","When I saw this, I felt like a fool. Like I needed
to do something, anything.","看到她那樣，就覺得自己這麼煩惱顯得很可笑，
覺得坐立難安、心情無法平靜下來……","","그걸 보니 고민하던 자신이 바보같아졌달까
가만히 있을 수가 없어졌달까…","Als ich das sah, fühlte ich mich wie ein Idiot.
Ich dachte, ich muss etwas tun. Irgendwas."
516,4914,"","So I decided I would help Nokia with her simple,
honest approach!","所以我才決定
要單純地協助諾奇雅小姐！","","그래서 저, 심플하고 단순하게
노키아 씨에게 협력해볼까 하고, 그렇게 정했슴다!","Also beschloss ich, Nokia bei ihrem einfachen,
ehrlichen Unterfangen zu helfen."
517,3001,"","...","……","","……","..."
518,4914,"","Huh!? Ah, speak of the devil, I'm getting a call
from Nokia! I...I've got to go and take this!","嗚哇！說曹操，曹操到。諾奇雅小姐發訊過來了！
那、那我就此告辭！！","","흐아왓! 호랑이도 제말 하면 온다더니, 노키아 씨한테서 통신임다!
저, 저는 이제 실례하겠슴다!!","Huch?! Wenn man vom Teufel spricht. Nokia ruft
mich gerade an! Ich ... Ich muss rangehen!"
519,3001,"","...It doesn't look like we can stop her.","看來果然阻止不了她啊。","","…역시 그녀는 멈출 수 없겠군","... Wir scheinen sie nicht aufhalten zu können."
520,3001,"","...[p], I have a favor to ask of you.","[p]，有件事想拜託你。","","…[p], 네게 한 가지 부탁이 있다","[p], ich muss dich um einen Gefallen bitten."
521,2001,"","?","？？","","??","?"
522,3001,"","Could you please protect her?
Nokia, I mean.","請你保護她……
保護諾奇雅。","","그녀를…
노키아를 지켜주길 바란다","Kannst du sie bitte schützen?
Nokia, meine ich."
523,3001,"","...You and I are similar, actually.","不過話說回來，
你跟我還挺像的。","","…그건 그렇고
너와 나는 닮았군","... Du und ich, wir sind uns ähnlich."
524,2001,"","?","？？","","??","?"
525,3001,"","We're being led on a wild-goose chase.","總會被某個東西耍得團團轉的這一點。","","무언가에 휘둘려지며 살아가는 것이, 말이야","Wir bemühen uns beide vergeblich um etwas."
526,3001,"","...But please be ready.","不過請你做好心理準備。","","…하지만 각오해두길 바란다","... Aber halte dich bitte bereit."
527,3001,"","Next time we meet we will be enemies.","下次見面時，我們就是敵人了。","","다음에 만날 때는, 적이야","Wenn wir uns das nächste Mal sehen, werden wir
Feinde sein."
601,3006,"","...He asked you to protect her?","叫你保護她是嗎……","","…그녀를 지켜주길 바란다, 라","... Er hat dich gebeten, sie zu schützen?"
602,3006,"","At first the case was just to hinder her
activities, wasn't it? That boy is confused...","他一開始的委託不是要阻止她的行動嗎？
那個少年還真是不坦率啊。","","첫 의뢰는 그녀의 행동을 막아달라는 거였지?
…꽤나 꼬인 녀석이군, 그 소년은","Zuerst ging es bei dem Fall darum, bloß ihre
Aktivitäten zu behindern, oder? Der Junge
ist verwirrt ..."
603,3006,"","That boy is confused...","那個少年還真是不坦率啊。","","…꽤나 꼬인 녀석이군, 그 소년은","Der Junge ist verwirrt ..."
604,3006,"","From what I'm hearing from your story it sounds
like his feelings for EDEN and sense of duty
are just teenage angst...","聽你說下來的感覺，他的EDEN感以及使命感
應該是青春期才有的“想太多”……","","네 이야기를 들어보면 그는 EDEN감이나 사명감은
사춘기 특유의 ""지나친 생각"" 같은 것 같지만…","Deiner Geschichte nach zu urteilen, sind seine
Gefühle für EDEN und sein Pflichtgefühl nur
typisches Teenie-Verhalten ..."
605,3006,"","Well, that's good.","不過這樣也好啦。","","뭐, 그건 괜찮겠지","Na, das ist ja gut."
606,3006,"","...Most people are not moved by mere words.","很多事情不是用“說的”就好。","","…대체적인 건 ""말""로는 움직이지 않아","Die meisten Leute werden von Worten allein
nicht motiviert."
607,3006,"","The possible events of the future should propel
you forward.","今後可能會發生的某起“事件”
應該會促使你們向前進。","","이후 일어날 어느 정도의 ""사건""이
너희들을 앞으로 나아가게 해 줄 거다","Die möglichen Zukunftsaussichten sollten dich
antreiben."
608,3006,"","Anyway, the boy paid us our fee. Honest and
proper, that.","說話回來那個少年還真有禮貌，
不忘把委託報酬付給我們。","","…그건 그렇고 그 소년
성실하게도 확실히 의뢰 보수를 지불해 줬어","Na jedenfalls hat er unser Honorar bezahlt.
Ehrlich und wie es sich gehört."
609,3006,"","He may be a little confused, but he was raised
right.","雖然個性不坦率，不過家教或許蠻好的。","","꼬여 있긴 하지만 교육은 잘 받았을지도 모르겠군","Er mag etwas verwirrt sein, aber er wurde gut
erzogen."
610,3006,"","...Actually, it's probably because he is so well
raised that he is confused.","當然也有可能正因為他家教好，
個性才會不坦率吧。","","…뭐, 애초에
교육을 잘 받았기 때문에 꼬여 있는 걸지도 모르지만","Wahrscheinlich liegt es sogar an seiner
guten Erziehung, dass er jetzt verwirrt ist."
1000,3001,"","...Do you want to walk around EDEN a bit more?","我們在EDEN再多走一下吧？","","…조금 더 EDEN을 걷지 않을래?","Willst du noch ein bisschen in EDEN spazieren?"
