ID,Speaker,Japanese,English,Chinese,EnglishCensored,Korean,German
0,4338,,"Ciao, bentornato! È sempre bello
rivedere te e i tuoi amici!","哎呀，歡迎光臨！
一直以來承蒙你和你朋友們的關照了！",,"어라, 어서 와!
항상 친구하고 와줘서 고마워!","Hallo, willkommen zurück! Immer schön, dich und
deine Freunde zu sehen!"
1,4340,,"Cosa prendi? Raccomando la nostra
miscela di caffè speciale!","要點餐嗎？
今日推薦是特調混合咖啡！",,"주문이신가요?
추천은 스페셜 블랜드 커피입니다!","Was darf’s sein? Ich empfehle unsere
Spezial-Kaffeemischung!"
100,4338,,"Allora, qui per un altro caso? O sei solo qui per
essere un normale cliente?","嗨，今天也有什麼委托嗎？
還是，是作為普通客人過來的嗎？",,"여어, 오늘도 뭔가 의뢰를 받았어?
아니면 일반 손님으로 와준 거야?","Bist du wegen eines neuen Falls hier? Oder nur
ganz normal als Kunde?"
101,4338,,"Il K-Cafe rimane aperto tutto l'anno per il bene di ogni amante
del caffè in chicchi e dei cultori del macinato di Nakano!","為了中野喜歡咖啡的人，
K-cafe全年無休天天營業喔！",,"나카노의 커피를 좋아하는 사람들을 위해
K-카페는 연중무휴로 영업하겠어!","Das K-Café ist das ganze Jahr lang offen. Für alle
Kaffeefanatiker und Connaisseurs in Nakano!"
102,4340,,"Il mio capo pensa solo a caffè, caffè, caffè... Vorrei
che si facesse coinvolgere un po' anche lui! Dovrei
ottenere una speciale paga extra occulta finché non finisce...","店長真是的，只會說咖啡的話題……
真希望他能被捲進奇怪的事裡，
這樣在怪事平息前，就能拿到特別加班費了～♪",,"점장님도 참, 항상 커피 일직선이라니까…
휘말리는 사람 입장도 되어주셨으면 해요
괴이가 잠잠해질 때까지는 특별출근수당을 받~아야지♪","Kaffee hin, Kaffee her ... mein Chef sollte sich
hier auch mal beteiligen! Bis das vorbei ist,
sollte ich Monster-Überstunden bezahlt bekommen!"
103,4340,,"Ad ogni modo, che ne dici del nostro buon
vecchio caffè speciale?","那麼，今天推薦的
特調混合咖啡味道如何呢？",,"자, 오늘도 추천하는
스페셜 블랜드 커피는 어떠신가요?","Wie wär’s jedenfalls mit unserer guten alten
Spezial-Kaffeemischung?"
