ID,Speaker,Japanese,English,Chinese,EnglishCensored,Korean,German
1,1042,"","Did you defeat the Dinobeemon?","……你幫忙打倒了恐蜂獸嗎？","","……다이노몬, 쓰러뜨려 줬어?","Hast du das Dinobeemon besiegt?"
2,1042,"","Thank you...but it's too late for some of us.","是嗎……
但是被他打敗的夥伴們已經……","","그래……
그래도, 녀석에게 사라진 동료들은 이미……","Danke ... aber für einige von uns ist es zu spät."
3,1042,"","And what Dinobeemon said is true. Even though it's
gone now, the humans will kill us off sooner or
later if we stay here.","而且，恐蜂獸說的是事實。
即使他不在了，但若繼續留在此地，
下次不知道何時會被人類消滅。","","그리고, 다이노몬의 말은 사실이야.
그 녀석이 사라져도, 여기 남아있으면
이번에는 인간이 나를 없앨지도 몰라","Und was Dinobeemon gesagt hat, stimmt. Auch wenn
es jetzt weg ist, werden die Menschen uns hier
früher oder später töten, wenn wir bleiben."
4,1042,"","I'm going now. Goodbye.","……我決定要離開這裡了。
再見了。","","……나, 이제 여기서 나갈 거야.
그럼 안녕","Ich gehe jetzt. Tschüs."
5,2020,"","...","…………","","…………","..."
6,2020,"","(I'll report back to the client.)","（總而言之，先去和委託人報告吧……）","","(우선 의뢰인에게 보고하러 가자……)","(Ich werde dem Klienten Bericht erstatten.)"
