ID,Speaker,Japanese,English,Chinese,EnglishCensored,Korean,German
100,4540,,"Benvenuto nel quartier generale EDEN
della Kamishiro Enterprises.",歡迎來到神代企業EDEN總公司。,,"어서 오십시오, 카미시로 엔터프라이즈 EDEN 본사에","Willkommen im EDEN-Hauptgeschäftssitz
von Kamishiro Enterprises."
150,4540,,"Benvenuto al quartier generale EDEN
della Kamishiro Enterprises.",歡迎來到神代企業EDEN總公司。,,"어서 오십시오, 카미시로 엔터프라이즈 EDEN 본사에","Willkommen im EDEN-Hauptgeschäftssitz
von Kamishiro Enterprises."
200,4541,,"EDEN utilizza la tecnologia di realtà virtuale
all'avanguardia di Kamishiro per creare
un'esperienza di cyberspazio all'avanguardia.","EDEN是以本公司最自豪且最先進的虛擬現實體感技術所開發出來，
獻給新世代的全新電腦空間。",,"이곳 EDEN은, 당사가 자랑하는 최첨단 가상현실 체험 기술로
차세대에게 보내는 완전히 새로운 전뇌공간입니다","EDEN nutzt die topmoderne VR-Technologie von
Kamishiro, um ein Cyberspace-Erlebnis der
Extraklasse zu ermöglichen."
201,4541,,"Ci sforziamo costantemente di offrire una
gamma di servizi agli utenti con l'obiettivo di
creare spazi confortevoli e convenienti per tutti.","我們提供客人各種服務，
以所有人都感到方便又舒適的空間為目標，
努力改善日常營運上的缺失。",,"저희들은, 다양한 서비스를 고객님께 제공하여
모두가 편리하고 편안하다고 느낄 수 있는 공간을 목표로
매일 운영과 개선 노력을 계속하고 있습니다","Wir sind bemüht, Nutzern eine Reihe an
Diensten zu bieten, um komfortable und
zweckmäßige Räume für alle zu erschaffen."
250,4541,,"EDEN utilizza la tecnologia di realtà virtuale
all'avanguardia di Kamishiro per creare
un'esperienza di cyberspazio all'avanguardia...","EDEN是以本公司最自豪且最先進的虛擬現實體感技術所開發出來，
獻給新世代的全新電腦空間……",,"이곳 EDEN은, 당사가 자랑하는 최첨단 가상현실 체험 기술로
차세대에게 보내는 완전히 새로운 전뇌공간입니다…","EDEN nutzt die topmoderne VR-Technologie von
Kamishiro, um ein Cyberspace-Erlebnis der
Extraklasse zu ermöglichen ..."
251,4541,,"Ci sforziamo costantemente di offrire una
serie di servizi agli utenti con
l'obiettivo di creare spazi comodi e convenienti per tutti...","我們提供客人各種服務，
以所有人都感到方便又舒適的空間為目標，
努力改善日常營運上的缺失……",,"저희들은, 다양한 서비스를 고객님께 제공하여
모두가 편리하고 편안하다고 느낄 수 있는 공간을 목표로
매일 운영과 개선 노력을 계속하고 있습니다…","Wir sind bemüht, Nutzern eine Reihe an
Diensten zu bieten, um komfortable und
zweckmäßige Räume für alle zu erschaffen ..."
252,4541,,...Ci stiamo davvero impegnando.,……我們真的有在努力。,,"……정말로, 노력하고 있습니다",... Wir arbeiten wirklich hart.
300,4542,,"Ehi tu, cosa stai facendo lì?
Questo non è un posto dove far giocare i bambini.","你有什麼事嗎？
這裡可不是小孩子可以來玩的地方哦。",,"너, 무슨 용무로 왔니
이곳은 어린애가 놀러 와도 되는 장소가 아니야","Du da drüben, was tust du da?
Dies ist hier kein Kinderspielplatz."
350,4542,,"Siamo molto occupati, basta controllare
le notizie!
Quindi è solo per i dipendenti, via!","我們現在很忙，只要有看新聞應該就會知道吧？
好了，無關的人快出去吧。",,"지금, 좀 바빠. 뉴스를 보면 알잖아?
자, 외부인은 나가 줘","Bei uns ist einiges los – lies einfach die
Nachrichten!
Zutritt nur für Mitarbeiter. Geh weg!"
400,4543,,"Oh, pensavo che se fossi venuto qui sarei
stato in grado di prendere della merce di Mr. Navit...
Ma è così popolare che è tutto esaurito anche qui!","我還以為只要來這裡就能買到NAVIT的周邊商品……
因為太過受歡迎，結果連總公司的商品中心也沒貨了。",,"이곳에 오면 내빗군의 굿즈를 살 수 있다고 생각했는데…
인기가 너무 많아서, 본사의 굿즈 코너에서도 매진이래","Ach, ich dachte, ich könnte mir hier ein paar
„Herr Navit“-Fanartikel holen ... Aber er ist so
beliebt, dass sie sogar hier ausverkauft sind!"
500,4541,,"Devi essere un amico della signorina
Yuuko. Benvenuto alla Kamishiro Enterprises.","您是悠子小姐的朋友吧。
歡迎來到神代企業。",,"유코 씨의 친구 분이시군요
어서 오십시오, 카미시로 엔터프라이즈에","Du bist also mit Ms. Yuuko befreundet.
Willkommen bei Kamishiro Enterprises."
501,4541,,"Aaah!
...Ah? Giurerei di aver visto qualcuno qui...
Devo immaginarmi le cose...","呀！！
……咦？　剛剛好像有誰在……？
是我的錯覺嗎……",,"꺄!!
…어머? 방금 누가 있었던 것 같았는데…?
기분 탓일까…","Aaah! ... Ah?
Ich könnte schwören, ich hätte hier wen gesehen.
Ich glaube, ich halluziniere ..."
502,2000,,"Uff, è stata
dura... Non sembra ci siano reti
da infiltrare.","……好險好險。
……看來沒有能夠入侵的網路。",,"…위험해, 위험해…
…침입이 가능할 것 같은 네트워크는 없는 것 같다","Puh, das war knapp ...
Anscheinend gibt es keine Netzwerke
zu infiltrieren."
600,4544,,"Sei un amico della signora Yuuko?
Spero che vi divertiate.",原來您是悠子小姐的朋友啊。請好好享受。,,유코 님의 친구 분이시군요. 즐기다 가세요,"Du bist mit Ms. Yuuko befreundet?
Ich wünsche dir viel Spaß."
601,4544,,"*sospiro* Starsene qui nella hall è così noioso...
È facile, quindi non dovrei lamentarmi, ma...","唉，一直站在大廳好無聊，
雖然這麼輕鬆是很好啦……",,"하아…, 로비에서 서 있기만 하는 건 지루해…
편해서 좋긴 하지만…","*Seufz* Es ist so langweilig, in der Lobby
herumzustehen ... Es ist nicht schwer und ich
sollte mich nicht beschweren, aber ..."
602,2000,,...Non credo di poter entrare in una rete qui.,……看來沒有能夠入侵的網路。,,…침입이 가능할 것 같은 네트워크는 없는 것 같다,"Ich glaube, hier komme ich in kein Netzwerk."
700,4545,,"Solo perché sei un amico della figlia del vecchio presidente
non significa che tu possa curiosare in giro.
Solo dipendenti, capito?","就算是前社長的女兒的朋友，
也請你不要隨便亂跑。
平時一般人是無法進入這裡的。",,"전 회장님의 따님 친구라고 해서
이상한 곳에 들어가거나 하면 안 돼
이곳은 평소에 일반인이 출입하는 것도 안 되니까","Nur, weil du mit der Tochter des Präsidenten
befreundet bist, kannst du hier nicht
rumschnüffeln. Nur für Mitarbeiter, verstanden?"
701,4545,,"Hmph... è la figlia del vecchio presidente.
Perché continua a bighellonare intorno all'azienda?","……哼，就算是前社長的女兒，
為什麼到現在還在公司裡晃來晃去的……",,"…후우 …전 사장님의 영애라고 해도
왜 아직도 회사를 드나드는 건지…","Hmpf ... Das ist die Tochter des alten
Präsidenten. Was lungert die hier in der
Firma herum?"
702,2000,,"...Non credo di poter entrare in una rete
qui. Forse è meglio se provo con
qualcuno di più importante.","……看來沒有能夠入侵的網路。
……如果是更重要的職位，說不定就會有……？",,"…침입이 가능할 것 같은 네트워크는 없는 것 같다
…좀 더 중역이라면, 혹시…?","Ich glaube, hier komme ich in kein Netzwerk.
Vielleicht sollte ich es mit jemand
Wichtigerem versuchen."
800,4546,,"Hrgh... È difficile adulare la signorina Kishibe.
Non so di cos'altro parlare!","唉唉唉……
要奉承岸部小姐還真難……
畢竟稱讚過的話基本上是不能再說第二次的……",,"중얼중얼중얼…
키시베 님을 치켜세우는 것도 힘들어…
같은 칭찬은 기본적으로 NG니까…","Hmpf ... Es ist schwer, sich bei
Ms. Kishibe einzuschleimen. Ich weiß nicht,
worüber ich noch reden soll!"
801,4546,,"Le ho fatto complimenti per il suo
aspetto, il suo stile, la sua abilità...
Parlare di età sembra una cattiva idea...","長相、身材跟才能都已經全部誇過了……
至於年齡……連稱讚都不行……",,"얼굴도 스타일도 재능도 다 칭찬했고…
연령에 대해서는…… 칭찬조차, 금구야…","Ich habe ihr Komplimente über ihr Aussehen, ihren
Stil, ihre Fähigkeiten gemacht ... Ihr Alter
sollte ich vielleicht lieber nicht erwähnen ..."
802,4546,,"Ecco! Se riuscissi a mettere le mani sul suo
fascicolo personale, potrei inventarmi
complimenti ancora più creativi e artistici!","對了……！只要掌握岸部小姐的個人情報，
應該就能想到更有創意又充滿藝術氣息的馬屁台詞了……！",,"그래…! 키시베 님의 개인정보를 입수하면
더욱 크리에이티브하고 아티스틱하게
치켜세울 수 있을 거야…!","Bingo! Wenn ich an ihre Personalakten komme,
könnte ich mir noch kreativere und
bessere Komplimente einfallen lassen!"
803,4546,,"Aspetta, no, probabilmente sono top secret...
Anche se potessi accedere al server Avalon, non ho
l'autorizzazione di sicurezza per ottenere i dettagli...","不、不行……我記得那是最高機密……
就算能用我的帳號權限登入阿瓦隆伺服器，
也無法調出最高機密情報……",,"아니, 무리인가… 그건 분명, 최고 기밀이었어…
내 계정 권한으로 아발론 서버에
접속은 할 수 있어도… 최고 기밀정보는 꺼낼 수는 없어…","Moment, nein, die sind sicher streng geheim ...
Selbst wenn ich auf den Avalon-Server komme,
bin ich nicht befugt, auf die Infos zuzugreifen."
804,4546,,"Cos'è rimasto... la personalità?
Mi chiedo se potrei trovare qualcosa di carino da dire...
Bleah...","再來就是……個性嗎……
要稱讚她那種個性，我辦得到嗎……
唉唉唉……",,"남은 건…… 성격인가…
그 성격을 칭찬한다니… 이 내가, 할 수 있을까…
중얼중얼중얼중얼…","Was bleibt noch übrig ... ihr Charakter?
Ob mir da etwas Nettes einfällt ...?
Argh ..."
1000,3012,,"Oh, di nuovo tu.
Tempismo perfetto allora, ho qualcosa che è
meglio tu veda.","啊，原來是你啊。
你來的正好，我有個東西想讓你看。",,"아아, 당신이구만요
마침 잘 됐심더, 당신에게 보여 주고 싶은 게 있구만요","Ach, du bist es wieder.
Gutes Timing. Es gibt da etwas, das du
sehen solltest."
1001,3012,,"Ho trovato dei vecchi dati, dai file
personali di Rie Kishibe o qualcosa del genere.","我在整理岸部里繪的個人檔案夾時，
找到了很舊的“日記（數據）＂呢。",,"키시베 리에의 개인 폴더인지 뭔지를 정리했더니
상당히 낡은 ""일기(데이터)""가 나와서 말이지요","Ich habe ein paar ganz alte Daten gefunden, aus
den Personalakten von Rie Kishibe oder so."
1002,3012,,"Sarà anche un po' raffazzonato, ma gli
dai un'occhiata?",雖然內容還挺奇怪的……你要看嗎？,,좀 이상한 내용이지만… 읽으시겠습니까?,"Sicher unvollständig, aber willste ’nen Blick
drauf werfen?"
1010,3012,,"Se cambi idea, basta
che tu lo dica.",想看的話，就隨時來找我吧。,,"읽고 싶어지면, 언제든 찾아오시지요","Wenn du deine Meinung änderst, sag
einfach Bescheid."
1020,3012,,"Vuoi dare un'occhiata al diario di
Kishibe?",要看岸部的日記嗎？,,"키시베의 일기, 읽으시겠습니까?","Riskierst du einen Blick auf das Tagebuch von
Kishibe?"
1100,3008,,<xXx Il Quaderno Demoniaco di Rie xXx>,『††里繪的閻羅王★筆記本††』,,『††리에의 염라대왕♥노~트††』,<xXx Ries Demons-Aufzeichnungen xXx>
1101,3008,,"Oggi sono stato molestato dal mio
supervisore! :D Poi l'ho detto alle
Risorse Umane e l'ho fatto retrocedere :D","「被部長性騷擾了★
我把內容寫得鉅細靡遺後投訴到人事部去，讓他被降職囉★",,"「부장~님에게 성희롱을 당했어♥
내용을 빵빵하게 적은 다음 인사부에 호소해서 좌천시켜 줬어★","„Heute wurde ich von meinem Vorgesetzten
belästigt! :D Ich habe es der Personalabteilung
mitgeteilt und er wurde degradiert :D"
1102,3008,,"Ho provato ad attirare qui un ingegnere della
Nile Corporation con la mia ~aura misteriosa~, ma non ha
abboccato >:F Uffa, un giorno comprerò quella stupida compagnia!","向尼羅河公司的技術人員搭訕，想說把他挖角過來。
結果卻被對方給甩了，嗚嗚～（＞＜）總有一天要連同企業一起買下來。",,"나일 코프의 기술자를 헌팅해서 빼내려고 했지만
차여 버렸어엉~（＞＜） 언젠가 기업째 인수해 주겠어","Habe versucht, einen Ingenieur der Nile
Corporation herzulocken, aber ohne Erfolg >:F
Gah, eines Tages kaufe ich diese blöde Firma auf!"
1103,3008,,"Ooh, ma non sarebbe meraviglioso se il BF fosse
tutto solo, con la sua famiglia uccisa in un
""misterioso incidente""??? :O :O >:3 0:)","聽說他的家人死於意外，他一直是獨自生活的。
所以趁他感到寂寞時誘惑★他也是一種不錯的方法？？",,"그 사람은 가족이 사고로 죽어서 홀몸인 것 같으니까
외로운 점을 파고들어서 유혹♥하는 것도 한 방법일까??","Wäre es nicht schön, wenn der Liebste ganz einsam
wäre, da seine Familie bei einem „mysteriösen
Unfall“ ums Leben kam? :O :O >:3 0:)"
1104,3008,,"Ma! Il vero pesce che voglio
allamare è il Presidente Satoru! Oggi gli
mostrerò i beni della mia compagnia <3","可是可是，人家現在的目‧標是悟留社長呢～♪
今天也要拼命向他進攻★",,"하지만하지만 리에의 현재 목표는 사토루 사장인걸~♪
오늘도 잔뜩 어필해야지♥","Aber! Wirklich ködern möchte ich
Präsident Satoru! Heute werde ich ihm zeigen,
was ich der Firma zu bieten habe <3"
1105,3008,,"Ops, ho avuto un piccolo problema con
il beta test oggi, ma ho fatto
prendermi la colpa al mio capo, evvai!","β測試發生了小～小的錯誤，
不過我把責任全推給上司了，所以一點問題也沒有♪",,"β테스트에서 약~간의 에러가 발생했지만
상사에게 책임을 전가했으니까 세이――――프♪","Huch, heute gab es ein winziges Problem mit dem
Betatest, aber ich habe es so gedreht, dass mein
Boss den Kopf hinhält. Gute Arbeit!"
1106,3008,,"Il progetto EDEN è ATTIVO!!! XDDD Attenti,
mondo! Tutto sta andando a gonfie vele per
Rie! \o\ /o/","EDEN計劃會繼續進行哦♪只要這個計劃上了軌道，
人家就會直接飛黃騰達啦★（≧∇≦）／",,"EDEN 프로젝트는 속행이야♪ 이게 궤도에 오르면
리에는 출세 가도를 곧장 일직선★（≧∇≦）／","Das EDEN-Projekt ist LIVE! XDDD
Achtung, Welt! Hier kommt Rie!
\o\ /o/"
1107,3008,,"Il presidente non cede ai miei inganni!
:((( Inoltre, sembra pensare
che io stia tramando qualcosa...","又被社長甩了，氣死我了！
而且～他好像在懷疑人家耶～",,"사장님에게 또 차였어, 짱 화나
게다가 왠~지 리에를 수상히 여기는 것 같고~","Der Präsident fällt nie auf meine Pläne herein!
:((( Außerdem scheint er zu glauben,
dass ich was im Schilde führe ..."
1108,3008,,"Maaaagari... Forse... Arriverà presto...
Attacco di Rie Darkside, tesoruccio, Attivazione!!!!!?""","這下～難不成～～～？
人家該發動心機攻勢了～～～！？！？」",,"이건~ 어쩌면 어쩌면이 아니여도~~~?
리에짱 다크사이드 어택 발동일까~~~!?!?」","Vielleicht ... ist es bald soweit ...
Die süße Rie aktiviert ihren fiesen Hinterhalt!“"
1109,2000,,...,……,,……,...
1110,2000,,...Basta così.,……日記到這裡就沒了。,,…여기서 끝났다,Das reicht jetzt aber.
2000,3003,,"Hm? Non sei riuscito a trovare il collegamento al
server sul terminale?",……咦？　找不到連結伺服器的終端？,,…에? 서버에 링크하고 있는 단말기가 보이질 않는다고요?,"Hm? Konntest du den Link zum Server nicht auf dem
Terminal finden?"
2001,3003,,"Ah... I diritti di accesso al server sono collegati
all'avatar di ogni impiegato. I terminali non c'entrano niente.","嗯……有登入伺服器權限的員工，
超連結會寫在自己的化身裡，
所以不會經由終端登入。",,"에에… 서버 접속 권한을 받은 사원은
자신의 아바타에 링크가 심어져 있기 때문에
단말기를 중개로 사용하지 않아요","Ah ... Die Zugriffsrechte zum Server sind mit
dem Avatar jedes Mitarbeiters verbunden.
Mit den Terminals hat das nichts zu tun."
2002,3003,,Significa che gli avatar stessi sono i collegamenti.,也就是說，就像是“化身本身＂就是超連結……,,"즉… ""아바타 자체""가 링크라고 할까요…","Das bedeutet, dass die Avatare die Links sind."
2003,2000,,"Gli avatar sono i collegamenti... Meglio controllare gli avatar
di alcuni impiegati della Kamishiro.","化身本身就是超連結……
那就去調查神代員工的化身好了……？",,"아바타 자체가 링크…
카미시로 사원의 아바타를 조사해 볼까…?","Die Avatare sind die Links ...
Ich sollte die Avatare von ein paar
Kamishiro-Mitarbeitern überprüfen."
2004,2000,,"Se guardo solo gli avatar, insospettirò
loro... Meglio usare
Stealth Hide per intrufolarmi.","如果堂堂正正地調查化身，反而會被懷疑……
使用“Stealth Hide＂悄悄地調查吧。",,"당당히 아바타를 조사하면, 수상히 여겨질 거야…
""스텔스 하이드""를 사용해서, 몰래 조사해 보자","Wenn ich mir nur Avatare ansehe, werden sie sicher
misstrauisch ...
Ich sollte Tarnkappe benutzen."
2100,2000,,"Quell'avatar!
A quali server può accedere?","……！！　這個化身……
擁有登入某個伺服器的權限……",,"………!! 이 아바타…
어느 서버로의 접속 권한을 갖고 있어…","Dieser Avatar!
Auf welche Server hat er Zugriff?"
2101,2000,,"Gli avatar sono solo dati...
Posso tuffarmi tramite il Salto di connessione?","化身也是數據……
既然如此，或許可以進行登入跳躍……？",,"아바타도 데이터…
그렇다면, 커넥트 점프를 할 수 있을지도…?","Avatare sind bloß Daten ...
Kann ich per Verbindungssprung eintauchen?"
2102,3003,,"...Eep!
...[p]?","……呀！？
……你是[p]對吧？",,"…꺅!?
…………[p] 씨죠…?","Huch!
... [p]?"
2103,3003,,"Non fare il buffone--per favore, finisci in fretta!",別開玩笑了，請快點完成委託……！,,"장난치지 마시고, 빨리 끝내고 오세요…!",Keine Spielchen – bring das bitte schnell zu Ende!
2104,2000,,"Si è arrabbiata... È
davvero seria fino al midollo.","……挨罵了。
快認真找吧。",,"…혼나고 말았다…
진지하게 찾자…","Sie wurde wütend ...
Sie meint es wirklich ernst."
2200,2000,,"Kyoko mi ha detto di improvvisare...",雖然杏子姊要我「隨機應變」……,,…쿄코 씨는「임기응변으로」라고 말씀하셨지만…,"Kyoko hat mir gesagt, ich muss schnell
reagieren ..."
2201,2000,,"Ma non vedo nessun posto dove
effettuare un Salto di Connessione...
Meglio guardarsi in giro.","但乍看之下，這裡並沒有能進行登入跳躍的終端？
總之，先到處調查看看吧。",,"언뜻 보기에 커넥트 점프가 가능할 것 같은 단말기는 보이지 않는걸…?
…어쨌든, 이곳저곳 조사해 보자","Aber ich sehe keinen Ort, zu dem ich
springen könnte ...
Ich muss mich umsehen."
