ID,Speaker,Japanese,English,Chinese,EnglishCensored,Korean,German
200,4609,"","Most of the hacking incidents in town have been
a product of that new ex-Zaxon team. Demons,
they're called.","最近跟駭客有關的事件大多是新隊伍
「惡魔亂舞」的成員搞的鬼。
聽說他們大部分的成員都曾經參加過Zaxon耶。","","최근의 해커 관련 사건의 대부분은
신참 팀「데몬즈」녀석들의 짓이야
대부분이 예전에 잭슨의 멤버였다는군","An den meisten Hacking-Vorfällen in der Stadt ist
das neue Team aus früheren Zaxons schuld. Sie
nennen sich „Demons“."
300,4610,"","We haven't heard much from Zaxon lately, maybe a
whole new team like Jude's is gonna sprout up.","Zaxon最近也沒什麼作為啊……
會不會再次出現像「Jude」那麼酷的隊伍啊。","","잭슨도 최근에는 눈에 띄질 않네…
「쥬드」같은 쿨한 팀이 또 안 나타나려나","Von Zaxon hört man in letzter Zeit nicht viel,
also gibt es vielleicht bald ein ganz neues Team,
wie Gamma."
400,4611,"","Walking around Kowloon earlier I saw some dude
selling ""discount Digimon captures""...","我之前在Kowloon裡散步時，
突然有人對我說「要不要買數碼寶貝捕捉器啊，我算超低價給妳」。","","얼마 전에, 쿠롱을 걷다 보니
「디지몬 캡처를 저렴하게 양도합니다」라고 말을 걸길래…","Vorhin habe ich in Kowloon einen Typen gesehen,
der „Digimon-Fang zum Rabattpreis“
verkauft hat ..."
401,4611,"","I know they're knock-offs but, I mean, as long
as they kinda work, right?","我明明知道那是詐騙，但講來講去就變成我要買了……","","사기란 걸 알았지만, 어쩌다 보니 구매하기로 돼서…","Klar ist das dann ein billiges Imitat, aber
solange es funktioniert ... oder?"
402,4611,"","So I went to go buy one, but the guy kept giving
me this weird look. He thought I was just some
random person off the street.","不過就在我打算進行交易時，
對方卻發現我是駭客。","","막상 거래하려고 했더니, 내가 해커인 걸
그쪽이 눈치채서…","Ich wollte also eins kaufen, aber der Typ hat mich
komisch angeguckt. Der dachte, ich wäre
eine Dahergelaufene von der Straße."
403,4611,"","When I finally told him I was a hacker, he
actually laughed at me. Said he wouldn't sell to
me because I don't act like a hacker.","然後就對我說教，說「妳要更有駭客的樣子」……","","좀 더 해커답게 다니라고, 설교를 당해 버렸습니다…","Als ich ihm endlich gesagt habe, dass ich eine
Hackerin bin, hat er mich ausgelacht. Meinte, 
so sind Hacker nicht und er verkauft mir nichts."
500,4612,"","I hear tell people are selling imitation Digimon
captures all over town. People are paying tons of
cash and trading away rare items for them.","最近似乎常發生數碼寶貝捕捉器詐騙耶。
聽說對方會要你拿出金錢或稀有道具來交換，
但拿到的捕捉器卻是假貨。","","디지몬 캡처 사기가 유행하는 것 같아
돈이나 레어한 아이템과 교환하게 되는데
결국, 가짜 캡처를 건네받는다고 하더라","Ich habe gehört, dass in der ganzen Stadt
Imitate von Digimon-Fang verkauft werden.
Die Leute geben eine Menge Geld dafür aus."
