ID,Speaker,Japanese,English,Chinese,EnglishCensored,Korean,German
15060,3013,"","Summoning the special Digimon will take some time.
Why not head back to the office? It's been a
while, I'm sure there are cases waiting.","要叫出特殊的數碼寶貝可能需要耗費一些時間。
可以請你先回事務所邊處理工作邊等嗎？
……說不定有什麼委託找上門囉？","","특수한 디지몬을 불러내려면 조금 시간이 걸릴 것 같아
사무소의 일이라도 하면서 기다려 줄 수 있을까
…어쩌면, 뭔가 의뢰가 와 있을지도 모르겠는걸?","Es wird dauern, die besonderen Digimon aufzurufen.
Warum gehst du nicht zurück zum Büro?
Dort warten sicher Fälle auf dich."
15065,3013,"","Apologies for the wait.
Let's get started, shall we?","讓你久等了呢……
那麼，我們走吧。","","기다리게 해 버린 것 같네…
그럼, 가 볼까","Tut mir leid, dass du warten musstest.
Sollen wir loslegen?"
15068,3013,"","Rina Shinomiya's come to help, yes? Barbamon is
powerful--one of the Seven Deadly Digimon. Don't
let down your guard. Find an opening and strike.","四之宮莉娜……你要去協助她打倒巴爾巴獸對吧。
巴爾巴獸是擁有強大力量的七大魔王之一哦，你絕對不能大意。
只要對方產生破綻，你就要持續不斷地攻擊它。","","시노미야 리나… 그녀에게 협력해서 발바몬을 쓰러뜨리러 가는 거구나
발바몬은 거대한 힘을 가진 7대 마왕의 일각이야
결코 방심하면 안 돼. 빈틈이 생기면 한꺼번에 공격하렴","Rina Shinomiya will helfen? Barbamon ist mächtig
und einer der Sieben Dämonenkönige der Digimon.
Sei auf der Hut. Nutze jede Schwäche."
15070,3013,"","You've some powerful allies...I trust you'll put
up quite a fight. Kentaurosmon has yet to strike,
so get to the EDEN Free Area before he does.","你得到了一位強力的伙伴呢！　這麼一來，你應該能好好戰鬥了。
八腳馬獸似乎還沒有移動，
在他開始移動之前，快點前往EDEN的自由區域吧。","","강력한 아군이 생겼구나… 이만하면 충분히 싸울 수 있을 거야
슬레이프몬은 아직 이동하지 않은 것 같으니까,
상대가 이동하기 전에, EDEN의 프리 에어리어로 향하는 게 어때?","Du hast mächtige Verbündete. Du wirst sicher gut
kämpfen. Kentaurosmon hat noch nicht angegriffen.
Geh also schnell zum Freien Bereich."
15080,3013,"","Haven't you anywhere better to be?
I thought the good Detective requested your
assistance. Hurry on to Asakusa.","你還在這種地方打混好嗎？
刑警有請求你前去支援對吧？
快去淺草幫他一把吧。","","너, 이런 곳에 있어도 되는 거야?
형사님으로부터, 지원 요청이 있었잖아?
서둘러 아사쿠사로 가 주렴","Hast du nichts Besseres zu tun? Ich dachte, du
wärst detektivisch gefragt.
Beeil dich und geh nach Asakusa."
15090,3013,"","Asakusa's Digital Shift. An Eater lies within.
The area is set up no differently than before.
...So. What future will you choose?","淺草的Digital Shift……侵食者就在這裡的深處哦。
這一帶的構造似乎跟之前一模一樣呢。
好啦，你會選擇什麼樣的未來呢？","","아사쿠사의 디지털 시프트… 이터는 이 안쪽에 있어
이 주변의 구조는 전과 달라진 게 없는 것 같네
…자 그럼, 넌 어떤 미래를 선택할까","Die digitale Verschiebung von Asakusa. Dort ist ein
Verschlinger. Der Bereich ist genau wie bisher.
... Also. Welche Zukunft wirst du wählen?"
16000,3013,"","Everyone is off performing their roles.
Shouldn't you head to Odaiba to do the same?","大家都為了完成各自的任務而行動著……
你不是應該要去御台場嗎？","","모두 각자의 역할을 다하기 위해 움직이고 있어…
넌 오다이바로 가야만 하는 게 아니었니?","Alle sind unterwegs, um ihren Teil zu leisten.
Solltest du nicht eigentlich in Odaiba sein?"
16005,3013,"","There's only one route to Odaiba. You can't get
lost. Examon awaits... Be amply prepared.","御台場那裡只有一條路，所以你不會迷路的。
深處有艾克薩獸在等著你，你可要先做好周全的準備啊。","","오다이바에는 길이 하나뿐이라 헤맬 일은 없어
안쪽에 엑자몬이 있는데… 준비는 확실히, 하렴","Es gibt nur eine Route nach Odaiba. Du kannst dich
nicht verlaufen. Examon erwartet dich ...
Bereite dich gut vor."
16006,3013,"","Time to battle against the dragon emperor...
If you're still uncertain, return to the office to
consult with your partners.","終於要跟“龍帝＂戰鬥了呢……
要是覺得不安，
就回事務所去找你的""伙伴""商量吧。","","드디어 ""용제""와의 싸움이구나…
만약 불안하면, 사무소로 돌아가서 당신의 ""파트너""에게
상담해 보렴","Zeit für den Kampf gegen den Drachenkaiser ...
Wenn du dir noch nicht sicher bist, geh zum Büro
und berate dich mit deinen Partnern."
16010,3013,"","Weren't you to meet that child?
...That's someone you really shouldn't leave alone
for long. Hurry to Kowloon Level 1.","你跟她約好要碰面對吧？
……不要太常忽略她比較好哦。
快點到Kowloon Lv. 1去吧。","","그 아이와 만나기로 약속했잖아?
…너무 그 아이에게서 눈을 떼지 않는 편이 좋아
빨리 쿠롱 Lv.1로 향하렴","Solltest du nicht das Kind treffen? Du solltest
es wirklich nicht lang allein lassen.
Schnell, zur ersten Ebene in Kowloon."
16020,3013,"","It seems the child's gone on to Kowloon Level 5.
Will you follow?","她似乎到Kowloon Lv. 5去了……
你也快去找她吧。","","그 아이는 쿠롱 Lv.5로 가 버린 것 같네…
너도 가는 게 어때?","Das Kind scheint jetzt auf der fünften Ebene in 
Kowloon zu sein. Wirst du ihm folgen?"
16030,3013,"","The wall's come down, hasn't it? All that's left
is to head to Kowloon Level 5. ...That said, it
won't be a simple task.","原本堵住去路的牆壁已經消失了吧？
再來只要前往Kowloon Lv. 5的深處就行啦。
……雖然我說得很輕鬆，但要達成目的應該沒那麼簡單吧。","","가로막고 있었던 벽은 이제 없지?
이제 쿠롱 Lv.5의 안쪽으로 나아가면 될 뿐이야
…나아가면 될 뿐, 이라고는 해도, 목적을 쉽게 달성할 수는 없겠지만","Die Firewall ist weg, oder? Jetzt musst du also zur
fünften Ebene in Kowloon. Allerdings wird
das keine einfache Angelegenheit."
16040,3013,"","You've been summoned, yes? In secret...
I won't tell anyone, so hurry to Odaiba.","有人在找你對吧？
而且你不想被別人知道對吧？
我會替你瞞著杏子跟其他人的，快點到御台場去吧。","","나와 달라고 부탁을 받았잖아?
비밀로, 말이야…
쿄코와 모두에게는 비밀로 할 테니, 빨리 오다이바로 향하렴","Du wurdest herbeigerufen? Im Geheimen ...
Ich werde es niemandem verraten.
Los, auf nach Odaiba. Schnell!"
17000,3013,"","Aren't you to meet someone in Akihabara?
Go on. It's rude to keep a lady waiting.","有人正在秋葉原等你吧？
不可以讓女孩子等你哦，快點去找她吧。","","아키하바라에서 기다리고 있는 사람이 있지 않을까?
여자애를 기다리게 하면 안 돼… 빨리 가 주렴","Solltest du nicht jemanden in Akihabara treffen?
Los, eine Dame soll man nicht warten lassen."
17010,3013,"","You're going to see Crusadermon in Akihabara,
yes? She'll be a wily opponent, do take care.
...Not that destiny cares how careful you are.","你要去秋葉原找劍皇獸對吧？
它鐵定是個不好惹的對手，你要十分小心謹慎哦。
雖然命運這種東西再怎麼小心也無濟於事……","","아키하바라에 있는 로드나이트몬에게 갈 거잖아?
분명 만만치 않은 상대일 거야… 충분히 조심하렴
운명은, 조심한다고 해서 어떻게 되는 것은 아니지만…","Du bist auf dem Weg zu Crusadermon in Akihabara?
Sie ist sehr gerissen, sei vorsichtig.
Nicht, dass das Schicksal darauf Rücksicht nimmt."
17020,3013,"","Are you wondering where you may be headed?
...Once you arrive, you'll know.
See your destiny with your own eyes.","你很在意自己現在身處何處嗎？
只要往前進就會知道囉。
你就去親眼確認你的命運吧。","","네가 지금 어디에 있는지, 궁금한 걸까?
…그건 나아가 보면 알게 될 거야
네 운명을 자신의 눈으로 확인하렴","Fragst du dich, wo die Reise hingeht? ... Wenn du
ankommst, wirst du es wissen. Du wirst dein
Schicksal mit eigenen Augen sehen."
18010,3013,"","...Can you hear me? [p]
is gone, so for now, I'll help you.
Alright, close your eyes...","聽得見嗎？
[p]不在，所以我現在先把力量借給妳們。
好了，把眼睛閉上……","","…들려?
[p]가(이) 없으니까, 지금은 너희들에게 힘을 빌려 줄게
자, 눈을 감아…","Kannst du mich hören? [p]
ist fort, also werde ich dir helfen.
Schließ die Augen ..."
18020,3013,"","Welcome to the DigiLab. Originally this space
was for [p], but...
Destiny has--shifted, and I need your help.","歡迎來到數碼實驗室。
這裡原本是為了[p]而開設的空間，
但命運現在變得搖擺不定，所以我需要妳們的力量。","","어서 와, 디지랩에
본래 이곳은 [p]를(을) 위해서 열린 공간이지만…
지금은 운명이 흔들리고 있어… 너희들의 힘이 필요해","Willkommen im DigilLab. Eigentlich war dieser Ort
für [p], aber ... das Schicksal ...
wurde verändert. Ich brauche deine Hilfe."
18021,3013,"","Your destinies reside elsewhere, so functionality
is limited. Nevertheless, please use this place
effectively.","妳們的命運還存在於別的地方。
所以機能才會受到限制，
不過就請妳們充分利用這個地方吧。","","너희들의 운명은 또 다른 장소에 있어
그래서 기능은 제한되어 버리지만…
이 장소를 효과적으로 사용해 줘","Du hast ein anderes Schicksal, deshalb ist die
Funktionalität beschränkt. Nutze diesen Ort
bitte trotzdem so gut wie möglich."
19000,3013,"","You're off to the Metropolitan Office to decide
things with the Royal Knights, yes? ...This
battle will decide your fate as well. Be strong.","你要去新都廳跟皇家騎士決戰對吧？
這場戰鬥將會決定你的命運，你可要好好振作哦。","","너, 로얄 나이츠와의 결전을 위해
신 도청으로 향하기로 하지 않았었니?
…이 싸움은, 네 운명을 결정짓게 될 거야… 힘내렴","Du gehst zum Metropolitan-Gebäude, um die Sache 
mit den Royal Knights zu Ende zu bringen? Dieser 
Kampf wird dein Schicksal bestimmen. Sei stark."
19005,3013,"","The Metropolitan Office is sprawling, so you'll
need luck and patience. With the proper elevators,
you can get to the 15th, 30th, and 40th floors.","新都廳內變得相當廣闊，所以你應該會需要運氣跟耐性。
只要搭上正確的電梯，
你就能分別前往15樓、30樓和40樓囉。","","신 도청 내부는 상당히 넓으니까 운과 끈기가 필요할 거야…
정답인 엘리베이터로는, 각각 15F, 30F, 40F로
향할 수 있어","Das Metropolitan-Gebäude ist riesig. Du brauchst
Glück und Geduld. Mit den richtigen Lifts gelangst
du in den 14., 29. und 39. Stock."
19010,3013,"","Good work, coming this far...is what I'd like to
say. But there is one final task to complete.","一路戰鬥至今真是辛苦你了……雖然我很想這樣慰勞你，
不過似乎還有最後一場戰鬥在等著你呢。","","지금까지 수고 많았어… 라고, 말하고 싶지만…
아직 마지막 마무리가 남아 있는 것 같네","Du bist bis hierher gekommen. Gute Arbeit.
Aber es gibt noch eine letzte Aufgabe,
die beendet werden muss."
19011,3013,"","Omnimon awaits at the top of the Metropolitan Office.
...Now, go! At last, I'll see how your destiny
plays out for myself.","奧米加獸正在新都廳的天台等著你哦。
好了，快去吧！
我會親眼見證你的命運的。","","신 도청의 옥상에서, 오메가몬이 기다리고 있어
…자, 가렴!
네 운명, 끝까지 지켜 보도록 하겠어","Omnimon wartet oben auf dem Gebäude.
... Nun geh schon! Endlich werde ich selbst
sehen, was dein Schicksal bereithält."
