ID,Speaker,Japanese,English,Chinese,EnglishCensored,Korean,German
7011,3013,"","Surely you should be able to handle much farther
down by now. Go on, bring the truth to light.","不過現在的你一定能前進到更深的地方。
你就努力地挖堀事件的真相吧。","","분명 지금의 너라면, 더욱 더 앞을 갈 수 있을 거야
열심히 해서 사건의 진상에 다가가 주렴","Sicher solltest du mittlerweile noch viel weiter
nach unten gehen können. Los, bring die Wahrheit
ans Licht."
7020,3013,"","Kyoko gave you a tip, yes? What you're looking for
should be on Kowloon Level 4. Now, go scour the
area for clues.","你有從杏子那裡獲得情報對吧？
你正在找的東西應該可以在Kowloon Lv. 4找到哦。
記得把每個角落都仔細找過啊。","","쿄코에게서 정보를 받았잖아?
네가 찾고 있는 것은 쿠롱 Lv.4에서 찾을 수 있을 거야
구석구석까지 샅샅이 찾아 보렴","Kyoko hat dir einen Tipp gegeben? Such auf der 
vierten Ebene in Kowloon. Dort solltest du fündig 
werden. Suche nach Hinweisen."
7030,3013,"","Firstly, learn about the missing child. Wasn't
your friend a fan of the suspicious band? And
doesn't the missing child have a dear male friend?","首先，你必須先收集那個下落不明的女孩子的情報。
在你的朋友裡，有沒有人也是那個奇怪樂團的粉絲？
還有，那個下落不明的女孩子有個很要好的男性朋友對吧？","","우선, 행방불명이 된 아이의 정보를 모아야겠지
그 수상한 밴드의 팬이, 네 친구 중에도 있지 않았니?
그리고, 행방불명이 된 애랑, 친한 남자인 친구가 있었지?","Finde zuerst etwas über das vermisste Kind heraus.
War deine Freundin nicht Fan dieser dubiosen Band?
Was ist mit dem Freund des Kindes?"
7031,3013,"","I believe the two people who held a clue are in
Nakano as we speak. Check every nook and cranny,
and listen to all you can.","可能會有線索的那兩人似乎正好就在中野。
你去把他們找出來打聽消息吧。","","단서를 갖고 있을 것 같은 그 두 사람은
마침 나카노에 있는 모양이야
그들을 찾아내서, 말을 걸어 보면 어떨까","Zwei Informanten sind wohl gerade
in Nakano. Durchforste alles und
halte die Ohren offen."
7040,3013,"","So, you were able to find information on the
missing child, but not on where they are... Why
not head back to the office to speak with Kyoko?","雖然獲得了那個下落不明的女孩子的情報，
卻仍不知道她身在何處嗎……
你就先回事務所一趟，去找杏子商量看看吧。","","행방불명이 된 아이의 정보는 얻었지만
장소까지는 모르는, 거구나…
일단 사무소로 돌아가서, 쿄코와 상담해 보면 어떨까","Du hast Informationen über das vermisste Kind
erhalten, aber nicht, wo es ist ... Warum gehst
du nicht mit Kyoko zurück ins Büro?"
7050,3013,"","There was a URL in the subliminal message of the
PV, yes? And that was when you were near the
medal seller... Why not check that area first?","在MV所隱藏的資訊裡，有包含URL對吧？
那裡好像是在你之前發現獎牌商人的地方附近……
你就先去那裡看看吧。","","PV의 서브리미널 안에, URL이 포함되어 있었잖아?
얼마 전에, 메달 판매원을 발견한 장소와 가깝다던가…
우선 그곳으로 가 보는 게 좋지 않을까","Das Promovideo enthielt eine versteckte URL, oder?
Da warst du in der Nähe des Medaillenverkäufers.
Schau dich da zuerst um."
7060,3013,"","If you've learned the location of the Demons'
hideout, all that's left is to go there. Remember,
you can go anywhere, so long as you have the URL.","既然已經知道惡魔巢穴在哪裡了，再來只要前往那裡就行了。
像之前一樣，只要有URL，無論在何處都能過去吧。","","데몬즈 아지트의 장소를 알아냈으니, 다음은 그곳으로 가는 것뿐이네
지금까지 했던 것처럼, URL만 있으면 어디서든 갈 수 있을 거야","Wenn du weißt, wo sich das Versteck der Demons
befindet, musst du nur noch hingehen. Denk dran:
Du kannst überallhin, wenn du die URL hast."
8010,3013,"","You're quite popular, aren't you?
Girls inviting you to Kowloon, guys inviting you
to Shinjuku...","你還挺受歡迎的嘛。
女孩子邀你去Kowloon，
男孩子則是邀你去新宿……","","너, 꽤 인기가 많구나
여자애에게서는 쿠롱으로 초대받고
남자애에게서는 신주쿠로…","Du bist ganz schön beliebt, was?
Mädchen, die dich nach Kowloon einladen,
Jungs nach Shinjuku ..."
8011,3013,"","There's really no need to choose. The two paths
end at the same destination. They're both
invitations from friends, yes? So go to both.","你不需要只選擇其中一邊，
無論你先去哪一邊，受到命運牽引的未來也會歸至同一個地方……
那是朋友的邀請對吧？　你就兩邊都去吧。","","둘 중 하나를 선택할 필요는 없고,
어디부터 가도, 자아내는 미래는 같은 장소로 귀결될 거야…
친구의 초대잖아? 양쪽 다 가 주렴","Es gibt aber keine Qual der Wahl. Beide Wege
führen zum gleichen Ziel. Es sind beides
Einladungen von Freunden, oder? Geh zu beidem."
8020,3013,"","Going with a boy, hmm?
You'll investigate Shinjuku's Digital Shifts, yes?","你正在陪男孩子行動啊……
你們在調查新宿的Digital Shift吧？","","남자애의 초대에 어울려 주고 있는 모양이네…
디지털 시프트에 대해, 신주쿠에서 조사하고 있는 거구나?","Die Wahl fiel auf einen Jungen, hm?
Du ermittelst wegen der digitalen
Verschiebung n in Shinjuku, ja?"
8021,3013,"","Your investigation wasn't completely off-base.
Could there be a spot you failed to check?","不見得是搞錯調查地點，
說不定是你還有沒調查到的地方哦。","","조사하는 장소로서는 그렇게 틀리진 않은 것 같은데?
어쩌면, 아직 조사하지 않은 장소가 있지 않을까","Deine Nachforschungen waren nicht völlig abwegig.
Hast du vielleicht einen Ort übersehen?"
8060,3013,"","You certainly do stumble across the strangest
things. What an intriguing destiny... Anyway,
stay on target. If you're injured, then pull back.","是經常遭遇事件的那個人啊……你的命運果然很令人感興趣呢。
總之，你就先試著前進吧。
如果有東西擋在你面前，你只要除掉它就行了。","","사건과 자주 조우를 하는 아이구나… 역시 네 운명은 흥미로워
어쨌든 앞으로 나아가 보렴
방해물이 있다면, 없애면 될 뿐이야","Du findest wirklich die seltsamsten Dinge. Was für
ein interessantes Schicksal ... Mach weiter so.
Zieh dich zurück, wenn du verletzt wirst."
8030,3013,"","You went along with your guy friend, yes?
Then next, you'll have to meet with your gal
friend. She's waiting for you in Kowloon.","你之前是陪男孩子行動對吧？
那麼，你這次就換陪女孩子行動吧。
她似乎正在Kowloon等待著你哦。","","남자애의 초대에는 다 어울려 준 거잖아?
그렇다면 다음은, 여자애의 초대에 어울려 주렴
그 아이는, 쿠롱에서 널 기다리고 있는 모양이야","Du bist mit deinem Freund mitgegangen, ja?
Nächstes Mal musst du deine Freundin treffen.
Sie wartet in Kowloon auf dich."
8040,3013,"","Heading out to see your gal pal, hm?
Searching for people to join her new hacker team?","你正在陪女孩子行動啊……
也就是說，你正在邀人加入新的駭客集團？","","여자애의 초대에 어울려 주고 있는 모양이네…
새로운 해커 팀의, 권유를 하고 있구나?","Triffst du dich mit deiner Freundin?
Sucht sie nach Leuten für ihr neues Hackerteam?"
8041,3013,"","That was some solicitation.
Effective, yes, but heading to enemy hideouts to
find members... Your friend certainly is daring.","招攬駭客啊……
雖然效率確實是不錯，但居然想闖進敵對集團的巢穴裡……
你的朋友還真是相當大膽呢……","","해커의 권유구나…
효율이 좋다고는 해도, 적 팀의 아지트에 쳐들어가다니…
네 친구는 상당히 대담한 행동을 하는구나…","Was für eine Art des Werbens. Effektiv, ja. Aber
zu Verstecken der Gegner zu gehen, um Mitglieder
zu finden ... Deine Freundin hat Mumm."
8050,3013,"","You gave out invites with your lady friend, yes?
Next, you'll need to meet with your guy friend.
He's waiting for you in Shinjuku.","你之前是陪女孩子行動對吧？
那麼，你這次就換陪男孩子行動吧。
他似乎正在新宿等待著你哦。","","여자애의 초대에는 다 어울려 준 거잖아?
그렇다면 다음은, 남자애의 초대에 어울려 주렴
그 아이는, 신주쿠에서 널 기다리고 있는 모양이야","Du hast mit deiner Freundin Einladungen verteilt?
Nächstes Mal musst du deinen Freund treffen.
Er wartet in Shinjuku auf dich."
9000,3013,"","You remember the plan, don't you? Your role is to
join the Kamishiro upgrade test, infiltrate the
company server, and clear the security protocols.","你有牢牢記住作戰內容吧？
你的任務是參加神代的版本升級體驗會，
然後入侵總公司的伺服器，解除他們的安全防護哦。","","작전은 제대로 기억하고 있는 걸까?
네 역할은, 카미시로의 버전 업 체험회에 참가해서
본사의 서버에 침입, 보안을 해제하는 거야","Du kennst den Plan? Mach beim Update-Test von
Kamishiro mit, infiltriere den Server und entferne
die Sicherheitsprotokolle."
9001,3013,"","A difficult mission, yes, but I'm sure you can
make everyone's hopes come true.
...It's your destiny, after all.","這是個艱難的任務，
但你一定能回應大家的期待。
……因為那就是你的命運。","","어려운 미션이지만,
너라면 분명, 모두의 기대에 부응할 수 있을 거야
…왜냐하면, 그게 너의 운명이니까","Eine schwierige Mission, aber du wirst uns
sicher nicht enttäuschen ...
Schließlich ist das dein Schicksal."
9010,3013,"","It seems you've been able to enter the Avalon
server without incident. Now, just work with the
Digimon to head towards the deepest area.","看來你順利進入阿瓦隆伺服器了呢。
再來你只要跟數碼寶貝們同心協力，以最深處為目標前進就行了。","","아발론 서버로는 무사히 진입했구나
그렇다면 다음은, 디지몬들과 협력해서 최심부로 향하는 것뿐이네","Du bist ohne Probleme auf den Avalon-Server
gekommen. Nutze jetzt die Digimon,
um ins tiefste Innere vorzudringen."
10000,3013,"","People are waiting for you in EDEN's free area.
Remember, even a one-sided conversation is worth
listening to.","有一群人正在EDEN的自由區域等著你哦。
雖然是對方單方面決定的，既然你有聽見那些話，
那就不能無視那個約定吧？","","EDEN의 프리 에어리어에서, 널 기다리고 있는 사람들이 있어
비록 일방적인 얘기였다 해도, 들어 버린 이상
무시할 수는 없지 않을까?","Im Freien Bereich von EDEN warten Leute auf dich.
Denk dran, es lohnt sich, selbst
einseitigen Unterhaltungen zuzuhören."
10010,3013,"","Didn't you promise to meet your friends in EDEN?
Your destiny cries out ever more stridently...
Mm, you'd best get a move on, I think.","你跟朋友約好在EDEN碰面對吧？
你的命運即將迎來巨大的改變呢……
快點過去比較好哦。","","친구와 EDEN에서 만나기로 약속했지?
네 운명이, 소란스럽게 울리고 있어…
서둘러 향하는 게 좋지 않을까","Hattest du nicht versprochen, deine Freunde in
EDEN zu treffen? Dein Schicksal ruft ...
Ja, du solltest dich beeilen."
10020,3013,"","Many peoples' destinies entwine at the Valhalla
server. You were headed there as well, yes?
...You cannot run from fate, so prepare well.","許多人的命運都交織在瓦爾哈拉伺服器裡呢。
你是不是也以那裡為目標呢？
……無論如何，你是無法逃離命運的，做好準備就前往那裡吧。","","발할라 서버에서, 많은 사람들의 운명이 엇갈리고 있어
너도 그곳으로 향하고 있지 않았니?
…어차피 운명에서는 벗어날 수 없어, 단단히 준비하고 향하렴","Die Schicksale vieler Menschen sind mit dem
Walhalla-Server verknüpft. Du wolltest da hin, ja?
Sei bereit, das Schicksal wartet nicht."
10030,3013,"","So, you've entered the Valhalla server.
Its deepest point is known as ""Under Zero""...
There are many traps, but trust in your Digimon.","看來你已經進入瓦爾哈拉伺服器了呢。
「Under Zero」存在於瓦爾哈拉伺服器的最深處……
雖然路上會有很多阻礙，但你就跟數碼寶貝們同心協力前進吧。","","발할라 서버에 들어간 것 같네
「언더 제로」는 발할라 서버의 최심부…
많은 장치가 되어 있겠지만, 디지몬들과 협력해서 나아가렴","Du bist auf dem Walhalla-Server. Sein zentraler
Punkt heißt „Unter Null“ ... Es gibt dort viele
Fallen, aber verlass dich auf deine Digimon."
11000,3013,"","Isn't someone waiting for you in the Zaxon forum?
Uncertain or no, just start with what you can do.","不是有人正在Zaxon廣場等著你嗎？
我知道你很不安，不過現在只能從做得到的事先做起了。","","잭슨 포럼에서 기다리고 있는 애가 있지 않을까?
불안한 건 알겠지만, 할 수 있는 일부터 해나갈 수밖에 없어","Wartet nicht jemand im Zaxon-Forum auf dich?
Auch wenn du unsicher bist,
fang mit dem an, was machbar ist."
11010,3013,"","You've held your planning meeting, yes? Speak
with Kyoko to confirm the details. ...You're
trying hard to struggle against fate's skein.","你開過作戰會議了對吧？
如果想確認內容的話，就去找杏子吧。
……你就試著在命運的漩渦之中拼命掙扎吧。","","작전 회의를 열었었지?
내용을 확인하고 싶으면, 쿄코에게 말을 걸어 보렴
…운명의 소용돌이 속에서, 힘껏 몸부림을 쳐 보렴","Das geplante Treffen hat stattgefunden, ja? Sprich
zur Bestätigung mit Kyoko ... Du kämpfst hart
gegen die Macht des Schicksals an."
11020,3013,"","You're heading to the Roppongi Underground Center,
yes? The underground route is huge, but built
simply. ...Still, don't let down your guard.","你現在是要去六本木地下設施對吧。
雖然地下道很大，但構造很單純。
……記得直到最後一刻都不能鬆懈哦。","","롯폰기 지하 시설을 목표로 하고 있구나
지하도는 넓지만, 구조는 간단해
…다만 마지막까지 긴장을 풀면 안 돼","Du willst zum unterirdischen Zentrum in Roppongi?
Die unterirdische Route ist lang, aber simpel.
... Bleib trotzdem wachsam."
13000,3013,"","One way to find something is to head where crowds
are. In fact, a friend who can move many people
is in Shibuya now. Try speaking with them.","如果想找什麼東西的話，讓一堆人去找也是一種方法哦。
人脈很廣的朋友似乎正好在涉谷那裡呢。
你就去找她商量看看吧。","","무언가를 찾고 싶다면, 대규모로 임하는 것도 하나의 방법이야
마침 시부야에 많은 사람들을 움직일 수 있는 친구가 있는 것 같네
그 아이에게 상담해 보면 되지 않을까","Wo Menschenmengen sind, wird man oft fündig. Ein
Freund, der viele zu bewegen weiß, ist jetzt in
Shibuya. Sprich mit ihm."
13010,3013,"","Your friend is searching for this world, yes? They
can even go to EDEN now, so why not search there?","這邊的世界的朋友會主動來找你對吧？
畢竟好不容易能到EDEN去了，
你就主動去找他們吧？","","이쪽 세계는 친구가 찾아 주는 거잖아?
모처럼 EDEN에 갈 수 있게 됐으니까,
넌 그쪽을 찾아 보는 게 어때?","Dein Freund sucht nach dieser Welt, ja? Er kann
jetzt sogar nach EDEN kommen.
Warum suchst du nicht dort?"
14000,3013,"","You've headed to Akihabara to meet Gallantmon,
yes? You'll find being able to ""take notice""
is convenient...but sporadic. Do stay alert.","你應該是要去秋葉原見紅蓮騎士獸對吧？
話說回來，「氣息」這東西還真方便呢……
不過那玩意兒卻也經常會產生變化……　你在路上要隨時注意哦。","","듀크몬을 만나기 위해, 아키하바라로 가기로 하지 않았니?
그건 그렇고,「기척」이라니, 참 편리하구나…
하지만 그것은 항상 변해 가는 것… 충분히 주의하고 향하렴","Du willst nach Akihabara, um Gallantmon zu
treffen? Dein „Spürsinn“ kann helfen.
Hin und wieder. Bleib auf der Hut."
14005,3013,"","Ah... Leopardmon and Dynasmon...
Destiny is cruel at times.
But don't forget that's not all the future holds.","是嗎……芳香獸跟杜納斯獸它們……
……命運有時很殘酷呢。
不過，你絕對不能忘記命運也不是只有殘酷的一面哦。","","그래… 두프트몬과 듀나스몬이…
…운명은, 때로는 잔혹한 거란다
하지만, 결코 그렇지만 않다는 것도, 잊어선 안 돼","Ach ... Duftmon und Dynasmon ...
Manchmal ist das Schicksal grausam.
Aber die Zukunft hält auch anderes bereit."
14006,3013,"","That being the case, why not check in at the
office? Kyoko will likely return...
Or something different, perhaps...","對了，你要不要去事務所露個面？
杏子或許已經回來了……
雖然搞不好又會發生別的事……","","그건 그렇고, 한번 사무소에 들러 보는 건 어떨까
쿄코가 돌아왔을지도 몰라…
어쩌면, 또 다른 무언가일지도 모르지만…","Wenn das so ist, schau doch im Büro vorbei?
Kyoko wird sicher zurückkehren ...
Oder vielleicht etwas anderes ..."
14010,3013,"","You've taken on Chika Yamashina's case, yes?
The investigation subject is in Central Hospital.
Why not start there and take a look?","你接受了山科千夏的委託對吧？
調查對象正在中央醫院裡住院呢。
你就先乖乖去那裡一趟吧。","","야마시나 치카로부터 의뢰를 받았잖아?
조사 대상은 센트럴 병원에 입원 중이었지
우선 순순히 그곳에 가 보면 어떨까?","Du hast den Fall von Chika Yamashina übernommen?
Das Ziel der Ermittlungen ist im
Zentralkrankenhaus. Warum fängst du nicht da an?"
14020,3013,"","Wouldn't the nurses in the hospital know more
about Makoto Yamashina than I do?","山科誠的事……與其問我，
不如去問他住的那間醫院的護理人員會比較好哦。","","야마시나 마코토에 대해서는, 나에게 물어보는 것보다
입원 중인 병원의, 간호사에게 물어보는 편이 좋다고 생각해","Wissen die Krankenschwestern im Krankenhaus nicht
mehr als ich über Makoto Yamashina?"
14030,3013,"","From what I can see, Makoto Yamashina has not left
the hospital. Ask around, surely he'll turn up.","依我的判斷，山科誠應該是沒有離開醫院……
只要在醫院裡到處找人打聽，應該很快就會找到人了吧。","","내 판단에 따르면, 야마시나 마코토는 병원에서 나오지 않았을 거야…
병원 내에서 탐문 조사를 해 보면, 머지않아 찾을 수 있지 않을까","Soweit ich sehen kann, hat Makoto Yamashina das
Krankenhaus nicht verlassen. Frag herum.
Er wird sicher wieder auftauchen."
14035,3013,"","The memory data Digital Shift was surprising, as
was your spur of the moment action. Removing the
protection is simple, but dangerous. Be prepared.","雖然我對記憶資料的Digital Shift感到吃驚，
不過你果斷的行動力也讓我很驚訝呢。
要解除資料的防護是不難，但是也很麻煩哦，記得要做好足夠的準備再去。","","기억 데이터의 디지털 시프트에도 놀랐지만,
너의 순간적인 행동력에도 깜짝 놀랐어
프로텍트 해제는 단순하지만 성가셔, 충분히 준비하고 가렴","Die digitale Verschiebung der Speicherdaten war
sehr überraschend. Den Schutz zu
entfernen, ist einfach, aber gefährlich. Vorsicht."
14040,3013,"","The police asked for your assistance, yes?
Then you'd best head to Shinjuku...quickly.","警方要你去支援對吧？
快點前往新宿比較好哦。","","경찰로부터 지원을 부탁받았잖아?
서둘러 신주쿠로 향하는 편이 좋지 않을까","Die Polizei will deine Hilfe?
Dann geh nach Shinjuku ... schnell."
14050,3013,"","Shinjuku's streets seem to be under control,
but there's still some in the underground, yes?
And wasn't your friend seen underground?","新宿地上的狀況似乎已經解決到某個程度了，
不過地下應該還剩不少麻煩吧？
而且有人告訴你他曾經在地下見過你的朋友對吧？","","신주쿠의 지상은 어느 정도 수습된 것 같지만,
지하가 아직 남아 있지 않아?
그리고, 네 친구를 지하에서 봤다는 정보도 있잖아?","Die Straßen von Shinjuku sind wohl sicher, aber es
sind noch welche in der U-Bahn, oder?
Wurde dein Freund nicht dort gesehen?"
14060,3013,"","You've come to Shinjuku's Digital Shift before,
but this time, you need to go farther...all the
way. No matter what, you know how to resolve this.","你應該有去過新宿的Digital Shift，
不過這次的目標是那裡的深處……你就以鐵軌的前方為目標吧。
就算途中有阻礙，你應該也已經知道解決的方法了。","","신주쿠의 디지털 시프트에는 한 번 와 봤겠지만
이번에는 더욱 안쪽… 선로의 끝으로 향하렴
방해물이 있어도, 그 해결법은 이미 알고 있을 거야","Du warst schon bei der digitalen Verschiebung in
Shinjuku, aber diesmal musst du ganz hinein.
Egal, was passiert, du weißt, was zu tun ist."
15000,3013,"","You're off to persuade the Royal Knights, yes?
Shibuya's underground, Ueno, EDEN's free area...
Not one will be straightforward. Good luck.","你要去說服皇家騎士對吧？
涉谷的地下、上野……還有EDEN的自由區域嗎？
那三個地方應該都不好處理，但你就加油吧。","","너, 로얄 나이츠를 설득하러 갈 거잖아?
시부야의 지하와, 우에노와… 그리고 EDEN의 프리 에어리어구나…
모두 만만치 않겠지만, 힘내렴","Du willst los und die Royal Knights überzeugen?
In der Shibuya-U-Bahn, Ueno, EDENs Freiem
Bereich. Das wird nicht einfach. Viel Glück."
15010,3013,"","The remaining Royal Knights are in Ueno and the
EDEN free area. Good luck.","剩下的皇家騎士分別在上野與EDEN自由區域裡哦。
你就照這個樣子繼續努力吧。","","남은 로얄 나이츠는, 우에노와 EDEN의 프리 에어리어야
이 기세로 계속 힘내렴","Die übrigen Royal Knights sind in Ueno und dem
Freien Bereich von EDEN. Viel Glück."
15020,3013,"","Hackmon has entered Ueno's museum, yes? Surely
BanchoLeomon is within. Maybe join them?","哈克獸似乎跑進上野的博物館裡了呢。
在那裡的深處一定有番長獅子獸在……
你也快點追過去比較好吧？","","헉몬은 우에노의 박물관에 들어간 모양이네
분명 그 안쪽에 반쵸레오몬이 있을 거야…
너도 뒤쫓아 가는 편이 좋지 않을까?","Hackmon hat das Ueno-Museum betreten, nicht wahr?
Dort ist BanchoLeomon.
Vielleicht solltest du zu ihnen gehen?"
15030,3013,"","The remaining Royal Knights are in the Shibuya
underground and the EDEN free area. Good luck.","剩下的皇家騎士分別在涉谷的地下跟EDEN的自由區域裡哦。
你就照這個樣子繼續努力吧。","","남은 로얄 나이츠는, 시부야의 지하와 EDEN의 프리 에어리어야
이 기세로 계속 힘내렴","Die übrigen Royal Knights sind im U-Bahn-System
von Shibuya und dem Freiem Bereich von EDEN.
Viel Glück."
15040,3013,"","All that's left is the EDEN free area, yes?
This time, the situation may be rather tough...
Well, you'd best go and see.","看來要去的地方只剩EDEN的自由區域了。
雖然這次可能會有些棘手……
總之你就先過去看看吧。","","남은 건 EDEN의 프리 에어리어 뿐인 것 같네
이번에는 좀 성가신 일이 될 것 같지만…
어쨌든 가 보렴","Jetzt ist nur noch der Freie Bereich von EDEN
übrig? Dieses Mal könnte es schwierig werden ...
Nun ja, geh hin und finde es heraus."
15050,3013,"","To summon Digimon with special skills,
you'll need Harmonious Will and Steel Will.
And you can find those...hee hee.","想叫出持有特殊技能的數碼寶貝時，
你會需要「和諧的意志」與「鋼鐵的意志」哦。
至於要去哪裡才有辦法獲得……　呵呵呵。","","특수한 스킬을 가진 디지몬을 불러내기 위해 필요한 것은
「조화의 의지」와「강철의 의지」야
어디서 구할 수 있는지는… 우후후","Um Digimon mit besonderen Fertigkeiten zu rufen,
benötigst du Harmonischer Wille und Stahlwille. 
Und die kannst du finden ... hihi."
15051,3013,"","Of course you're worried... But for now, why not
meet with the Royal Knights in Ueno and the
Shibuya underground?","就算一直煩惱也沒有意義啊……
總之，你現在就先去見
在涉谷的地下以及上野的皇家騎士吧。","","고민해 봐도 별수 없어…
어쨌든 지금은, 시부야의 지하와 우에노에 있는
로얄 나이츠를 만나러 가 보면 어떨까","Natürlich bist du besorgt ... Aber triff dich doch
erst mit den Royal Knights in Ueno und dem
U-Bahn-System von Shibuya."
15055,3013,"","That's a surprise. You have it already...","唉呀，真叫人吃驚。原來你已經有了啊……","","어머, 놀랐어. 이미 갖고 있구나…","Das ist eine Überraschung. Du hast es schon ..."
15059,3013,"","Got it.","我確實收下了……","","확실히 받았어…","Verstanden."
