ID,Speaker,Japanese,English,Chinese,EnglishCensored,Korean,German
1,7376,"","The grand finals are about to start. Contestants,
please take your places.","高中生程式選手權決賽即將開始，
關於選手們的規定位置……","","고교생 프로그램 선수권, 결승전이 곧 시작됩니다.
선수는 지정된 위치에서……","Das Finale geht gleich los. Teilnehmer, bitte auf
die Plätze."
2,3045,"","Why would you ask me to come to this?","……為什麼連我也要啊。","","……어째서 나까지","Warum wollt ihr mich denn dabeihaben?"
3,3047,"","You're free, right? And Ryuji's nowhere to be
found. We might need an extra pair of hands!","有什麼關係，反正妳一定也沒事做吧？
而且龍司也不在，人手多一點不會有壞事的！","","상관없잖아~ 어차피 한가하지?
류지도 없고 일손은 많을수록 좋으니까!","Du hast doch Zeit, oder? Und von Ryuji ist keine
Spur. Wir brauchen vielleicht noch jemanden zum
Anpacken!"
4,3045,"","I'm not interested in some high school
competition. Sabotaging the opposition doesn't
sound like that big a deal.","……我對高中生的大賽沒有興趣，
反正對手的妨礙手段一定也沒什麼大不了的。","","…고교생 대회 같은 건 흥미 없는데.
상대의 방해 공작이래 봤자 어차피 별거 아닐 거라고 생각해","Ein Schulwettbewerb interessiert mich nicht. Das
wird schon nicht so schlimm sein, wenn sie den
Gegnern ein Bein stellen."
5,3047,"","High school kids these days actually have some
pretty good skills. Some of them have created some
interesting programs!","不不不，妳可不要看不起最近的高中生喔～？
也有寫出了相當有趣的程式的傢伙喔！ ","","아니아니, 요즘 고등학생도 제법 얕볼 수 없다구~?
꽤 재미있는 프로그램을 짜는 녀석도 있으니까!","Highschool-Schüler heutzutage haben schon einiges
auf dem Kasten. Manche haben schon interessante
Programme geschrieben!"
6,3045,"","You just like all the hustle and bustle.","千歲就是喜歡這種場合……真是的。","","치토세는 축제의 소란을 좋아하는 것뿐이잖아……나 참","Du hast einfach nur Spaß am ganzen Trara."
7,7374,"","Are you all with Hudie?","你們是hudie的人吧？","","후디에 분들이시죠?","Gehört ihr alle zu Hudie?"
8,7374,"","Thanks for coming.","今天請多指教。","","오늘은 잘 부탁드립니다","Danke, dass ihr gekommen seid."
9,3047,"","Wait? Don't you need to get ready for the contest?
They just called the contestants.","辛苦啦。
咦？　社長大人不用做準備嗎？
剛剛不是叫到選手了嗎？","","수고했어.
어라? 부장님은 준비하지 않아도 돼?
방금 선수를 부르던데","Moment, musst du dich nicht für den Wettbewerb
fertig machen? Sie haben gerade die Teilnehmer
aufgerufen."
10,7374,"","I'm not on the team. I'm kind of like the coach...
I give them support.","我不是出賽成員，所以沒關係。
我比較像是教練……支援選手的立場。","","저는 선발 멤버가 아니니 괜찮습니다.
코치 같은 입장이라고 할까…선수의 서포트를 맡고 있습니다","Ich gehöre nicht zum Team. Ich bin eher die
Trainerin ... und leiste Unterstützung."
11,7374,"","I'll be keeping a close eye on Nishinomori High
School with you during the competition.","我想和大家一起，在比賽時監視西之森高中的動作。","","시합 도중에도 여러분과 함께 니시노모리 고교의 움직임을
엄중하게 감시할 생각입니다","Ich werde mit euch ein Auge auf die Nishinomori
High School haben, während der Wettbewerb läuft."
12,3047,"","You're taking this really seriously.","真有幹勁呢。","","기합이 들어갔네","Du nimmst das ganz schön ernst."
13,7374,"","That's how much I care about this contest. If we
can pull this off, we'll be the first team to win
two consecutive championships in seven years!","我對這場大賽就是有如此強烈的執著。
一定要達成闊別七年的二連霸！","","그 정도로 이 시합에 깊은 마음을 담고 있는 겁니다.
7년 만의 2연패, 반드시 달성하고 말겠습니다!","Der Wettbewerb ist mir eben sehr wichtig. Wenn wir
das schaffen, sind wir seit sieben Jahren das
erste Team, das zweimal in Folge gewinnt!"
14,7377,"","Well, if it isn't Kuraji.","哎～呀哎呀，這不是井之電的社長嗎？","","어~라어라, 이거 이노덴의 부장 아냐","Na, wenn das mal nicht Kuraji ist."
15,7377,"","What are you doing over here? The contest's about
to start.","在這種地方偷懶沒關係嗎？
比賽要開始了喔。","","이런 곳에서 농땡이 치고 있어도 되는 걸까나?
곧 시합이 시작된다고?","Was machst du denn hier drüben? Es geht gleich
los."
16,7374,"","I could ask you the same thing.","……要這樣說的話你不也是嗎，東雲。","","…그건 너도 마찬가지잖아, 시노노메","Ich könnte dich das Gleiche fragen."
17,7378,"","I'm just here to wish you luck. I hope it's a good
contest.","哼，就讓我們互相好好的比一場吧。
希望這能成為一場好比賽。","","흥, 뭐 서로 건투해보자.
좋은 시합이 되기를 기원하지","Ich wollte euch nur viel Glück wünschen. Ich
hoffe, es wird ein guter Wettbewerb."
18,7378,"","I just hope nothing goes wrong... Hahaha...","希望不要發生什麼突發事件才好……呵呵呵。","","아무 사고도 일어나지 않았으면 좋겠네……크크크","Hoffentlich geht nichts schief ... Hahaha ..."
19,7374,"","That was Shinonome, president of the Nishinomori
Digital Club.","……那就是對手學校的社長，東雲。","","……저게 라이벌 학교의 부장, 시노노메입니다","Das war Shinomone, der Vorsitzende des
Nishinomori-Informatikclubs."
20,3047,"","He's clearly plotting something. He wasn't exactly
subtle about it.","……完全散發出那種「有不良企圖」的臉呢。
連挑釁都很好看穿。","","…척 봐도「뭔가 꾸미고 있습니다」같은 얼굴이었지.
알기 쉬운 도발이로구만","Der führt definitiv etwas im Schilde. Damit hat er
ja kaum hinter dem Berg gehalten."
21,7374,"","He's not on the team either. If they do anything,
he'll probably be the one behind it.","因為他也不是出賽選手，
如果發生什麼狀況，他一定也會有所動作","","저 사람도 선발 선수가 아니기 때문에
무슨 일이 일어난다면 분명 그가 움직인 것이겠죠","Er ist auch nicht in deren Team. Wenn sie etwas
machen, steckt er wahrscheinlich dahinter."
22,7374,"","Their most likely target is the server that
controls the program we built. I'll send you the
URL.","他們鎖定的目標，應該是我們所構築的
程式管理伺服器。我現在就把伺服器的
URL交給你們。","","노린다면 아마 저희가 구축한 프로그램의
관리 서버일 거라고 생각합니다.
늦기 전에 서버의 URL을 보내드릴게요","Am ehesten haben sie es auf den Server abgesehen,
der unser Programm steuert. Ich schicke euch die
URL."
23,7374,"","I'm counting on you.","那就拜託你們了。","","그러면 잘 부탁드립니다","Ich verlasse mich auf euch."
24,3047,"","I guess we just have to wait for Nishinomori to
make their move.","人家是這樣說的喔，
剩下的就是等對方出手吧。","","그렇대. 남은 건 상대가 어떻게 나오냐에 달렸다는 느낌인걸","Jetzt müssen wir wohl abwarten, bis Nishinomori
zuschlägt."
25,3047,"","Hey? Where's [p]?","……嗯？　[p]在哪啊？","","…어라? [p] 녀석은 어디 갔지?","He, wo ist denn [p]?"
26,3045,"","Behind me.","……我的後面。","","……내 뒤에","Hinter mir."
27,3047,"","What are you scared of?! It's not as if the
digital club members know who you are, do they?","不用那麼怕吧！
數碼社的人不會認識你吧？","","그렇게까지 겁내지 말라고!
디지털부 녀석들이랑 안면이 있는 건 아니잖아?","Wovor hast du denn Angst? Die Mitglieder des
Informatikclubs kennen dich doch nicht, oder?"
28,3045,"","And you're not doing anything wrong. Man up.","就是說啊，我們又沒有做壞事。
堂堂正正的就行了。","","그래. 딱히 나쁜 짓을 하는 것도 아니니까
당당하게 있어","Und du tust ja nichts Böses. Reiß dich mal
zusammen."
29,3047,"","I don't get you. Why take this case if you're so
afraid to see people from your high school?","你也真是好事～
如果那麼不想和高中的人見面，
何必還特地接受委託啊。","","너도 참 별나네~
그렇게나 같은 학교 녀석들과 마주치고 싶지 않다면
굳이 의뢰를 받을 필요도 없었을 텐데","Ich verstehe dich nicht. Warum nimmst du den Fall
denn an, wenn du solche Angst hast, dass Leute
aus deiner Schule dich sehen?"
30,3045,"","You're too soft for your own good.","……根本已經超越爛好人的境界了。","","…도를 넘을 정도로 사람이 좋은 거야","Du hast ein viel zu weiches Herz."
31,3047,"","If you're that worried, you don't need to get too
close. Just hide here and keep your eyes peeled.","唉……那麼擔心，就不要這麼近距離觀看比賽啊。
躲起來當幕後就好啦。","","뭐…그렇게나 걱정된다면 시합을 가까이에서 보는 건 그만둘까.
여기 숨어서 배후를 지키도록 하자","Wenn du dir solche Sorgen machst, dann geh nicht
zu nah ran. Versteck dich hier und halte einfach
die Augen offen."
32,3047,"","Relax! If anything happens, I'll deal with it.","不要那麼緊張啦！
有什麼事的話我也會支援的……","","그렇게 굳어있지 말라니까!
무슨 일이 생긴다면 내가 서포트 할 테고…","Entspann dich! Wenn etwas ist, werde ich mich
schon kümmern."
33,3047,"","And if you get caught on camera, Erika will use
her hacking skills to remove all trace of it!","就算會被攝影機照到，
也可以用小姐的入侵順利蒙混過去！","","혹시 카메라에 비춰질 것 같으면
아가씨가 해킹으로 감쪽같이 속여 줄 테니까!","Und wenn dich eine Kamera erwischt, setzt Erika
ihre Hackertalente ein, um sämtliche Spuren
verschwinden zu lassen!"
34,3045,"","Don't speak for me...although I could do that.","不要隨便決定……
不過，那點程度的話我是沒差啦。","","멋대로 결정하지 말아 줄래…
뭐, 그 정도야 별로 상관없지만","Red nicht für mich ... wobei ich das in der Tat
könnte."
35,7376,"","Time for round one!","決賽第一戰，開始！","","결승전 1회전, 시작합니다!","Zeit für die erste Runde!"
36,3047,"","Oh, it's started.","喔，開始了。","","아, 시작됐네","Ah, es geht los."
37,3045,"","It best of three.","……我記得是三回合的賽制吧。","","……분명 세판 승부였었지","Es wird über drei Runden entschieden."
38,7376,"","Both teams are off to a great start! Oh?!
Nishinomori has just slipped behind. Inoden has
the advantage!","兩校都順利的開始動作了！
……哎呀！？　但是西之森高中稍微慢了一步。
目前是井之電高中領先！","","두 학교, 초반은 순조롭게 출발하고 있습니다!
…이런!? 하지만 여기서 니시노모리 고교가 한 걸음 뒤처졌습니다
이노덴 고교가 우세합니다!","Beide Teams legen einen guten Start hin! Oha!
Nishinomori ist gerade zurückgefallen. Inoden
liegt im Vorteil!"
39,3047,"","Inoden's doing well. If nothing unexpected
happens, this will be the easiest case ever.","井之電的人好像很努力嘛，
如果就這樣順利結束，就能輕鬆獲得報酬了。","","이노덴 녀석들 열심히 하고 있나 본데.
이대로 아무 일도 일어나지 않는다면 편하게 보수를 받겠는걸","Inoden schlägt sich gut. Wenn nichts Unerwartetes
passiert, wird das der leichteste Fall überhaupt."
40,7376,"","Oh, what's this?! It looks like something's gone
wrong with Inoden's program!","哎呀，發生了什麼事了嗎！？
井之電高中的隊伍所構築的程式
好像有什麼突發狀況！","","이런, 이게 무슨 일이죠!?
이노덴 고교 팀이 구축한 프로그램에
사고가 일어난 모양입니다!","Was ist jetzt los?! Da scheint etwas mit dem
Programm von Inoden schiefgegangen zu sein!"
41,3047,"","?!","……！？","","……!?","?!"
42,7376,"","The tables have turned! It's anyone's match!","情勢瞬間逆轉！
最終結果會是如何還無人知曉！","","순식간에 형세 역전!
이래선 어떻게 될지 알 수 없게 되었습니다!","Das Blatt hat sich gewendet! Es ist wieder alles
offen!"
43,3045,"","So something has gone wrong.","……還是發生了呢，突發狀況。","","……일어났네, 사고","Es ist also etwas schiefgegangen."
44,3047,"","Okay, let's get to work!","沒辦法，開始工作吧！","","어쩔 수 없구만, 작업을 개시해볼까!","Machen wir uns an die Arbeit!"
45,3047,"","This is the server URL Kuraji sent us!","這是從社長那拿到的數碼社的
管理伺服器的URL！","","이게 부장에게서 받은 디지털부의
관리 서버 URL이다!","Das ist die Server-URL, die Kuraji uns geschickt
hat!"
46,3047,"","I'll see you there!","到那邊會合吧！","","저쪽에서 합류하자!","Wir sehen uns dort!"
