ID,Speaker,Japanese,English,Chinese,EnglishCensored,Korean,German
1,4921,,"Ti sta bene, Jimiken?",吉米肯真的很棒呢。,,"…좋네요, 지미켄","Hast du nichts dagegen, Jimiken?"
2,4921,,"Un paradosso, un angelo con un'ala sola, il cuore di un demone,
caduto in questo mondo indebolito di bugie e canzoni.","他就像是惡魔一般的單翼墮天使，
降臨在這個充滿冒牌貨的灰色俗世。",,"거짓투성이인 잿빛 속세에 내려온
한쪽 날개의 악마적 타천사죠","Ein Paradox, ein Engel mit nur einem Flügel, das
Herz eines Dämonen, ist auf diese schwache
Welt der Lügen und Lieder gefallen."
3,4921,,"Quindi vuoi sapere di Jimiken, eh?","咦？
你說吉米肯是什麼？",,"…에?
지미켄이 뭐냐고?","Du willst also mehr über Jimiken wissen, hm?"
4,4921,,Nooooon ancora!,你少來啦——！！,,또 또 또 또 그런다――!!,Noch niiicht!
5,4921,,Ahah! Jimiken è mitico!,"好棒啊～
吉米肯真的好棒啊～",,"좋다~
지미켄, 진짜 좋다~…",Haha! Jimiken ist der Größte!
6,4921,,Ahahah!,………,,………ㅋㅋㅋㅋㅋ,Hahaha!
