ID,Speaker,Japanese,English,Chinese,EnglishCensored,Korean,German
1,1738,"","This, this is good...
To martyr myself for my path... An honorable end!","這樣就好了……
為了自己的路而犧牲……這個結局才是我的榮耀……！","","이거면, 됐다…
내 길을 위하여 목숨을 바치는… 이 결말이야말로, 내 명예…!","Das ist gut so ...
Ich werde zum Märtyrer ...
Ein ehrbares Ende!"
2,1738,"","I reached the end without wavering in my faith!
My life will conclude in annihilation!","在不動搖自己選擇的信念下，到達的結局！
我的一生就以毀滅作為結束！","","스스로 선택한 신념을 굽히는 일 없이 나아가 도달한 결말!
…내 생애는 이 소멸에 의해 완결된다!","Ich habe bis zum Schluss nicht gezweifelt!
Jetzt geht es zu Ende."
3,1738,"","The Way of the Knight is in death and discovery!
Haha... Hahahahahaha!","我發現了！所謂的騎士精神就是毀滅！！
哈哈……哈哈哈哈哈哈哈哈哈哈哈！","","기사도란! 멸하는 것이라고, 깨달았느니라아아아!!
하핫… 하하하하하하하하하하하―!","Der Weg eines Knights liegt in der Entdeckung
und im Tod! Haha ... hahahaha!"
4,4837,"","Was his laugh a bit silly to you?","你們會嘲笑它很愚蠢嗎？","","…그를 어리석다고 비웃을 텐가?","Findet ihr diese Lache nicht komisch?"
5,4837,"","It's all down to the will of King Drasil.
Both sides determine the course of events now.","全都是世界樹的意志——
世界樹的意志決定了它們的存在方式……和我們的存在方式。","","모든 건 위그드라실의 의지―
그렇게 존재하도록 정해져 있는 것이, 그들이며… 우리들이다","Der Wille König Drasils ist alles, was zählt.
Jetzt bestimmen beide Seiten, was geschieht."
6,4837,"","The Royal Knights, and a single program...","皇家騎士也是其中一個程式……","","로얄 나이츠도 또한 하나의 프로그램…","Die Royal Knights und ein einzelnes Programm ..."
7,4837,"","No matter how powerful you may
be, you cannot run from destiny.","不管再怎麼強，
都無法擺脫“制約（宿命）”呀。","","아무리 강하다 해도
""제약(규칙)""에서는 벗어날 수 없다는 거다","Wie mächtig man auch ist, dem Schicksal kann man
nicht entrinnen."
8,2000,"","...","………","","………","..."
