ID,Speaker,Japanese,English,Chinese,EnglishCensored,Korean,German
1,2000,,"?
Non riesco a inviare l'URL dell'invito.","……？
邀請URL傳不出去……",,"…?
초대 URL을 보낼 수가 없어…","?
Ich kann keine URL-Einladung verschicken."
2,2000,,Meglio mettersi in contatto con Arata.,要快想辦法跟新聯絡。,,…일단 아라타에게 연락하자,Ich sollte mich bei Arata melden.
3,3004,,"Ehi, sembra che tu sia entrato abbastanza facilmente.
Ora inviami l'URL dell'invito.","喔～你好像順利進去了，
那快點把邀請URL給我……",,"오, 문제없이 안에 들어간 모양이네
그럼 초대 URL을…","He, du bist ja gut reingekommen.
Schick mir jetzt die Einladung."
4,3004,,"Cosa? Non puoi inviarlo? C'è un blocco?
Hmph, stupido vecchio database Kamishiro...","咦？URL傳不出來？被鎖起來了嗎？
哼，再爛畢竟也是神代的資料庫嘛！",,"아? URL을 보낼 수가 없다고? 블락이 걸려 있어?
…흥, 썩어도 카미시로의 데이터베이스라는 건가","Wie? Du kannst sie nicht senden? Sie wird
blockiert? Hmpf, dämliche Kamishiro-Datenbank ..."
5,3004,,"Okay, cercherò di fare qualcosa da parte mia.",好吧，那我就自己想辦法！,,"알겠어, 난 나대로 어떻게든 해 볼게","Okay, ich versuche etwas von dieser Seite aus."
6,3004,,"Per ora, rintraccia e supera la sicurezza
così potremo contattare Kyoko.","總之，你快去找出防範措施，再將其解除，
這樣才能連絡上杏子姊。",,"일단 댁은, 보안을 찾아서 해제해 줘
쿄코 씨와 연락을 할 수 있도록 말이지","Kümmere du dich derweil um das Sicherheitssystem,
damit wir uns bei Kyoko melden können."
7,3004,,"Ehi, tieni duro! Non c'è bisogno di essere nervosi per
una cosa del genere. Ci sentiamo dopo.","喂，你還好嗎？不要因為這點小意外就嚇成這樣！
待會見啦……",,"야 괜찮아? 이 정도의 사고로
쫄지 말라고? …그럼 나중에 보자","He, nur Mut! Kein Grund, nervös zu sein.
Bis später."
8,2000,,"Continuiamo.
La sicurezza dovrebbe essere da qualche parte qui intorno!",防範措施應該就在某處才對！,,"앞으로 나아가 보자
어딘가에 보안이 있을 거야…!","Also weiter.
Die Sicherheitssysteme müssen hier irgendwo sein!"
