ID,Speaker,Japanese,English,Chinese,EnglishCensored,Korean,German
0,4581,"","The strong, the smart, and the badass! Kowloon
belongs to us hackers!","很強的傢伙！　聰明的傢伙！　還有自由的傢伙！
「Kowloon」是屬於我們這些駭客的東西！","","강한 녀석! 영리한 녀석! 그리고 자유로운 녀석!
「쿠롱」은 그러한 우리 해커의 것이다!","Stark, klug und cool! Kowloon gehört uns Hackern!"
1,4582,"","The affinity between species and attributes is
vital in a Digimon battle. But the Digimon you can
take are limited, so you need to strike a balance.","有關數碼寶貝戰鬥，「種族」和「屬性」
的適性是非常重要的喔。但能夠帶出去的數碼寶貝
有限，整編隊伍要好好的考量平衡喔！","","디지몬 배틀은「종족」과「속성」의 상성이 중요해.
하지만 데려갈 수 있는 디지몬은 제한이 있으니까
균형을 생각하면서 파티를 잘 짜둬야 해!","Bei einem Digimon-Kampf ist die Affinität zwischen
Spezies und Attribut sehr wichtig. Aber man kann
nur wenige mitnehmen und muss sie gut auswählen."
2,4583,"","Digimon with high SPD are good because they can
move soon after the battle starts, but lots of
them are weak and have low ATK.","「SPD」高的數碼寶貝，在戰鬥開始時，很快就能
行動，所以很方便。但缺點則是較脆弱，以及
攻擊力低的數碼寶貝居多。","","「민첩」이 높은 디지몬은
배틀을 개시했을 때, 빨리 행동할 수 있으니까 편리하지.
단점은 맷집이 약하거나 공격력이 낮은 녀석이 많은 거려나","Digimon mit hoher GES sind gut, weil sie sich
nach Kampfbeginn schnell bewegen können, aber
viele von ihnen bieten nur schwache Angriffswerte."
3,4585,"","Abnormal statuses are horrible, especially
Confusion. That's why it's important to have
equipment that resists and nullifies them.","千萬不要小看異常狀態喔。特別是混亂，相當棘手。
不要放過提昇異常狀態耐性，和無效效果的裝備。","","상태 이상은 무시할 수 없어. 특히 혼란은 성가시지.
상태 이상 내성이라던가, 무효 효과가 붙은 장비는 뺄 수가 없어","Statusleiden sind schlimm, vor allem Verwirrung.
Deshalb braucht man Ausrüstung, die gegen sie
resistent macht oder sie negiert."
100,4581,"","The sky may have opened up and it may be raining
Digimon, but Kowloon belongs to us hackers!","……不管是天空破個洞也好，還是有數碼寶貝
從那個洞掉下來也好……
這「Kowloon」都是我們駭客的東西！！","","…하늘이 갈라지든, 거기서 디지몬이 내려오든…
이「쿠롱」은 우리 해커의 것이다아앗!!","Auch wenn der Himmel aufgebrochen ist und es
Digimon regnet – Kowloon gehört uns Hackern!"
101,4582,"","Are you keeping an eye on the affinity between
species and attributes? Once you have a party that
works for you, you can rival the best hackers!","你有注意「種族」和「適性」的平衡來戰鬥嗎？
如果有好好整編出輕易戰鬥的隊伍，
你就算得上是一位好駭客了喔！","","「종족」과「상성」의 균형을 신경 쓰며 배틀하고 있어?
싸우기 쉬운 자신만의 파티 구성을 짤 수 있게 되면
너도 누구 못지않은 해커야!","Behältst du die Affinität zwischen Spezies und
Attributen im Augen? Wenn deine Gruppe gut ist,
kannst du es mit den besten Hackern aufnehmen!"
102,4583,"","I had a party of only Digimon with high SPD.
They all attacked as soon as the battle started!
Getting the first strike makes all the difference!","組了個只有「SPD」高的數碼寶貝的隊伍，
在剛開始戰鬥時，全部一起攻擊真是爽快！
先下手為強啊！","","「민첩」이 높은 디지몬만으로 파티를 짰어
배틀이 시작된 직후에 일제 공격할 수 있어서 상쾌해! 선수 필승이지!","Ich hatte eine Gruppe, bei der alle Digimon hohe
GES hatten. Sie griffen alle sofort nach
Kampfbeginn an! Das war entscheidend!"
103,4585,"","Poison attacks are bad, but protecting against
them could leave me open to Confusion... Oh, where
am I? How did I end up here?","我太害怕劇毒攻擊，所以裝了劇毒耐性的裝備，
卻陷入了混亂狀態……。
咦，回家的路要怎麼走……？","","맹독 공격이 무서워서 맹독 내성인 장비를 달았더니, 혼란 상태에
빠져서 큰일이었어… 어라, 돌아가는 길은 어느쪽이었지…?","Giftangriffe sind schlimm, aber schütze ich mich
gegen sie, bin ich anfällig für Verwirrung. ...
Huch, wo bin ich? Wie bin ich hier gelandet?"
