ID,Speaker,Japanese,English,Chinese,EnglishCensored,Korean,German
1,5004,,"Non c'è altro che lunghi sentieri che continuano.
Alla loro fine, i sogni dei bambini appaiono e scompaiono.
Illusioni dell'infanzia.","漫長的通道不斷延伸。
在通道的前方，小孩的幻影一下子出現，一下子消失。
孩童時期的幻影。",,"한결같이 긴 통로가 이어진다.
통로의 앞에는, 아이의 환영이 나타났다 사라졌다 한다.
어렸을 때의 환영.","Lange Wege führen immer weiter ins Nichts.
Am Ende erscheinen Träume von Kindern.
Trugbilder aus der Kindheit."
2,5004,,"Il sentiero continua all'infinito.
Diventa sempre più oscuro man mano che procede.
A volte si sentono dei rumori.","通道無限延伸。
光線漸漸變暗。
雜音時而掠過。",,"어디까지고 통로가 이어진다.
점점 어두워진다.
가끔 노이즈가 발생한다.","Der Weg führt immer weiter.
Er wird immer finsterer.
Ab und an hört man Geräusche."
3,5004,,"Alla fine...
Tutto diventa nero, come uno schermo che si spegne.","不久。
畫面像螢幕的電源關掉一樣，突然消失。",,"이윽고.
화면이, 모니터의 전원이 꺼지듯 팟 하고 사라진다.","Am Ende ... wird alles schwarz,
wie wenn ein Bildschirm ausgeknipst wird."
