ID,Speaker,Japanese,English,Chinese,EnglishCensored,Korean,German
1,1020,"","You haven't seen them yet, have you?","你似乎還沒見到他們？","","아직 둘과 만나지 못한 것 같네?","Du hast sie noch nicht gesehen, oder?"
2,1020,"","They were still fighting as usual...","他們還是一如往常地不停吵架……","","여전히 둘의 싸움이 멈추지 않아서……","Sie haben sich immer noch gestritten, wie üblich."
3,1020,"","As soon as they saw me, they started asking whose
side I'm on.","我只要見到他們，
就一直被問「你到底站在誰那邊」。","","나는 얼굴만 봤다 하면
「누구 편이냐」는 말만 들어","Sobald sie mich gesehen haben, haben sie gefragt,
auf wessen Seite ich stehe."
4,1020,"","They used to be such good friends...","至今為止明明就處得很好，
究竟為什麼會變成這樣……","","지금까지 잘 지냈는데
어째서 이렇게……","Sie waren früher so gut befreundet ..."
5,1020,"","You have to hurry!","總之請盡快！
趕快去見見看他們。","","어쨌든 빨리!
네가 만나러 가줘","Du musst dich beeilen!"
6,1020,"","I'm sure they're still going at it.","看來在你要前往的地方，
他們倆還在吵架。","","아무래도 네가 있는 너머에서
둘은 아직 싸우고 있는 것 같아","Ich bin mir sicher, sie sind immer noch dabei."
7,1020,"","You're my only hope. Please help!","我只能交給你了……
萬事拜託了！","","나는 너한테 맡길 수밖에 없으니까……
부디 잘 부탁드립니다!","Du bist meine einzige Hoffnung. Bitte hilf mir!"
