ID,Speaker,Japanese,English,Chinese,EnglishCensored,Korean,German
100,4755,,"Il segnale è pessimo qui. Non riesco a mettermi
in contatto con il mio amico! Presenterò un reclamo!","真是的～！　通訊狀態很差，
完全沒辦法聯絡上約好的朋友！
我要去跟官方客訴～！",,"정말~! 통신 상태가 나빠서
만나기로 한 친구하고 연락이 안 되잖아!
운영자한테 항의해주겠어~!","Der Empfang hier ist das Letzte! Ich erreiche
meinen Freund nicht! Ich werde mich beschweren!"
200,4755,,"Anche tu stai incontrando un amico? Non ho visto una
ragazza del genere. Tutto questo rumore nel Cyberspazio sta
rovinando ogni cosa.","你也約了朋友嗎？
我沒有看到那樣子的女孩……
但真是困擾啊，電腦世界中都是雜音之類的……",,"너도 친구하고 만나기로 한 거야?
그런 여자애는 못 봤는데….
곤란하지~ 전뇌세계에서 노이즈라니…","Triffst du auch jemanden? So ein Mädchen habe ich
nicht gesehen. Der ganze Radau im Cyberspace
ruiniert alles."
300,4755,,"Ehi! Non avvicinarti a me se non
hai niente da dire!",哎呀──！　沒有什麼事的話就不要跟我搭話！,,이익~! 용무가 없으면 말 걸지 말라고!,"He! Pluster dich hier nicht so auf, wenn du gar
nichts zu sagen hast!"
