ID,Speaker,Japanese,English,Chinese,EnglishCensored,Korean,German
1,3046,"","Sorry. There's something I want to do before going
to EDEN.","抱歉，在去EDEN之前有想先做的事。","","미안하지만 EDEN에 가기 전에 해둬야 할 일이 있어","Tut mir leid. Ich will noch etwas erledigen, bevor
ich nach EDEN gehe."
2,3046,"","I want Chitose, you, and Wormmon to see.","千歲，[p]……還有蟲蟲獸，
我想讓大家一起見證。","","치토세, [p]…… 그리고 추추몬.
전원이 지켜봐줬으면 한다","Ich will, dass Chitose, du und Wormmon es seht."
3,3046,"","I'll be waiting in Ikebukuro. ","我在池袋等你們。","","이케부쿠로에서 기다리고 있겠다","Ich warte in Ikebukuro auf dich. "
4,2020,"","...?","…………？","","…………?","...?"
