ID,Speaker,Japanese,English,Chinese,EnglishCensored,Korean,German
1,1135,"","Huh? Nokia, it looks like we can't go any further.","嗯……？　諾奇雅，這邊好像不能過喔。","","응…? 노키아, 아무래도 여긴 지나갈 수 없나봐","Was? Nokia, anscheinend können wir nicht weiter."
2,3002,"","What?! Why?!","咦！？　怎麼會！？　為什麼！？","","에엑!? 어째서!? 왜!?","Was? Warum das denn?"
3,1027,"","I don't know. Something's stopping us.","我不知道。
好像被什麼東西妨礙了。","","모르겠어.
누군가가 방해하고 있나봐","Ich weiß nicht. Jemand hält uns davon ab."
4,3002,"","But we won't be able to get to Under Zero!","怎麼會！　要是不能通過這裡，
不就沒辦法到Under Zero了嗎！？","","이럴수가~! 여길 빠져나가지 못하면
언더 제로엔 못 가는 거잖아!?","Aber dann kommen wir nicht zu Unter Null!"
5,3002,"","Whoever you are! Let us past! You coward!","妨礙我們的是哪個傢伙啊！
你這卑鄙小人！","","어디 사는 어떤 놈이야~! 우리를 방해하는 놈은~!
이 비겁한 놈~!","Wer auch immer du bist! Lass uns vorbei!
Du Feigling!"
6,4005,"","Who are you calling a coward?","你說卑鄙？　這我可不能當沒聽到。","","비겁하다고? 흘려넘길 수 없는 말인걸","Wen nennst du hier einen Feigling?"
7,3002,"","Eek! Zaxon?!","嗚啊！　Z、Zaxon！？","","으엑! 재, 잭슨!?","Huch! Zaxon?!"
8,4005,"","You must be the group of amateurs Yuugo mentioned.
I can't let you go any farther.","YUGO說的菜鳥集團就是你們吧。
抱歉啊，你們不能再前進了。","","유고가 말했던 초보자 집단이라는 게 너희들이냐?
안됐지만 이 너머론 보내지 않겠다","Ihr müsst die Amateure sein, die Yuugo erwähnt
hatte. Ich darf euch nicht weiterlassen."
9,4005,"","Zaxon will have the glory of conquering Under
Zero! Give up and go home!","要在Under Zero取得榮耀的人是我們Zaxon ！
才剛成為駭客的菜鳥，就給我放棄回家去吧！","","언더 제로에서 영광을 쟁취하는 건, 우리들 잭슨이다!
갓 해커가 된 초보자는 포기하고 빨리
집으로 돌아가!","Der Ruhm, Unter Null zu erobern, wird Zaxon
gehören! Gebt auf und geht heim!"
10,3002,"","No way! We're ready to face whatever comes our way!","開玩笑！　我們也不是隨隨便便就到這來的啊！","","농담하지 마! 우리 역시 어설픈 각오로
여기에 온 것이 아니야!","Niemals! Wir nehmen es mit allem auf, was sich
uns in den Weg stellt!"
11,3002,"","We'll be the first to take Under Zero, and make
all the hackers understand that Digimon aren't
just tools!","我們要最快攻略Under Zero，
向駭客們表明我們的主張……
讓他們知道數碼寶貝不只是道具！","","이 언더 제로를 일등으로 공략해서
해커들에게 우리들의 주장을…
디지몬은 도구가 아니라는 것을 깨닫게 해주겠어!","Wir werden Unter Null als Erste einnehmen und den
Hackern zu verstehen geben, dass Digimon nicht
nur Werkzeuge sind!"
12,4005,"","I warned you. Yuugo ordered me to show no mercy to
anyone who tries to stop us.","……我已經警告過妳了。
YUGO說要是妳來礙事，就不用留情把妳打倒。","","…경고는 했다.
방해한다면 봐주지 말고 쓰러뜨리라고 유고가 말했지","Ich habe euch gewarnt. Yuugo hat mir aufgetragen,
keine Gnade zu zeigen, wenn jemand versucht,
uns aufzuhalten."
13,4005,"","You should know, we've blocked the route ahead.
Even if you beat us in an ordinary Digimon battle,
the network won't be restored.","我先說清楚啊，我們屏蔽了前面的侵入路徑。
就算用普通的數碼寶貝戰鬥打倒我們，
網路也無法復原喔。","","말해두겠는데 이 앞 침입로는 우리가 차단했어.
평범한 디지몬 배틀로 우리를 쓰러뜨려봤자
네트워크는 회복되지 않아","Ihr solltet wissen, dass wir den Weg blockiert
haben. Selbst wenn ihr uns in einem Digimon-Kampf
besiegt, funktioniert das Netzwerk nicht wieder."
14,4005,"","If you're a real hacker, try hacking it to gain
control. Hehehe...","既然你們是駭客，就用駭客的方法
來搶過去啊……嘻嘻。","","해커라면 해커의 방법으로
복구해보던가…큭큭","Wenn du eine echte Hackerin bist, hacke es doch,
um es unter deine Kontrolle zu bringen. Hehehe ..."
15,3002,"","Hacking it?! What do you mean?!","駭、駭客的方法！？　……什麼意思！？","","해, 해커의 방법!? …무슨 소리야!?","Es hacken?! Was meinst du denn damit?!"
16,3047,"","Well... It looks like Zaxon is standing in Nokia's
way.","哎呀……諾奇雅那傢伙被Zaxon妨礙了啊。","","어라라…노키아 녀석, 잭슨의 방해를 받았네","Tja ... Zaxon scheint sich Nokia in den Weg
gestellt zu haben."
17,3047,"","They've stolen the network authorization and
locked down the area. There are definitely some
advantages to having such a big team.","那群傢伙，是奪取網路權限後鎮壓了整個區域吧。
規模龐大的隊伍，做的事情果然不一樣啊。","","저 녀석들, 네트워크 권한을 빼앗아서
에어리어 자체를 제압했군.
역시 숫자가 많은 팀은 스케일이 달라","Sie haben die Netzwerk-Befugnis gestohlen und den
Bereich abgeriegelt. Manchmal ist ein großes
Team doch von Vorteil."
18,3047,"","At this rate, no one will be able to get past and
Yuugo is sure to emerge victorious.","這樣下去，大家都會被擋在這裡，
聽YUGO說出勝利宣言啊。","","이대로라면 전원이 여기에 발이 묶인 채
유고의 승리 선언을 듣게 되겠는걸","Wenn das so weitergeht, kommt niemand an ihnen
vorbei und Yuugo wird als Sieger hervorgehen."
19,3047,"","[p], there's no other option.
Let's steal control of the area!","[p]，去大鬧一場吧。
從他們手上搶下這區域的鎮壓權！","","[p], 한바탕 날뛰어보자.
이 에어리어의 제압권을 녀석들에게서 빼앗는 거야!","[p], wir haben keine andere Wahl.
Übernehmen wir die Kontrolle über den Bereich!"
25,3002,"","Come on, WarGreymon! MetalGarurumon!","上吧，戰鬥暴龍獸、鋼鐵加魯魯！","","가자, 워그레이몬, 메탈가루몬!","Kommt schon, WarGreymon! MetalGarurumon!"
26,1027,"","Yeah!","遵命！","","오우!","Jawohl!"
27,1135,"","Yeah!","遵命！","","오우!","Ja!"
28,3047,"","[p], you take the lead!","[p]，就交給你指揮啦！","","[p], 지휘는 맡겨둘게!","[p], geh voran!"
