ID,Speaker,Japanese,English,Chinese,EnglishCensored,Korean,German
1,1738,"","Hah! You stand at a disadvantage now!
I will return this debt to you without fail!","呿！看來現在的形勢不利……
這個仇，我一定會報！","","큭…! 지금은 불리한가…!
이 빚은 반드시 갚아주마!","Ha! Du schlägst dich auf die Verliererseite!
Das werde ich dir garantiert heimzahlen!"
2,1382,"","As you wish.
My mind is made up on this matter.","正合我意。
我已做好覺悟……","","바라는 바입니다
그 정도의 결의는 했으니까요…","Wie du willst.
Ich habe mich entschieden."
3,3002,"","Thanks, Magnamon! I can't tell you how happy I am
to have a friend I can count on as much as you!","謝謝你，金甲龍獸！
能得到這麼可靠的伙伴，我超～感動的！","","고마워 매그너몬!
굉장히 믿음직스러운 동료가 생겨서, 나 초~ 감격이야!","Danke, Magnamon! Ach, was bin ich froh, einen
Freund zu haben, auf den ich mich so verlassen
kann!"
4,1382,"","It is I who should thank you. You gave me the
opportunity, and I will always be your ally.","我才要道謝……謝謝你們給了我機會，
今後我永遠會是人類的伙伴。","","저야말로 감사합니다 …계기를 주셔서
앞으로 저는, 계속 인간의 편입니다","Ich habe dir zu danken. Du hast mir eine Chance
gewährt. Ich werde immer dein Verbündeter sein."
5,1382,"","Call me whenever you need me.","如果有事的話，歡迎隨時召喚我。","","무슨 일이 생기면, 언제든 불러 주세요","Ruf mich, wann immer du mich brauchst."
6,1382,"","Oh yes. As a sign of my cooperation,
I shall offer you this.","對了，
這個給你，當作協力的證明。","","…맞아
협력의 증표로서, 당신에게 이걸 드리겠습니다","Ach ja. Und als Zeichen meines Beistandes gebe
ich dir das hier."
7,2000,"","Magnamon of the Royal Knights is now an ally.
Better go report this to the agency.","皇家騎士的成員――金甲龍獸成為了伙伴。
暫且先回事務所報告吧。","","로얄 나이츠의 일원, 매그너몬이 동료가 되었다
일단, 사무소로 돌아가서 보고하자","Magnamon von den Royal Knights ist jetzt ein
Verbündeter. Das melde ich lieber im Büro."
