ID,Speaker,Japanese,English,Chinese,EnglishCensored,Korean,German
1,4806,"","Yuugo came down with EDEN Syndrome eight years
ago.","8年前……哥哥得到了EDEN症候群……","","8년 전… 오빠가 EDEN 증후군에 걸렸어요…","Yuugo hat sich vor acht Jahren das EDEN-Syndrom
zugezogen."
2,4806,"","Because my father was so busy developing EDEN,
I took his place at Yuugo's bedside.","父親不回家，埋首於EDEN開發，
只有我會去探望哥哥。","","집에 돌아가지 않고, EDEN의 개발에 몰두하는 아버지 대신
저만이 오빠의 곁에 있었어요…","Da mein Vater mit EDEN so beschäftigt war, war ich
statt ihm bei Yuugo."
3,4806,"","No matter how many times I called to him, he 
wouldn't wake up, so I stopped trying.","不管我怎麼呼喚，哥哥都不醒來。
所以我放棄了呼喊……","","아무리 불러 봐도, 오빠는 눈을 뜨지 않았고
전 부르는 걸 그만뒀어요…","So oft ich ihn auch gerufen habe, er wollte nicht
aufwachen. Also habe ich aufgegeben."
4,4806,"","My father died. It was Miss Rie who tried to
cheer me up.","父親死了……
鼓勵我的是里繪姊。","","아버지가 돌아가시고…
저를 격려해 줬던 게 리에 씨였어요…","Mein Vater ist gestorben. Fräulein Rie hat
versucht, mich aufzumuntern."
5,4806,"","She taught me that there was a way for me to not 
lose my family.","里繪姊告訴我，
有不會失去家人的方法……","","가족을 잃지 않는 방법이 있다고
리에 씨가 가르쳐 주셨어요…","Sie hat mir gezeigt, dass es einen Weg gab, meine
Familie nicht zu verlieren."
6,4806,"","She said I should become Yuugo and lead the
hackers to protect the EDEN my father built.","為了守護父親創造的EDEN……
她要我成為“YUGO”，統率駭客……","","아버지가 만든 EDEN을 지키기 위해…
""유고""가 되어서 해커를 통솔해 줬으면 한다, 고…","Sie meinte, ich sollte Yuugos Platz einnehmen
und die Hacker anführen, um das EDEN meines Vaters
zu beschützen."
7,4806,"","When I was all lost and alone, she gave me
purpose.","我一個人孤伶伶，束手無策。
是她給了我該做的事情……","","홀로 어찌할 바를 모르던 저에게
해야 할 일을 줬어요…","Als ich mich einsam und verloren gefühlt habe,
hat sie mir eine Bestimmung gegeben."
8,4806,"","And so I...
I abandoned myself and became Yuugo...","所以我……
捨棄了我自己，成為了“YUGO”……","","그래서 전…
제 자신을 버리고 ""유고""가 됐어요…","Also habe ich ...
mich aufgegeben und bin zu Yuugo geworden ..."
9,4806,"","I thought I could lose myself and connect to my
family at the same time... but it was all lies!","就算要捨去自我，我也想要和家人有所聯繫。
但是……結果……一切都是謊言……！","","제 자신을 잃는다 해도, 가족과 이어져 있고 싶었어요
하지만… 결국… 모든 게 다 거짓이었어…!","Ich dachte, ich könnte mich gleichzeitig verlieren
und meiner Familie verbunden fühlen.
Doch es waren alles nur Lügen!"
