ID,Speaker,Japanese,English,Chinese,EnglishCensored,Korean,German
1,3006,,"Tuttavia, era una delle trappole di Rie Kishibe.",不過，那是「岸部里繪」設下的陷阱。,,"―하지만, 그건「키시베 리에」가 준비한 함정이었다",Doch das war eine von Rie Kishibes Fallen.
2,3006,,"Ardeva di ambizione di controllare Kamishiro,
e andò da Kyoko Kuremi, accusando Satoru
Kamishiro stesso di aver commesso i crimini.","她滿懷掌握神代實權的野心，向暮海杏子控訴
神代悟留才是不正當行為的罪魁禍首——",,"카미시로의 실권을 쥐겠다는 야심으로 불타오르던 그녀는,
쿠레미 쿄쿄에게 카미시로 사토루야말로 부정의 장본인이라고 호소했고―","In ihrem Ehrgeiz wollte sie Kamishiro unbedingt
übernehmen. Sie ging also zu Kyoko Kuremi und
schwärzte Satoru Kamishiro selbst an."
3,3006,,Anche le prove erano falsificate alla perfezione.,甚至巧妙地捏造證據。,,"그 증거조차, 교묘하게 날조했다",Die Beweise waren hervorragend gefälscht.
4,3006,,"Donazioni ai politici, vendita di dati degli utenti...",政治獻金、用戶個人資料的買賣——,,"정치가에게의 헌금, 유저 개인정보의 매매―","Spenden an Politiker, Verkauf von Nutzerdaten ..."
5,3006,,Era proprio il tipo di storia su cui i media si sarebbero fatti una scorpacciata.,"最後還加上自己的不倫戀等等，
新聞媒體會爭相報導的“桃色緋聞（新聞題材）”。",,"끝내는 자신과의 불륜이라는, 매스컴이 달려들 법한
""유언비어""까지 입에 담으면서, 말이지","Es war genau die Art Geschichte, über die sich die
Medien das Maul zerreißen."
6,3006,,"Ma una trappola ancora più grande di quella di Rie Kishibe era in preparazione, ordita da qualcun altro.","不過……比起岸部里繪的陷阱，有個規模更大的陷阱，
經由某個人物的雙手所設下。",,"하지만… 키시베 리에의 함정보다도, 더 큰 함정이
어느 인물의 손에 의해 준비되어 있었다","Doch jemand anders hatte eine noch größere Falle
als Rie Kishibe ausgelegt."
7,3006,,"Kyoko Kuremi è stata consumata da un Eater!
Ha contratto la Sindrome di EDEN, come Rie Kishibe.","然後，暮海杏子被侵食者吞噬，
和岸部里繪一樣，罹患了EDEN症候群——",,"그리고 쿠레미 쿄코는 이터에게 먹혀
키시베 리에와 함께, EDEN 증후군에 걸렸다―","Kyoko Kuremi wurde von einem Verschlinger
gefressen! Sie zog sich das EDEN-Syndrom zu, genau
wie Rie Kishibe."
